,entity,to_search,snippet,address,coordinates,name_location,class,type
72,Ca' d'Oro,Ca' d'Oro,"[""...Chief examples of the style are the Doge's Palace and the Ca' d'Oro in the city....""]","Ca' D' Oro, Calle Ca' D'Oro, Cannaregio, Venezia-Murano-Burano, Mestre, Venice, Venezia, Veneto, 30121, Italy","{""coordinates"": [12.333893, 45.440545], ""type"": ""Point""}","Ca' D' Oro, Calle Ca' D'Oro, Cannaregio, Venezia-Murano-Burano, Mestre, Venice, Venezia, Veneto, 30121, Italy",amenity,ferry_terminal
73,Ca' Pesaro,Ca' Pesaro,"[""...The city also has several Renaissance and Baroque buildings, including the Ca' Pesaro and the Ca' Rezzonico....""]","Ca' Pesaro, Fondamenta de Ca' Pesaro, Santa Croce, Venezia-Murano-Burano, Mestre, Venice, Venezia, Veneto, 30135, Italy","{""coordinates"": [12.331542, 45.440973], ""type"": ""Point""}","Ca' Pesaro, Fondamenta de Ca' Pesaro, Santa Croce, Venezia-Murano-Burano, Mestre, Venice, Venezia, Veneto, 30135, Italy",tourism,museum
74,Ca' Rezzonico,Ca' Rezzonico,"[""...The city also has several Renaissance and Baroque buildings, including the Ca' Pesaro and the Ca' Rezzonico....""]","Ca' Rezzonico, Fondamenta del Tragheto, Dorsoduro, Venezia-Murano-Burano, Mestre, Venice, Venezia, Veneto, 30123, Italy","{""coordinates"": [12.327151, 45.433264], ""type"": ""Point""}","Ca' Rezzonico, Fondamenta del Tragheto, Dorsoduro, Venezia-Murano-Burano, Mestre, Venice, Venezia, Veneto, 30123, Italy",amenity,ferry_terminal
82,Palazzo del Cinema,Palazzo del Cinema,['*...Screenings take place in the historic Palazzo del Cinema on the Lungomare Marconi....'],"Palazzo del Cinema, Piazzale Casinò, Lido-Pellestrina, Lido, Venice, Venezia, Veneto, 30126, Italy","{""coordinates"": [12.36695, 45.406318], ""type"": ""Point""}","Palazzo del Cinema, Piazzale Casinò, Lido-Pellestrina, Lido, Venice, Venezia, Veneto, 30126, Italy",man_made,surveillance
83,Lungomare Marconi,Lungomare Marconi,['...Screenings take place in the historic Palazzo del Cinema on the Lungomare Marconi....'],"Lungomare Marconi, Lion's Bar, Lungomare Guglielmo Marconi, Lido-Pellestrina, Lido, Venice, Venezia, Veneto, 30126, Italy","{""coordinates"": [12.36701, 45.405024], ""type"": ""Point""}","Lungomare Marconi, Lion's Bar, Lungomare Guglielmo Marconi, Lido-Pellestrina, Lido, Venice, Venezia, Veneto, 30126, Italy",highway,bus_stop
85,Silk Road,Silk Road,"['...Marco Polo (ca. 1254 – 1324), trader and explorer, one of the first Westerners to travel the Silk Road to China ;...']","Silk Road, 1420E, Calle dei Cortellotti, Dorsoduro, Venezia-Murano-Burano, Mestre, Venice, Venezia, Veneto, 30123, Italy","{""coordinates"": [12.322373, 45.430648], ""type"": ""Point""}","Silk Road, 1420E, Calle dei Cortellotti, Dorsoduro, Venezia-Murano-Burano, Mestre, Venice, Venezia, Veneto, 30123, Italy",tourism,guest_house
