,entity,to_search,snippet,address,coordinates,name_location,class,type
75,Castellón de la Plana,Castellón de la Plana,"['*...Valencia ha un proprio hub per il trasporto dei pendolari, che è composto da sei linee che collegano Valencia con Gandia, Mogente, Utiel, Xirivella, Caudiel e Castellón de la Plana....']","Castellón de la Plana, Ortembach, Calp, la Marina Alta, Alacant / Alicante, Comunità Valenzana, 03710, Spagna","{""coordinates"": [0.072683, 38.640723], ""type"": ""Point""}","Castellón de la Plana, Ortembach, Calp, la Marina Alta, Alacant / Alicante, Comunità Valenzana, 03710, Spagna",highway,residential
78,Aeroporto di Manises,Aeroporto di Manises,"[""...L'idea fu poi accantonata per costruire l'Aeroporto di Manises...."", ""...L'Aeroporto di Valencia è situato a 9\xa0km a ovest dalla periferia di Valencia raggiungibile con la metro 3 e 5...."", ""*...La legge sugli aeroporti del 1927, stabilì l'urgenza di dotare la città di un Aeroporto, motivo per il quale nell'area del porto fu attrezzato uno spazio utile per l'idroaviazione...."", ""...Poco tempo più tardi, fu proposto il progetto di realizzare l'Aeroporto sulla lingua di terra che separa l'Albufera da Valencia dal mare, in modo che potesse essere utilizzato sia per gli aeroplani che dagli idromobili che dagli aerei terrestri...."", ""*...L'Aeroporto ospita voli per tutta la Spagna, l'Europa e le città del Nord Africa....""]","Aeroporto Internazionale di Valencia, Llegadas, Manises, l'Horta Sud, Valencia, Comunità Valenzana, 46940, Spagna","{""coordinates"": [-0.481209, 39.487865], ""type"": ""Point""}","Aeroporto Internazionale di Valencia, Llegadas, Manises, l'Horta Sud, Valencia, Comunità Valenzana, 46940, Spagna",aeroway,aerodrome
80,Terminal 2,Terminal 2,"[""*...Nella seconda decade del Duemila, sono stati aperti i cantieri per i lavori di ampliamento del terminal, la piattaforma logistica per il trasporto merci e quella per l'aviazione generale, il parcheggio, l'assistenza tecnica per il controllo e il monitoraggio di tali strutture, nonché il nuovo Terminal 2, estensione sul lato est a complemento del terminal regionale....""]","Valencia - Terminal 2, Llegadas, Manises, l'Horta Sud, Valencia, Comunità Valenzana, 46940, Spagna","{""coordinates"": [-0.471816, 39.490843], ""type"": ""Point""}","Valencia - Terminal 2, Llegadas, Manises, l'Horta Sud, Valencia, Comunità Valenzana, 46940, Spagna",aeroway,terminal
82,Avenida Menéndez Pidal,Avenida Menéndez Pidal,"['*...La stazione urbana degli autobus si trova a Avenida Menéndez Pidal, da dove si dipartono linee urbane, nazionali e internazionali....']","Avinguda de Menéndez Pidal, les Tendetes, Campanar, Valencia, Comarca de València, Valencia, Comunità Valenzana, 46009, Spagna","{""coordinates"": [-0.385421, 39.480998], ""type"": ""Point""}","Avinguda de Menéndez Pidal, les Tendetes, Campanar, Valencia, Comarca de València, Valencia, Comunità Valenzana, 46009, Spagna",highway,residential
84,Ciutat de Valencia,Ciutat de Valencia,"['...La più antica è il Levante Unión Deportiva, fondata nel 1909, che disputa le partite interne nel campo ""Ciutat de Valencia"";...']","Museo Ciudad, 3, Plaça de l'Arquebisbe, la Seu, Ciutat Vella, Valencia, Comarca de València, Valencia, Comunità Valenzana, 46003, Spagna","{""coordinates"": [-0.373644, 39.476051], ""type"": ""Point""}","Museo Ciudad, 3, Plaça de l'Arquebisbe, la Seu, Ciutat Vella, Valencia, Comarca de València, Valencia, Comunità Valenzana, 46003, Spagna",tourism,museum
85,Mestalla,Mestalla,"[""*...Quest'ultima compagine ha il suo quartier generale nello stadio di Mestalla; vanta nel suo palmarès 6 titoli di Liga, 8 Coppe del Re e 7 coppe europee....""]","Mestalla, 25, Carrer de Misser Mascó, Exposició, el Pla del Real, Valencia, Comarca de València, Valencia, Comunità Valenzana, 46010, Spagna","{""coordinates"": [-0.361852, 39.475395], ""type"": ""Point""}","Mestalla, 25, Carrer de Misser Mascó, Exposició, el Pla del Real, Valencia, Comarca de València, Valencia, Comunità Valenzana, 46010, Spagna",amenity,restaurant
86,Ricardo Tormo,Ricardo Tormo,"['...A circa 20\xa0km da Valencia sorge l\'autodromo ""Ricardo Tormo"", che ospita gare del campionato del mondo superbike, motomondiale, test di Formula 1 e altri campionati minori di auto e moto....']","Circuit Ricardo Tormo, Carretera de Cheste a Loriguilla, Cheste, La Hoya de Buñol, Valencia, Comunità Valenzana, 46393, Spagna","{""coordinates"": [-0.625704, 39.495526], ""type"": ""Point""}","Circuit Ricardo Tormo, Carretera de Cheste a Loriguilla, Cheste, La Hoya de Buñol, Valencia, Comunità Valenzana, 46393, Spagna",railway,halt
