100,"La stagione del liberty torinese fu caratterizzata anche da una cospicua realizzazione di edifici pubblici tra cui scuole, uffici e bagni pubblici."
101,"In questo settore dell'amministrazione locale emersero illustri esponenti tra cui dapprima l'ingegnere Daniele Donghi, già professore ordinario di Architettura tecnica a Milano e Padova, che per circa quindici anni fu a capo dell'Ufficio tecnico dei Lavori pubblici, carica che lasciò alla volta dell'analogo incarico presso il Comune di Padova, quello di Venezia, divenendo infine direttore della filiale milanese dell'Impresa Porcheddu di Torino."
102,"A Donghi subentrò l'ingegner Camillo Dolza che firmò i più importanti progetti di edilizia pubblica torinese dei primi decenni del Novecento, tra cui si contano l'imponente edificio dell'istituto superiore femminile magistrale ""V."
103,"Monti"" di corso Galileo Ferraris 11 (1900), i primi Bagni Municipali di Via G. Saccarelli (1901), quelli di Via O. Morgari (1905), quelli di borgo Vanchiglia (1910)"
104,", il Palazzo Poste e Telegrafi di Via Alfieri (1908) e la nuova scuola elementare ""Santorre di Santarosa"" di Via Braccini (1920)."
105,"Parallelamente al naturalismo talvolta esasperato del liberty, la corrente del neogotico continuò a essere lo stile prediletto della aristocrazia e della committenza di gusto più conservatore e tradizionalista;"
106,"inoltre, grazie della forte connotazione allegorica d'ispirazione medievale si confermò lo stile preferito per la realizzazione di edifici religiosi, se si esclude l'unico caso italiano della Chiesa liberty dedicata a Santa Elisabetta, all'interno del Villaggio Leumann."
107,"Uno dei maggiori detrattori del liberty fu il poeta torinese Guido Gozzano che, per ironia della sorte, visse e morì in un edificio progettato secondo questo nuovo stile dallo stesso Pietro Fenoglio."
108,"Egli espresse sovente parole di biasimo per il liberty, fino a definirlo «rosolia del buon gusto», quasi a paragonarla a una passeggera infatuazione per modelli europei che, secondo il suo pensiero, non avevano legami con la tradizione architettonica italiana;"
109,al contrario nel neogotico egli avvertiva un sano «ritorno all'ordine» che poneva al riparo da pericolose avanguardie stilistiche troppo audaci.
110,"Della stessa idea furono anche i maggiori esponenti della nobiltà e della finanza che, pur senza ricorrere al neogotico, per i loro edifici di rappresentanza predilessero uno stile neoclassico più sobrio, tradizionale e conservatore, come accadde per esempio per l'edificio eclettico delle Assicurazioni Generali Venezia in Piazza Solferino, progettato dello stesso Pietro Fenoglio che tuttavia qui si piegò alle indiscutibili esigenze del committente."
112,Oltre
113,"al ben noto Borgo Medievale del Parco del Valentino, gioiello frutto di un accurato studio delle vestigia medievali locali coordinato dall'architetto portoghese Alfredo d'Andrade, nell'elegante quartiere residenziale Cit Turin si possono notare degli ottimi esempi di architettura civile nelle opere commissionate da Carrera:"
114,"la Casa della Vittoria (1918-20) di Gottardo Gussoni, insieme all'abitazione dello stesso Carrera, ne sono l'esempio di maggior rilevanza."
115,"Sempre nel medesimo quartiere è degno di nota anche l'operato dell'architetto Giuseppe Gallo, a cui si deve il progetto della Chiesa dedicata a Gesù Nazareno affacciata su Piazza Martini."
116,"Ulteriori esempi di edifici civili in stile neogotico sono evidenziabili nel vicino quartiere San Donato con il gruppo di case di Via Piffetti, famose per i ferri battuti, le caratteristiche sfingi e le decorazioni a coda di pavone."
117,"Altri isolati esempi di neogotico di Giuseppe Gallo sono altresì presenti nella zona di San Salvario e nel quartiere Crocetta, dove svetta la Casa Lattes (1911), imponente esempio presso l'incrocio di Via Sacchi e corso Sommelier."
118,"Nel quartiere Parella, invece, al tempo estrema periferia contornata dalla campagna, sorge il Palazzotto Arduino, un ricco esempio di neogotico progettato dall'architetto Paolo Napione nel 1926, quando ormai l'avanguardia architettonica stava già sperimentando in città i primi esempi di razionalismo come, per esempio, Palazzo Gualino."
119,"Mentre gli orrori della prima guerra mondiale decretarono, non soltanto simbolicamente, la fine della spensierata stagione del liberty, nel corso del secondo decennio del Novecento il tema della «funzione» prevalse sulla «forma» e l'art déco fu una sorta di sinossi stilistica che vide trasformare le sue sinuose audacie in stilemi più rigorosi che anticiparono, anche se di poco, i caratteri principali del razionalismo;"
120,Torino ospita anche alcuni degni esempi di questa nuova corrente.
121,"Oltre ad alcune ville sulla zona collinare, una delle prime espressioni di architettura déco apparve in Via Cibrario 62, dove sorge Casa Enrieu dell'architetto Bertola:"
122,"il suo apparato decorativo, ormai privo di decorazioni floreali, è caratterizzato da cornici e motivi odivaghi alternati a superfici piane;"
123,"stesso dicasi per l'edificio accanto, all'angolo con la vicina Via Bossi."
124,"Altro esempio di art déco fu l'edificio che sorse all'angolo di corso Vittorio Emanuele II che venne realizzato nel 1926 su progetto di dell'ingegner Bonadè-Bottino per ospitare il Palazzo del Cinema, in seguito Cinema Corso, al tempo la sala cinematografica più grande d'Italia;"
125,"malgrado la sua distruzione in un incendio nel 9 marzo 1980 la caratteristica facciata con accesso angolare sormontata da una cupola venne conservata e l'edificio fu destinato a differente uso, su progetto dell'architetto Pier Paolo Maggiora."
126,"In Piazza Solferino, invece sorge un altro esempio dalle forme sobrie ed eleganti realizzato nel 1928 su progetto di Giuseppe Momo, come sede della Società Anonima Edile Torinese,
Un altro autore torinese che si affermò per le sue opere déco fu l'architetto Vittorio Eugenio Ballatore di Rosana."
127,"Già autore del motovelodromo di vaga ispirazione liberty e dello Stadium, egli si distinse per la progettazione delle Torri Rivella, la coppia di edifici posti nell'omonimo slargo all'incrocio di corso Regina Margherita e corso Regio Parco, nonché l'imponente edificio dell'Istituto Elettrotecnico Nazionale ""Galileo Ferraris"", di corso Massimo d'Azeglio e un gruppo di edifici a ridosso di Piazza Bernini."
128,"Negli anni cinquanta del Novecento il liberty ebbe una sorta di reinterpretazione da parte di alcuni esponenti dell'architettura torinese dell'epoca tra cui Roberto Gabetti, Aimaro Isola, Sergio Jaretti ed Elio Luzi e altresì lo studio milanese BBPR che, per la loro rilettura degli stilemi floreali e strutturali, indussero il critico Paolo Portoghesi a definire tale fenomeno neoliberty."
129,"Di Jaretti e Luzi è emblematica la cosiddetta Casa dell'Obelisco, dove emergono con raffinata ironia colti riferimenti stilistici che conducono a una rivisitazione dei materiali da costruzione, riproponendo l'utilizzo del litocemento per elementi decorativi che caratterizzano tutti i sinuosi prospetti dell'edificio marcatamente scanditi da rilievi orizzontali sovrapposti che richiamano le morfologie moderniste di Gaudí."
130,"Sempre nella zona collinare di Borgo Po, all'inizio degli anni duemila, è comparso un eccentrico edificio unifamiliare progettato dell'architetto torinese Alessandro Celli."
131,"Egli nel 2002 ha progettato per il suo committente Villa Grivet Brancot, ovvero un autentico «falso architettonico» che si ispira ai maggiori stilemi liberty torinesi."
132,"L'abitazione della famiglia Grivet Brancot è caratterizzata da un ricco apparato decorativo costituito da litocemento, cornici, decorazioni e ferri battuti che sembrano davvero appartenere al repertorio fenogliano ma che invece sono il frutto di un'attenta ricerca contemporanea di maestranze e di materiale filologicamente coerenti con l'epoca liberty e a suo perpetuo omaggio."
133,Mappa sinottica degli edifici in stile liberty a Torino
