,entity,to_search,snippet,address,coordinates,name_location,class,type
156,Biblioteca Medicea Laurenziana,Biblioteca Medicea Laurenziana,"['...Questa piazza è famosa per il vivace Mercato che vi si tiene tutti giorni, oltre a ospitare la Biblioteca Medicea Laurenziana e la statua di Giovanni delle Bande Nere....', '*...Biblioteca Medicea Laurenziana ;...']","Biblioteca Medicea Laurenziana, 9, Piazza di San Lorenzo, Quartiere 1, Firenze, Toscana, 50123, Italia","{""coordinates"": [11.253773, 43.774421], ""type"": ""Point""}","Biblioteca Medicea Laurenziana, 9, Piazza di San Lorenzo, Quartiere 1, Firenze, Toscana, 50123, Italia",amenity,library
158,Piazza Santa Maria Novella,Piazza Santa Maria Novella,"[""*...Piazza Santa Maria Novella\ndominata dalla splendida facciata dell'omonima Chiesa, è una delle piazze principali di Firenze...."", ""*...Museo Novecento, si trova all'interno dell'antico Spedale delle Leopoldine in Piazza Santa Maria Novella. È dedicato all'arte italiana del XX secolo e propone una selezione di circa 300 opere distribuite in 15 ambienti. È stato inaugurato il 24 giugno 2014....""]","Piazza Santa Maria Novella, San Frediano, Quartiere 1, Firenze, Toscana, 50123, Italia","{""coordinates"": [11.250033, 43.77356], ""type"": ""Point""}","Piazza Santa Maria Novella, San Frediano, Quartiere 1, Firenze, Toscana, 50123, Italia",highway,pedestrian
159,via degli Avelli,via degli Avelli,"['*...È antistante a piazza della Stazione, a cui si accede da via degli Avelli....', ""*...Piazza dell'Unità Italiana\nmolto vicina a piazza della Stazione, con la quale condivide il ruolo di importante snodo delle linee di autobus cittadine, la piazza si apre sul fianco nord della basilica di Santa Maria Novella, davanti a via degli Avelli e via Panzani....""]","Via degli Avelli, San Frediano, Quartiere 1, Firenze, Toscana, 50123, Italia","{""coordinates"": [11.249933, 43.774202], ""type"": ""Point""}","Via degli Avelli, San Frediano, Quartiere 1, Firenze, Toscana, 50123, Italia",highway,pedestrian
160,Piazza della Santissima Annunziata,Piazza della Santissima Annunziata,"['*...Piazza della Santissima Annunziata\nè una delle piazze più belle e stilisticamente armoniose non solo della città, ma di tutta Italia, forse primo esempio europeo di pianificazione urbanistica....', ""*...Santissima Annunziata\nè il santuario mariano di Firenze, casa madre dell'ordine dei Servi di Maria;..."", ""*...Santa Croce: parte orientale posta tra il Ponte Vecchio e Porta San Gallo con le parrocchie di Sant'Ambrogio, Santissima Annunziata, San Giuseppe, San Marco Evangelista, Santa Margherita nella Madonna de' Ricci, Duomo di Santa Maria del Fiore e Santa Reparata, San Michele in Orto e San Michele Visdomini;...""]","Piazza della Santissima Annunziata, Quartiere 1, Firenze, Toscana, 50112, Italia","{""coordinates"": [11.260626, 43.776066], ""type"": ""Point""}","Piazza della Santissima Annunziata, Quartiere 1, Firenze, Toscana, 50112, Italia",highway,pedestrian
162,Loggia dei Servi di Maria,Loggia dei Servi di Maria,"[""...Su di essa si affaccia l'omonima basilica, lo Spedale degli Innocenti del Brunelleschi, la Loggia dei Servi di Maria, Palazzo Budini Gattai e il Museo archeologico nazionale....""]","Loggia dei Servi di Maria, Piazza della Santissima Annunziata, Quartiere 1, Firenze, Toscana, 50112, Italia","{""coordinates"": [11.260267, 43.776705], ""type"": ""Point""}","Loggia dei Servi di Maria, Piazza della Santissima Annunziata, Quartiere 1, Firenze, Toscana, 50112, Italia",building,apartments
163,Palazzo Budini Gattai,Palazzo Budini Gattai,"[""*...Su di essa si affaccia l'omonima basilica, lo Spedale degli Innocenti del Brunelleschi, la Loggia dei Servi di Maria, Palazzo Budini Gattai e il Museo archeologico nazionale....""]","Palazzo Budini Gattai, Via dei Servi, Quartiere 1, Firenze, Toscana, 50112, Italia","{""coordinates"": [11.26006, 43.776296], ""type"": ""Point""}","Palazzo Budini Gattai, Via dei Servi, Quartiere 1, Firenze, Toscana, 50112, Italia",building,apartments
164,Museo archeologico nazionale,Museo archeologico nazionale,"[""...Su di essa si affaccia l'omonima basilica, lo Spedale degli Innocenti del Brunelleschi, la Loggia dei Servi di Maria, Palazzo Budini Gattai e il Museo archeologico nazionale...."", ""...Museo Archeologico Nazionale, situato in un palazzo seicentesco utilizzato come residenza della principessa Maria Maddalena de' Medici in piazza SS Annunziata, è composto dalla sezione etrusca, la sezione romana, la sezione greca, e il Museo Egizio, il più importante d'Italia dopo quello di Torino....""]","MAF Museo archeologico nazionale di Firenze, 9, Piazza della Santissima Annunziata, Quartiere 1, Firenze, Toscana, 50122, Italia","{""coordinates"": [11.261407, 43.776542], ""type"": ""Point""}","MAF Museo archeologico nazionale di Firenze, 9, Piazza della Santissima Annunziata, Quartiere 1, Firenze, Toscana, 50122, Italia",tourism,museum
165,Parterre,Parterre,"[""...Fu realizzata nell'Ottocento nel corso dei lavori per la creazione dei viali di Circonvallazione, e su di essa si affacciano grandi palazzi dai lunghi portici, il Parterre e il maestoso Arco di Trionfo posto davanti a porta San Gallo...."", '*...Altri eventi si svolgono nella struttura polifunzionale del Parterre, dinnanzi a Piazza della Libertà (che nel periodo natalizio ospita anche una pista di pattinaggio sul ghiaccio), e nello spazio polivalente della Stazione Leopolda (oggi struttura espositiva e congressuale), così come nel grande Nelson Mandela Forum....']","Parterre, Via Pippo Spano, Le Cure, Quartiere 2, Firenze, Toscana, 50199, Italia","{""coordinates"": [11.263262, 43.785173], ""type"": ""Point""}","Parterre, Via Pippo Spano, Le Cure, Quartiere 2, Firenze, Toscana, 50199, Italia",building,yes
166,porta San Gallo,porta San Gallo,"['...Porta San Gallo...', ""*...Fu realizzata nell'Ottocento nel corso dei lavori per la creazione dei viali di Circonvallazione, e su di essa si affacciano grandi palazzi dai lunghi portici, il Parterre e il maestoso Arco di Trionfo posto davanti a porta San Gallo...."", ""...Santa Croce: parte orientale posta tra il Ponte Vecchio e Porta San Gallo con le parrocchie di Sant'Ambrogio, Santissima Annunziata, San Giuseppe, San Marco Evangelista, Santa Margherita nella Madonna de' Ricci, Duomo di Santa Maria del Fiore e Santa Reparata, San Michele in Orto e San Michele Visdomini;..."", '...Santa Maria Novella: parte occidentale posta tra il Ponte Vecchio e Porta San Gallo con la Fortezza da Basso e fino alla Porta al Prato, con le parrocchie di Santa Lucia al Prato, Santa Maria Novella, San Salvatore in Ognissanti, Santa Trinita e collegiata di San Lorenzo;...', '*...Porta San Gallo...', ""*...Santa Croce: parte orientale posta tra il Ponte Vecchio e Porta San Gallo con le parrocchie di Sant'Ambrogio, Santissima Annunziata, San Giuseppe, San Marco Evangelista, Santa Margherita nella Madonna de' Ricci, Duomo di Santa Maria del Fiore e Santa Reparata, San Michele in Orto e San Michele Visdomini;..."", '*...Santa Maria Novella: parte occidentale posta tra il Ponte Vecchio e Porta San Gallo con la Fortezza da Basso e fino alla Porta al Prato, con le parrocchie di Santa Lucia al Prato, Santa Maria Novella, San Salvatore in Ognissanti, Santa Trinita e collegiata di San Lorenzo;...']","Porta San Gallo, Piazza della Libertà, Le Cure, Quartiere 2, Firenze, Toscana, 50199, Italia","{""coordinates"": [11.261701, 43.783694], ""type"": ""Point""}","Porta San Gallo, Piazza della Libertà, Le Cure, Quartiere 2, Firenze, Toscana, 50199, Italia",historic,city_gate
167,Piazza Beccaria,Piazza Beccaria,"[""...Si trova in piazza Beccaria, una delle isole di traffico create nell'Ottocento con i viali di Circonvallazione...."", '*...Piazza Beccaria\nè una grande piazza della città, la quale si trova sui viali di Circonvallazione....', ""*...Si trova in piazza Beccaria, una delle isole di traffico create nell'Ottocento con i viali di Circonvallazione....""]","Piazza Beccaria, Piazza Cesare Beccaria, Quartiere 1, Firenze, Toscana, 50121, Italia","{""coordinates"": [11.270349, 43.770543], ""type"": ""Point""}","Piazza Beccaria, Piazza Cesare Beccaria, Quartiere 1, Firenze, Toscana, 50121, Italia",highway,bus_stop
168,Archivio di Stato,Archivio di Stato,"[""...Su questa piazza si affaccia anche l'Archivio di Stato...."", ""...La via si snoda dal palazzo del Bargello fino ad arrivare all'archivio di stato sui viali di Circonvallazione...."", ""...Archivio di Stato di Firenze, si tratta dell'immenso deposito di carte e di documenti di ogni epoca relativi a Firenze, di importanza fondamentale per gli studi storici, storico-artistici, linguistici, e diplomatici....""]","Archivio di Stato, Viale della Giovine Italia, San Niccolò, Quartiere 2, Firenze, Toscana, 50121, Italia","{""coordinates"": [11.270565, 43.76902], ""type"": ""Point""}","Archivio di Stato, Viale della Giovine Italia, San Niccolò, Quartiere 2, Firenze, Toscana, 50121, Italia",amenity,library
169,Piazza Santo Spirito,Piazza Santo Spirito,"['*...Piazza Santo Spirito\nè una delle più tipiche e vivaci piazze del quartiere di Oltrarno....', '*...Firenze come ""culla del Rinascimento"" ha i suoi capolavori nelle opere di Filippo Brunelleschi (lo Spedale degli Innocenti, la basilica di San Lorenzo e quella di Santo Spirito) e di Leon Battista Alberti (la facciata di Santa Maria Novella e Palazzo Rucellai), ma anche altri periodi artistici hanno lasciato i loro capolavori assoluti:...', ""*...Santo Spirito\nsituata nel quartiere dell'Oltrarno, è l'ultima opera e l'esempio più compiuto dell'architettura logica e razionale di Filippo Brunelleschi; completata dopo la sua morte colpisce per la cristallina armonia nella combinazione di spazi aperti e volumi pieni, inondati di luce naturale...."", '*...Santo Spirito....', '*...La basilica di Santa Maria Novella, la basilica di Santo Spirito, la basilica di Santa Croce, e il battistero di San Giovanni....', ""*...Santo Spirito: tutta la parte d'Oltrarno, compresi i ponti con le parrocchie di San Felice in Piazza, Santa Felicita, collegiata di San Frediano in Cestello e San Piero in Gattolini detto Serumido....""]","Piazza di Santo Spirito, Oltrarno, Quartiere 1, Firenze, Toscana, Italia","{""coordinates"": [11.247721, 43.766734], ""type"": ""Point""}","Piazza di Santo Spirito, Oltrarno, Quartiere 1, Firenze, Toscana, Italia",highway,pedestrian
171,Palazzo Buondelmonti,Palazzo Buondelmonti,"[""...Su di essa si affacciano oltre alla basilica, il Palazzo Spini Feroni oggi sede della maison Ferragamo e dell'omonimo Museo, il Palazzo Buondelmonti, e il Palazzo Bartolini Salimbeni, oltre che alla Colonna della Giustizia....""]","Palazzo Buondelmonti, Via delle Terme, Oltrarno, Quartiere 1, Firenze, Toscana, 50123, Italia","{""coordinates"": [11.251497, 43.769969], ""type"": ""Point""}","Palazzo Buondelmonti, Via delle Terme, Oltrarno, Quartiere 1, Firenze, Toscana, 50123, Italia",building,apartments
172,Palazzo Bartolini Salimbeni,Palazzo Bartolini Salimbeni,"[""...Su di essa si affacciano oltre alla basilica, il Palazzo Spini Feroni oggi sede della maison Ferragamo e dell'omonimo Museo, il Palazzo Buondelmonti, e il Palazzo Bartolini Salimbeni, oltre che alla Colonna della Giustizia....""]","Palazzo Bartolini Salimbeni, Via Porta Rossa, Oltrarno, Quartiere 1, Firenze, Toscana, 50123, Italia","{""coordinates"": [11.251504, 43.770179], ""type"": ""Point""}","Palazzo Bartolini Salimbeni, Via Porta Rossa, Oltrarno, Quartiere 1, Firenze, Toscana, 50123, Italia",historic,building
173,Colonna della Giustizia,Colonna della Giustizia,"[""*...Su di essa si affacciano oltre alla basilica, il Palazzo Spini Feroni oggi sede della maison Ferragamo e dell'omonimo Museo, il Palazzo Buondelmonti, e il Palazzo Bartolini Salimbeni, oltre che alla Colonna della Giustizia....""]","Colonna della Giustizia, Piazza Santa Trinita, Oltrarno, Quartiere 1, Firenze, Toscana, 50123, Italia","{""coordinates"": [11.251271, 43.770121], ""type"": ""Point""}","Colonna della Giustizia, Piazza Santa Trinita, Oltrarno, Quartiere 1, Firenze, Toscana, 50123, Italia",tourism,artwork
174,Piazza della Stazione,Piazza della Stazione,"['...È antistante a piazza della Stazione, a cui si accede da via degli Avelli....', ""*...Piazza della Stazione\ndominata dalla Stazione di Firenze Santa Maria Novella è una delle più grandi piazze di Firenze, sulla quale si affacciano grandi palazzi, tra cui la Palazzina Reale e l'antistante Palazzo degli Affari, oltre che al retro della grande basilica di Santa Maria Novella...."", ""...Piazza dell'Unità Italiana\nmolto vicina a piazza della Stazione, con la quale condivide il ruolo di importante snodo delle linee di autobus cittadine, la piazza si apre sul fianco nord della basilica di Santa Maria Novella, davanti a via degli Avelli e via Panzani...."", ""...Via de' Cerretani\nè un'ampia via del centro storico che da piazza della Stazione, tramite via Panzani, porta a piazza San Giovanni...."", '*...È antistante a piazza della Stazione, a cui si accede da via degli Avelli....', ""*...Piazza dell'Unità Italiana\nmolto vicina a piazza della Stazione, con la quale condivide il ruolo di importante snodo delle linee di autobus cittadine, la piazza si apre sul fianco nord della basilica di Santa Maria Novella, davanti a via degli Avelli e via Panzani...."", ""*...Via de' Cerretani\nè un'ampia via del centro storico che da piazza della Stazione, tramite via Panzani, porta a piazza San Giovanni....""]","Piazza della Stazione, San Frediano, Quartiere 1, Firenze, Toscana, 50123, Italia","{""coordinates"": [11.249946, 43.775298], ""type"": ""Point""}","Piazza della Stazione, San Frediano, Quartiere 1, Firenze, Toscana, 50123, Italia",highway,residential
177,Palazzo degli Affari,Palazzo degli Affari,"[""*...Piazza della Stazione\ndominata dalla Stazione di Firenze Santa Maria Novella è una delle più grandi piazze di Firenze, sulla quale si affacciano grandi palazzi, tra cui la Palazzina Reale e l'antistante Palazzo degli Affari, oltre che al retro della grande basilica di Santa Maria Novella...."", ""...Molte manifestazioni si tengono nel centro espositivo di Firenze Fiera, formato dalla Fortezza da Basso, il Palazzo dei Congressi e il Palazzo degli Affari, come Pitti Immagine e la Mostra internazionale dell'artigianato...."", ""*...Il settore del turismo congressuale e fieristico (la fiera di Firenze si tiene nella Fortezza da Basso, nel Palazzo dei Congressi e nel Palazzo degli Affari che sono tra di loro contigui) ha conosciuto un enorme incremento con la ristrutturazione del centro congressi nei primi anni novanta e vede esposizioni, congressi, meeting, social forum, concerti e manifestazioni internazionali in ogni periodo dell'anno....""]","Palazzo degli Affari, Via Bernardo Cennini, Quartiere 1, Firenze, Toscana, 50100, Italia","{""coordinates"": [11.249993, 43.778246], ""type"": ""Point""}","Palazzo degli Affari, Via Bernardo Cennini, Quartiere 1, Firenze, Toscana, 50100, Italia",building,yes
179,piazza del Duomo,piazza del Duomo,"[""...Piazza del Duomo\nè uno dei complessi monumentali più famosi d'Italia, con la Cattedrale di Santa Maria del Fiore e la Cupola del Brunelleschi, il Campanile di Giotto e il Battistero di San Giovanni, oltre che agli splendidi palazzi e musei che vi si affacciano, come il Palazzo Arcivescovile, il Museo dell'Opera del Duomo, la Loggia del Bigallo, il palazzo dei Canonici e molti altri...."", ""*...La piazza si incrocia con via Cavour che la collega a piazza del Duomo a un estremo e piazza della Libertà all'altro tramite via Cesare Battisti è collegata a piazza SS Annunziata...."", ""*...Museo dell'Opera del Duomo, nato dalla raccolta di opere provenienti dal complesso di piazza del Duomo ed è stato riordinato e ammodernato nei locali negli anni novanta. Conserva capolavori di Michelangelo come la Pietà Bandini (dove qui scolpì il David), Donatello, Luca della Robbia, Lorenzo Ghiberti, Andrea Pisano, Nanni di Banco e molti altri...."", ""*...Piazza del Duomo\nè uno dei complessi monumentali più famosi d'Italia, con la Cattedrale di Santa Maria del Fiore e la Cupola del Brunelleschi, il Campanile di Giotto e il Battistero di San Giovanni, oltre che agli splendidi palazzi e musei che vi si affacciano, come il Palazzo Arcivescovile, il Museo dell'Opera del Duomo, la Loggia del Bigallo, il palazzo dei Canonici e molti altri....""]","Piazza del Duomo, Quartiere 1, Firenze, Toscana, Italia","{""coordinates"": [11.255478, 43.773102], ""type"": ""Point""}","Piazza del Duomo, Quartiere 1, Firenze, Toscana, Italia",highway,pedestrian
180,piazza della Libertà,piazza della Libertà,"[""...Fa parte delle Mura di Firenze e si trova in Piazza della Libertà, dirimpetto all'Arco di Trionfo...."", '...Piazza della Libertà\nsegna il punto più a nord del centro storico di Firenze....', ""*...La piazza si incrocia con via Cavour che la collega a piazza del Duomo a un estremo e piazza della Libertà all'altro tramite via Cesare Battisti è collegata a piazza SS Annunziata...."", '...La via permette da piazza San Giovanni di raggiungere piazza San Marco e, proseguendo, di giungere a Piazza della Libertà....', '...Altri eventi si svolgono nella struttura polifunzionale del Parterre, dinnanzi a Piazza della Libertà (che nel periodo natalizio ospita anche una pista di pattinaggio sul ghiaccio), e nello spazio polivalente della Stazione Leopolda (oggi struttura espositiva e congressuale), così come nel grande Nelson Mandela Forum....', ""*...Fa parte delle Mura di Firenze e si trova in Piazza della Libertà, dirimpetto all'Arco di Trionfo...."", '*...Piazza della Libertà\nsegna il punto più a nord del centro storico di Firenze....', '*...La via permette da piazza San Giovanni di raggiungere piazza San Marco e, proseguendo, di giungere a Piazza della Libertà....', '*...Altri eventi si svolgono nella struttura polifunzionale del Parterre, dinnanzi a Piazza della Libertà (che nel periodo natalizio ospita anche una pista di pattinaggio sul ghiaccio), e nello spazio polivalente della Stazione Leopolda (oggi struttura espositiva e congressuale), così come nel grande Nelson Mandela Forum....']","Piazza della Libertà, Quartiere 1, Firenze, Toscana, 50199, Italia","{""coordinates"": [11.261942, 43.783441], ""type"": ""Point""}","Piazza della Libertà, Quartiere 1, Firenze, Toscana, 50199, Italia",highway,primary
181,via Cesare Battisti,via Cesare Battisti,"[""*...La piazza si incrocia con via Cavour che la collega a piazza del Duomo a un estremo e piazza della Libertà all'altro tramite via Cesare Battisti è collegata a piazza SS Annunziata....""]","Via Cesare Battisti, Querceto, Sesto Fiorentino, Firenze, Toscana, 50019, Italia","{""coordinates"": [11.199488, 43.837514], ""type"": ""Point""}","Via Cesare Battisti, Querceto, Sesto Fiorentino, Firenze, Toscana, 50019, Italia",highway,residential
182,piazza SS Annunziata,piazza SS Annunziata,"[""*...La piazza si incrocia con via Cavour che la collega a piazza del Duomo a un estremo e piazza della Libertà all'altro tramite via Cesare Battisti è collegata a piazza SS Annunziata...."", ""*...Museo Archeologico Nazionale, situato in un palazzo seicentesco utilizzato come residenza della principessa Maria Maddalena de' Medici in piazza SS Annunziata, è composto dalla sezione etrusca, la sezione romana, la sezione greca, e il Museo Egizio, il più importante d'Italia dopo quello di Torino....""]","Piazza della Santissima Annunziata, Quartiere 1, Firenze, Toscana, 50112, Italia","{""coordinates"": [11.260626, 43.776066], ""type"": ""Point""}","Piazza della Santissima Annunziata, Quartiere 1, Firenze, Toscana, 50112, Italia",highway,pedestrian
183,Piazza dell'Unità Italiana,Piazza dell'Unità Italiana,"[""*...Piazza dell'Unità Italiana\nmolto vicina a piazza della Stazione, con la quale condivide il ruolo di importante snodo delle linee di autobus cittadine, la piazza si apre sul fianco nord della basilica di Santa Maria Novella, davanti a via degli Avelli e via Panzani....""]","Piazza dell'Unità Italiana, San Frediano, Quartiere 1, Firenze, Toscana, 50123, Italia","{""coordinates"": [11.25106, 43.77482], ""type"": ""Point""}","Piazza dell'Unità Italiana, San Frediano, Quartiere 1, Firenze, Toscana, 50123, Italia",highway,residential
184,via Panzani,via Panzani,"[""*...Piazza dell'Unità Italiana\nmolto vicina a piazza della Stazione, con la quale condivide il ruolo di importante snodo delle linee di autobus cittadine, la piazza si apre sul fianco nord della basilica di Santa Maria Novella, davanti a via degli Avelli e via Panzani...."", ""*...Via de' Cerretani\nè un'ampia via del centro storico che da piazza della Stazione, tramite via Panzani, porta a piazza San Giovanni....""]","Via Panzani, San Frediano, Quartiere 1, Firenze, Toscana, 50123, Italia","{""coordinates"": [11.250782, 43.774263], ""type"": ""Point""}","Via Panzani, San Frediano, Quartiere 1, Firenze, Toscana, 50123, Italia",highway,residential
185,Palazzo dei Cerretani,Palazzo dei Cerretani,['...Su di essa si affacciano il Palazzo dei Cerretani e grand hotel tra i quali il moderno Hotel Majestic....'],"Palazzo dei Cerretani, Piazza dell'Unità Italiana, San Frediano, Quartiere 1, Firenze, Toscana, 50123, Italia","{""coordinates"": [11.250492, 43.775304], ""type"": ""Point""}","Palazzo dei Cerretani, Piazza dell'Unità Italiana, San Frediano, Quartiere 1, Firenze, Toscana, 50123, Italia",building,yes
187,Piazza dell'Indipendenza,Piazza dell'Indipendenza,"[""*...Piazza dell'Indipendenza\nè una grande piazza del centro storico di Firenze;...""]","Piazza dell'Indipendenza, Quartiere 1, Firenze, Toscana, 50129, Italia","{""coordinates"": [11.25279, 43.779576], ""type"": ""Point""}","Piazza dell'Indipendenza, Quartiere 1, Firenze, Toscana, 50129, Italia",highway,residential
188,piazza San Firenze,piazza San Firenze,"[""...Palazzo del Bargello\nposto in via del Proconsolo, molto vicino al Complesso di San Filippo Neri di Piazza San Firenze e alla Badia Fiorentina, il palazzo del Bargello la cui costruzione iniziò nel 1255 e proseguì con modifiche nei secoli successivi ospita l'importante Museo nazionale del Bargello che custodisce tra le tante sculture anche il David di Donatello...."", '*...Piazza San Firenze\nposta appena dietro a piazza della Signoria, piazza San Firenze è dominata dal complesso di San Filippo Neri, palazzo Gondi e palazzo Columbia-Parlamento....', ""*...In essa sfocia via del Proconsolo sulla quale proprio all'estremo verso piazza San Firenze si affacciano il Bargello e la Badia Fiorentina, ben visibili dalla suddetta piazza...."", ""*...Palazzo del Bargello\nposto in via del Proconsolo, molto vicino al Complesso di San Filippo Neri di Piazza San Firenze e alla Badia Fiorentina, il palazzo del Bargello la cui costruzione iniziò nel 1255 e proseguì con modifiche nei secoli successivi ospita l'importante Museo nazionale del Bargello che custodisce tra le tante sculture anche il David di Donatello....""]","Piazza San Firenze, San Niccolò, Quartiere 1, Firenze, Toscana, Italia","{""coordinates"": [11.257628, 43.769865], ""type"": ""Point""}","Piazza San Firenze, San Niccolò, Quartiere 1, Firenze, Toscana, Italia",highway,pedestrian
189,palazzo Gondi,palazzo Gondi,"['*...Piazza San Firenze\nposta appena dietro a piazza della Signoria, piazza San Firenze è dominata dal complesso di San Filippo Neri, palazzo Gondi e palazzo Columbia-Parlamento....']","Palazzo Gondi, Via dei Gondi, San Niccolò, Quartiere 1, Firenze, Toscana, 50122, Italia","{""coordinates"": [11.257245, 43.76961], ""type"": ""Point""}","Palazzo Gondi, Via dei Gondi, San Niccolò, Quartiere 1, Firenze, Toscana, 50122, Italia",building,apartments
190,palazzo Columbia-Parlamento,palazzo Columbia-Parlamento,"['...Piazza San Firenze\nposta appena dietro a piazza della Signoria, piazza San Firenze è dominata dal complesso di San Filippo Neri, palazzo Gondi e palazzo Columbia-Parlamento....']","Palazzo Columbia-Parlamento, Via dei Leoni, San Niccolò, Quartiere 1, Firenze, Toscana, 50122, Italia","{""coordinates"": [11.257637, 43.769277], ""type"": ""Point""}","Palazzo Columbia-Parlamento, Via dei Leoni, San Niccolò, Quartiere 1, Firenze, Toscana, 50122, Italia",building,hotel
191,Via dei Calzaiuoli,Via dei Calzaiuoli,"['*...Via dei Calzaiuoli\nè la via più centrale e tra le più eleganti di Firenze, meta costante di un intenso traffico pedonale, lungo i suoi lati si trovano molti dei negozi più eleganti della città....']","Via dei Calzaiuoli, Oltrarno, Quartiere 1, Firenze, Toscana, 50122, Italia","{""coordinates"": [11.255279, 43.770213], ""type"": ""Point""}","Via dei Calzaiuoli, Oltrarno, Quartiere 1, Firenze, Toscana, 50122, Italia",highway,pedestrian
192,via degli Speziali,via degli Speziali,"['*...Parallela a via Roma, e collegata a Piazza della Repubblica da via degli Speziali, questa via si snoda da piazza San Giovanni a piazza della Signoria....']","Via degli Speziali, Oltrarno, Quartiere 1, Firenze, Toscana, 50122, Italia","{""coordinates"": [11.254781, 43.771511], ""type"": ""Point""}","Via degli Speziali, Oltrarno, Quartiere 1, Firenze, Toscana, 50122, Italia",highway,pedestrian
