,entity,to_search,snippet,address,coordinates,name_location,class,type
227,Viale Fratelli Rosselli,Viale Fratelli Rosselli,"['...Ponte alla Vittoria\nè il primo a valle al di fuori del centro storico, porta accanto al piazzale del Parco delle Cascine e immette sui Viali di Circonvallazione nel viale Fratelli Rosselli....', '...Porta al Prato\nfa parte delle Mura di Firenze e si trova al centro di un piazzale molto trafficato sui viali di Circonvallazione cittadini, dove convergono il viale Fratelli Rosselli, la via Ponte alle Mosse, viale Belfiore e Il Prato....', ""...Questa torre, oggi situata in un'isola nei trafficati viali di Circonvallazione in mezzo al viale Fratelli Rosselli, aveva una funzione di guardia ed era un tempo vicina a una postierla...."", '*...I viali principali sono Viale Filippo Strozzi, Viale Spartaco Lavagnini, Viale Fratelli Rosselli, Viale Giacomo Matteotti, Viale Antonio Gramsci, Viale Giovanni Amendola e Viale della Giovine Italia....', '...Dal 2011 la sede si è trasferita da via Palestrina a una nuova e più funzionale sede nel viale Fratelli Rosselli, sempre nella zona di Porta al Prato....', '*...Dal 2011 la sede si è trasferita da via Palestrina a una nuova e più funzionale sede nel viale Fratelli Rosselli, sempre nella zona di Porta al Prato....', '...Vi sono sepolti tra gli altri i fratelli Rosselli, Giuseppe Poggi, Spartaco Lavagnini, Luigi Dallapiccola....', '*...Ponte alla Vittoria\nè il primo a valle al di fuori del centro storico, porta accanto al piazzale del Parco delle Cascine e immette sui Viali di Circonvallazione nel viale Fratelli Rosselli....', ""*...Questa torre, oggi situata in un'isola nei trafficati viali di Circonvallazione in mezzo al viale Fratelli Rosselli, aveva una funzione di guardia ed era un tempo vicina a una postierla....""]","Viale Fratelli Rosselli, San Iacopino, Quartiere 1, Firenze, Toscana, 50100, Italia","{""coordinates"": [11.244117, 43.779297], ""type"": ""Point""}","Viale Fratelli Rosselli, San Iacopino, Quartiere 1, Firenze, Toscana, 50100, Italia",highway,primary
228,Viale Giacomo Matteotti,Viale Giacomo Matteotti,"['*...I viali principali sono Viale Filippo Strozzi, Viale Spartaco Lavagnini, Viale Fratelli Rosselli, Viale Giacomo Matteotti, Viale Antonio Gramsci, Viale Giovanni Amendola e Viale della Giovine Italia....']","Viale Giacomo Matteotti, Le Cure, Quartiere 2, Firenze, Toscana, 50199, Italia","{""coordinates"": [11.263328, 43.782561], ""type"": ""Point""}","Viale Giacomo Matteotti, Le Cure, Quartiere 2, Firenze, Toscana, 50199, Italia",highway,primary
229,Viale Antonio Gramsci,Viale Antonio Gramsci,"['*...I viali principali sono Viale Filippo Strozzi, Viale Spartaco Lavagnini, Viale Fratelli Rosselli, Viale Giacomo Matteotti, Viale Antonio Gramsci, Viale Giovanni Amendola e Viale della Giovine Italia....']","Viale Antonio Gramsci, Quartiere 2, Firenze, Toscana, 50132, Italia","{""coordinates"": [11.271232, 43.77174], ""type"": ""Point""}","Viale Antonio Gramsci, Quartiere 2, Firenze, Toscana, 50132, Italia",highway,footway
230,Viale Giovanni Amendola,Viale Giovanni Amendola,"['*...I viali principali sono Viale Filippo Strozzi, Viale Spartaco Lavagnini, Viale Fratelli Rosselli, Viale Giacomo Matteotti, Viale Antonio Gramsci, Viale Giovanni Amendola e Viale della Giovine Italia....']","Viale Giovanni Amendola, Quartiere 2, Firenze, Toscana, 50121, Italia","{""coordinates"": [11.271296, 43.769313], ""type"": ""Point""}","Viale Giovanni Amendola, Quartiere 2, Firenze, Toscana, 50121, Italia",highway,footway
231,Viale della Giovine Italia,Viale della Giovine Italia,"['*...I viali principali sono Viale Filippo Strozzi, Viale Spartaco Lavagnini, Viale Fratelli Rosselli, Viale Giacomo Matteotti, Viale Antonio Gramsci, Viale Giovanni Amendola e Viale della Giovine Italia....']","Viale della Giovine Italia, San Niccolò, Quartiere 1, Firenze, Toscana, 50121, Italia","{""coordinates"": [11.270414, 43.769826], ""type"": ""Point""}","Viale della Giovine Italia, San Niccolò, Quartiere 1, Firenze, Toscana, 50121, Italia",highway,primary
235,Rivoire,Rivoire,"[""*...Tra i principali caffè storici della città, si possono citare il Caffè Gilli, Paszkowski e il Caffè Le Giubbe Rosse, in piazza della Repubblica, il caffè Rivoire in Piazza della Signoria, il Gran Caffè Doney e Procacci in via de' Tornabuoni, il caffè Robiglio in via dei Servi....""]","Rivoire, 4R, Via Vacchereccia, Oltrarno, Quartiere 1, Firenze, Toscana, 50122, Italia","{""coordinates"": [11.2551, 43.769626], ""type"": ""Point""}","Rivoire, 4R, Via Vacchereccia, Oltrarno, Quartiere 1, Firenze, Toscana, 50122, Italia",amenity,cafe
237,Robiglio,Robiglio,"[""*...Tra i principali caffè storici della città, si possono citare il Caffè Gilli, Paszkowski e il Caffè Le Giubbe Rosse, in piazza della Repubblica, il caffè Rivoire in Piazza della Signoria, il Gran Caffè Doney e Procacci in via de' Tornabuoni, il caffè Robiglio in via dei Servi....""]","Robiglio, Via dei Tosinghi, Oltrarno, Quartiere 1, Firenze, Toscana, 50122, Italia","{""coordinates"": [11.254889, 43.772137], ""type"": ""Point""}","Robiglio, Via dei Tosinghi, Oltrarno, Quartiere 1, Firenze, Toscana, 50122, Italia",shop,deli
238,via dei Servi,via dei Servi,"[""*...Tra i principali caffè storici della città, si possono citare il Caffè Gilli, Paszkowski e il Caffè Le Giubbe Rosse, in piazza della Repubblica, il caffè Rivoire in Piazza della Signoria, il Gran Caffè Doney e Procacci in via de' Tornabuoni, il caffè Robiglio in via dei Servi....""]","Via dei Servi, Quartiere 1, Firenze, Toscana, 50112, Italia","{""coordinates"": [11.257747, 43.773998], ""type"": ""Point""}","Via dei Servi, Quartiere 1, Firenze, Toscana, 50112, Italia",highway,pedestrian
239,Hard Rock Cafe,Hard Rock Cafe,"[""...Nel 2011 è stato aperto a Firenze l'Hard Rock Cafe....""]","Hard Rock Cafe, 1, Via dei Brunelleschi, Oltrarno, Quartiere 1, Firenze, Toscana, 50123, Italia","{""coordinates"": [11.253519, 43.772078], ""type"": ""Point""}","Hard Rock Cafe, 1, Via dei Brunelleschi, Oltrarno, Quartiere 1, Firenze, Toscana, 50123, Italia",amenity,restaurant
240,Giardino storico,Giardino storico,"['*...Giardino di Boboli\ncon i suoi 45 ettari, è uno dei più grandi esempi di Giardino storico in Italia, connesso con Palazzo Pitti e col Forte Belvedere....']","Giardino Storico della Villa Medicea di Castello, Via di San Michele a Castello, Castello, Quartiere 5, Firenze, Toscana, 50141, Italia","{""coordinates"": [11.22982, 43.820413], ""type"": ""Point""}","Giardino Storico della Villa Medicea di Castello, Via di San Michele a Castello, Castello, Quartiere 5, Firenze, Toscana, 50141, Italia",tourism,museum
243,piazza Vittorio Veneto,piazza Vittorio Veneto,"[""*...Ha inizio dall'attuale piazza Vittorio Veneto per arrivare fino sotto al ponte all'Indiano delimitato naturalmente dal fiume Arno dal torrente Mugnone e dal canale Macinante....""]","Piazza Vittorio Veneto, Quartiere 1, Firenze, Toscana, 50144, Italia","{""coordinates"": [11.23702, 43.776914], ""type"": ""Point""}","Piazza Vittorio Veneto, Quartiere 1, Firenze, Toscana, 50144, Italia",highway,primary
244,Macinante,Macinante,"[""*...Ha inizio dall'attuale piazza Vittorio Veneto per arrivare fino sotto al ponte all'Indiano delimitato naturalmente dal fiume Arno dal torrente Mugnone e dal canale Macinante....""]","Via del Fosso Macinante, Quartiere 1, Firenze, Toscana, 50144, Italia","{""coordinates"": [11.237115, 43.776976], ""type"": ""Point""}","Via del Fosso Macinante, Quartiere 1, Firenze, Toscana, 50144, Italia",highway,residential
245,Piramide delle Cascine,Piramide delle Cascine,"[""...Oltre che a locali e discoteche, ospita il monumento al principe indiano Rajaram Chuttraputti, la statua in bronzo del Re Vittorio Emanuele II a cavallo, la Piramide delle Cascine, l'anfiteatro e la Scuola militare aeronautica Giulio Douhet....""]","Ghiacciaia delle Cascine (Piramide), Viale degli Olmi, Quartiere 1, Firenze, Toscana, 50144, Italia","{""coordinates"": [11.225018, 43.779557], ""type"": ""Point""}","Ghiacciaia delle Cascine (Piramide), Viale degli Olmi, Quartiere 1, Firenze, Toscana, 50144, Italia",historic,monument
246,Scuola militare aeronautica,Scuola militare aeronautica,"[""...Oltre che a locali e discoteche, ospita il monumento al principe indiano Rajaram Chuttraputti, la statua in bronzo del Re Vittorio Emanuele II a cavallo, la Piramide delle Cascine, l'anfiteatro e la Scuola militare aeronautica Giulio Douhet...."", '...Hanno inoltre sede in città il centro coreografico internazionale Opus Ballet, il Conservatorio Luigi Cherubini e la Scuola militare aeronautica Giulio Douhet....']","Biblioteca della Scuola di guerra aerea e Scuola di applicazione aeronautica militare, Viale dell'Aeronautica, Il Barco, Quartiere 1, Firenze, Toscana, 50127, Italia","{""coordinates"": [11.214606, 43.785757], ""type"": ""Point""}","Biblioteca della Scuola di guerra aerea e Scuola di applicazione aeronautica militare, Viale dell'Aeronautica, Il Barco, Quartiere 1, Firenze, Toscana, 50127, Italia",amenity,library
247,Piazzale delle Cascine,Piazzale delle Cascine,"[""*...Nell'agosto 2013, nei locali delle ex scuderie in Piazzale delle Cascine venne inaugurato un nuovo centro visite con lo scopo di fornire informazioni sul Parco e migliorarne la fruibilità....""]","Piazzale delle Cascine, Quartiere 1, Firenze, Toscana, 50144, Italia","{""coordinates"": [11.220535, 43.782069], ""type"": ""Point""}","Piazzale delle Cascine, Quartiere 1, Firenze, Toscana, 50144, Italia",highway,residential
248,Viale Giuseppe Poggi,Viale Giuseppe Poggi,"['*...Giardino delle Rose\nè un grazioso Parco nella zona di Oltrarno sottostante al Piazzale Michelangelo verso ovest, in Viale Giuseppe Poggi....']","Viale Giuseppe Poggi, San Niccolò, Quartiere 1, Firenze, Toscana, 50122, Italia","{""coordinates"": [11.264862, 43.763594], ""type"": ""Point""}","Viale Giuseppe Poggi, San Niccolò, Quartiere 1, Firenze, Toscana, 50122, Italia",highway,unclassified
249,Giardino dei Semplici,Giardino dei Semplici,"[""*...Giardino dei Semplici\nè una sezione del Museo di Storia Naturale dell'Università degli Studi di Firenze....""]","Giardino dei Semplici, Quartiere 1, Firenze, Toscana, Italia","{""coordinates"": [11.262099, 43.778908], ""type"": ""Point""}","Giardino dei Semplici, Quartiere 1, Firenze, Toscana, Italia",highway,pedestrian
251,Ponte Rosso,Ponte Rosso,"[""*...Giardino dell'Orticoltura\nSituato nella zona del Ponte Rosso, nella parte nord di Firenze che ha ospitato esposizioni nazionali e mostre prestigiose....""]","Ponte Rosso, Quartiere 5, Firenze, Toscana, 50199, Italia","{""coordinates"": [11.262218, 43.786028], ""type"": ""Point""}","Ponte Rosso, Quartiere 5, Firenze, Toscana, 50199, Italia",highway,unclassified
252,Loggetta Bondi,Loggetta Bondi,"['*...Oltre alla Loggetta Bondi, nel Giardino si trovano anche una serra in ferro e vetro di grandi dimensioni che non aveva precedenti in Italia quando fu costruita;...']","Loggetta Bondi, Via Vittorio Emanuele II, Quartiere 5, Firenze, Toscana, 50199, Italia","{""coordinates"": [11.261228, 43.78735], ""type"": ""Point""}","Loggetta Bondi, Via Vittorio Emanuele II, Quartiere 5, Firenze, Toscana, 50199, Italia",building,yes
255,Giardino della Gherardesca,Giardino della Gherardesca,"[""*...Giardino della Gherardesca\nè il più grande Giardino privato nel centro storico di Firenze e ha l'entrata principale sul piazzale Donatello....""]","Giardino della Gherardesca, Borgo Pinti, Quartiere 1, Firenze, Toscana, 50132, Italia","{""coordinates"": [11.26568, 43.77822], ""type"": ""Point""}","Giardino della Gherardesca, Borgo Pinti, Quartiere 1, Firenze, Toscana, 50132, Italia",leisure,garden
257,Palazzo della Gherardesca,Palazzo della Gherardesca,['...Antistante a esso si trova il Palazzo della Gherardesca....'],"Palazzo della Gherardesca, Borgo Pinti, Quartiere 1, Firenze, Toscana, 50132, Italia","{""coordinates"": [11.266522, 43.777427], ""type"": ""Point""}","Palazzo della Gherardesca, Borgo Pinti, Quartiere 1, Firenze, Toscana, 50132, Italia",building,yes
258,Giardino Torrigiani,Giardino Torrigiani,"[""*...Giardino Torrigiani\nsi tratta di un grande Parco all'interno delle mura fiorentine, in stato di conservazione ottimale e costituisce un esempio tipico dello stile romantico che contrassegnò i giardini all'inizio dell'Ottocento....""]","il Torrino del Giardino Torrigiani, Via Gusciana, San Frediano, Quartiere 1, Firenze, Toscana, 50124, Italia","{""coordinates"": [11.241729, 43.765393], ""type"": ""Point""}","il Torrino del Giardino Torrigiani, Via Gusciana, San Frediano, Quartiere 1, Firenze, Toscana, 50124, Italia",man_made,tower
260,Gymnasium,Gymnasium,"['...Al suo interno si trovano tra le varie cose anche la Grotta di Merlino, il Gymnasium, e il torrino....']","Gymnasium Club, 33, Viale Giovanni XXIII, Borgo San Lorenzo, Firenze, Toscana, 50032, Italia","{""coordinates"": [11.377839, 43.954641], ""type"": ""Point""}","Gymnasium Club, 33, Viale Giovanni XXIII, Borgo San Lorenzo, Firenze, Toscana, 50032, Italia",leisure,fitness_centre
261,viale Filippo Strozzi,viale Filippo Strozzi,"['...I viali principali sono Viale Filippo Strozzi, Viale Spartaco Lavagnini, Viale Fratelli Rosselli, Viale Giacomo Matteotti, Viale Antonio Gramsci, Viale Giovanni Amendola e Viale della Giovine Italia....', '*...Giardini della Fortezza\ndetti anche del Vascone, posti in una posizione molto centrale della città e del trasporto urbano, si trovano sul lato est della Fortezza da Basso, tra i bastioni della fortezza e i viali di Circonvallazione, cui viale Filippo Strozzi li contorna per buona parte....', '*...I viali principali sono Viale Filippo Strozzi, Viale Spartaco Lavagnini, Viale Fratelli Rosselli, Viale Giacomo Matteotti, Viale Antonio Gramsci, Viale Giovanni Amendola e Viale della Giovine Italia....']","Viale Filippo Strozzi, Quartiere 1, Firenze, Toscana, 50129, Italia","{""coordinates"": [11.250595, 43.780606], ""type"": ""Point""}","Viale Filippo Strozzi, Quartiere 1, Firenze, Toscana, 50129, Italia",highway,residential
265,Palazzo Strozzi Sacrati,Palazzo Strozzi Sacrati,"[""*...A Firenze, sono presenti le sedi della provincia nel Palazzo Medici Riccardi e la sede della Regione Toscana nel Palazzo Strozzi Sacrati, la prefettura, la Ragioneria provinciale dello Stato, la direzione regionale dell'Agenzia delle entrate, gli uffici della motorizzazione civile e l'Agenzia Italiana per la Sicurezza delle ferrovie...."", ""...Palazzo Strozzi\nsi trova circa a metà dell'attuale via de' Tornabuoni...."", ""*...Via de' Tornabuoni\nè una lussuosa Strada del centro storico che si caratterizza per la presenza delle migliori boutique di stilisti di alta moda e di gioielleria, su cui si affacciano numerosi palazzi storici, tra cui palazzo Strozzi...."", ""*...Palazzo Strozzi\nsi trova circa a metà dell'attuale via de' Tornabuoni....""]","Palazzo Sacrati Strozzi - Presidenza della Regione Toscana, Piazza del Duomo, Quartiere 1, Firenze, Toscana, 50122, Italia","{""coordinates"": [11.257998, 43.772724], ""type"": ""Point""}","Palazzo Sacrati Strozzi - Presidenza della Regione Toscana, Piazza del Duomo, Quartiere 1, Firenze, Toscana, 50122, Italia",amenity,townhall
266,Villa Salviati,Villa Salviati,"[""*...British Institute of Florence, il Segretariato Mondiale per il diritto all'acqua e ai servizi igienico-sanitari, gli uffici di ricerca dell'UNICEF, presso lo Spedale degli Innocenti e la sede degli archivi dei documenti storici dell'Unione europea, in Villa Salviati....""]","Villa Salviati, Via Salviati, La Lastra, Quartiere 2, Firenze, Toscana, 50131, Italia","{""coordinates"": [11.274103, 43.803996], ""type"": ""Point""}","Villa Salviati, Via Salviati, La Lastra, Quartiere 2, Firenze, Toscana, 50131, Italia",amenity,public_building
267,Centro traumatologico ortopedico,Centro traumatologico ortopedico,['*...Il Centro traumatologico ortopedico (Firenze);...'],"CTO Centro Traumatologico Ortopedico, Via Incontri, Poggetto, Quartiere 5, Firenze, Toscana, 50134, Italia","{""coordinates"": [11.248512, 43.801099], ""type"": ""Point""}","CTO Centro Traumatologico Ortopedico, Via Incontri, Poggetto, Quartiere 5, Firenze, Toscana, 50134, Italia",amenity,hospital
269,Meyer,Meyer,"[""*...L'Azienda ospedaliero universitaria Meyer, tra le più importanti d'Italia per il trattamento pediatrico;...""]","Meyer Health Campus, Via Cosimo il Vecchio, Quartiere 5, Serpiolle, Firenze, Toscana, 50139, Italia","{""coordinates"": [11.255465, 43.80832], ""type"": ""Point""}","Meyer Health Campus, Via Cosimo il Vecchio, Quartiere 5, Serpiolle, Firenze, Toscana, 50139, Italia",amenity,hospital
272,Ospedale di Ospedale di San Giovanni di Dio,Ospedale di Ospedale di San Giovanni di Dio,"['*...Il nuovo Ospedale di San Giovanni di Dio, popolarmente detto Ospedale di Torregalli, posto al confine con Scandicci e recentemente sottoposto a un totale rinnovamento; il vecchio Ospedale di Ospedale di San Giovanni di Dio situato in Borgo Ognissanti, è stato trasferito nel 1982 nel rione di Torregalli oggi ha la funzione di ASL;...']","Chiesa dell'Ospedale San Giovanni di Dio, Borgo Ognissanti, San Frediano, Quartiere 1, Firenze, Toscana, 50123, Italia","{""coordinates"": [11.246764, 43.771836], ""type"": ""Point""}","Chiesa dell'Ospedale San Giovanni di Dio, Borgo Ognissanti, San Frediano, Quartiere 1, Firenze, Toscana, 50123, Italia",amenity,place_of_worship
273,Borgo Ognissanti,Borgo Ognissanti,"['*...Il nuovo Ospedale di San Giovanni di Dio, popolarmente detto Ospedale di Torregalli, posto al confine con Scandicci e recentemente sottoposto a un totale rinnovamento; il vecchio Ospedale di Ospedale di San Giovanni di Dio situato in Borgo Ognissanti, è stato trasferito nel 1982 nel rione di Torregalli oggi ha la funzione di ASL;...']","Borgo Ognissanti, San Frediano, Quartiere 1, Firenze, Toscana, 50123, Italia","{""coordinates"": [11.24689, 43.771607], ""type"": ""Point""}","Borgo Ognissanti, San Frediano, Quartiere 1, Firenze, Toscana, 50123, Italia",highway,residential
274,Ospedale di Santa Maria Annunziata,Ospedale di Santa Maria Annunziata,"[""...L'Ospedale di Santa Maria Annunziata, serve un'ampia zona del comune;...""]","Ospedale Santa Maria Annunziata, Via dell'Antella, Ponte a Niccheri, Antella, Bagno a Ripoli, Firenze, Toscana, 50012, Italia","{""coordinates"": [11.306063, 43.731444], ""type"": ""Point""}","Ospedale Santa Maria Annunziata, Via dell'Antella, Ponte a Niccheri, Antella, Bagno a Ripoli, Firenze, Toscana, 50012, Italia",amenity,hospital
275,Villa I Tatti,Villa I Tatti,"[""...Ci sono, inoltre, sedi di Università statunitensi e internazionali in tutta la città, come l'Università di Harvard, che ha sede presso la Villa I Tatti nella zona di Settignano, la California State University, la Pepperdine University, la New York University che ha, nella storica villa La Pietra, il più grande campus in Europa, la Florida State University e tante altre....""]","Villa I Tatti, Via di Vincigliata, Vincigliata, Fiesole, Firenze, Toscana, 50010, Italia","{""coordinates"": [11.309712, 43.786507], ""type"": ""Point""}","Villa I Tatti, Via di Vincigliata, Vincigliata, Fiesole, Firenze, Toscana, 50010, Italia",historic,manor
281,Kaffeehaus,Kaffeehaus,"[""*...Giardino di Boboli, connesso anche al Forte Belvedere, accoglie ogni anno oltre 800\xa0000 visitatori ed è uno dei più importanti esempi di Giardino all'italiana al mondo. È un vero e proprio Museo all'aperto, per l'impostazione architettonico-paesaggistica e per la collezione di sculture, che vanno dalle antichità romane al XIX secolo. Notevole è l'importanza che nel Giardino assumono le statue e gli edifici, come la settecentesca Kaffeehaus (raro esempio di gusto rococò), che permette di godere del panorama sulla città, o la Limonaia....""]","Kaffeehaus del Giardino di Boboli, il Viottolone, Oltrarno, Quartiere 1, Firenze, Toscana, 50125, Italia","{""coordinates"": [11.252482, 43.764159], ""type"": ""Point""}","Kaffeehaus del Giardino di Boboli, il Viottolone, Oltrarno, Quartiere 1, Firenze, Toscana, 50125, Italia",building,yes
282,Limonaia,Limonaia,"[""...Giardino di Boboli, connesso anche al Forte Belvedere, accoglie ogni anno oltre 800\xa0000 visitatori ed è uno dei più importanti esempi di Giardino all'italiana al mondo. È un vero e proprio Museo all'aperto, per l'impostazione architettonico-paesaggistica e per la collezione di sculture, che vanno dalle antichità romane al XIX secolo. Notevole è l'importanza che nel Giardino assumono le statue e gli edifici, come la settecentesca Kaffeehaus (raro esempio di gusto rococò), che permette di godere del panorama sulla città, o la Limonaia....""]","Limonaia, Via Faenza, Quartiere 1, Firenze, Toscana, 50100, Italia","{""coordinates"": [11.249843, 43.778751], ""type"": ""Point""}","Limonaia, Via Faenza, Quartiere 1, Firenze, Toscana, 50100, Italia",building,yes
283,Museo di San Marco,Museo di San Marco,"[""*...Museo di San Marco, nell'antico convento di San Marco il Museo conserva la migliore raccolta al mondo di opere del Beato Angelico, che qui visse e lavorò. Lo stesso convento è un capolavoro dell'architettura del primo Quattrocento, creato da Michelozzo per Cosimo de' Medici. Vi sono esposte altre opere di arte sacra rinascimentale e il lapidario della zona del Mercato Vecchio, distrutto verso il 1895 per far posto a piazza della Repubblica....""]","Museo di San Marco, Piazza San Marco, Quartiere 1, Firenze, Toscana, 50112, Italia","{""coordinates"": [11.258816, 43.778082], ""type"": ""Point""}","Museo di San Marco, Piazza San Marco, Quartiere 1, Firenze, Toscana, 50112, Italia",highway,bus_stop
285,Museo dell'Opificio delle Pietre Dure,Museo dell'Opificio delle Pietre Dure,"[""*...Museo dell'Opificio delle Pietre Dure, uno dei vanti della città toscana e dell'Italia a livello mondiale. La sua attività è diretta al restauro delle opere d'arte e alla ricerca scientifica in tale campo....""]","Museo dell'Opificio delle Pietre Dure, Via degli Alfani, Quartiere 1, Firenze, Toscana, 50112, Italia","{""coordinates"": [11.258926, 43.776141], ""type"": ""Point""}","Museo dell'Opificio delle Pietre Dure, Via degli Alfani, Quartiere 1, Firenze, Toscana, 50112, Italia",tourism,museum
286,Museo Galileo,Museo Galileo,"['*...Museo Galileo, conserva una delle raccolte scientifiche più importanti a livello nazionale e internazionale, con strumenti originali usati da Galileo Galilei....']","Biblioteca del Museo Galileo, Lungarno Anna Maria Luisa de' Medici, Oltrarno, Quartiere 1, Firenze, Toscana, 50125, Italia","{""coordinates"": [11.255932, 43.767721], ""type"": ""Point""}","Biblioteca del Museo Galileo, Lungarno Anna Maria Luisa de' Medici, Oltrarno, Quartiere 1, Firenze, Toscana, 50125, Italia",amenity,library
289,Museo Novecento,Museo Novecento,"[""*...Museo Novecento, si trova all'interno dell'antico Spedale delle Leopoldine in Piazza Santa Maria Novella. È dedicato all'arte italiana del XX secolo e propone una selezione di circa 300 opere distribuite in 15 ambienti. È stato inaugurato il 24 giugno 2014....""]","Museo Nazionale Alinari della Fotografia, 10, Piazza Santa Maria Novella, San Frediano, Quartiere 1, Firenze, Toscana, 50123, Italia","{""coordinates"": [11.248841, 43.773037], ""type"": ""Point""}","Museo Nazionale Alinari della Fotografia, 10, Piazza Santa Maria Novella, San Frediano, Quartiere 1, Firenze, Toscana, 50123, Italia",tourism,museum
291,via Santa Maria,via Santa Maria,"['*...Anche Vittorio Gassman dal 1979 al 1991, con la Bottega Teatrale da lui fondata e diretta in via Santa Maria, è stato un protagonista del mondo culturale fiorentino che ha richiamato a Firenze moltissimi dei nomi più noti del Teatro e del Cinema italiano e mondiale da Giorgio Albertazzi (per molti anni vicedirettore) a Orazio Costa, da Antonella Daviso a Ettore Scola, da Yoves Le Bretton a Siro Ferrone....']","Via Santa Maria, San Frediano, Quartiere 1, Firenze, Toscana, 50125, Italia","{""coordinates"": [11.245257, 43.764716], ""type"": ""Point""}","Via Santa Maria, San Frediano, Quartiere 1, Firenze, Toscana, 50125, Italia",highway,residential
293,Conservatorio Luigi Cherubini,Conservatorio Luigi Cherubini,"['...Hanno inoltre sede in città il centro coreografico internazionale Opus Ballet, il Conservatorio Luigi Cherubini e la Scuola militare aeronautica Giulio Douhet....', ""...A Firenze è presente il Conservatorio Luigi Cherubini, nello stesso isolato dell'Accademia di Belle Arti, della Galleria dell'Accademia e dell'Opificio delle pietre dure che incorpora anche il Museo degli strumenti musicali antichi che custodisce soprattutto strumenti settecenteschi come violini, viole e violoncelli, alcuni dei quali realizzati dal più importante liutaio della storia, Stradivari, nonché numerose curiosità musicali come il clavicembalo di Bartolomeo Cristofori, inventore del pianoforte....""]","Conservatorio Luigi Cherubini, Via di Rocca Tedalda, Rovezzano, Quartiere 2, Firenze, Toscana, 50136, Italia","{""coordinates"": [11.316679, 43.767489], ""type"": ""Point""}","Conservatorio Luigi Cherubini, Via di Rocca Tedalda, Rovezzano, Quartiere 2, Firenze, Toscana, 50136, Italia",amenity,school
