,entity,to_search,snippet,address,coordinates,name_location,class,type
58,via Porta Rossa,via Porta Rossa,"[""*...Palazzo Davanzati\nsituato in via Porta Rossa, è un raro esempio di casa trecentesca restaurata con cura all'inizio del Novecento dall'antiquario Elia Volpi....""]","Via Porta Rossa, Oltrarno, Quartiere 1, Firenze, Toscana, 50122, Italia","{""coordinates"": [11.254738, 43.77021], ""type"": ""Point""}","Via Porta Rossa, Oltrarno, Quartiere 1, Firenze, Toscana, 50122, Italia",highway,pedestrian
60,Palazzo Antinori,Palazzo Antinori,"[""*...Palazzo Antinori\nconsiderato tra i più bei palazzi rinascimentali di Firenze, si trova nell'omonima piazza Antinori, a una delle estremità di via de' Tornabuoni, con un elegante cortile porticato al centro e il Giardino retrostante, si ispira al Palazzo Medici Riccardi, ma ha una forma architettonica ancora più leggera ed elegante....""]","Palazzo Antinori, Via degli Antinori, San Frediano, Quartiere 1, Firenze, Toscana, 50123, Italia","{""coordinates"": [11.251259, 43.772827], ""type"": ""Point""}","Palazzo Antinori, Via degli Antinori, San Frediano, Quartiere 1, Firenze, Toscana, 50123, Italia",historic,building
62,Museo Salvatore Ferragamo,Museo Salvatore Ferragamo,"[""...Ospita il Museo Salvatore Ferragamo, nato per far conoscere il ruolo e l'attività internazionale dello stilista fiorentino dagli anni venti al 1960, anno della sua scomparsa...."", ""...Inoltre è presente il Museo Salvatore Ferragamo nel palazzo Spini Feroni in via de' Tornabuoni e in questa città si tenne in via dei Serragli nel 1953 la prima sfilata d'Alta Moda italiana....""]","Museo Salvatore Ferragamo, 5 R, Piazza di Santa Trinita, Oltrarno, Quartiere 1, Firenze, Toscana, 50123, Italia","{""coordinates"": [11.251175, 43.769849], ""type"": ""Point""}","Museo Salvatore Ferragamo, 5 R, Piazza di Santa Trinita, Oltrarno, Quartiere 1, Firenze, Toscana, 50123, Italia",tourism,museum
63,Palazzo del Bargello,Palazzo del Bargello,"[""*...Palazzo del Bargello\nposto in via del Proconsolo, molto vicino al Complesso di San Filippo Neri di Piazza San Firenze e alla Badia Fiorentina, il palazzo del Bargello la cui costruzione iniziò nel 1255 e proseguì con modifiche nei secoli successivi ospita l'importante Museo nazionale del Bargello che custodisce tra le tante sculture anche il David di Donatello...."", '...Via Ghibellina\nè una delle vie più lunghe del centro di Firenze e conta vari monumenti dal palazzo del Bargello a palazzo Borghese, alla Badia Fiorentina, al Teatro Verdi (Firenze), e a Casa Buonarroti....', ""...La via si snoda dal palazzo del Bargello fino ad arrivare all'archivio di stato sui viali di Circonvallazione....""]","Palazzo del Bargello, 4, Via del Proconsolo, San Niccolò, Quartiere 1, Firenze, Toscana, 50122, Italia","{""coordinates"": [11.257985, 43.770396], ""type"": ""Point""}","Palazzo del Bargello, 4, Via del Proconsolo, San Niccolò, Quartiere 1, Firenze, Toscana, 50122, Italia",tourism,museum
64,via del Proconsolo,via del Proconsolo,"[""*...Palazzo del Bargello\nposto in via del Proconsolo, molto vicino al Complesso di San Filippo Neri di Piazza San Firenze e alla Badia Fiorentina, il palazzo del Bargello la cui costruzione iniziò nel 1255 e proseguì con modifiche nei secoli successivi ospita l'importante Museo nazionale del Bargello che custodisce tra le tante sculture anche il David di Donatello...."", ""*...In essa sfocia via del Proconsolo sulla quale proprio all'estremo verso piazza San Firenze si affacciano il Bargello e la Badia Fiorentina, ben visibili dalla suddetta piazza....""]","Via del Proconsolo, San Niccolò, Quartiere 1, Firenze, Toscana, 50122, Italia","{""coordinates"": [11.257818, 43.770504], ""type"": ""Point""}","Via del Proconsolo, San Niccolò, Quartiere 1, Firenze, Toscana, 50122, Italia",highway,pedestrian
66,Badia Fiorentina,Badia Fiorentina,"['*...Badia Fiorentina\nsituata nel cuore della città antica davanti al Museo nazionale del Bargello, è stata la prima abbazia cittadina....', ""*...Palazzo del Bargello\nposto in via del Proconsolo, molto vicino al Complesso di San Filippo Neri di Piazza San Firenze e alla Badia Fiorentina, il palazzo del Bargello la cui costruzione iniziò nel 1255 e proseguì con modifiche nei secoli successivi ospita l'importante Museo nazionale del Bargello che custodisce tra le tante sculture anche il David di Donatello...."", ""...In essa sfocia via del Proconsolo sulla quale proprio all'estremo verso piazza San Firenze si affacciano il Bargello e la Badia Fiorentina, ben visibili dalla suddetta piazza...."", '...Via Ghibellina\nè una delle vie più lunghe del centro di Firenze e conta vari monumenti dal palazzo del Bargello a palazzo Borghese, alla Badia Fiorentina, al Teatro Verdi (Firenze), e a Casa Buonarroti....']","Badia Fiorentina, Via del Proconsolo, San Niccolò, Quartiere 1, Firenze, Toscana, 50122, Italia","{""coordinates"": [11.257555, 43.770503], ""type"": ""Point""}","Badia Fiorentina, Via del Proconsolo, San Niccolò, Quartiere 1, Firenze, Toscana, 50122, Italia",amenity,place_of_worship
67,Villa medicea di Careggi,Villa medicea di Careggi,['*...Villa medicea di Careggi ;...'],"Villa Medicea di Careggi, Viale Gaetano Pieraccini, Quartiere 5, Serpiolle, Firenze, Toscana, 50139, Italia","{""coordinates"": [11.249631, 43.809344], ""type"": ""Point""}","Villa Medicea di Careggi, Viale Gaetano Pieraccini, Quartiere 5, Serpiolle, Firenze, Toscana, 50139, Italia",historic,castle
68,Villa medicea di Castello,Villa medicea di Castello,['*...Villa medicea di Castello ;...'],"Villa medicea di Castello, Piazza delle Lingue d'Europa, Castello, Quartiere 5, Firenze, Toscana, 27500, Italia","{""coordinates"": [11.22828, 43.819733], ""type"": ""Point""}","Villa medicea di Castello, Piazza delle Lingue d'Europa, Castello, Quartiere 5, Firenze, Toscana, 27500, Italia",amenity,library
70,Villa medicea della Topaia,Villa medicea della Topaia,['*...Villa medicea della Topaia ;...'],"Villa medicea della Topaia, Via della Topaia, Quartiere 5, Firenze, Toscana, 50141, Italia","{""coordinates"": [11.236995, 43.825227], ""type"": ""Point""}","Villa medicea della Topaia, Via della Topaia, Quartiere 5, Firenze, Toscana, 50141, Italia",historic,manor
71,Villa medicea di Marignolle,Villa medicea di Marignolle,['*...Villa medicea di Marignolle ;...'],"Villa Medicea di Marignolle, Via di Santa Maria a Marignolle, Baronta, Quartiere 3, Firenze, Toscana, 50143, Italia","{""coordinates"": [11.217049, 43.752991], ""type"": ""Point""}","Villa Medicea di Marignolle, Via di Santa Maria a Marignolle, Baronta, Quartiere 3, Firenze, Toscana, 50143, Italia",historic,manor
73,Forte Belvedere,Forte Belvedere,"['*...Forte Belvedere ....', '*...Giardino di Boboli\ncon i suoi 45 ettari, è uno dei più grandi esempi di Giardino storico in Italia, connesso con Palazzo Pitti e col Forte Belvedere....', ""*...Giardino Bardini\nsi estende, attorno all'omonima villa, sulle colline meridionale della città, non lontano dal Forte Belvedere a dall'area sommitale del Giardino di Boboli;..."", ""*...Giardino di Boboli, connesso anche al Forte Belvedere, accoglie ogni anno oltre 800\xa0000 visitatori ed è uno dei più importanti esempi di Giardino all'italiana al mondo. È un vero e proprio Museo all'aperto, per l'impostazione architettonico-paesaggistica e per la collezione di sculture, che vanno dalle antichità romane al XIX secolo. Notevole è l'importanza che nel Giardino assumono le statue e gli edifici, come la settecentesca Kaffeehaus (raro esempio di gusto rococò), che permette di godere del panorama sulla città, o la Limonaia....""]","Forte di Belvedere, 1, Via di San Leonardo, Oltrarno, Quartiere 1, Firenze, Toscana, 50125, Italia","{""coordinates"": [11.253738, 43.763054], ""type"": ""Point""}","Forte di Belvedere, 1, Via di San Leonardo, Oltrarno, Quartiere 1, Firenze, Toscana, 50125, Italia",tourism,attraction
74,Villa Demidoff,Villa Demidoff,"['*...Villa Demidoff (questa non si trova a Firenze, ma a Pratolino) ;...']","Villa San Donato, Via Alessandro Stradella, Firenze Nova, Quartiere 5, Firenze, Toscana, 50127, Italia","{""coordinates"": [11.225759, 43.790299], ""type"": ""Point""}","Villa San Donato, Via Alessandro Stradella, Firenze Nova, Quartiere 5, Firenze, Toscana, 50127, Italia",historic,castle
75,Villa Gamberaia,Villa Gamberaia,['*...Villa Gamberaia ;...'],"Villa Gamberaia, 72, Via del Rossellino, P. Conserva, Quartiere 2, Settignano, Firenze, Toscana, 50135, Italia","{""coordinates"": [11.328238, 43.779398], ""type"": ""Point""}","Villa Gamberaia, 72, Via del Rossellino, P. Conserva, Quartiere 2, Settignano, Firenze, Toscana, 50135, Italia",tourism,attraction
76,Villa Bardini,Villa Bardini,['*...Villa Bardini ;...'],"Villa Bardini, 2, Costa San Giorgio, Oltrarno, Quartiere 1, Firenze, Toscana, 50125, Italia","{""coordinates"": [11.256193, 43.764264], ""type"": ""Point""}","Villa Bardini, 2, Costa San Giorgio, Oltrarno, Quartiere 1, Firenze, Toscana, 50125, Italia",tourism,museum
77,Villa La Quiete,Villa La Quiete,['*...Villa La Quiete ;...'],"Villa La Quiete, Via Pietro Dazzi, Villa Socci, Quartiere 5, Serpiolle, Firenze, Toscana, 50141, Italia","{""coordinates"": [11.242406, 43.81281], ""type"": ""Point""}","Villa La Quiete, Via Pietro Dazzi, Villa Socci, Quartiere 5, Serpiolle, Firenze, Toscana, 50141, Italia",tourism,attraction
78,Villa Corsini,Villa Corsini,['*...Villa Corsini ;...'],"Villa Corsini, 38, Via della Petraia, Castello, Quartiere 5, Firenze, Toscana, 50141, Italia","{""coordinates"": [11.232375, 43.816157], ""type"": ""Point""}","Villa Corsini, 38, Via della Petraia, Castello, Quartiere 5, Firenze, Toscana, 50141, Italia",tourism,museum
79,Villa La Pietra,Villa La Pietra,"['*...Villa La Pietra ;...', ""...Ci sono, inoltre, sedi di Università statunitensi e internazionali in tutta la città, come l'Università di Harvard, che ha sede presso la Villa I Tatti nella zona di Settignano, la California State University, la Pepperdine University, la New York University che ha, nella storica villa La Pietra, il più grande campus in Europa, la Florida State University e tante altre...."", '...Ponte alle Grazie\nterzo ponte realizzato a Firenze in muratura, fu costruito nel 1237 già interamente in pietra, con nove arcate (ridotte a cinque nel XIX secolo), nel punto più ampio del fiume....', ""...Distrutto da un'alluvione fu ricostruito in pietra....""]","Villa La Pietra, Via dei Bruni, Le Cure, Quartiere 2, Firenze, Toscana, 50133, Italia","{""coordinates"": [11.265966, 43.79578], ""type"": ""Point""}","Villa La Pietra, Via dei Bruni, Le Cure, Quartiere 2, Firenze, Toscana, 50133, Italia",historic,manor
80,Villa Favard,Villa Favard,['*...Villa Favard ;...'],"Conservatorio Luigi Cherubini, Via di Rocca Tedalda, Rovezzano, Quartiere 2, Firenze, Toscana, 50136, Italia","{""coordinates"": [11.316679, 43.767489], ""type"": ""Point""}","Conservatorio Luigi Cherubini, Via di Rocca Tedalda, Rovezzano, Quartiere 2, Firenze, Toscana, 50136, Italia",amenity,school
81,Villa Fabbricotti,Villa Fabbricotti,['*...Villa Fabbricotti ;...'],"Villa Fabbricotti, Via Trieste, Statuto, Quartiere 5, Firenze, Toscana, 50199, Italia","{""coordinates"": [11.257377, 43.790572], ""type"": ""Point""}","Villa Fabbricotti, Via Trieste, Statuto, Quartiere 5, Firenze, Toscana, 50199, Italia",historic,manor
82,Villa Il Ventaglio,Villa Il Ventaglio,['*...Villa Il Ventaglio ;...'],"Villa Il Ventaglio, Via delle Forbici, Le Cure, Quartiere 2, Firenze, Toscana, 50133, Italia","{""coordinates"": [11.279441, 43.78836], ""type"": ""Point""}","Villa Il Ventaglio, Via delle Forbici, Le Cure, Quartiere 2, Firenze, Toscana, 50133, Italia",building,yes
83,Villa Strozzi al Boschetto,Villa Strozzi al Boschetto,['*...Villa Strozzi al Boschetto ....'],"Villa Strozzi al Boschetto, Via Pisana, Monticelli, Quartiere 4, Firenze, Toscana, 50143, Italia","{""coordinates"": [11.226918, 43.770695], ""type"": ""Point""}","Villa Strozzi al Boschetto, Via Pisana, Monticelli, Quartiere 4, Firenze, Toscana, 50143, Italia",building,yes
84,torre della Castagna,torre della Castagna,"['...Tra queste spiccano per altezza le torri civiche, le uniche mai abbassate, quali la torre della Castagna, la torre del Bargello e la torre di Arnolfo in palazzo Vecchio....']","Torre della Castagna, Piazza San Martino, Oltrarno, Quartiere 1, Firenze, Toscana, 50122, Italia","{""coordinates"": [11.256915, 43.770856], ""type"": ""Point""}","Torre della Castagna, Piazza San Martino, Oltrarno, Quartiere 1, Firenze, Toscana, 50122, Italia",man_made,tower
86,Arnolfo,Arnolfo,"[""...Nei secoli ha subito molte trasformazioni, con l'opera di artisti come Arnolfo di Cambio, Giorgio Vasari, il Bronzino, Gian Domenico Ferretti...."", '*...Tra queste spiccano per altezza le torri civiche, le uniche mai abbassate, quali la torre della Castagna, la torre del Bargello e la torre di Arnolfo in palazzo Vecchio....', ""*...La piana dove sorge la città è attraversata dall'Arno (la città stessa divide il suo corso fra Valdarno superiore e Valdarno inferiore) e da corsi d'acqua minori come il Mugnone, il Terzolle e il fiume Greve...."", '*...Nella piana sono presenti aree umide non urbanizzate nella zona a ovest della città lungo il fiume Arno....', ""*...Il primo insediamento stabile fu un villaggio su palafitte, realizzato attorno all'IX secolo a.C. dagli Etruschi nel periodo villanoviano, nei pressi di un guado sul fiume Arno, al centro di una fertile pianura...."", '*...Attorno al 150 a.C., gli Etruschi della vicina Visul (l\'odierna Fiesole), situata in alto sulla collina, vi fondarono una ""città satellite"" nei pressi dell\'Arno, per sfruttare la presenza della via d\'acqua, e vi edificarono un primo ponte in legno....', ""*...Gran parte del centro fu invaso dall'acqua del fiume Arno, con la furia delle acque che fece alcune vvittime e un'enorme devastazione, invadenso le chiese, i palazzi e i musei, distruggendo anche in maniera irraparabile archivi, opere d'arte e molti preziosi volumi...."", '*...Il fiume Arno, che passa in mezzo alla città, occupa un posto nella storia fiorentina alla pari con la gente che ci vive....', ""*...La riva sinistra dell'Arno (l'Oltrarno) è una zona ricca di monumenti dove ancora oggi si respira, tra le sue secolari botteghe artigiane, l'atmosfera della Firenze di un tempo, descritta per esempio da Vasco Pratolini...."", ""*...È il ponte sull'Arno più a monte del centro di Firenze...."", ""*...I ponti sull'Arno nel territorio fiorentino in totale sono quattordici, considerando tra questi il ponte costruito alle Cascine per la tranvia, la passerella dell'Isolotto, il ponte sull'autostrada A1 e, vicino a Rovezzano, il ponte per la ferrovia dell'Alta Velocità...."", '*...Torre della Zecca\nchiudeva le mura di Firenze verso l\'Arno a est, per questo si può parlare di ""torre terminale""....', ""*...Piazza Santa Trinita\ndominata dalla Chiesa di Santa Trinita, è posta all'estremo vicino all'Arno di via de' Tornabuoni...."", ""*...Viali di Circonvallazione\nsono una serie di viali di grandi dimensioni (da quattro fino a sei corsie per senso di marcia) che circondano il centro di Firenze sulla sponda a nord dell'Arno, ispirati ai boulevard di Parigi furono costruiti durante il periodo in cui Firenze era capitale d'Italia...."", ""*...Ha inizio dall'attuale piazza Vittorio Veneto per arrivare fino sotto al ponte all'Indiano delimitato naturalmente dal fiume Arno dal torrente Mugnone e dal canale Macinante...."", ""*...Ogni anno si tiene il Conte of Florence International Approach Championship, un torneo che si svolge sull'Arno nei pressi del Ponte Vecchio con buche che galleggiano sull'acqua....""]","Torre di Arnolfo, Piazza della Signoria, Oltrarno, Quartiere 1, Firenze, Toscana, 50122, Italia","{""coordinates"": [11.255999, 43.769294], ""type"": ""Point""}","Torre di Arnolfo, Piazza della Signoria, Oltrarno, Quartiere 1, Firenze, Toscana, 50122, Italia",man_made,tower
87,torre di San Niccolò,torre di San Niccolò,"['...Tra quelle che fecero parte della cinta muraria si annoverano la torre di San Niccolò, la torre della Serpe e la torre della Zecca....']","Torre di San Niccolò, Via di San Donnino, San Donnino, Certaldo, Firenze, Toscana, 50021, Italia","{""coordinates"": [11.128299, 43.537293], ""type"": ""Point""}","Torre di San Niccolò, Via di San Donnino, San Donnino, Certaldo, Firenze, Toscana, 50021, Italia",man_made,tower
91,Maggio Musicale Fiorentino,Maggio Musicale Fiorentino,"['*...Teatro comunale\nfino al 2011 il più grande Teatro di Firenze e sede del prestigioso Maggio Musicale Fiorentino, vi si sono esibiti grandi nomi della musica classica e operistica e del balletto internazionale:...', ""...In questa grande struttura si tengono opere liriche, concertistiche e balletto, oltre a ospitare l'opera del Maggio Musicale Fiorentino...."", ""...Durante l'anno sono numerose le manifestazioni culturali e folkloristiche, le più importanti delle quali sono il Maggio Musicale Fiorentino e il calcio in costume che si svolge nel mese di giugno in Piazza Santa Croce....""]","Teatro dell'Opera - Maggio Musicale Fiorentino, Piazza Fedora Barbieri, San Iacopino, Quartiere 1, Firenze, Toscana, 50144, Italia","{""coordinates"": [11.234874, 43.778877], ""type"": ""Point""}","Teatro dell'Opera - Maggio Musicale Fiorentino, Piazza Fedora Barbieri, San Iacopino, Quartiere 1, Firenze, Toscana, 50144, Italia",amenity,theatre
93,Parco delle Cascine,Parco delle Cascine,"[""*...Parco della musica e della cultura\ngrande complesso terminato nel dicembre 2012 nel Parco delle Cascine, dietro alla Stazione Leopolda, è il maggiore centro per la musica e la cultura dell'intera area metropolitana...."", '*...Ponte alla Vittoria\nè il primo a valle al di fuori del centro storico, porta accanto al piazzale del Parco delle Cascine e immette sui Viali di Circonvallazione nel viale Fratelli Rosselli....', '...Lungarni\ntagliano in due il centro storico, e vi si affacciano numerosi luoghi di interesse come il Corridoio vasariano e gli Uffizi, il Parco delle Cascine, la Biblioteca Nazionale Centrale, il Ponte alle Grazie, la Chiesa di San Frediano in Cestello, Piazza Demidoff, oltre che alle varie torri....', '*...Parco delle Cascine\ndetto anche più comunemente Le Cascine, con i suoi 160 ettari è il più grande Parco pubblico di Firenze;...']","Centro visite del Parco delle Cascine, 6/A, Piazzale delle Cascine, Quartiere 1, Firenze, Toscana, 50127, Italia","{""coordinates"": [11.218635, 43.783379], ""type"": ""Point""}","Centro visite del Parco delle Cascine, 6/A, Piazzale delle Cascine, Quartiere 1, Firenze, Toscana, 50127, Italia",place,house
95,Teatro Verdi,Teatro Verdi,"[""*...Teatro Verdi\nsituato nell'isolato tra via Ghibellina, via Verdi, via dei Lavatoi e via Isola delle Stinche questo Teatro offre una programmazione teatrale caratterizzata dallo spettacolo leggero (rivista e commedia leggera) nel quale si sono esibiti importanti..."", '*...Via Ghibellina\nè una delle vie più lunghe del centro di Firenze e conta vari monumenti dal palazzo del Bargello a palazzo Borghese, alla Badia Fiorentina, al Teatro Verdi (Firenze), e a Casa Buonarroti....']","Teatro Verdi, Via dei Lavatoi, San Niccolò, Quartiere 1, Firenze, Toscana, 50122, Italia","{""coordinates"": [11.260781, 43.769991], ""type"": ""Point""}","Teatro Verdi, Via dei Lavatoi, San Niccolò, Quartiere 1, Firenze, Toscana, 50122, Italia",amenity,theatre
96,via Verdi,via Verdi,"[""*...Teatro Verdi\nsituato nell'isolato tra via Ghibellina, via Verdi, via dei Lavatoi e via Isola delle Stinche questo Teatro offre una programmazione teatrale caratterizzata dallo spettacolo leggero (rivista e commedia leggera) nel quale si sono esibiti importanti...""]","Via Verdi, Gambassi Terme, Firenze, Toscana, 50051, Italia","{""coordinates"": [10.963463, 43.572988], ""type"": ""Point""}","Via Verdi, Gambassi Terme, Firenze, Toscana, 50051, Italia",highway,unclassified
97,via dei Lavatoi,via dei Lavatoi,"[""*...Teatro Verdi\nsituato nell'isolato tra via Ghibellina, via Verdi, via dei Lavatoi e via Isola delle Stinche questo Teatro offre una programmazione teatrale caratterizzata dallo spettacolo leggero (rivista e commedia leggera) nel quale si sono esibiti importanti...""]","Via dei Lavatoi, San Niccolò, Quartiere 1, Firenze, Toscana, 50122, Italia","{""coordinates"": [11.260387, 43.769979], ""type"": ""Point""}","Via dei Lavatoi, San Niccolò, Quartiere 1, Firenze, Toscana, 50122, Italia",highway,residential
98,via Isola delle Stinche,via Isola delle Stinche,"[""*...Teatro Verdi\nsituato nell'isolato tra via Ghibellina, via Verdi, via dei Lavatoi e via Isola delle Stinche questo Teatro offre una programmazione teatrale caratterizzata dallo spettacolo leggero (rivista e commedia leggera) nel quale si sono esibiti importanti...""]","Via Isola delle Stinche, San Niccolò, Quartiere 1, Firenze, Toscana, 50122, Italia","{""coordinates"": [11.260136, 43.769914], ""type"": ""Point""}","Via Isola delle Stinche, San Niccolò, Quartiere 1, Firenze, Toscana, 50122, Italia",highway,pedestrian
99,Teatro Goldoni,Teatro Goldoni,"['*...Teatro Goldoni\nil Teatro fu inaugurato il 17 aprile 1817 con Il burbero benefico di Carlo Goldoni (da cui prende il nome) e con il balletto La figlia malcustodita di Jean Dauberval, il famoso ballerino e coreografo francese del Settecento....']","Teatro Goldoni, Via Santa Maria, San Frediano, Quartiere 1, Firenze, Toscana, 50125, Italia","{""coordinates"": [11.244541, 43.764852], ""type"": ""Point""}","Teatro Goldoni, Via Santa Maria, San Frediano, Quartiere 1, Firenze, Toscana, 50125, Italia",amenity,theatre
100,Teatro Niccolini,Teatro Niccolini,"['*...Teatro Niccolini\ndetto anche Teatro del Cocomero, si trova in via Ricasoli, a pochi passi dal Duomo....', ""...Fu utilizzato da Don Lorenzo de' Medici che nel 1648 fu tra i fondatori dell'Accademia Drammatica e tra gli spettacoli ospitati al Niccolini, vanno ricordati quelli di Ingmar Bergman, del Living Theatre, di Carmelo Bene e di Vittorio Gassman....""]","Teatro Niccolini, Via Ricasoli, Quartiere 1, Firenze, Toscana, 50112, Italia","{""coordinates"": [11.256101, 43.773801], ""type"": ""Point""}","Teatro Niccolini, Via Ricasoli, Quartiere 1, Firenze, Toscana, 50112, Italia",amenity,theatre
102,via Ricasoli,via Ricasoli,"['*...Teatro Niccolini\ndetto anche Teatro del Cocomero, si trova in via Ricasoli, a pochi passi dal Duomo....']","Via Ricasoli, Quartiere 1, Firenze, Toscana, 50112, Italia","{""coordinates"": [11.258173, 43.776308], ""type"": ""Point""}","Via Ricasoli, Quartiere 1, Firenze, Toscana, 50112, Italia",highway,residential
103,Teatro Puccini,Teatro Puccini,"[""*...Teatro Puccini\nsituato nell'omonima piazza al margine della Manifattura Tabacchi, fu inaugurato nel 1940 come luogo di svago per gli operai della manifattura stessa....""]","Teatro Puccini, Via Giuseppe Tartini, Il Barco, Quartiere 1, Firenze, Toscana, 50144, Italia","{""coordinates"": [11.225394, 43.786207], ""type"": ""Point""}","Teatro Puccini, Via Giuseppe Tartini, Il Barco, Quartiere 1, Firenze, Toscana, 50144, Italia",amenity,theatre
104,Manifattura Tabacchi,Manifattura Tabacchi,"[""*...Teatro Puccini\nsituato nell'omonima piazza al margine della Manifattura Tabacchi, fu inaugurato nel 1940 come luogo di svago per gli operai della manifattura stessa....""]","Manifattura Tabacchi, 1 R, Via della Spada, Oltrarno, Quartiere 1, Firenze, Toscana, 50123, Italia","{""coordinates"": [11.249581, 43.771928], ""type"": ""Point""}","Manifattura Tabacchi, 1 R, Via della Spada, Oltrarno, Quartiere 1, Firenze, Toscana, 50123, Italia",amenity,bar
105,Corridoio Vasariano,Corridoio Vasariano,"[""...Attraversato dal nobile Corridoio vasariano, è l'unico ponte della città a essere passato indenne attraverso la seconda guerra mondiale...."", '*...Attraversato dal Corridoio Vasariano, vede la presenza di antichi negozi di gioiellieri....', '...Lungarni\ntagliano in due il centro storico, e vi si affacciano numerosi luoghi di interesse come il Corridoio vasariano e gli Uffizi, il Parco delle Cascine, la Biblioteca Nazionale Centrale, il Ponte alle Grazie, la Chiesa di San Frediano in Cestello, Piazza Demidoff, oltre che alle varie torri....', '...Corridoio vasariano, è un percorso sopraelevato che a Firenze collega Palazzo Vecchio con Palazzo Pitti passando per la Galleria degli Uffizi e sopra il Ponte Vecchio; fu costruito per il Granduca Cosimo I....', ""*...Attraversato dal nobile Corridoio vasariano, è l'unico ponte della città a essere passato indenne attraverso la seconda guerra mondiale...."", '*...Corridoio vasariano, è un percorso sopraelevato che a Firenze collega Palazzo Vecchio con Palazzo Pitti passando per la Galleria degli Uffizi e sopra il Ponte Vecchio; fu costruito per il Granduca Cosimo I....']","Corridoio Vasariano, Piazza del Pesce, Oltrarno, Quartiere 1, Firenze, Toscana, 50125, Italia","{""coordinates"": [11.253903, 43.768268], ""type"": ""Point""}","Corridoio Vasariano, Piazza del Pesce, Oltrarno, Quartiere 1, Firenze, Toscana, 50125, Italia",tourism,museum
107,Ponte alle Grazie,Ponte alle Grazie,"['*...Ponte alle Grazie\nterzo ponte realizzato a Firenze in muratura, fu costruito nel 1237 già interamente in pietra, con nove arcate (ridotte a cinque nel XIX secolo), nel punto più ampio del fiume....', '...Lungarni\ntagliano in due il centro storico, e vi si affacciano numerosi luoghi di interesse come il Corridoio vasariano e gli Uffizi, il Parco delle Cascine, la Biblioteca Nazionale Centrale, il Ponte alle Grazie, la Chiesa di San Frediano in Cestello, Piazza Demidoff, oltre che alle varie torri....', '*...Ponte alle Grazie ;...']","Ponte alle Grazie, San Niccolò, Quartiere 1, Firenze, Toscana, 50122, Italia","{""coordinates"": [11.25871, 43.766162], ""type"": ""Point""}","Ponte alle Grazie, San Niccolò, Quartiere 1, Firenze, Toscana, 50122, Italia",man_made,bridge
