,entity,to_search,snippet,address,coordinates,name_location,class,type
1,Europa,Europa,"[""*...Nel 1477, quando divenne capitale dei Paesi Bassi austriaci, era ritenuta una delle città più attraenti e ricche d'Europa, grazie soprattutto alle sue attività commerciali, concentrate sul traffico di tessuti...."", '*...Il Municipio di Bruxelles è uno dei più begli esempi di Palazzi pubblici in Europa, e uno dei più alti capolavori dello stile Gotico brabantino, eretto fra il 1402 e il 1455....', ""...Statua dell'Europa ;...""]","Palazzo Europa, 155, Rue de la Loi - Wetstraat, Quartier européen - Europese Wijk, Bruxelles, Brussel-Hoofdstad - Bruxelles-Capitale, Région de Bruxelles-Capitale - Brussels Hoofdstedelijk Gewest, 1000, Belgio","{""coordinates"": [4.380655, 50.842539], ""type"": ""Point""}","Palazzo Europa, 155, Rue de la Loi - Wetstraat, Quartier européen - Europese Wijk, Bruxelles, Brussel-Hoofdstad - Bruxelles-Capitale, Région de Bruxelles-Capitale - Brussels Hoofdstedelijk Gewest, 1000, Belgio",office,government
2,Grand Place,Grand Place,"[""*...Questi ultimi si impadronirono infine della città con il trattato di Aquisgrana (1748), e governarono in modo avveduto, promuovendo tra l'altro un programma di rinnovamento urbanistico (che previde la realizzazione della magnifica Grand Place, per opera dell'architetto Guimerd)...."", ""...La Grand Place è la piazza centrale e storica della città. Circondata dai maggiori monumenti cittadini e dalle belle case delle corporazioni, è ritenuta una delle più belle piazze del mondo. La Grand Place di Bruxelles è stata iscritta nel 1998 nella lista del patrimonio dell'umanità dell'UNESCO....""]","Grand-Place - Grote Markt, Grand Place, Quartier Saint-Jacques - Sint-Jacobswijk, Quartier du Centre - Centrumwijk, Pentagone - Vijfhoek, Bruxelles, Brussel-Hoofdstad - Bruxelles-Capitale, Région de Bruxelles-Capitale - Brussels Hoofdstedelijk Gewest, 1000, Belgio","{""coordinates"": [4.352418, 50.846811], ""type"": ""Point""}","Grand-Place - Grote Markt, Grand Place, Quartier Saint-Jacques - Sint-Jacobswijk, Quartier du Centre - Centrumwijk, Pentagone - Vijfhoek, Bruxelles, Brussel-Hoofdstad - Bruxelles-Capitale, Région de Bruxelles-Capitale - Brussels Hoofdstedelijk Gewest, 1000, Belgio",amenity,marketplace
6,Maison du Roi,Maison du Roi,"[""...La Maison du Roi, era l'antico Mercato coperto del pane, costruito nel XVI secolo in stile gotico brabantino e restaurato nel XIX secolo....""]","Maison du Roi - Broodhuis, Grand Place, Quartier Saint-Jacques - Sint-Jacobswijk, Quartier du Centre - Centrumwijk, Pentagone - Vijfhoek, Bruxelles, Brussel-Hoofdstad - Bruxelles-Capitale, Région de Bruxelles-Capitale - Brussels Hoofdstedelijk Gewest, 1212, Belgio","{""coordinates"": [4.352826, 50.847005], ""type"": ""Point""}","Maison du Roi - Broodhuis, Grand Place, Quartier Saint-Jacques - Sint-Jacobswijk, Quartier du Centre - Centrumwijk, Pentagone - Vijfhoek, Bruxelles, Brussel-Hoofdstad - Bruxelles-Capitale, Région de Bruxelles-Capitale - Brussels Hoofdstedelijk Gewest, 1212, Belgio",historic,building
19,Basilica del Sacro Cuore,Basilica del Sacro Cuore,['*...Basilica del Sacro Cuore a Koekelberg ....'],"Basilica del Sacro Cuore, 1, Parvis de la Basilique - Basiliekvoorplein, Ganshoren, Brussel-Hoofdstad - Bruxelles-Capitale, Région de Bruxelles-Capitale - Brussels Hoofdstedelijk Gewest, 1083, Belgio","{""coordinates"": [4.316944, 50.867078], ""type"": ""Point""}","Basilica del Sacro Cuore, 1, Parvis de la Basilique - Basiliekvoorplein, Ganshoren, Brussel-Hoofdstad - Bruxelles-Capitale, Région de Bruxelles-Capitale - Brussels Hoofdstedelijk Gewest, 1083, Belgio",amenity,place_of_worship
21,Porta di Halle,Porta di Halle,['*...Porta di Halle ;...'],"Porta di Halle, 150, Boulevard du Midi - Zuidlaan, Bruxelles, Brussel-Hoofdstad - Bruxelles-Capitale, Région de Bruxelles-Capitale - Brussels Hoofdstedelijk Gewest, 1000, Belgio","{""coordinates"": [4.344899, 50.833025], ""type"": ""Point""}","Porta di Halle, 150, Boulevard du Midi - Zuidlaan, Bruxelles, Brussel-Hoofdstad - Bruxelles-Capitale, Région de Bruxelles-Capitale - Brussels Hoofdstedelijk Gewest, 1000, Belgio",historic,city_gate
23,Manneken Pis,Manneken Pis,['*...Manneken Pis ;...'],"Manneken-Pis, Rue du Midi - Zuidstraat, Quartier Saint-Jacques - Sint-Jacobswijk, Quartier du Centre - Centrumwijk, Pentagone - Vijfhoek, Bruxelles, Brussel-Hoofdstad - Bruxelles-Capitale, Région de Bruxelles-Capitale - Brussels Hoofdstedelijk Gewest, 1212, Belgio","{""coordinates"": [4.349329, 50.845812], ""type"": ""Point""}","Manneken-Pis, Rue du Midi - Zuidstraat, Quartier Saint-Jacques - Sint-Jacobswijk, Quartier du Centre - Centrumwijk, Pentagone - Vijfhoek, Bruxelles, Brussel-Hoofdstad - Bruxelles-Capitale, Région de Bruxelles-Capitale - Brussels Hoofdstedelijk Gewest, 1212, Belgio",highway,bus_stop
24,Atomium,Atomium,"['*...Atomium ;...', ""...L'Atomium, una rappresentazione alta 103 metri di un cristallo di ferro, venne costruita per l'Expo '58, ed è stata mantenuta, diventando una specie di equivalente belga della Torre Eiffel....""]","Atomium, 16, Rue Reper-Vreven - Reper-Vrevenstraat, Heysel - Heizel, Laeken - Laken, Bruxelles, Brussel-Hoofdstad - Bruxelles-Capitale, Région de Bruxelles-Capitale - Brussels Hoofdstedelijk Gewest, 1020, Belgio","{""coordinates"": [4.34238, 50.890472], ""type"": ""Point""}","Atomium, 16, Rue Reper-Vreven - Reper-Vrevenstraat, Heysel - Heizel, Laeken - Laken, Bruxelles, Brussel-Hoofdstad - Bruxelles-Capitale, Région de Bruxelles-Capitale - Brussels Hoofdstedelijk Gewest, 1020, Belgio",amenity,pharmacy
26,Heysel,Heysel,"[""*...Per quanto riguarda la storia contemporanea, Bruxelles è stata tristemente al centro delle cronache per la strage dell'Heysel, avvenuta il 29 maggio 1985...."", '*...Heysel ;...', '...Lo stadio principale, dove si giocano anche le partite della nazionale e gli incontri più importanti a livello internazionale, è lo Stadio Re Baldovino (ex stadio Heysel), capace di ospitare 60.000 spettatori....']","Heysel - Heizel, Avenue Impératrice Charlotte - Keizerin Charlottelaan, Verregat, Laeken - Laken, Bruxelles, Brussel-Hoofdstad - Bruxelles-Capitale, Région de Bruxelles-Capitale - Brussels Hoofdstedelijk Gewest, 1020, Belgio","{""coordinates"": [4.33813, 50.896432], ""type"": ""Point""}","Heysel - Heizel, Avenue Impératrice Charlotte - Keizerin Charlottelaan, Verregat, Laeken - Laken, Bruxelles, Brussel-Hoofdstad - Bruxelles-Capitale, Région de Bruxelles-Capitale - Brussels Hoofdstedelijk Gewest, 1020, Belgio",railway,tram_stop
30,Alma,Alma,"['*...Bruxelles ha diverse Università, quattro di queste sono l\'Université Libre de Bruxelles (ULB), la Vrije Universiteit Brussel (VUB), le Facultés universitaires Saint-Louis (FUSL) e la Katholieke Universiteit Brussel (KUB) nonché le facoltà di medicina dell\'Université catholique de Louvain (UCL), situata nel quartiere Alma presso il grande Ospedale ""Saint Luc""....']","Alma, Rue des Éperonniers - Spoormakersstraat, Quartier Saint-Jacques - Sint-Jacobswijk, Quartier du Centre - Centrumwijk, Pentagone - Vijfhoek, Bruxelles, Brussel-Hoofdstad - Bruxelles-Capitale, Région de Bruxelles-Capitale - Brussels Hoofdstedelijk Gewest, 1000, Belgio","{""coordinates"": [4.353424, 50.845246], ""type"": ""Point""}","Alma, Rue des Éperonniers - Spoormakersstraat, Quartier Saint-Jacques - Sint-Jacobswijk, Quartier du Centre - Centrumwijk, Pentagone - Vijfhoek, Bruxelles, Brussel-Hoofdstad - Bruxelles-Capitale, Région de Bruxelles-Capitale - Brussels Hoofdstedelijk Gewest, 1000, Belgio",tourism,hotel
33,Archives générales du Royaume,Archives générales du Royaume,"['...Bibliothèque des Archives générales du Royaume ;...', '...Hanno sede anche gli Archives générales du Royaume (archivio centrale dello stato), la Cinémathèque Royale e la Médiathèque....']","Archives générales du Royaume - Algemeen Rijksarchief, 2, Rue de Ruysbroeck - Ruisbroekstraat, Sablon - Zavel, Pentagone - Vijfhoek, Bruxelles, Brussel-Hoofdstad - Bruxelles-Capitale, Région de Bruxelles-Capitale - Brussels Hoofdstedelijk Gewest, 1000, Belgio","{""coordinates"": [4.356427, 50.842385], ""type"": ""Point""}","Archives générales du Royaume - Algemeen Rijksarchief, 2, Rue de Ruysbroeck - Ruisbroekstraat, Sablon - Zavel, Pentagone - Vijfhoek, Bruxelles, Brussel-Hoofdstad - Bruxelles-Capitale, Région de Bruxelles-Capitale - Brussels Hoofdstedelijk Gewest, 1000, Belgio",office,government
36,Musée d'art spontané,Musée d'art spontané,"[""*...Musée d'art spontané ;...""]","Musée d'art spontané - Museum voor Spontane Kunst, 27, Rue de la Constitution - Grondwetstraat, Quartier Brabant - Brabantwijk, Schaerbeek - Schaarbeek, Brussel-Hoofdstad - Bruxelles-Capitale, Région de Bruxelles-Capitale - Brussels Hoofdstedelijk Gewest, 1030, Belgio","{""coordinates"": [4.369989, 50.860355], ""type"": ""Point""}","Musée d'art spontané - Museum voor Spontane Kunst, 27, Rue de la Constitution - Grondwetstraat, Quartier Brabant - Brabantwijk, Schaerbeek - Schaarbeek, Brussel-Hoofdstad - Bruxelles-Capitale, Région de Bruxelles-Capitale - Brussels Hoofdstedelijk Gewest, 1030, Belgio",tourism,museum
37,Musée juif de Belgique,Musée juif de Belgique,['*...Musée juif de Belgique ;...'],"Musée Juif de Belgique - Joods Museum van België, 21, Rue des Minimes - Minimenstraat, Sablon - Zavel, Pentagone - Vijfhoek, Bruxelles, Brussel-Hoofdstad - Bruxelles-Capitale, Région de Bruxelles-Capitale - Brussels Hoofdstedelijk Gewest, 1000, Belgio","{""coordinates"": [4.353295, 50.840742], ""type"": ""Point""}","Musée Juif de Belgique - Joods Museum van België, 21, Rue des Minimes - Minimenstraat, Sablon - Zavel, Pentagone - Vijfhoek, Bruxelles, Brussel-Hoofdstad - Bruxelles-Capitale, Région de Bruxelles-Capitale - Brussels Hoofdstedelijk Gewest, 1000, Belgio",tourism,museum
38,Musées Royaux des Beaux-Arts de Belgique,Musées Royaux des Beaux-Arts de Belgique,"['...Bibliothèque et centre de documentation des Musées royaux des Beaux-Arts de Belgique ;...', '*...Musées Royaux des Beaux-Arts de Belgique ;...']","Musées royaux des Beaux-Arts de Belgique - Koninklijke Musea voor Schone Kunsten van België, 3, Rue de la Régence - Regentschapsstraat, Quartier Royal - Koninklijke Wijk, Pentagone - Vijfhoek, Bruxelles, Brussel-Hoofdstad - Bruxelles-Capitale, Région de Bruxelles-Capitale - Brussels Hoofdstedelijk Gewest, 1000, Belgio","{""coordinates"": [4.358238, 50.84168], ""type"": ""Point""}","Musées royaux des Beaux-Arts de Belgique - Koninklijke Musea voor Schone Kunsten van België, 3, Rue de la Régence - Regentschapsstraat, Quartier Royal - Koninklijke Wijk, Pentagone - Vijfhoek, Bruxelles, Brussel-Hoofdstad - Bruxelles-Capitale, Région de Bruxelles-Capitale - Brussels Hoofdstedelijk Gewest, 1000, Belgio",tourism,museum
42,Musée Constantin Meunier,Musée Constantin Meunier,['*...Musée Constantin Meunier ;...'],"Musée Meunier Museum, 59, Rue de l'Abbaye - Abdijstraat, Bascule, Ixelles - Elsene, Brussel-Hoofdstad - Bruxelles-Capitale, Région de Bruxelles-Capitale - Brussels Hoofdstedelijk Gewest, 1050, Belgio","{""coordinates"": [4.367004, 50.819329], ""type"": ""Point""}","Musée Meunier Museum, 59, Rue de l'Abbaye - Abdijstraat, Bascule, Ixelles - Elsene, Brussel-Hoofdstad - Bruxelles-Capitale, Région de Bruxelles-Capitale - Brussels Hoofdstedelijk Gewest, 1050, Belgio",tourism,museum
45,Musée,Musée,"['...Bibliothèque du Musée des Instruments de Musique ;...', ""...Bibliothèques du Musée royal de l'Afrique Centrale ;..."", ""...Musée communal des Beaux-Arts d'Ixelles ;..."", ""...Musée d'art spontané ;..."", '...Musée juif de Belgique ;...', ""...Musée royal d'art ancien ;..."", ""...Musée royal d'art moderne ;..."", '...Musée Antoine Wiertz ;...', '...Musée Constantin Meunier ;...', '...Musée du jouet ;...', '...Musée du cinéma ;...', '*...Musée Bellevue ;...', '...Musée bruxellois de la gueuze ;...']","Musée Juif de Belgique - Joods Museum van België, 21, Rue des Minimes - Minimenstraat, Sablon - Zavel, Pentagone - Vijfhoek, Bruxelles, Brussel-Hoofdstad - Bruxelles-Capitale, Région de Bruxelles-Capitale - Brussels Hoofdstedelijk Gewest, 1000, Belgio","{""coordinates"": [4.353295, 50.840742], ""type"": ""Point""}","Musée Juif de Belgique - Joods Museum van België, 21, Rue des Minimes - Minimenstraat, Sablon - Zavel, Pentagone - Vijfhoek, Bruxelles, Brussel-Hoofdstad - Bruxelles-Capitale, Région de Bruxelles-Capitale - Brussels Hoofdstedelijk Gewest, 1000, Belgio",tourism,museum
46,Musée bruxellois de la gueuze,Musée bruxellois de la gueuze,['*...Musée bruxellois de la gueuze ;...'],"Musée Bruxellois de la Gueuze - Brussels Museum van de Geuze, 56, Rue Gheude - Gheudestraat, Cureghem - Kuregem, Anderlecht, Brussel-Hoofdstad - Bruxelles-Capitale, Région de Bruxelles-Capitale - Brussels Hoofdstedelijk Gewest, 1070, Belgio","{""coordinates"": [4.335805, 50.841549], ""type"": ""Point""}","Musée Bruxellois de la Gueuze - Brussels Museum van de Geuze, 56, Rue Gheude - Gheudestraat, Cureghem - Kuregem, Anderlecht, Brussel-Hoofdstad - Bruxelles-Capitale, Région de Bruxelles-Capitale - Brussels Hoofdstedelijk Gewest, 1070, Belgio",tourism,museum
50,Palais des beaux-arts de Bruxelles,Palais des beaux-arts de Bruxelles,"[""*...Numerose orchestre e complessi musicali hanno sede a Bruxelles, fra cui l'Orchestra Nazionale del Belgio (con sede nel Palais des beaux-arts de Bruxelles) e La Petite Bande, specializzata nella musica barocca....""]","Bozar, 23, Rue Ravenstein - Ravensteinstraat, Quartier Royal - Koninklijke Wijk, Pentagone - Vijfhoek, Bruxelles, Brussel-Hoofdstad - Bruxelles-Capitale, Région de Bruxelles-Capitale - Brussels Hoofdstedelijk Gewest, 1000, Belgio","{""coordinates"": [4.359792, 50.843721], ""type"": ""Point""}","Bozar, 23, Rue Ravenstein - Ravensteinstraat, Quartier Royal - Koninklijke Wijk, Pentagone - Vijfhoek, Bruxelles, Brussel-Hoofdstad - Bruxelles-Capitale, Région de Bruxelles-Capitale - Brussels Hoofdstedelijk Gewest, 1000, Belgio",amenity,arts_centre
51,Maison de la Radio,Maison de la Radio,"['*...Brussels Philharmonic (Orchestra della Radio fiamminga), con sede nella Maison de la Radio....']","Maison de la Radio - Radiohuis, Place Sainte-Croix - Heilig-Kruisplein, Flagey, Ixelles - Elsene, Brussel-Hoofdstad - Bruxelles-Capitale, Région de Bruxelles-Capitale - Brussels Hoofdstedelijk Gewest, 1050, Belgio","{""coordinates"": [4.373074, 50.826946], ""type"": ""Point""}","Maison de la Radio - Radiohuis, Place Sainte-Croix - Heilig-Kruisplein, Flagey, Ixelles - Elsene, Brussel-Hoofdstad - Bruxelles-Capitale, Région de Bruxelles-Capitale - Brussels Hoofdstedelijk Gewest, 1050, Belgio",building,yes
52,Louvre,Louvre,"['*...Tra le opere più riuscite prodotte nella seconda metà del XV secolo vi fu la Vergine in gloria del 1485, esposta al Louvre e caratterizzata da una composizione simile al trittico....']","Le Louvre, Parvis Saint-Gilles - Sint-Gillisvoorplein, Saint-Gilles - Sint-Gillis, Brussel-Hoofdstad - Bruxelles-Capitale, Région de Bruxelles-Capitale - Brussels Hoofdstedelijk Gewest, 1060, Belgio","{""coordinates"": [4.344683, 50.830234], ""type"": ""Point""}","Le Louvre, Parvis Saint-Gilles - Sint-Gillisvoorplein, Saint-Gilles - Sint-Gillis, Brussel-Hoofdstad - Bruxelles-Capitale, Région de Bruxelles-Capitale - Brussels Hoofdstedelijk Gewest, 1060, Belgio",amenity,pub
55,Aeroporto di Bruxelles-Zaventem,Aeroporto di Bruxelles-Zaventem,"[""*...Bruxelles è servita dall'Aeroporto di Bruxelles-Zaventem, situato nella municipalità di Zaventem, e dall'Aeroporto di Charleroi-Bruxelles Sud, posto vicino alla città di Charleroi in Vallonia....""]","Aeroporto di Bruxelles-National, Luchthaven Brussel Nationaal, Zaventem, Halle-Vilvoorde, Vlaams-Brabant, Vlaanderen, 1930, Belgio","{""coordinates"": [4.483259, 50.898336], ""type"": ""Point""}","Aeroporto di Bruxelles-National, Luchthaven Brussel Nationaal, Zaventem, Halle-Vilvoorde, Vlaams-Brabant, Vlaanderen, 1930, Belgio",aeroway,terminal
57,Lotto Park,Lotto Park,"[""*...Nel calcio la capitale belga è rappresentata dall'Anderlecht, con sede nell'omonima municipalità, che con 34 titoli nazionali è la società più titolata del Belgio e gioca nello Lotto Park (ex stadio Constant Vanden Stock)....""]","Lotto Park, 2, Avenue Théo Verbeeck - Théo Verbeecklaan, Peterbos, Moortebeek, Anderlecht, Brussel-Hoofdstad - Bruxelles-Capitale, Région de Bruxelles-Capitale - Brussels Hoofdstedelijk Gewest, 1070, Belgio","{""coordinates"": [4.297855, 50.83402], ""type"": ""Point""}","Lotto Park, 2, Avenue Théo Verbeeck - Théo Verbeecklaan, Peterbos, Moortebeek, Anderlecht, Brussel-Hoofdstad - Bruxelles-Capitale, Région de Bruxelles-Capitale - Brussels Hoofdstedelijk Gewest, 1070, Belgio",leisure,stadium
59,Joseph Marien,Joseph Marien,"['*...Nata nel 1897, ha vinto per 11 volte il campionato belga e due volte la Coppa del Belgio, e gioca presso lo stadio Joseph Marien....']","Stade Joseph Marien - Joseph Marienstadion, Rue du Stade - Stadionstraat, Altitude Cent - Hoogte Honderd, Forest - Vorst, Brussel-Hoofdstad - Bruxelles-Capitale, Région de Bruxelles-Capitale - Brussels Hoofdstedelijk Gewest, 1190, Belgio","{""coordinates"": [4.329508, 50.817929], ""type"": ""Point""}","Stade Joseph Marien - Joseph Marienstadion, Rue du Stade - Stadionstraat, Altitude Cent - Hoogte Honderd, Forest - Vorst, Brussel-Hoofdstad - Bruxelles-Capitale, Région de Bruxelles-Capitale - Brussels Hoofdstedelijk Gewest, 1190, Belgio",leisure,stadium
60,Stade Fallon,Stade Fallon,"['*...La Royal White Star Bruxelles, nata da varie fusioni e scissioni, con sede nella municipalità di Woluwe-Saint-Lambert ma che gioca allo Stade Fallon, è fallita nel 2016....']","Stade Fallon - Fallon Stadion, Chaussée de Stockel - Stokkelsesteenweg, Roodebeek, Woluwe-Saint-Lambert - Sint-Lambrechts-Woluwe, Brussel-Hoofdstad - Bruxelles-Capitale, Région de Bruxelles-Capitale - Brussels Hoofdstedelijk Gewest, 1200, Belgio","{""coordinates"": [4.443176, 50.841144], ""type"": ""Point""}","Stade Fallon - Fallon Stadion, Chaussée de Stockel - Stokkelsesteenweg, Roodebeek, Woluwe-Saint-Lambert - Sint-Lambrechts-Woluwe, Brussel-Hoofdstad - Bruxelles-Capitale, Région de Bruxelles-Capitale - Brussels Hoofdstedelijk Gewest, 1200, Belgio",highway,bus_stop
