,entity,to_search,snippet,address,coordinates,name_location,class,type
113,GVB,GVB,"['...Amsterdam possiede diversi sistemi di trasporto pubblico cittadini, gestiti dalla Gemeentelijk Vervoer Bedrijf (GVB):...']","GVB Tickets & Information, 7, Stationsplein, Centrum, Amsterdam, Noord-Holland, Paesi Bassi, 1012 AB, Paesi Bassi","{""coordinates"": [4.900187, 52.377582], ""type"": ""Point""}","GVB Tickets & Information, 7, Stationsplein, Centrum, Amsterdam, Noord-Holland, Paesi Bassi, 1012 AB, Paesi Bassi",tourism,information
117,Delft,Delft,"[""*...Negli orari notturni ci sono treni a cadenza oraria per l'Aeroporto, per Leida, per l'Aia, per Delft, per Rotterdam e per Utrecht....""]","Royal Delft, 65, Damrak, Centrum, Amsterdam, Noord-Holland, Paesi Bassi, 1012 LM, Paesi Bassi","{""coordinates"": [4.894949, 52.374808], ""type"": ""Point""}","Royal Delft, 65, Damrak, Centrum, Amsterdam, Noord-Holland, Paesi Bassi, 1012 LM, Paesi Bassi",shop,gift
121,Haarlemmermeer,Haarlemmermeer,"[""*...L'Aeroporto di Amsterdam-Schiphol, è il principale Aeroporto dei Paesi Bassi e si trova a sud di Amsterdam, nel comune di Haarlemmermeer....""]","Haarlemmermeerstraat, Albert Neuhuysstraat, Hoofddorperpleinbuurt, Zuid, Amsterdam, Noord-Holland, Paesi Bassi, 1058 SB, Paesi Bassi","{""coordinates"": [4.850476, 52.355408], ""type"": ""Point""}","Haarlemmermeerstraat, Albert Neuhuysstraat, Hoofddorperpleinbuurt, Zuid, Amsterdam, Noord-Holland, Paesi Bassi, 1058 SB, Paesi Bassi",highway,bus_stop
122,Centraal,Centraal,"['...Station Amsterdam Centraal. La Stazione Centrale di Amsterdam è la principale stazione ferroviaria della città. Fu realizzata tra il 1881 e il 1889 su progetto di Pierre Cuypers e A. L. van Gendt in stile neorinascimentale olandese....', '*...Le bici sono usate da tutti i gruppi socio-economici grazie alla loro convenienza, al fatto che Amsterdam è una piccola città in pianura, ai 400\xa0km di piste ciclabili,\nLa città si trova nella Randstad Holland ed è amministrata non solo dal sindaco e dal consiglio municipale centrale (Centraal [Stads]Bestuur) ma è anche divisa in sette distretti cittadini/circoscrizioni chiamati stadsdeel, che hanno i loro propri consigli (Stadsdeelraad)....']","&Klevering Centraal, 8, Haarlemmerstraat, Haarlemmerbuurt, Centrum, Amsterdam, Noord-Holland, Paesi Bassi, 1013 ER, Paesi Bassi","{""coordinates"": [4.893957, 52.379459], ""type"": ""Point""}","&Klevering Centraal, 8, Haarlemmerstraat, Haarlemmerbuurt, Centrum, Amsterdam, Noord-Holland, Paesi Bassi, 1013 ER, Paesi Bassi",shop,gift
125,Amsterdam Noord,Amsterdam Noord,"[""*...Amsterdam Noord è separata dal resto della città dalla via d'acqua, il Canale del Mare del Nord....""]","Amsterdam-Noord, Ringweg-Noord, Noord, Amsterdam, Noord-Holland, Paesi Bassi, 1022 KK, Paesi Bassi","{""coordinates"": [4.931931, 52.409745], ""type"": ""Point""}","Amsterdam-Noord, Ringweg-Noord, Noord, Amsterdam, Noord-Holland, Paesi Bassi, 1022 KK, Paesi Bassi",highway,motorway_junction
126,Stadio Olimpico,Stadio Olimpico,['*...Lo Stadio Olimpico è ancora in funzione oggi ed ospita eventi sportivi e culturali....'],"Stadio Olimpico di Amsterdam, Olympisch Stadion, Zuid, Amsterdam, Noord-Holland, Paesi Bassi, 1076 DE, Paesi Bassi","{""coordinates"": [4.854054, 52.343444], ""type"": ""Point""}","Stadio Olimpico di Amsterdam, Olympisch Stadion, Zuid, Amsterdam, Noord-Holland, Paesi Bassi, 1076 DE, Paesi Bassi",leisure,stadium
127,Stadion De Meer,Stadion De Meer,"['*...A metà degli anni novanta ha lasciato il vecchio Stadion De Meer per spostarsi nella Johan Cruijff Arena (impianto noto anche come Amsterdam Arena), situata nella zona sud-est della città....']","Middenstip Stadion De Meer, Esplanade de Meer, Park de Meer, Oost, Amsterdam, Noord-Holland, Paesi Bassi, 1098 WG, Paesi Bassi","{""coordinates"": [4.949977, 52.34443], ""type"": ""Point""}","Middenstip Stadion De Meer, Esplanade de Meer, Park de Meer, Oost, Amsterdam, Noord-Holland, Paesi Bassi, 1098 WG, Paesi Bassi",tourism,artwork
128,Johan Cruijff Arena,Johan Cruijff Arena,"['*...A metà degli anni novanta ha lasciato il vecchio Stadion De Meer per spostarsi nella Johan Cruijff Arena (impianto noto anche come Amsterdam Arena), situata nella zona sud-est della città....']","Johan Cruijff ArenA, 29, Johan Cruijff Boulevard, Zuidoost, Amsterdam, Noord-Holland, Paesi Bassi, 1101 AX, Paesi Bassi","{""coordinates"": [4.942843, 52.314353], ""type"": ""Point""}","Johan Cruijff ArenA, 29, Johan Cruijff Boulevard, Zuidoost, Amsterdam, Noord-Holland, Paesi Bassi, 1101 AX, Paesi Bassi",leisure,stadium
129,Amsterdam Arena,Amsterdam Arena,"['*...A metà degli anni novanta ha lasciato il vecchio Stadion De Meer per spostarsi nella Johan Cruijff Arena (impianto noto anche come Amsterdam Arena), situata nella zona sud-est della città....']","Amsterdam ArenA, De loper, D-buurt, Zuidoost, Amsterdam, Noord-Holland, Paesi Bassi, 1102 TE, Paesi Bassi","{""coordinates"": [4.942931, 52.31599], ""type"": ""Point""}","Amsterdam ArenA, De loper, D-buurt, Zuidoost, Amsterdam, Noord-Holland, Paesi Bassi, 1102 TE, Paesi Bassi",railway,halt
