,entity,to_search,snippet,address,coordinates,name_location,class,type
0,Danubio,Danubio,"[""*...Budapest nacque ufficialmente nel 1873 dall'unione delle città storiche di Buda e Óbuda, ubicate a ovest del Danubio, con l'abitato di Pest, situato sulla riva opposta del fiume e anch'esso di antiche origini;..."", '*...Sulla riva opposta del Danubio fu fondata Pest....', ""*...I due più bei edifici di architettura romantica di Budapest sono la Grande Sinagoga e la sala concerti Vigadó sulla passeggiata sul Danubio, entrambi progettati dall'architetto Frigyes Feszl (1821-1884)...."", '*...Tabán, Vár (Castello) - I Circoscrizione\nSi trova sulla riva destra del Danubio e conta più di 30\xa0000 abitanti....', '*...Essa è situata sulla riva sinistra del Danubio e, secondo i dati del censimento del 1990, conta 115\xa0000 abitanti....', ""*...Nella circoscrizione si trova l'imbocco in sponda sinistra del ponte Megyeri, inaugurato nel 2008, che collega Újpest con la sponda destra del Danubio...."", ""*...L'area che abbraccia è quella compresa tra il Kiskörút (Piccolo Corso) e il Danubio, vi si trova anche il Mercato coperto di Vásárcsarnok che può considerarsi uno dei più grandi d'Europa...."", '*...Si trova a ovest del Danubio e fa quindi parte di Buda....', '*...I ponti ""Szabadsag"" e ""Lagymanyosi"" collegano il quartiere con la parte al di là del Danubio....', ""*...Il quartiere prende il nome dall'isola Csepel e si trova nel mezzo del Danubio, tra Buda e Pest...."", '...Scarpe sulla sponda del Danubio (Cipők a Duna-parton) ;...', ""*...È un'isola lunga 2\xa0500 metri e larga fino a 500 metri posta in mezzo al Danubio, composta in gran parte da un Parco...."", '*...Possiamo contare sette isole sul Danubio:...', '*...Isola Csepel è la più grande isola del Danubio in Ungheria. E lunga  e larga 6- e la sua area comprende , mentre solo la punta settentrionale è dentro i limiti della città....', '*...Uno dei motivi per cui i Romani colonizzarono la zona a ovest del Danubio e stabilirono qui la loro capitale regionale a Aquincum (ora parte di Óbuda, nel nord di Budapest) è stato per la possibilità di utilizzare e godere delle sorgenti termali....', '*...I bagni Rudas non solo si trovano in una superba posizione centrale, in una stretta striscia di terra compresa tra la collina Gellért e il Danubio, ma sono anche uno straordinario esempio di architettura risalente al periodo turco....', '*...La città è dotata di una rete ferroviaria metropolitana, di un servizio ferroviario suburbano (BHÉV), di una rete tranviaria, oltre che di una rete di autobus, filobus e navette fluviali sul Danubio....', ""*...) corre di direzione est-ovest ed è l'unica linea che si estende nella parte occidentale della città (Buda), attraversando il Danubio...."", ""*...È in fase di progettazione la linea  tra i capolinea di Varga Jenő tér e Pomázi út, con doppio attraversamento del Danubio e dell'isola Margherita....""]","Danubio, 4, Hajóépítő sétány, Marina part, Vizafogó, XIII. kerület, Budapest, Ungheria Centrale, 1138, Ungheria","{""coordinates"": [19.064653, 47.543047], ""type"": ""Point""}","Danubio, 4, Hajóépítő sétány, Marina part, Vizafogó, XIII. kerület, Budapest, Ungheria Centrale, 1138, Ungheria",building,apartments
3,Palazzo Reale,Palazzo Reale,"[""*...Già luogo di una certa importanza, venne ricostruita velocemente dopo la distruzione a opera degli invasori Mongoli nel 1241, ma fu Buda, sede del Palazzo Reale sin dal 1247, a diventare la capitale dell'Ungheria...."", '...Il quartiere del castello è un altro luogo da visitare dove sono stati costruiti il più famoso palazzo reale di Buda e molti altri edifici in stile barocco....', '...Palazzo Reale di Buda detto anche Castello di Buda (Királyi Palota) (Budai vár) ;...']","palazzo reale Duna Palota, 5, Zrínyi utca, Lipótváros, V. kerület, Budapest, Ungheria Centrale, 1051, Ungheria","{""coordinates"": [19.049127, 47.500073], ""type"": ""Point""}","palazzo reale Duna Palota, 5, Zrínyi utca, Lipótváros, V. kerület, Budapest, Ungheria Centrale, 1051, Ungheria",amenity,community_centre
6,Palazzo delle Arti,Palazzo delle Arti,"[""*...Budapest ha edifici architettonicamente degni di nota in un'ampia gamma di stili e di periodi di tempo distinti, dall'antichità come la città romana di Aquincum a Óbuda (Distretto III), che risale intorno all'89 d.C., al più moderno Palazzo delle Arti, il contemporaneo Museo d'arte e sala da concerto...."", ""...Numerosi punti di riferimento sono stati creati nell'ultimo decennio a Budapest, come il Teatro Nazionale, il Palazzo delle Arti, il ponte Rákóczi, il ponte Megyeri, lo Sky Court dell'Aeroporto di Budapest, tra gli altri, e milioni di metri quadrati di nuovi edifici per uffici e appartamenti....""]","palazzo delle arti, 37, Dózsa György út, Városliget, Budapest, XIV. kerület, Ungheria Centrale, 1146, Ungheria","{""coordinates"": [19.078903, 47.513914], ""type"": ""Point""}","palazzo delle arti, 37, Dózsa György út, Városliget, Budapest, XIV. kerület, Ungheria Centrale, 1146, Ungheria",tourism,museum
8,Castello,Castello,"['*...I pochi edifici in questo stile rimasti si trovano nel quartiere del Castello....', '...Il quartiere del castello è un altro luogo da visitare dove sono stati costruiti il più famoso palazzo reale di Buda e molti altri edifici in stile barocco....', '...Tabán, Vár (Castello) - I Circoscrizione\nSi trova sulla riva destra del Danubio e conta più di 30\xa0000 abitanti....', '*...Essa è meglio conosciuta con il nome di ""Castello"" ed è la più visitata dai turisti....', '*...Nella circoscrizione del Castello c\'è anche la cosiddetta ""Cittadella"", un forte arroccato su una collina sovrastante la città....', '...Rózsadomb, Pasarét - II Circoscrizione\nSituato a nord del ""Castello"" in un elegante quartiere tranquillo, è conosciuto come Rózsadomb, cioè ""collina delle rose"", nome derivato dalla presenza del derviscio turco Gül Baba che riempì gli spazi verdi di roseti....', '...Belváros, Lipótváros - V Circoscrizione\nBelváros è il vero e proprio centro di Pest, dallo stile barocco che si estende lungo il fiume davanti alla collina del castello....', '...Il quartiere si trova dietro la collina del castello;...', '...Al di sotto del castello di Buda è presente il Museo Ospedale nella Roccia e Bunker Antiatomico....', '...Palazzo Reale di Buda detto anche Castello di Buda (Királyi Palota) (Budai vár) ;...', '...Castello Vajdahunyad (Vajdahunyad vára) ;...']","Pizza Castello, 3, Darnó utca, Rákospalota, XV. kerület, Budapest, Ungheria Centrale, 1155, Ungheria","{""coordinates"": [19.115096, 47.536154], ""type"": ""Point""}","Pizza Castello, 3, Darnó utca, Rákospalota, XV. kerület, Budapest, Ungheria Centrale, 1155, Ungheria",place,house
15,Rudas,Rudas,"['*...Budapest è infatti uno dei pochi posti al mondo con originali bagni turchi funzionanti risalenti al XVI secolo, come le terme Rudas o le terme Király....', '...Bagni Rudas (Rudas Gyógyfürdő) ;...', '*...I bagni Rudas non solo si trovano in una superba posizione centrale, in una stretta striscia di terra compresa tra la collina Gellért e il Danubio, ma sono anche uno straordinario esempio di architettura risalente al periodo turco....']","Rudas gyógyfürdő és uszoda, 9, Döbrentei tér, Tabán, I. kerület, Budapest, Ungheria Centrale, 1013, Ungheria","{""coordinates"": [19.0478, 47.489066], ""type"": ""Point""}","Rudas gyógyfürdő és uszoda, 9, Döbrentei tér, Tabán, I. kerület, Budapest, Ungheria Centrale, 1013, Ungheria",tourism,attraction
16,Király,Király,"['*...Budapest è infatti uno dei pochi posti al mondo con originali bagni turchi funzionanti risalenti al XVI secolo, come le terme Rudas o le terme Király....', '...Bagni Király (Király Gyógyfürdő) ;...', '*...La costruzione dei bagni Király è iniziata nel 1565 e la maggior parte della struttura attuale appartiene al periodo turco, in particolare la piscina e la cupola che la ricopre....']","Király utca, Terézváros, VI. kerület, Budapest, Ungheria Centrale, 1077, Ungheria","{""coordinates"": [19.068673, 47.505153], ""type"": ""Point""}","Király utca, Terézváros, VI. kerület, Budapest, Ungheria Centrale, 1077, Ungheria",highway,tertiary
23,Chiesa luterana di Buda,Chiesa luterana di Buda,"['...Alcuni dei migliori esempi sono il Museo nazionale ungherese, la Chiesa luterana di Buda (entrambi progettati da Pollack) e la sede del presidente ungherese, il Palazzo Sándor....', '*...Chiesa luterana di Buda ;...']","Chiesa luterana di Buda, 28, Táncsics Mihály utca, Vár, I. kerület, Budapest, Ungheria Centrale, 1014, Ungheria","{""coordinates"": [19.030932, 47.504529], ""type"": ""Point""}","Chiesa luterana di Buda, 28, Táncsics Mihály utca, Vár, I. kerület, Budapest, Ungheria Centrale, 1014, Ungheria",amenity,place_of_worship
25,Grande Sinagoga,Grande Sinagoga,"[""...I due più bei edifici di architettura romantica di Budapest sono la Grande Sinagoga e la sala concerti Vigadó sulla passeggiata sul Danubio, entrambi progettati dall'architetto Frigyes Feszl (1821-1884)...."", '*...Il Museo, che ha sede nella Grande Sinagoga, vuole ricordare la vita quotidiana degli ebrei ungheresi e le persecuzioni durante la seconda guerra mondiale....']","Sinagoga Grande, 2, Dohány utca, Erzsébetváros, VII. kerület, Budapest, Ungheria Centrale, 1074, Ungheria","{""coordinates"": [19.060868, 47.496102], ""type"": ""Point""}","Sinagoga Grande, 2, Dohány utca, Erzsébetváros, VII. kerület, Budapest, Ungheria Centrale, 1074, Ungheria",amenity,place_of_worship
26,Vigadó,Vigadó,"[""*...I due più bei edifici di architettura romantica di Budapest sono la Grande Sinagoga e la sala concerti Vigadó sulla passeggiata sul Danubio, entrambi progettati dall'architetto Frigyes Feszl (1821-1884)...."", '...Vigadó tér ;...']","Pesti Vigadó, 2, Vigadó tér, Lipótváros, V. kerület, Budapest, Ungheria Centrale, 1051, Ungheria","{""coordinates"": [19.049569, 47.49597], ""type"": ""Point""}","Pesti Vigadó, 2, Vigadó tér, Lipótváros, V. kerület, Budapest, Ungheria Centrale, 1051, Ungheria",amenity,arts_centre
29,Ponte delle Catene,Ponte delle Catene,"[""...L'attrazione in stile classicista più iconica e ampiamente conosciuta a Budapest è il Ponte delle catene...."", ""*...Un altro esempio di Art Nouveau a Budapest è il Palazzo Gresham davanti al Ponte delle Catene, l'Hotel Gellért, l'Accademia Musicale Franz Liszt o lo Zoo e Giardino botanico di Budapest...."", '*...Ponte delle Catene (Széchenyi lánchíd) ;...']","Ponte delle Catene, 24498, 14397, 14398, 14400, Clark Ádám tér, Buda, Víziváros, I. kerület, Budapest, Ungheria Centrale, 1013, Ungheria","{""coordinates"": [19.043649, 47.498979], ""type"": ""Point""}","Ponte delle Catene, 24498, 14397, 14398, 14400, Clark Ádám tér, Buda, Víziváros, I. kerület, Budapest, Ungheria Centrale, 1013, Ungheria",tourism,attraction
30,Hotel Gellért,Hotel Gellért,"[""...Un altro esempio di Art Nouveau a Budapest è il Palazzo Gresham davanti al Ponte delle Catene, l'Hotel Gellért, l'Accademia Musicale Franz Liszt o lo Zoo e Giardino botanico di Budapest....""]","Hotel Gellért, 2, Szent Gellért tér, Szentimreváros, XI. kerület, Budapest, Ungheria Centrale, 1114, Ungheria","{""coordinates"": [19.052179, 47.483865], ""type"": ""Point""}","Hotel Gellért, 2, Szent Gellért tér, Szentimreváros, XI. kerület, Budapest, Ungheria Centrale, 1114, Ungheria",building,hotel
38,ponte Megyeri,ponte Megyeri,"[""...Numerosi punti di riferimento sono stati creati nell'ultimo decennio a Budapest, come il Teatro Nazionale, il Palazzo delle Arti, il ponte Rákóczi, il ponte Megyeri, lo Sky Court dell'Aeroporto di Budapest, tra gli altri, e milioni di metri quadrati di nuovi edifici per uffici e appartamenti...."", ""...Nella circoscrizione si trova l'imbocco in sponda sinistra del ponte Megyeri, inaugurato nel 2008, che collega Újpest con la sponda destra del Danubio....""]","Ponte Megyeri, M0, Megyeri Hídfő, Káposztásmegyer, IV. kerület, Budapest, Ungheria Centrale, 1044, Ungheria","{""coordinates"": [19.089087, 47.608989], ""type"": ""Point""}","Ponte Megyeri, M0, Megyeri Hídfő, Káposztásmegyer, IV. kerület, Budapest, Ungheria Centrale, 1044, Ungheria",man_made,bridge
41,Museo,Museo,"[""...Budapest ha edifici architettonicamente degni di nota in un'ampia gamma di stili e di periodi di tempo distinti, dall'antichità come la città romana di Aquincum a Óbuda (Distretto III), che risale intorno all'89 d.C., al più moderno Palazzo delle Arti, il contemporaneo Museo d'arte e sala da concerto...."", '...Alcuni dei migliori esempi sono il Museo nazionale ungherese, la Chiesa luterana di Buda (entrambi progettati da Pollack) e la sede del presidente ungherese, il Palazzo Sándor....', '...Uno dei suoi edifici più belli a Budapest è il Museo delle Arti Applicate....', ""*...All'interno del forte vi è anche un Museo dedicato al bunker edificato durante la seconda guerra mondiale...."", ""*...Degli anfiteatri, palazzi e colonnati tipici dell'architettura dell'Impero Romano, oggi rimane poco e quei pochi resti salvati dalle razzie della storia si trovano quasi tutti nella piazza principale, Fö tér, presso gli scavi archeologici di Aquincum e il relativo Museo...."", '...Vi si trova anche lo zoo e il Museo di Belle Arti....', ""*...Nel 1808 la Dieta creò il Museo nazionale ungherese, con lo scopo di raccogliere i reperti storici, archeologici e naturali dell'Ungheria e il Museo venne unito alla Biblioteca...."", '*...Nel 1846 venne costruita la nuova sede del Museo a Pest e anche la Biblioteca vi fu trasferita....', '*...Solo nel 1949 la Biblioteca venne separata dal Museo....', ""*...Il Museo illustra la storia del commercio e dell'artigianato ed espone, in un edificio che è uno degli esempi più significativi del primo Novecento, in puro stile liberty ungherese, una ricchissima collezione di mobili, vasi, arazzi, oggetti d'arte floreale e secessionista, oltre a manufatti delle culture islamica, indù e persiana...."", '*...Il Museo, che ha sede nella Grande Sinagoga, vuole ricordare la vita quotidiana degli ebrei ungheresi e le persecuzioni durante la seconda guerra mondiale....', ""...In questo settore è considerato il più grande Museo d'Europa...."", '*...Il Museo è ospitato in una cantina che si estende su  nelle cui sale si organizzano corsi sul vino, degustazioni e convegni....', '*...La stazione Deák Ferenc tér ospita un Museo in cui giacciono mezzi storici, fotografie, piantine....', '...Al di sotto del castello di Buda è presente il Museo Ospedale nella Roccia e Bunker Antiatomico....', '...Museo storico di Budapest ;...', '...Museo etnografico (Néprajzi Múzeum) ;...', '...Museo Zoltán Kodály ;...', '...Museo Franz Liszt ;...', '...Museo di belle arti (Szépművészeti Múzeum) ;...', '...Museo delle arti orientali Ferenc Hopp (Hopp Ferenc Kelet-Ázsiai Művészeti Múzeum) ;...', '...Museo Casa del terrore (Terror Háza) ;...', '...Museo del Teatro Gizi Bajor ;...', ""...Museo Farmacia all'Aquila d'Oro ;..."", '...Museo della storia militare di Budapest ;...', '...Museo Semmelweis di storia della medicina ;...', '...Museo Ludwig di arte contemporanea ....']","Néprajzi Múzeum, Városligeti fasor, Ligetváros, Erzsébetváros, VII. kerület, Budapest, Ungheria Centrale, 1146, Ungheria","{""coordinates"": [19.080657, 47.512167], ""type"": ""Point""}","Néprajzi Múzeum, Városligeti fasor, Ligetváros, Erzsébetváros, VII. kerület, Budapest, Ungheria Centrale, 1146, Ungheria",tourism,museum
43,Fö tér,Fö tér,"[""*...Degli anfiteatri, palazzi e colonnati tipici dell'architettura dell'Impero Romano, oggi rimane poco e quei pochi resti salvati dalle razzie della storia si trovano quasi tutti nella piazza principale, Fö tér, presso gli scavi archeologici di Aquincum e il relativo Museo....""]","Fő tér, Újpalotai lakótelep, Újpalota, XV. kerület, Budapest, Ungheria Centrale, 1157, Ungheria","{""coordinates"": [19.140173, 47.540718], ""type"": ""Point""}","Fő tér, Újpalotai lakótelep, Újpalota, XV. kerület, Budapest, Ungheria Centrale, 1157, Ungheria",highway,service
45,Megyeri,Megyeri,"[""...Numerosi punti di riferimento sono stati creati nell'ultimo decennio a Budapest, come il Teatro Nazionale, il Palazzo delle Arti, il ponte Rákóczi, il ponte Megyeri, lo Sky Court dell'Aeroporto di Budapest, tra gli altri, e milioni di metri quadrati di nuovi edifici per uffici e appartamenti...."", ""*...Nella circoscrizione si trova l'imbocco in sponda sinistra del ponte Megyeri, inaugurato nel 2008, che collega Újpest con la sponda destra del Danubio....""]","Szusza Ferenc Stadion, Megyeri út, Károlyi Városnegyed, Újpest, IV. kerület, Budapest, Ungheria Centrale, 1044, Ungheria","{""coordinates"": [19.083529, 47.574877], ""type"": ""Point""}","Szusza Ferenc Stadion, Megyeri út, Károlyi Városnegyed, Újpest, IV. kerület, Budapest, Ungheria Centrale, 1044, Ungheria",leisure,stadium
48,Europa,Europa,"[""...Dopo la caduta del regime comunista (1989) Budapest ha riallacciato i suoi tradizionali legami economici e culturali con l'Europa occidentale, ponendosi come capofila nel tumultuoso passaggio al capitalismo dei Paesi centro europei ex socialisti...."", ""...La seconda metà del XX secolo vide anche, sotto il regime comunista, la costruzione di condomini (panelház), come in altri paesi dell'Europa orientale...."", ""*...L'area che abbraccia è quella compresa tra il Kiskörút (Piccolo Corso) e il Danubio, vi si trova anche il Mercato coperto di Vásárcsarnok che può considerarsi uno dei più grandi d'Europa...."", ""...In questo settore è considerato il più grande Museo d'Europa...."", '...Archivi di Radio Europa Libera ....', ""*...Hajógyári-sziget è un'isola artificiale situata nel terzo distretto. L'isola ospita numerose attività tra le quali: stazione d'imbarco, moto d'acqua durante il giorno e discoteche durante la notte. Questa è l'isola dove il famoso Sziget Festival ha luogo e che ospita centinaia di spettacoli con circa 400\xa0000 visitatori nella sua ultima edizione. Molti progetti sono in corso per rendere questa isola uno dei più grandi centri di divertimento d'Europa. Si progetta di costruire appartamenti, alberghi, casinò e un porto turistico...."", ""*...I bagni Széchenyi sono tra i più grandi complessi termali di tutta l'Europa...."", ""...La metropolitana di Budapest è la più antica dell'Europa continentale...."", ""...Aperta nel 1896, è la prima linea metropolitana dell'Europa continentale, è stata estesa nel 1973 al nuovo capolinea di Mexikói út...."", ""*...L'Aeroporto offre collegamenti, oltre che con le principali città d'Europa, anche con Medio Oriente, Asia e Nord America....""]","Európa, 4/C, Gyakorló utca, Gyakorló utcai lakótelep, Felsőrákos, X. kerület, Budapest, Ungheria Centrale, 1106, Ungheria","{""coordinates"": [19.139069, 47.501772], ""type"": ""Point""}","Európa, 4/C, Gyakorló utca, Gyakorló utcai lakótelep, Felsőrákos, X. kerület, Budapest, Ungheria Centrale, 1106, Ungheria",amenity,pharmacy
50,Sinagoga,Sinagoga,"[""...I due più bei edifici di architettura romantica di Budapest sono la Grande Sinagoga e la sala concerti Vigadó sulla passeggiata sul Danubio, entrambi progettati dall'architetto Frigyes Feszl (1821-1884)...."", ""*...Erzsébetváros - VII Circoscrizione\nNella circoscrizione è compreso anche il quartiere ebraico e dietro la Sinagoga, che fa da punto di riferimento per i visitatori, è visibile ancora ciò che rimane dell'antico ghetto ebraico...."", '...Il Museo, che ha sede nella Grande Sinagoga, vuole ricordare la vita quotidiana degli ebrei ungheresi e le persecuzioni durante la seconda guerra mondiale....', '...Sinagoga grande ....']","Sinagoga Grande, 2, Dohány utca, Erzsébetváros, VII. kerület, Budapest, Ungheria Centrale, 1074, Ungheria","{""coordinates"": [19.060868, 47.496102], ""type"": ""Point""}","Sinagoga Grande, 2, Dohány utca, Erzsébetváros, VII. kerület, Budapest, Ungheria Centrale, 1074, Ungheria",amenity,place_of_worship
52,Moricz Zsigmond Korter,Moricz Zsigmond Korter,"['...Molte delle attività di questa Circoscrizione ruotano intorno al ""Moricz Zsigmond Korter"", che rappresenta il crocevia per moltissime linee di trasporto pubblico....']","Móricz Zsigmond körtér M, Karinthy Frigyes út, Lágymányos, XI. kerület, Budapest, Ungheria Centrale, 1117, Ungheria","{""coordinates"": [19.049888, 47.476963], ""type"": ""Point""}","Móricz Zsigmond körtér M, Karinthy Frigyes út, Lágymányos, XI. kerület, Budapest, Ungheria Centrale, 1117, Ungheria",highway,bus_stop
53,Szabadsag,Szabadsag,"['*...I ponti ""Szabadsag"" e ""Lagymanyosi"" collegano il quartiere con la parte al di là del Danubio....']","Szabadság híd, Raoul Wallenberg rakpart, Lágymányos, XI. kerület, Budapest, Ungheria Centrale, 1111, Ungheria","{""coordinates"": [19.054918, 47.485731], ""type"": ""Point""}","Szabadság híd, Raoul Wallenberg rakpart, Lágymányos, XI. kerület, Budapest, Ungheria Centrale, 1111, Ungheria",man_made,bridge
54,Lagymanyosi,Lagymanyosi,"['...I ponti ""Szabadsag"" e ""Lagymanyosi"" collegano il quartiere con la parte al di là del Danubio....']","Rákóczi híd, Középső-Ferencváros, XI. kerület, Budapest, IX. kerület, Ungheria Centrale, 1095, Ungheria","{""coordinates"": [19.070648, 47.468794], ""type"": ""Point""}","Rákóczi híd, Középső-Ferencváros, XI. kerület, Budapest, IX. kerület, Ungheria Centrale, 1095, Ungheria",highway,primary
57,Zugló - XIV,Zugló - XIV,['*...Zugló - XIV...'],"Budapest Főváros XIV. Kerület Zugló Önkormányzat, 11-17, Pétervárad utca, Herminamező, Budapest, XIV. kerület, Ungheria Centrale, 1145, Ungheria","{""coordinates"": [19.109451, 47.518539], ""type"": ""Point""}","Budapest Főváros XIV. Kerület Zugló Önkormányzat, 11-17, Pétervárad utca, Herminamező, Budapest, XIV. kerület, Ungheria Centrale, 1145, Ungheria",amenity,townhall
58,Museo di Belle Arti,Museo di Belle Arti,"['...Vi si trova anche lo zoo e il Museo di Belle Arti....', '...Museo di belle arti (Szépművészeti Múzeum) ;...']","Museo di belle arti, 41, Dózsa György út, Városliget, VI. kerület, Budapest, XIV. kerület, Ungheria Centrale, 1146, Ungheria","{""coordinates"": [19.076405, 47.516258], ""type"": ""Point""}","Museo di belle arti, 41, Dózsa György út, Városliget, VI. kerület, Budapest, XIV. kerület, Ungheria Centrale, 1146, Ungheria",tourism,museum
59,Stefánia út,Stefánia út,"[""*...Il quartiere Istvánmező è un quartiere piuttosto elegante e verde, tanto che la sua via principale, Stefánia út, è ricordata in alcune canzoni popolari dei primi del '900 e vi si trovano numerose ambasciate, tra cui quella italiana....""]","Stefánia út, Istvánmező, Budapest, XIV. kerület, Ungheria Centrale, 1143, Ungheria","{""coordinates"": [19.107364, 47.502466], ""type"": ""Point""}","Stefánia út, Istvánmező, Budapest, XIV. kerület, Ungheria Centrale, 1143, Ungheria",highway,tertiary_link
62,Puskás Ferenc Stadion,Puskás Ferenc Stadion,['*...Vi si trovano anche il grande Parco cittadino Városliget e lo stadio Népstadion (oggi rinominato Puskás Ferenc Stadion) costruito nel 1954 e che poteva contenere fino a circa 100\xa0000 persone (oggi il numero dei posti è stato ridotto)....'],"Puskás Ferenc Stadion, Kerepesi út, Istvánmező, Budapest, XIV. kerület, Ungheria Centrale, 1146, Ungheria","{""coordinates"": [19.105989, 47.500266], ""type"": ""Point""}","Puskás Ferenc Stadion, Kerepesi út, Istvánmező, Budapest, XIV. kerület, Ungheria Centrale, 1146, Ungheria",railway,station
64,Memento Park,Memento Park,"[""...In esso si trova il Memento Park che ospita le statue e monumenti dell'epoca comunista, che si trovavano sparsi per la città prima di essere brutalmente rimosse dopo alcuni anni dalla caduta del sistema socialista....""]","Memento Park, Szabadkai utca, Erdődűlő, Budatétény, Budapest, XXII. kerület, Ungheria Centrale, 1223, Ungheria","{""coordinates"": [19.001446, 47.425951], ""type"": ""Point""}","Memento Park, Szabadkai utca, Erdődűlő, Budatétény, Budapest, XXII. kerület, Ungheria Centrale, 1223, Ungheria",highway,bus_stop
66,Deák Ferenc,Deák Ferenc,"['...Gli spazi pubblici attirano ingenti investimenti anche da parte delle imprese e del governo, tanto che la città ha acquisito piazze, parchi e monumenti completamente nuovi (o rinnovati e ridisegnati), ad esempio la piazza Kossuth, la piazza Deák Ferenc e la piazza della Libertà....', '*...La stazione Deák Ferenc tér ospita un Museo in cui giacciono mezzi storici, fotografie, piantine....']","Deák Ferenc, Széchenyi István tér, Lipótváros, V. kerület, Budapest, Ungheria Centrale, 1051, Ungheria","{""coordinates"": [19.047526, 47.498996], ""type"": ""Point""}","Deák Ferenc, Széchenyi István tér, Lipótváros, V. kerület, Budapest, Ungheria Centrale, 1051, Ungheria",historic,memorial
71,Basilica di Santo Stefano,Basilica di Santo Stefano,['*...Basilica di Santo Stefano ;...'],"Basilica di Santo Stefano, 1, Szent István tér, Lipótváros, V. kerület, Budapest, Ungheria Centrale, 1051, Ungheria","{""coordinates"": [19.053992, 47.500777], ""type"": ""Point""}","Basilica di Santo Stefano, 1, Szent István tér, Lipótváros, V. kerület, Budapest, Ungheria Centrale, 1051, Ungheria",amenity,place_of_worship
74,Chiesa nella Roccia,Chiesa nella Roccia,['*...Chiesa nella Roccia ;...'],"Chiesa nella Roccia, 1, Szent Gellért rakpart, Gellérthegy, XI. kerület, Budapest, Ungheria Centrale, 1114, Ungheria","{""coordinates"": [19.052168, 47.484925], ""type"": ""Point""}","Chiesa nella Roccia, 1, Szent Gellért rakpart, Gellérthegy, XI. kerület, Budapest, Ungheria Centrale, 1114, Ungheria",amenity,place_of_worship
