,entity,to_search,snippet,address,coordinates,name_location,class,type
137,Wimbledon,Wimbledon,"['...Molti altri grandi spazi verdi, più selvaggi e meno formali, sono in periferia, come Hampstead Heath, Wimbledon Common ed Epping Forest....', ""*...South London\nSouth London comprende distretti come Wimbledon (famoso come sede dell'omonimo torneo di tennis), Bermondsey e Dulwich...."", '*...Si estende da Wimbledon, a nord, fino a Beckenham Junction, Elmers End e New Addington a sud....', '...AFC Wimbledon\nArsenal\nBarnet\nBrentford\nLeyton Orient\nChelsea\nFulham\nMillwall\nTottenham Hotspur\nSutton Utd...', ""*...Uno degli eventi sportivi più importanti che si tengono a Londra è il torneo di tennis di Wimbledon, presso l'All England Club, nel sud-ovest di Wimbledon, il più antico e prestigioso torneo di tennis al mondo, vinto per 8 volte da Roger Federer (record assoluto)....""]","The All England Lawn Tennis Club, St Mary's Walk, Wimbledon Village, London Borough of Merton, Londra, Greater London, Inghilterra, SW19 5JA, Regno Unito","{""coordinates"": [-0.215003, 51.434217], ""type"": ""Point""}","The All England Lawn Tennis Club, St Mary's Walk, Wimbledon Village, London Borough of Merton, Londra, Greater London, Inghilterra, SW19 5JA, Regno Unito",leisure,sports_centre
141,Alexandra Park,Alexandra Park,"[""*...In questa parte della capitale britannica si trovano grandi parchi come Hampstead Heath o Alexandra Park, dove si trova l'Alexandra Palace....""]","Alexandra Park Branch, Roslyn Road, Seven Sisters, West Green, London Borough of Haringey, Londra, Greater London, Inghilterra, N15 5ER, Regno Unito","{""coordinates"": [-0.093086, 51.588772], ""type"": ""Point""}","Alexandra Park Branch, Roslyn Road, Seven Sisters, West Green, London Borough of Haringey, Londra, Greater London, Inghilterra, N15 5ER, Regno Unito",railway,razed
142,Alexandra Palace,Alexandra Palace,"[""...In questa parte della capitale britannica si trovano grandi parchi come Hampstead Heath o Alexandra Park, dove si trova l'Alexandra Palace....""]","Alexandra Palace, Dukes Avenue, Muswell Hill, London Borough of Haringey, Londra, Greater London, Inghilterra, N10 2QB, Regno Unito","{""coordinates"": [-0.130885, 51.594222], ""type"": ""Point""}","Alexandra Palace, Dukes Avenue, Muswell Hill, London Borough of Haringey, Londra, Greater London, Inghilterra, N10 2QB, Regno Unito",tourism,attraction
143,Upper Street,Upper Street,"['*...Islington, che si estende per circa 1 miglio lungo Upper Street, ha più bar e ristoranti rispetto a qualsiasi altra Strada del Regno Unito....']","Upper Street, Angel, Clerkenwell, London Borough of Islington, Londra, Greater London, Inghilterra, N1 8EQ, Regno Unito","{""coordinates"": [-0.105996, 51.533044], ""type"": ""Point""}","Upper Street, Angel, Clerkenwell, London Borough of Islington, Londra, Greater London, Inghilterra, N1 8EQ, Regno Unito",highway,trunk
145,Selfridges,Selfridges,"['*...La zona più commerciale della città rimane Oxford Street, una via dedicata allo shopping lunga quasi 1 miglio e sede di grandi magazzini tra cui Selfridges....']","Selfridges, Oxford Street, Mayfair, Londra, Greater London, Inghilterra, W1K 6JL, Regno Unito","{""coordinates"": [-0.151626, 51.514189], ""type"": ""Point""}","Selfridges, Oxford Street, Mayfair, Londra, Greater London, Inghilterra, W1K 6JL, Regno Unito",highway,bus_stop
146,Knightsbridge,Knightsbridge,['*...Knightsbridge è invece la sede del famoso negozio Harrods....'],"Knightsbridge, Kensington e Chelsea, City of Westminster, Greater London, Inghilterra, SW1X 7RJ, Regno Unito","{""coordinates"": [-0.16001, 51.501951], ""type"": ""Point""}","Knightsbridge, Kensington e Chelsea, City of Westminster, Greater London, Inghilterra, SW1X 7RJ, Regno Unito",highway,trunk
147,Petticoat Lane Market,Petticoat Lane Market,"[""*...Oltre al già citato Covent Garden, altri mercati importanti all'aperto si trovano presso Petticoat Lane Market e Portobello Road...."", ""*...Vi si trovano vari luoghi d'interesse turistico, come i mercati (ad esempio il Columbia Road Flower Market e quelli a Spitalfields, Brick Lane, Petticoat Lane) e diversi musei....""]","Wentworth Street Market, Resolution Plaza, Spitalfields, Whitechapel, London Borough of Tower Hamlets, Londra, Greater London, Inghilterra, E1 7AJ, Regno Unito","{""coordinates"": [-0.074901, 51.516722], ""type"": ""Point""}","Wentworth Street Market, Resolution Plaza, Spitalfields, Whitechapel, London Borough of Tower Hamlets, Londra, Greater London, Inghilterra, E1 7AJ, Regno Unito",amenity,marketplace
149,A1,A1,"[""...L'A1 e M1 collegano Londra a Edimburgo, Leeds e Newcastle....""]","Holloway Road, Holloway, London Borough of Islington, Londra, Greater London, Inghilterra, N7 6HT, Regno Unito","{""coordinates"": [-0.119584, 51.557983], ""type"": ""Point""}","Holloway Road, Holloway, London Borough of Islington, Londra, Greater London, Inghilterra, N7 6HT, Regno Unito",highway,trunk
150,M1,M1,"[""*...L'A1 e M1 collegano Londra a Edimburgo, Leeds e Newcastle....""]","M1, Brent Cross, London Borough of Barnet, Londra, Greater London, Inghilterra, NW4 3HR, Regno Unito","{""coordinates"": [-0.229006, 51.572119], ""type"": ""Point""}","M1, Brent Cross, London Borough of Barnet, Londra, Greater London, Inghilterra, NW4 3HR, Regno Unito",highway,motorway
152,Charing Cross,Charing Cross,"['*...Charing Cross ;...', ""*...Future espansioni (per ora solo proposte) raggiungeranno grandi stazioni ferroviarie del centro, quali Charing Cross, Euston e King's Cross....""]","Charing Cross, St. James's, Covent Garden, Londra, Greater London, Inghilterra, SW1A 2DR, Regno Unito","{""coordinates"": [-0.127412, 51.507249], ""type"": ""Point""}","Charing Cross, St. James's, Covent Garden, Londra, Greater London, Inghilterra, SW1A 2DR, Regno Unito",highway,primary
153,Euston,Euston,"['*...Euston ;...', ""*...Future espansioni (per ora solo proposte) raggiungeranno grandi stazioni ferroviarie del centro, quali Charing Cross, Euston e King's Cross....""]","Euston, Eversholt Street, St Pancras, Camden, Londra, Greater London, Inghilterra, NW1 1DT, Regno Unito","{""coordinates"": [-0.131945, 51.528404], ""type"": ""Point""}","Euston, Eversholt Street, St Pancras, Camden, Londra, Greater London, Inghilterra, NW1 1DT, Regno Unito",railway,stop
154,Liverpool Street,Liverpool Street,"['*...Liverpool Street (collegata agli aeroporti di Stansted, City e Southend) ;...']","The Liverpool Street Hostel, 52, Wilson Street, Shoreditch, London Borough of Hackney, Londra, Greater London, Inghilterra, EC2A 2EP, Regno Unito","{""coordinates"": [-0.085047, 51.520366], ""type"": ""Point""}","The Liverpool Street Hostel, 52, Wilson Street, Shoreditch, London Borough of Hackney, Londra, Greater London, Inghilterra, EC2A 2EP, Regno Unito",tourism,hostel
156,Waterloo,Waterloo,"[""*...Waterloo (fu il capolinea dell'Eurostar fino a novembre 2007) ;...""]","Waterloo, York Road, South Bank, Waterloo, London Borough of Lambeth, Londra, Greater London, Inghilterra, SE1 7NJ, Regno Unito","{""coordinates"": [-0.114867, 51.503342], ""type"": ""Point""}","Waterloo, York Road, South Bank, Waterloo, London Borough of Lambeth, Londra, Greater London, Inghilterra, SE1 7NJ, Regno Unito",railway,stop
157,St. Pancras International,St. Pancras International,"[""*...St. Pancras International (collegata all'Aeroporto di Luton e dal 6 novembre 2007 capolinea inglese del treno Eurostar che collega Londra all'oltreManica)....""]","Le Pain Quotidien, Euston Road, King's Cross, Camden, Londra, Greater London, Inghilterra, N1C 4QL, Regno Unito","{""coordinates"": [-0.12608, 51.530669], ""type"": ""Point""}","Le Pain Quotidien, Euston Road, King's Cross, Camden, Londra, Greater London, Inghilterra, N1C 4QL, Regno Unito",amenity,cafe
159,Heathrow Express,Heathrow Express,"[""*...Heathrow - il principale per i voli internazionali, a  a ovest della città. Scalo di alcune delle più grandi compagnie aeree (British Airways, Virgin Atlantic Airways, Bmi British Midland), racchiude 5 terminal, facilmente raggiungibili sia in treno (Heathrow Express, dalla stazione di Paddington) sia con la Piccadilly line (Underground). Nel 2016, circa 75,5 milioni di passeggeri sono passati da questo Aeroporto, ponendolo al primo posto come Aeroporto più trafficato d'Europa....""]","Heathrow Express Tickets, London Street, Paddington, Londra, Greater London, Inghilterra, W2 1EE, Regno Unito","{""coordinates"": [-0.176628, 51.516483], ""type"": ""Point""}","Heathrow Express Tickets, London Street, Paddington, Londra, Greater London, Inghilterra, W2 1EE, Regno Unito",shop,ticket
162,Southend,Southend,"['*...Liverpool Street (collegata agli aeroporti di Stansted, City e Southend) ;...', ""*...Southend - il sesto per traffico, è il più piccolo e distante da Londra, situato nella contea dell'Essex, vicino alla costa, a  a est dalla capitale. Nato anch'esso come Aeroporto militare, gestisce pochi voli, anche internazionali, senza però raggiungere il milione di passeggeri l'anno. Anche per questo Aeroporto è previsto un progetto di ampliamento che dovrebbe incrementare il flusso di passeggeri fino a raggiungere i 2 milioni di passeggeri l'anno....""]","Southend Lane, Bellingham, Southend, London Borough of Lewisham, Londra, Greater London, Inghilterra, SE6 3AP, Regno Unito","{""coordinates"": [-0.026946, 51.426871], ""type"": ""Point""}","Southend Lane, Bellingham, Southend, London Borough of Lewisham, Londra, Greater London, Inghilterra, SE6 3AP, Regno Unito",highway,primary
165,"Tram
","Tram
",['*...Tram\nIl Tramlink è il servizio tram operante nel sud di Londra....'],"Kingsway Tram Subway, Gray's Inn, Holborn, Camden, Londra, Greater London, Inghilterra, WC1B 5HL, Regno Unito","{""coordinates"": [-0.120719, 51.518332], ""type"": ""Point""}","Kingsway Tram Subway, Gray's Inn, Holborn, Camden, Londra, Greater London, Inghilterra, WC1B 5HL, Regno Unito",highway,service
166,Tramlink,Tramlink,"['*...Il trasporto pubblico londinese comprende la London Underground (metropolitana), la London Overground, la Docklands Light Railway, il Tramlink e i servizi autobus e fluviali urbani....', '...Tram\nIl Tramlink è il servizio tram operante nel sud di Londra....']","Tramlink Shop, George Street, Broad Green, Croydon, Londra, Greater London, Inghilterra, CR0 1PE, Regno Unito","{""coordinates"": [-0.096027, 51.374115], ""type"": ""Point""}","Tramlink Shop, George Street, Broad Green, Croydon, Londra, Greater London, Inghilterra, CR0 1PE, Regno Unito",tourism,information
170,Tower Gateway,Tower Gateway,"['*...Si estende a nord fino a Stratford, a sud fino a Lewisham, ad est fino a Woolwich Arsenal, in apertura nel 2009, e si collega col centro alle stazioni di Bank (Città di Londra) e Tower Gateway, vicino alla stazione di Tower Hill (Underground)....']","Tower Hill / Tower Gateway Station, Mansell Street, East Smithfield, Whitechapel, London Borough of Tower Hamlets, Londra, Greater London, Inghilterra, EC3N 4DX, Regno Unito","{""coordinates"": [-0.073252, 51.509679], ""type"": ""Point""}","Tower Hill / Tower Gateway Station, Mansell Street, East Smithfield, Whitechapel, London Borough of Tower Hamlets, Londra, Greater London, Inghilterra, EC3N 4DX, Regno Unito",highway,bus_stop
172,Cutty Sark,Cutty Sark,"['...La DLR è usata prevalentemente come collegamento per il Aeroporto di Londra-City, il Cutty Sark e Canary Wharf....']","Cutty Sark, Greenwich Church Street, East Greenwich, Royal Borough of Greenwich, Londra, Greater London, Inghilterra, SE10 9BL, Regno Unito","{""coordinates"": [-0.009615, 51.482933], ""type"": ""Point""}","Cutty Sark, Greenwich Church Street, East Greenwich, Royal Borough of Greenwich, Londra, Greater London, Inghilterra, SE10 9BL, Regno Unito",tourism,attraction
173,Knowledge,Knowledge,['...Ogni tassista deve superare un esame di conoscenza delle strade e dei luoghi di interesse della capitale britannica chiamato The Knowledge per poter operare....'],"Knowledge, Mile End Road, Globe Town, Mile End, London Borough of Tower Hamlets, Londra, Greater London, Inghilterra, E1 4NS, Regno Unito","{""coordinates"": [-0.040298, 51.524315], ""type"": ""Point""}","Knowledge, Mile End Road, Globe Town, Mile End, London Borough of Tower Hamlets, Londra, Greater London, Inghilterra, E1 4NS, Regno Unito",tourism,artwork
174,Hotel Savoy,Hotel Savoy,"[""...Inoltre, tutti i taxi di Londra hanno come massimo di raggio di curvatura il valore di , poiché devono essere in grado di affrontare la stretta rotonda all'entrata dell'Hotel Savoy....""]","Savoy Hotel, Strand, St Clement Danes, Covent Garden, Londra, Greater London, Inghilterra, WC2R 0EU, Regno Unito","{""coordinates"": [-0.120499, 51.510127], ""type"": ""Point""}","Savoy Hotel, Strand, St Clement Danes, Covent Garden, Londra, Greater London, Inghilterra, WC2R 0EU, Regno Unito",tourism,hotel
175,National Rail,National Rail,['*...La British Transport Police è responsabile per i servizi di polizia sulla National Rail e sulla metropolitana....'],"Limehouse DLR and National Rail Station, Bekesbourne Street entrance 1, Bekesbourne Street, Ratcliffe, Limehouse, London Borough of Tower Hamlets, Londra, Greater London, Inghilterra, E14 7JE, Regno Unito","{""coordinates"": [-0.03986, 51.51245], ""type"": ""Point""}","Limehouse DLR and National Rail Station, Bekesbourne Street entrance 1, Bekesbourne Street, Ratcliffe, Limehouse, London Borough of Tower Hamlets, Londra, Greater London, Inghilterra, E14 7JE, Regno Unito",railway,subway_entrance
176,Stadio di Wembley,Stadio di Wembley,"['...Subito dopo la guerra, presso lo stadio di Wembley si tennero le Olimpiadi estive del 1948....', '...Dal 1924, lo Stadio di Wembley originale era la sede della nazionale inglese di calcio e servì come sede per la finale di FA Cup così come per quella della coppa di rugby....', '...Il nuovo stadio di Wembley serve esattamente le stesse finalità e ha una capacità di 90\xa0000 posti....', '*...Subito dopo la guerra, presso lo stadio di Wembley si tennero le Olimpiadi estive del 1948....', ""...Londra ha numerose sedi per i concerti rock e pop, tra cui grandi arene, come Earls Court, Wembley Arena e l'O2 Arena, così come molte medie imprese locali, come la Brixton Academy e l'Hammersmith Apollo...."", '*...Il nuovo stadio di Wembley serve esattamente le stesse finalità e ha una capacità di 90\xa0000 posti....']","Stadio di Wembley, Pacific Crescent, London Borough of Brent, Londra, Greater London, Inghilterra, HA9 0SL, Regno Unito","{""coordinates"": [-0.279603, 51.556069], ""type"": ""Point""}","Stadio di Wembley, Pacific Crescent, London Borough of Brent, Londra, Greater London, Inghilterra, HA9 0SL, Regno Unito",tourism,attraction
177,Lord's Cricket Ground,Lord's Cricket Ground,"[""...Londra possiede inoltre due stadi di cricket appartenenti al Test cricket, il Lord's Cricket Ground sede del Middlesex CCC e l'Oval sede del Surrey CCC a Kennington...."", ""...Il Lord's Cricket Ground ha ospitato quattro finali di Coppa del Mondo di cricket....""]","Lord's Cricket Ground, Wellington Road, St. John's Wood, Londra, Greater London, Inghilterra, NW8 9SP, Regno Unito","{""coordinates"": [-0.169648, 51.530466], ""type"": ""Point""}","Lord's Cricket Ground, Wellington Road, St. John's Wood, Londra, Greater London, Inghilterra, NW8 9SP, Regno Unito",highway,bus_stop
178,Oval,Oval,"[""...Londra possiede inoltre due stadi di cricket appartenenti al Test cricket, il Lord's Cricket Ground sede del Middlesex CCC e l'Oval sede del Surrey CCC a Kennington....""]","Oval, Harleyford Street, Oval, London Borough of Lambeth, Londra, Greater London, Inghilterra, SE11 5SY, Regno Unito","{""coordinates"": [-0.112615, 51.481983], ""type"": ""Point""}","Oval, Harleyford Street, Oval, London Borough of Lambeth, Londra, Greater London, Inghilterra, SE11 5SY, Regno Unito",railway,subway_entrance
