,entity,to_search,snippet,address,coordinates,name_location,class,type
90,Tate Britain,Tate Britain,"['...La galleria nazionale di arte britannica è la Tate Britain, originariamente istituita nel 1897....', ""*...Altre importanti attrazioni turistiche includono la St Paul's Cathedral, la National Gallery, il Bankside di Southwark con il Globe Theatre, la Tate Modern e il London Bridge, il Tower Bridge e la Torre di Londra, Tate Britain, il British Museum a Bloomsbury....""]","Tate Britain, John Islip Street, Millbank, Londra, Greater London, Inghilterra, SW1P 4JH, Regno Unito","{""coordinates"": [-0.128135, 51.492072], ""type"": ""Point""}","Tate Britain, John Islip Street, Millbank, Londra, Greater London, Inghilterra, SW1P 4JH, Regno Unito",highway,bus_stop
91,Tate Modern,Tate Modern,"['...Nel 2000 questa collezione è stata trasferita presso la Tate Modern, una nuova galleria ospitata nella ex centrale elettrica di Bankside....', ""...Altre importanti attrazioni turistiche includono la St Paul's Cathedral, la National Gallery, il Bankside di Southwark con il Globe Theatre, la Tate Modern e il London Bridge, il Tower Bridge e la Torre di Londra, Tate Britain, il British Museum a Bloomsbury...."", '*...Tate Modern;...']","Switch House, Tate Modern, Holland Street, Bankside, The Borough, London Borough of Southwark, Londra, Greater London, Inghilterra, SE1 9FU, Regno Unito","{""coordinates"": [-0.100294, 51.507135], ""type"": ""Point""}","Switch House, Tate Modern, Holland Street, Bankside, The Borough, London Borough of Southwark, Londra, Greater London, Inghilterra, SE1 9FU, Regno Unito",tourism,viewpoint
92,Bankside,Bankside,"['*...Nel 2000 questa collezione è stata trasferita presso la Tate Modern, una nuova galleria ospitata nella ex centrale elettrica di Bankside....', ""...Altre importanti attrazioni turistiche includono la St Paul's Cathedral, la National Gallery, il Bankside di Southwark con il Globe Theatre, la Tate Modern e il London Bridge, il Tower Bridge e la Torre di Londra, Tate Britain, il British Museum a Bloomsbury....""]","Bankside, The Borough, London Borough of Southwark, Londra, Greater London, Inghilterra, SE1 9JE, Regno Unito","{""coordinates"": [-0.097095, 51.508401], ""type"": ""Point""}","Bankside, The Borough, London Borough of Southwark, Londra, Greater London, Inghilterra, SE1 9JE, Regno Unito",highway,footway
95,Baker Street,Baker Street,"['*...A Londra si può visitare la sua casa in Baker Street, dove ancora oggi giungono centinaia di lettere per chiedere aiuto per la risoluzione di casi inspiegabili....']","Baker Street, Marylebone Road, Marylebone, Londra, Greater London, Inghilterra, NW1 5LD, Regno Unito","{""coordinates"": [-0.156735, 51.522586], ""type"": ""Point""}","Baker Street, Marylebone Road, Marylebone, Londra, Greater London, Inghilterra, NW1 5LD, Regno Unito",railway,station
96,King's Cross,King's Cross,"[""*...Il binario 9 ¾, citato nel primo libro della saga, si troverebbe nella stazione ferroviaria di King's Cross, dove si può oggi notare tale scritta su uno degli archi tra i binari 9 e 10 della stazione...."", ""*...King's Cross ;..."", ""*...Future espansioni (per ora solo proposte) raggiungeranno grandi stazioni ferroviarie del centro, quali Charing Cross, Euston e King's Cross....""]","King's Cross, Argyle Street, King's Cross, Camden, Londra, Greater London, Inghilterra, WC1H 8ER, Regno Unito","{""coordinates"": [-0.122559, 51.528475], ""type"": ""Point""}","King's Cross, Argyle Street, King's Cross, Camden, Londra, Greater London, Inghilterra, WC1H 8ER, Regno Unito",tourism,hotel
97,Craven Road,Craven Road,"['*...Un altro celebre abitante immaginario di Londra è Dylan Dog, che la fantasia del suo creatore Tiziano Sclavi fa risiedere nella City fin dalla sua prima avventura, al 7 di Craven Road....', '*...Nonostante a Londra esistano ben due Craven Road, Sclavi ha dichiarato di non essersi ispirato a un indirizzo reale ma ha piuttosto inteso omaggiare il regista horror Wes Craven dando il suo nome alla Strada dove Dylan vive....', '*...I numerosi fan dell\'indagatore dell\'incubo però non si sono fatti scoraggiare e sono sempre numerosi coloro i quali tornano da Londra con una foto-ricordo accanto alla targa di una delle due ""vere"" Craven Road....']","Craven Road, Paddington, City of Westminster, Greater London, Inghilterra, W2 3BP, Regno Unito","{""coordinates"": [-0.176868, 51.514892], ""type"": ""Point""}","Craven Road, Paddington, City of Westminster, Greater London, Inghilterra, W2 3BP, Regno Unito",highway,primary
98,Royal Opera House,Royal Opera House,"[""...La Royal Opera House (spesso chiamata Covent Garden) che è sede de The Royal Opera e de The Royal Ballet, e il London Coliseum, dove si esibisce l'English National Opera, ENO...."", ""...Il Royal Ballet, l'English National Ballet si esibiscono presso la Royal Opera House, e la English National Opera è ospitata dal London Coliseum, nei pressi di Covent Garden....""]","Royal Opera House, Bow Street, St Clement Danes, Covent Garden, Islington, Londra, Greater London, Inghilterra, WC2E 9DD, Regno Unito","{""coordinates"": [-0.12255, 51.512913], ""type"": ""Point""}","Royal Opera House, Bow Street, St Clement Danes, Covent Garden, Islington, Londra, Greater London, Inghilterra, WC2E 9DD, Regno Unito",tourism,attraction
99,London Coliseum,London Coliseum,"[""...La Royal Opera House (spesso chiamata Covent Garden) che è sede de The Royal Opera e de The Royal Ballet, e il London Coliseum, dove si esibisce l'English National Opera, ENO...."", ""*...Il Royal Ballet, l'English National Ballet si esibiscono presso la Royal Opera House, e la English National Opera è ospitata dal London Coliseum, nei pressi di Covent Garden....""]","London Coliseum, St. Martin's Lane, Seven Dials, Covent Garden, Londra, Greater London, Inghilterra, WC2N 4ES, Regno Unito","{""coordinates"": [-0.126217, 51.509996], ""type"": ""Point""}","London Coliseum, St. Martin's Lane, Seven Dials, Covent Garden, Londra, Greater London, Inghilterra, WC2N 4ES, Regno Unito",amenity,theatre
100,Barbican Centre,Barbican Centre,"['...Il Royal National Theatre nel quartiere di South Bank è la sede della National Theatre Company, mentre il Barbican Centre è la sede londinese della Royal Shakespeare Company....']","Barbican Dental Centre, 16-18, Goswell Road, Barbican, London Borough of Islington, City of London, Greater London, Inghilterra, EC1M 7AA, Regno Unito","{""coordinates"": [-0.097429, 51.522428], ""type"": ""Point""}","Barbican Dental Centre, 16-18, Goswell Road, Barbican, London Borough of Islington, City of London, Greater London, Inghilterra, EC1M 7AA, Regno Unito",amenity,dentist
101,Theatre Royal Drury Lane,Theatre Royal Drury Lane,"[""...Fra i teatri più antichi della città vi sono il Theatre Royal Drury Lane, nel West End, che è il più antico, il Theatre Royal Haymarket e il suo rivale Her Majesty's Theatre....""]","Theatre Royal, Drury Lane, 57, Catherine Street, St Clement Danes, Covent Garden, Londra, Greater London, Inghilterra, WC2B 5JF, Regno Unito","{""coordinates"": [-0.12023, 51.512994], ""type"": ""Point""}","Theatre Royal, Drury Lane, 57, Catherine Street, St Clement Danes, Covent Garden, Londra, Greater London, Inghilterra, WC2B 5JF, Regno Unito",amenity,theatre
102,Theatre Royal Haymarket,Theatre Royal Haymarket,"[""...Fra i teatri più antichi della città vi sono il Theatre Royal Drury Lane, nel West End, che è il più antico, il Theatre Royal Haymarket e il suo rivale Her Majesty's Theatre....""]","Theatre Royal Haymarket, Suffolk Street, St. James's, Covent Garden, City of Westminster, Greater London, Inghilterra, SW1Y 4HG, Regno Unito","{""coordinates"": [-0.131203, 51.508663], ""type"": ""Point""}","Theatre Royal Haymarket, Suffolk Street, St. James's, Covent Garden, City of Westminster, Greater London, Inghilterra, SW1Y 4HG, Regno Unito",amenity,theatre
103,Royal Festival Hall,Royal Festival Hall,"['*...Al Royal Festival Hall ha sede la London Philharmonic Orchestra, al Barbican Arts Centre ha la base principale la London Symphony Orchestra, a Cadogan Hall la Royal Philharmonic Orchestra, a Royal Albert Hall si tengono i celebri The Proms, in cui ha un ruolo importante la BBC Symphony Orchestra....']","Wagamama, Riverside Level, Festival Terrace, South Bank, Waterloo, London Borough of Lambeth, Londra, Greater London, Inghilterra, SE1 8XX, Regno Unito","{""coordinates"": [-0.117683, 51.505705], ""type"": ""Point""}","Wagamama, Riverside Level, Festival Terrace, South Bank, Waterloo, London Borough of Lambeth, Londra, Greater London, Inghilterra, SE1 8XX, Regno Unito",amenity,restaurant
105,Cadogan Hall,Cadogan Hall,"['*...Al Royal Festival Hall ha sede la London Philharmonic Orchestra, al Barbican Arts Centre ha la base principale la London Symphony Orchestra, a Cadogan Hall la Royal Philharmonic Orchestra, a Royal Albert Hall si tengono i celebri The Proms, in cui ha un ruolo importante la BBC Symphony Orchestra....']","Cadogan Hall, 5, Sloane Terrace, Hans Town, Chelsea, Kensington e Chelsea, Londra, Greater London, Inghilterra, SW1X 9DQ, Regno Unito","{""coordinates"": [-0.157202, 51.493775], ""type"": ""Point""}","Cadogan Hall, 5, Sloane Terrace, Hans Town, Chelsea, Kensington e Chelsea, Londra, Greater London, Inghilterra, SW1X 9DQ, Regno Unito",amenity,theatre
106,Royal Albert Hall,Royal Albert Hall,"['*...Al Royal Festival Hall ha sede la London Philharmonic Orchestra, al Barbican Arts Centre ha la base principale la London Symphony Orchestra, a Cadogan Hall la Royal Philharmonic Orchestra, a Royal Albert Hall si tengono i celebri The Proms, in cui ha un ruolo importante la BBC Symphony Orchestra....', ""...L'organo a canne più grande del Regno Unito è conservato presso la Royal Albert Hall....""]","Royal Albert Hall, Kensington Gore, Knightsbridge, Londra, Greater London, Inghilterra, SW7 2AN, Regno Unito","{""coordinates"": [-0.176398, 51.501631], ""type"": ""Point""}","Royal Albert Hall, Kensington Gore, Knightsbridge, Londra, Greater London, Inghilterra, SW7 2AN, Regno Unito",highway,bus_stop
108,Earls Court,Earls Court,"[""*...Londra ha numerose sedi per i concerti rock e pop, tra cui grandi arene, come Earls Court, Wembley Arena e l'O2 Arena, così come molte medie imprese locali, come la Brixton Academy e l'Hammersmith Apollo....""]","Savills Earls Court, 237, Earl's Court Road, The Boltons, Earl's Court, Kensington e Chelsea, Londra, Greater London, Inghilterra, SW5 9AH, Regno Unito","{""coordinates"": [-0.190128, 51.489746], ""type"": ""Point""}","Savills Earls Court, 237, Earl's Court Road, The Boltons, Earl's Court, Kensington e Chelsea, Londra, Greater London, Inghilterra, SW5 9AH, Regno Unito",office,estate_agent
109,Wembley Arena,Wembley Arena,"[""*...Londra ha numerose sedi per i concerti rock e pop, tra cui grandi arene, come Earls Court, Wembley Arena e l'O2 Arena, così come molte medie imprese locali, come la Brixton Academy e l'Hammersmith Apollo....""]","Wembley Arena, Empire Way, London Borough of Brent, Londra, Greater London, Inghilterra, HA9 0FZ, Regno Unito","{""coordinates"": [-0.284613, 51.559406], ""type"": ""Point""}","Wembley Arena, Empire Way, London Borough of Brent, Londra, Greater London, Inghilterra, HA9 0FZ, Regno Unito",highway,bus_stop
110,O2 Arena,O2 Arena,"[""...Londra ha numerose sedi per i concerti rock e pop, tra cui grandi arene, come Earls Court, Wembley Arena e l'O2 Arena, così come molte medie imprese locali, come la Brixton Academy e l'Hammersmith Apollo...."", '...Uno dei maggiori palazzi dello sport è The O2 Arena, con 20\xa0000 posti a sedere....']","The O2, Up at The O2, Greenwich Peninsula, Royal Borough of Greenwich, Londra, Greater London, Inghilterra, SE10 0DX, Regno Unito","{""coordinates"": [0.003203, 51.502937], ""type"": ""Point""}","The O2, Up at The O2, Greenwich Peninsula, Royal Borough of Greenwich, Londra, Greater London, Inghilterra, SE10 0DX, Regno Unito",leisure,stadium
111,Hard Rock Cafe,Hard Rock Cafe,"['*...Londra è sede del primo Hard Rock Cafe e degli Abbey Road Studios dove i Beatles rivoluzionarono la musica negli anni 1960 concentrando, insieme ai The Rolling Stones la sperimentazione della musica moderna proprio a Londra ed aprendo la Strada alle future band inglesi negli anni settanta e ottanta, musicisti e gruppi come Elton John, David Bowie, Pink Floyd, Genesis, Queen, Duran Duran Elvis Costello, Cat Stevens, The Kinks, The Who, Madness, The Jam, The Small Faces, Led Zeppelin, Iron Maiden, The Police, The Cure, Squeeze e Sade hanno iniziato la loro attività a Londra....']","Hard Rock Cafe, 150, Old Park Lane, Mayfair, Londra, Greater London, Inghilterra, W1K 1QZ, Regno Unito","{""coordinates"": [-0.149046, 51.503872], ""type"": ""Point""}","Hard Rock Cafe, 150, Old Park Lane, Mayfair, Londra, Greater London, Inghilterra, W1K 1QZ, Regno Unito",amenity,restaurant
112,Abbey Road Studios,Abbey Road Studios,"['...Londra è sede del primo Hard Rock Cafe e degli Abbey Road Studios dove i Beatles rivoluzionarono la musica negli anni 1960 concentrando, insieme ai The Rolling Stones la sperimentazione della musica moderna proprio a Londra ed aprendo la Strada alle future band inglesi negli anni settanta e ottanta, musicisti e gruppi come Elton John, David Bowie, Pink Floyd, Genesis, Queen, Duran Duran Elvis Costello, Cat Stevens, The Kinks, The Who, Madness, The Jam, The Small Faces, Led Zeppelin, Iron Maiden, The Police, The Cure, Squeeze e Sade hanno iniziato la loro attività a Londra....']","Abbey Road Studios, 3, Abbey Road, St. John's Wood, Londra, Greater London, Inghilterra, NW8 9AY, Regno Unito","{""coordinates"": [-0.178226, 51.531988], ""type"": ""Point""}","Abbey Road Studios, 3, Abbey Road, St. John's Wood, Londra, Greater London, Inghilterra, NW8 9AY, Regno Unito",tourism,attraction
113,Brick Lane,Brick Lane,"['*...Centri gastronomici sono i ristoranti del Bangladesh di Brick Lane e di cucina cinese nei ristoranti di Chinatown....', ""*...Vi si trovano vari luoghi d'interesse turistico, come i mercati (ad esempio il Columbia Road Flower Market e quelli a Spitalfields, Brick Lane, Petticoat Lane) e diversi musei....""]","Brick Lane, Spitalfields, Whitechapel, London Borough of Tower Hamlets, Londra, Greater London, Inghilterra, E1 6RH, Regno Unito","{""coordinates"": [-0.071311, 51.518271], ""type"": ""Point""}","Brick Lane, Spitalfields, Whitechapel, London Borough of Tower Hamlets, Londra, Greater London, Inghilterra, E1 6RH, Regno Unito",highway,secondary
114,Square Mile,Square Mile,"['*...La City of London (conosciuta semplicemente come City o Square Mile) è il principale centro bancario del mondo e il principale centro di affari europeo....', ""*...Central London\nLa City, detta anche Square Mile (Miglio Quadrato), è il principale distretto finanziario del Regno Unito, d'Europa ed uno dei principali del mondo....""]","Square Mile Coffee Roasters, Blackhorse Lane, Higham Hill, Walthamstow, Londra, Greater London, Inghilterra, E17 5QJ, Regno Unito","{""coordinates"": [-0.042634, 51.591163], ""type"": ""Point""}","Square Mile Coffee Roasters, Blackhorse Lane, Higham Hill, Walthamstow, Londra, Greater London, Inghilterra, E17 5QJ, Regno Unito",man_made,works
115,Kensington and Chelsea,Kensington and Chelsea,"['*...La City of Westminster con la Westminster Abbey, il palazzo reale di Buckingham Palace, Clarence House e altro, Kensington and Chelsea, con i suoi musei (lo Science Museum, il Natural History Museum, il Victoria and Albert Museum) e Hyde Park....']","South Kensington and Chelsea Mental Health Centre, 1, Nightingale Place, Lot's Village, World's End, Kensington e Chelsea, Londra, Greater London, Inghilterra, SW10 0JF, Regno Unito","{""coordinates"": [-0.180297, 51.484354], ""type"": ""Point""}","South Kensington and Chelsea Mental Health Centre, 1, Nightingale Place, Lot's Village, World's End, Kensington e Chelsea, Londra, Greater London, Inghilterra, SW10 0JF, Regno Unito",building,hospital
119,West Tower,West Tower,"['...Una volta dominata dalla cattedrale di San Paolo, negli ultimi decenni la City ha visto la costruzione di diversi grattacieli, tra i quali Tower 42 (fino al 1990 il più alto edificio britannico, in passato ed ancora oggi colloquialmente conosciuto come Nat West Tower) ed il recente 30 St Mary Axe, indicato anche come ""Il Cetriolo"" (da The Guardian:...']","West Tower, Goodwin Street, City North, Finsbury Park, London Borough of Islington, Londra, Greater London, Inghilterra, N4 3HQ, Regno Unito","{""coordinates"": [-0.10756, 51.564172], ""type"": ""Point""}","West Tower, Goodwin Street, City North, Finsbury Park, London Borough of Islington, Londra, Greater London, Inghilterra, N4 3HQ, Regno Unito",building,yes
121,East London,East London,"['...Alcune Università erano già considerate dei politecnici fino al 1992 quando, grazie ad un emendamento, hanno ricevuto lo statuto di Università (come la University of East London)....', '*...La maggior parte di questi si trova a East London, il più famoso è lo stabilimento di News International a Wapping....', ""*...Negli ultimi anni, l'eccessiva congestione della City ha fatto emergere come distretto finanziario alternativo la zona di Canary Wharf, nella parte Est di Londra (East London)...."", '*...East London \nA East London si sono scritti molti capitoli della storia industriale cittadina....', '*...Per la seconda volta nella storia moderna, East London è stata al centro di un vasto programma urbanistico....']","East London Mosque, 82-92, Whitechapel Road, St. George in the East, Whitechapel, London Borough of Tower Hamlets, Londra, Greater London, Inghilterra, E1 1JQ, Regno Unito","{""coordinates"": [-0.065362, 51.517398], ""type"": ""Point""}","East London Mosque, 82-92, Whitechapel Road, St. George in the East, Whitechapel, London Borough of Tower Hamlets, Londra, Greater London, Inghilterra, E1 1JQ, Regno Unito",amenity,place_of_worship
124,Oxford Circus,Oxford Circus,"[""*...Oxford Street si interseca a Oxford Circus con un'altra celebre via londinese, Regent Street, dove è presente il famoso negozio di giocattoli Hamleys....""]","Oxford Circus, Argyll Street, Soho, City of Westminster, Greater London, Inghilterra, W1F 7TN, Regno Unito","{""coordinates"": [-0.141012, 51.515181], ""type"": ""Point""}","Oxford Circus, Argyll Street, Soho, City of Westminster, Greater London, Inghilterra, W1F 7TN, Regno Unito",railway,station
125,Tottenham Court Road,Tottenham Court Road,"['*...Più avanti invece Oxford Street si interseca con Tottenham Court Road, questa via è il centro principale dei grandi magazzini....']","Tottenham Court Road, Charing Cross Road, St Giles, Bloomsbury, Camden, Londra, Greater London, Inghilterra, WC2H 0LA, Regno Unito","{""coordinates"": [-0.130242, 51.51565], ""type"": ""Point""}","Tottenham Court Road, Charing Cross Road, St Giles, Bloomsbury, Camden, Londra, Greater London, Inghilterra, WC2H 0LA, Regno Unito",railway,stop
126,Hyde Park Corner,Hyde Park Corner,"[""*...Piccadilly è un'importante ed elegante arteria del cuore che congiunge Piccadilly Circus a est con Hyde Park Corner a ovest...."", '*...Un altro importante monumento è il Marble Arch un arco trionfale situato nei pressi di Hyde Park e vicino ad Oxford Street, costruito interamente con marmo di Carrara....', ""*...Dai nove Parchi Reali, antiche riserve di caccia aperte al pubblico (Green Park, St James's Park, Hyde Park e Kensington Gardens nel West End, Regent's Park a nord del centro della città, Greenwich Park, Bushy Park, Richmond Park in periferia) e Brompton Cemetery ai molti giardini del centro costruiti ad uso dei residenti ed oggi spesso aperti a tutti...."", '*...La City of Westminster con la Westminster Abbey, il palazzo reale di Buckingham Palace, Clarence House e altro, Kensington and Chelsea, con i suoi musei (lo Science Museum, il Natural History Museum, il Victoria and Albert Museum) e Hyde Park....']","Hyde Park Corner, Piccadilly, Mayfair, Londra, Greater London, Inghilterra, W1J 7BJ, Regno Unito","{""coordinates"": [-0.14766, 51.504167], ""type"": ""Point""}","Hyde Park Corner, Piccadilly, Mayfair, Londra, Greater London, Inghilterra, W1J 7BJ, Regno Unito",highway,motorway_junction
127,Bond Street,Bond Street,['*...Regent Street e Bond Street sono altre vie molto importanti....'],"Bond Street, Davies Street, East Marylebone, Mayfair, Londra, Greater London, Inghilterra, W1K 5LP, Regno Unito","{""coordinates"": [-0.148429, 51.513438], ""type"": ""Point""}","Bond Street, Davies Street, East Marylebone, Mayfair, Londra, Greater London, Inghilterra, W1K 5LP, Regno Unito",railway,station
128,"West London
West London","West London
West London","['*...West London\nWest London è conosciuta per alcuni suoi eleganti quartieri residenziali, fra tutti Notting Hill....']","West London Synagogue of British Jews, 33, Seymour Place, Marylebone, Londra, Greater London, Inghilterra, W1H 5AU, Regno Unito","{""coordinates"": [-0.161933, 51.515507], ""type"": ""Point""}","West London Synagogue of British Jews, 33, Seymour Place, Marylebone, Londra, Greater London, Inghilterra, W1H 5AU, Regno Unito",amenity,place_of_worship
130,Portobello Road,Portobello Road,"[""*...Fanno parte del distretto pure il Mercato dell'antiquariato a Portobello Road e King's Road, un'elegante via commerciale...."", ""*...Oltre al già citato Covent Garden, altri mercati importanti all'aperto si trovano presso Petticoat Lane Market e Portobello Road....""]","Portobello Road, Notting Hill, Kensington e Chelsea, Londra, Greater London, Inghilterra, W11 2QD, Regno Unito","{""coordinates"": [-0.200595, 51.512073], ""type"": ""Point""}","Portobello Road, Notting Hill, Kensington e Chelsea, Londra, Greater London, Inghilterra, W11 2QD, Regno Unito",highway,residential
131,King's Road,King's Road,"[""*...Fanno parte del distretto pure il Mercato dell'antiquariato a Portobello Road e King's Road, un'elegante via commerciale....""]","King's Road, Lot's Village, World's End, Kensington e Chelsea, Londra, Greater London, Inghilterra, SW10 0LJ, Regno Unito","{""coordinates"": [-0.177035, 51.483375], ""type"": ""Point""}","King's Road, Lot's Village, World's End, Kensington e Chelsea, Londra, Greater London, Inghilterra, SW10 0LJ, Regno Unito",highway,primary
132,Twickenham Stadium,Twickenham Stadium,"['...In questo angolo di Londra si trovano il Parco più grande della città, Richmond Park, e la sede della nazionale inglese di rugby, il Twickenham Stadium....', '...Il Twickenham Stadium a sud-ovest di Londra ospita la nazionale di rugby a 15 e quella di rugby a 13, ma questa non sempre, e ha una capienza di 84\xa0000 posti, ora che è stato ampliato....', '*...Comprende i due attraenti quartieri di Richmond e Twickenham....', '*...Lo stadio di Twickenham ospita annualmente, tra la fine di gennaio e il mese di marzo, incontri della nazionale inglese del torneo Sei Nazioni e, nel novembre 2011, ha ospitato il ""4 Nazioni"", un torneo di rugby al quale hanno partecipato, oltre l\'Inghilterra, anche l\'Australia, la Nuova Zelanda e il Galles....']","Twickenham Stadium, Whitton Road, Twickenham, Richmond upon Thames, Londra, Greater London, Inghilterra, TW2 7QU, Regno Unito","{""coordinates"": [-0.339492, 51.454898], ""type"": ""Point""}","Twickenham Stadium, Whitton Road, Twickenham, Richmond upon Thames, Londra, Greater London, Inghilterra, TW2 7QU, Regno Unito",highway,bus_stop
133,East End,East End,"['*...Il quartiere di East End, nei dintorni di Spitalfields, è stato il quartiere di ""approdo"" di differenti gruppi etnici, che da questo distretto si sono poi mossi altrove all\'interno della città in cerca di prosperità....', ""...L'East End è prossimo al vecchio porto di Londra e per questa ragione è stato tradizionalmente il luogo in cui gli immigrati, arrivati via mare, trovavano la loro prima residenza londinese...."", ""...L'East End parte dal lato orientale della City, e comprende zone come Whitechapel, Mile End, Bethnal Green, Hackney, Bow e Poplar....""]","East End Road, Finchley, London Borough of Barnet, Londra, Greater London, Inghilterra, N2 8AB, Regno Unito","{""coordinates"": [-0.164143, 51.589467], ""type"": ""Point""}","East End Road, Finchley, London Borough of Barnet, Londra, Greater London, Inghilterra, N2 8AB, Regno Unito",highway,primary
134,Isle of Dogs,Isle of Dogs,"[""*...Docklands\nI docks di Londra, detti Docklands, sull'Isle of Dogs, si sono sviluppati enormemente a partire dai primi anni ottanta....""]","Royal Mail Poplar and Isle of Dogs Delivery Office, Burdett Road, Bow Common, Limehouse, London Borough of Tower Hamlets, Londra, Greater London, Inghilterra, E14 7AE, Regno Unito","{""coordinates"": [-0.028274, 51.513107], ""type"": ""Point""}","Royal Mail Poplar and Isle of Dogs Delivery Office, Burdett Road, Bow Common, Limehouse, London Borough of Tower Hamlets, Londra, Greater London, Inghilterra, E14 7AE, Regno Unito",amenity,post_depot
136,ExCeL Exhibition Centre,ExCeL Exhibition Centre,"[""...Un poco più a est, nel distretto di Newham, sorgono l'Aeroporto di Londra-City e l'ExCeL Exhibition Centre....""]","ExCel Exhibition Centre, West Terrace, Custom House, Silvertown, London Borough of Newham, Londra, Greater London, Inghilterra, E16 1XL, Regno Unito","{""coordinates"": [0.026142, 51.508012], ""type"": ""Point""}","ExCel Exhibition Centre, West Terrace, Custom House, Silvertown, London Borough of Newham, Londra, Greater London, Inghilterra, E16 1XL, Regno Unito",highway,bus_stop
