,entity,to_search,snippet,address,coordinates,name_location,class,type
0,Serdica,Serdica,"[""*...Affonda le sue radici all'epoca dei Traci, che la chiamarono Serdica...."", '*...La Chiesa di San Giorgio (in bulgaro: Ротонда „Свети Георги""?, traslitterato: Rotonda ""Sveti Georgi"") è una Chiesa a pianta circolare di epoca paleocristiana. Costruita in laterizio rosso, è considerata il più antico edificio della capitale bulgara. Fu costruita nel IV secolo e venne decorata con affreschi nel X secolo e poi ancora nel XII secolo. Durante il periodo ottomano fu convertita in moschea. Oggi è un Museo, e si trova circondata dai resti dell\'antica Serdica e da un albergo. Degli affreschi di 22 profeti, risalenti al XII-XIV secolo, ricoprono la cupola....']","Антична Сердика, пл. Независимост, Оборище, Sofia, Столична, София-град, 1000, Bulgaria","{""coordinates"": [23.322257, 42.69809], ""type"": ""Point""}","Антична Сердика, пл. Независимост, Оборище, Sofia, Столична, София-град, 1000, Bulgaria",railway,subway_entrance
4,Bojana,Bojana,"[""*...Tra le principali attrazioni troviamo la Chiesa di Bojana (inserita tra i Patrimoni dell'Umanità dell'UNESCO nel 1979), la Chiesa di San Giorgio, la Chiesa di Santa Sofia e la cattedrale di Aleksandăr Nevski...."", ""...La Chiesa di Bojana, situata nel quartiere omonimo a sud del centro, è dal 1979 patrimonio dell'umanità....""]","Национален исторически музей, 16, Витошко лале, ж.к. Манастирски ливади - запад, Sofia, Столична, София-град, 1618, Bulgaria","{""coordinates"": [23.270931, 42.655024], ""type"": ""Point""}","Национален исторически музей, 16, Витошко лале, ж.к. Манастирски ливади - запад, Sofia, Столична, София-град, 1618, Bulgaria",tourism,museum
11,Vladajski,Vladajski,"['*...Cinque passi montani portano alla città, il Vladajski, il Dragomanski, il Petrohanski, il Botevgradski e Vitinya....']","Владайски манастир, 1;6, м. Св. Петка, Владая, Витоша, Столична, София-град, 1641, Bulgaria","{""coordinates"": [23.186299, 42.624836], ""type"": ""Point""}","Владайски манастир, 1;6, м. Св. Петка, Владая, Витоша, Столична, София-град, 1641, Bulgaria",amenity,place_of_worship
16,Iskăr,Iskăr,"['*...Attraverso i quartieri orientali scorre il fiume Iskăr, ma in questo suo tratto non ha ancora una grande portata....', '*...Iskăr (Искър) (Busmanci)\n10. Kremikovci (Кремиковци) (Buhovo, Željava, Jana, Gorni Borgov, Dolni Borgov)\n16....']","Искър, Оборище, Sofia, Столична, София-град, 1377, Bulgaria","{""coordinates"": [23.324458, 42.699649], ""type"": ""Point""}","Искър, Оборище, Sofia, Столична, София-град, 1377, Bulgaria",highway,residential
26,Rotonda,Rotonda,"['*...La Chiesa di San Giorgio (in bulgaro: Ротонда „Свети Георги""?, traslitterato: Rotonda ""Sveti Georgi"") è una Chiesa a pianta circolare di epoca paleocristiana. Costruita in laterizio rosso, è considerata il più antico edificio della capitale bulgara. Fu costruita nel IV secolo e venne decorata con affreschi nel X secolo e poi ancora nel XII secolo. Durante il periodo ottomano fu convertita in moschea. Oggi è un Museo, e si trova circondata dai resti dell\'antica Serdica e da un albergo. Degli affreschi di 22 profeti, risalenti al XII-XIV secolo, ricoprono la cupola....']","Ротонда, пл. Света Неделя, Център, Средец, Sofia, Столична, София-град, 1301, Bulgaria","{""coordinates"": [23.322755, 42.696668], ""type"": ""Point""}","Ротонда, пл. Света Неделя, Център, Средец, Sofia, Столична, София-град, 1301, Bulgaria",amenity,cafe
27,Sveti Georgi,Sveti Georgi,"['*...La Chiesa di San Giorgio (in bulgaro: Ротонда „Свети Георги""?, traslitterato: Rotonda ""Sveti Georgi"") è una Chiesa a pianta circolare di epoca paleocristiana. Costruita in laterizio rosso, è considerata il più antico edificio della capitale bulgara. Fu costruita nel IV secolo e venne decorata con affreschi nel X secolo e poi ancora nel XII secolo. Durante il periodo ottomano fu convertita in moschea. Oggi è un Museo, e si trova circondata dai resti dell\'antica Serdica e da un albergo. Degli affreschi di 22 profeti, risalenti al XII-XIV secolo, ricoprono la cupola....']","Свети Георги, Искърско дефиле, в.з. Ласка, Владо Тричков, Своге, Софийска, 2299, Bulgaria","{""coordinates"": [23.357723, 42.859006], ""type"": ""Point""}","Свети Георги, Искърско дефиле, в.з. Ласка, Владо Тричков, Своге, Софийска, 2299, Bulgaria",amenity,restaurant
29,Banja Baši,Banja Baši,"['*...La moschea Banja Baši, costruita dal celebre architetto ottomano Sinān nel XVI secolo, è la principale testimonianza della dominazione turca sulla città....']","Баня баши джамия, бул. Княгиня Мария Луиза, Оборище, Sofia, Столична, София-град, 1000, Bulgaria","{""coordinates"": [23.322572, 42.6995], ""type"": ""Point""}","Баня баши джамия, бул. Княгиня Мария Луиза, Оборище, Sofia, Столична, София-град, 1000, Bulgaria",amenity,place_of_worship
35,Largo,Largo,"['*...La Presidenza della Repubblica, così come il Consiglio dei Ministri, è situata in piazza Indipendenza, popolarmente conosciuto come Largo o il Triangolo del Potere....']","Ларгото, Оборище, Sofia, Столична, София-град, Bulgaria","{""coordinates"": [23.322918, 42.697786], ""type"": ""Point""}","Ларгото, Оборище, Sofia, Столична, София-град, Bulgaria",highway,pedestrian
37,Bălgarska,Bălgarska,"[""*...Ci sono inoltre altre istituzioni nazionali (l'Istituto statistico nazionale, l'amministrazione centrale della viabilità e altre), varie istituzioni economiche (Българска стопанска камара, Bălgarska stopanska kamara, la Camera dell'Economia Bulgara) ed altri organi, il cui compito principale è l'attuazione del processo di riforma del Paese (Agenzia per la privatizzazione, Agenzia per la privatizzazione di massa, Agenzia per gli investimenti stranieri)....""]","Първа българска армия, НПЗ Хаджи Димитър, кв. Орландовци, Сердика, Sofia, Столична, София-град, 1510, Bulgaria","{""coordinates"": [23.346236, 42.711327], ""type"": ""Point""}","Първа българска армия, НПЗ Хаджи Димитър, кв. Орландовци, Сердика, Sofia, Столична, София-град, 1510, Bulgaria",highway,tertiary
41,Възраждане,Възраждане,['*...Văzraždane (Възраждане)\n5....'],"Възраждане, кв. Кремиковци, район Кремиковци, Столична, София-град, 1849, Bulgaria","{""coordinates"": [23.493854, 42.777602], ""type"": ""Point""}","Възраждане, кв. Кремиковци, район Кремиковци, Столична, София-град, 1849, Bulgaria",highway,residential
42,Izgrev,Izgrev,['*...Izgrev (Изгрев)\n6....'],"ж.к. Изгрев, бул. Драган Цанков, ж.к. Изгрев, Изгрев, Sofia, Столична, София-град, 1113, Bulgaria","{""coordinates"": [23.350934, 42.671288], ""type"": ""Point""}","ж.к. Изгрев, бул. Драган Цанков, ж.к. Изгрев, Изгрев, Sofia, Столична, София-град, 1113, Bulgaria",railway,subway_entrance
43,Изгрев,Изгрев,['*...Izgrev (Изгрев)\n6....'],"ж.к. Изгрев, бул. Драган Цанков, ж.к. Изгрев, Изгрев, Sofia, Столична, София-град, 1113, Bulgaria","{""coordinates"": [23.350934, 42.671288], ""type"": ""Point""}","ж.к. Изгрев, бул. Драган Цанков, ж.к. Изгрев, Изгрев, Sofia, Столична, София-град, 1113, Bulgaria",railway,subway_entrance
44,Ilinden,Ilinden,['*...Ilinden (Илинден)\n8....'],"Илинден, ж.к. Красна поляна 1, Красна поляна, Sofia, Столична, София-град, 1330, Bulgaria","{""coordinates"": [23.283669, 42.698652], ""type"": ""Point""}","Илинден, ж.к. Красна поляна 1, Красна поляна, Sofia, Столична, София-град, 1330, Bulgaria",highway,residential
45,Илинден,Илинден,['*...Ilinden (Илинден)\n8....'],"Илинден, ж.к. Красна поляна 1, Красна поляна, Sofia, Столична, София-град, 1330, Bulgaria","{""coordinates"": [23.283669, 42.698652], ""type"": ""Point""}","Илинден, ж.к. Красна поляна 1, Красна поляна, Sofia, Столична, София-град, 1330, Bulgaria",highway,residential
47,Красна Поляна,Красна Поляна,['*...Krasna Poljana (Красна Поляна)...'],"ТД на НАП София - офис Красна Поляна, 1А, бул. Възкресение, ж.к. Разсадник Коньовица, Красна поляна, Sofia, Столична, София-град, 1330, Bulgaria","{""coordinates"": [23.292743, 42.693429], ""type"": ""Point""}","ТД на НАП София - офис Красна Поляна, 1А, бул. Възкресение, ж.к. Разсадник Коньовица, Красна поляна, Sofia, Столична, София-град, 1330, Bulgaria",office,government
48,Krasno Selo,Krasno Selo,['*...Krasno Selo (Красно Село)\n11. Losenec (Лозенец)\n12....'],"ж.к. Красно село, бул. Гоце Делчев, ж.к. Красно село, Красно село, Sofia, Столична, София-град, 1620, Bulgaria","{""coordinates"": [23.28522, 42.678262], ""type"": ""Point""}","ж.к. Красно село, бул. Гоце Делчев, ж.к. Красно село, Красно село, Sofia, Столична, София-град, 1620, Bulgaria",railway,subway_entrance
49,Красно Село,Красно Село,['*...Krasno Selo (Красно Село)\n11. Losenec (Лозенец)\n12....'],"ж.к. Красно село, бул. Гоце Делчев, ж.к. Красно село, Красно село, Sofia, Столична, София-град, 1620, Bulgaria","{""coordinates"": [23.28522, 42.678262], ""type"": ""Point""}","ж.к. Красно село, бул. Гоце Делчев, ж.к. Красно село, Красно село, Sofia, Столична, София-град, 1620, Bulgaria",railway,subway_entrance
51,Лозенец,Лозенец,['*...Krasno Selo (Красно Село)\n11. Losenec (Лозенец)\n12....'],"Лозенец, ж.к. Лозенец, Лозенец, Sofia, Столична, София-град, 1042, Bulgaria","{""coordinates"": [23.323577, 42.681012], ""type"": ""Point""}","Лозенец, ж.к. Лозенец, Лозенец, Sofia, Столична, София-град, 1042, Bulgaria",highway,residential
52,Младост,Младост,['*...Mladost (Младост)\n14....'],"Младост, Волуяк, Връбница, Столична, София-град, 1331, Bulgaria","{""coordinates"": [23.250091, 42.773458], ""type"": ""Point""}","Младост, Волуяк, Връбница, Столична, София-град, 1331, Bulgaria",highway,residential
53,Надежда,Надежда,['*...Nadežda (Надежда)\n17....'],"Надежда, ж.к. Разсадник Коньовица, Красна поляна, Sofia, Столична, София-град, 1309, Bulgaria","{""coordinates"": [23.293625, 42.70055], ""type"": ""Point""}","Надежда, ж.к. Разсадник Коньовица, Красна поляна, Sofia, Столична, София-град, 1309, Bulgaria",highway,residential
55,Оборище,Оборище,['*...Oborište (Оборище)\n19....'],"Оборище, Център, Средец, Sofia, Столична, София-град, 1169, Bulgaria","{""coordinates"": [23.330198, 42.696213], ""type"": ""Point""}","Оборище, Център, Средец, Sofia, Столична, София-град, 1169, Bulgaria",highway,residential
56,Подуяне,Подуяне,['*...Podujane (Подуяне)\n20. Serdika (Сердика)\n21....'],"Подуяне, бул. Генерал Данаил Николаев, ж.к. Хаджи Димитър, Подуяне, Sofia, Столична, София-град, 1505, Bulgaria","{""coordinates"": [23.354744, 42.697873], ""type"": ""Point""}","Подуяне, бул. Генерал Данаил Николаев, ж.к. Хаджи Димитър, Подуяне, Sofia, Столична, София-град, 1505, Bulgaria",railway,station
57,Сердика,Сердика,['*...Podujane (Подуяне)\n20. Serdika (Сердика)\n21....'],"Сердика, бул. Тодор Александров, ж.к. Зона Б-5-3, Възраждане, Sofia, Столична, София-град, 1000, Bulgaria","{""coordinates"": [23.321158, 42.69781], ""type"": ""Point""}","Сердика, бул. Тодор Александров, ж.к. Зона Б-5-3, Възраждане, Sofia, Столична, София-град, 1000, Bulgaria",railway,stop
58,Slatina,Slatina,['*...Slatina (Слатина)...'],"Слатина, Гео Милев, ж.к. Христо Смирненски, Слатина, Sofia, Столична, София-град, 1574, Bulgaria","{""coordinates"": [23.371326, 42.680948], ""type"": ""Point""}","Слатина, Гео Милев, ж.к. Христо Смирненски, Слатина, Sofia, Столична, София-град, 1574, Bulgaria",railway,stop
59,Слатина,Слатина,['*...Slatina (Слатина)...'],"Слатина, Гео Милев, ж.к. Христо Смирненски, Слатина, Sofia, Столична, София-град, 1574, Bulgaria","{""coordinates"": [23.371326, 42.680948], ""type"": ""Point""}","Слатина, Гео Милев, ж.к. Христо Смирненски, Слатина, Sofia, Столична, София-град, 1574, Bulgaria",railway,stop
60,Studentski,Studentski,['*...Studentski (Студентски)\n23....'],"Национален студентски дом, 10, пл. Народно събрание, Център, Средец, Sofia, Столична, София-град, 1000, Bulgaria","{""coordinates"": [23.331633, 42.693627], ""type"": ""Point""}","Национален студентски дом, 10, пл. Народно събрание, Център, Средец, Sofia, Столична, София-град, 1000, Bulgaria",amenity,community_centre
61,Студентски,Студентски,['*...Studentski (Студентски)\n23....'],"Национален студентски дом, 10, пл. Народно събрание, Център, Средец, Sofia, Столична, София-град, 1000, Bulgaria","{""coordinates"": [23.331633, 42.693627], ""type"": ""Point""}","Национален студентски дом, 10, пл. Народно събрание, Център, Средец, Sofia, Столична, София-град, 1000, Bulgaria",amenity,community_centre
62,Sredec,Sredec,['*...Sredec (Средец)\n24....'],"Средец, кв. Кумарица, Нови Искър, Столична, София-град, 1280, Bulgaria","{""coordinates"": [23.3386, 42.802337], ""type"": ""Point""}","Средец, кв. Кумарица, Нови Искър, Столична, София-град, 1280, Bulgaria",highway,residential
63,Средец,Средец,['*...Sredec (Средец)\n24....'],"Средец, кв. Кумарица, Нови Искър, Столична, София-град, 1280, Bulgaria","{""coordinates"": [23.3386, 42.802337], ""type"": ""Point""}","Средец, кв. Кумарица, Нови Искър, Столична, София-град, 1280, Bulgaria",highway,residential
64,Triadica,Triadica,['*...Triadica (Триадица)\nAltri 5 distretti includono anche frazioni separate dal tessuto urbano metropolitano:...'],"Триадица, Оборище, Sofia, Столична, София-град, 1377, Bulgaria","{""coordinates"": [23.323356, 42.698922], ""type"": ""Point""}","Триадица, Оборище, Sofia, Столична, София-град, 1377, Bulgaria",highway,residential
65,Триадица,Триадица,['*...Triadica (Триадица)\nAltri 5 distretti includono anche frazioni separate dal tessuto urbano metropolitano:...'],"Триадица, Оборище, Sofia, Столична, София-град, 1377, Bulgaria","{""coordinates"": [23.323356, 42.698922], ""type"": ""Point""}","Триадица, Оборище, Sofia, Столична, София-град, 1377, Bulgaria",highway,residential
66,Витоша,Витоша,"['*...2. Vitoša (Витоша) (Vladaja, Mărčaevo)\n3....']","Витоша, бул. Черни връх, кв. Хладилника, Триадица, Sofia, Столична, София-град, 1407, Bulgaria","{""coordinates"": [23.316268, 42.658178], ""type"": ""Point""}","Витоша, бул. Черни връх, кв. Хладилника, Триадица, Sofia, Столична, София-град, 1407, Bulgaria",railway,station
70,Mramor,Mramor,"['*...Vrăbnica (Връбница) (Volujak, Mramor)...']","Мрамор, ж.к. Триъгълника-Надежда, ж.к. Триъгълника - Надежда, Надежда, Sofia, Столична, София-град, 1220, Bulgaria","{""coordinates"": [23.302836, 42.722302], ""type"": ""Point""}","Мрамор, ж.к. Триъгълника-Надежда, ж.к. Триъгълника - Надежда, Надежда, Sofia, Столична, София-град, 1220, Bulgaria",highway,residential
71,Искър,Искър,"['*...Iskăr (Искър) (Busmanci)\n10. Kremikovci (Кремиковци) (Buhovo, Željava, Jana, Gorni Borgov, Dolni Borgov)\n16....']","Искър, Оборище, Sofia, Столична, София-град, 1377, Bulgaria","{""coordinates"": [23.324458, 42.699649], ""type"": ""Point""}","Искър, Оборище, Sofia, Столична, София-град, 1377, Bulgaria",highway,residential
72,Busmanci,Busmanci,"['*...Iskăr (Искър) (Busmanci)\n10. Kremikovci (Кремиковци) (Buhovo, Željava, Jana, Gorni Borgov, Dolni Borgov)\n16....']","кв. Бусманци, пл. Елин Пелин, кв. Абдовица, Бусманци, район Искър, Столична, София-град, 1520, Bulgaria","{""coordinates"": [23.433514, 42.675931], ""type"": ""Point""}","кв. Бусманци, пл. Елин Пелин, кв. Абдовица, Бусманци, район Искър, Столична, София-град, 1520, Bulgaria",highway,bus_stop
73,Malo Bučino,Malo Bučino,"['*...Ovča kupel (Овча купел) (Malo Bučino)\nTutti i distretti hanno un proprio sindaco (in bulgaro: кмет?, traslitterato:...']","Мало Бучино, Автомагистрала Струма, Овча Купел, Столична, София-град, 1362, Bulgaria","{""coordinates"": [23.187945, 42.692698], ""type"": ""Point""}","Мало Бучино, Автомагистрала Струма, Овча Купел, Столична, София-град, 1362, Bulgaria",highway,motorway_junction
