,entity,to_search,snippet,address,coordinates,name_location,class,type
2,Bronx,Bronx,"['...Manhattan, The Bronx, Queens, Brooklyn e Staten Island....', '*...Di essi, uno è nel continente (il Bronx, situato a nord di Manhattan), tre si trovano su isole:...', ""*...Queens e Brooklyn, rispettivamente nell'estremità nord-occidentale e sud-occidentale dell'isola di Long Island) e uno, Manhattan, sull'appendice inferiore della penisola su cui si trova anche il Bronx e che da esso è separato dall'Harlem River, fiume-canale che collega l'Hudson all'East River...."", '*...Le altre due contee (Bronx e Queens) sono omonime dei distretti e si sovrappongono al loro territorio amministrativo....', ""*...Sul finire del secolo, nel 1898, venne formata la moderna città di New York, tramite l'accorpamento (consolidation) di Manhattan con la città, fino ad allora indipendente, di Brooklyn e con alcune aree esterne come il Bronx, il Queens e Staten Island...."", ""*...La più settentrionale, il Bronx, sorge sul continente, all'estremità di una piccola penisola;..."", ""...In quartieri come Riverdale, The Bronx, Ditmas Park, Brooklyn, Douglaston, Queens, vi sono grandi case unifamiliari in vari stili architettonici come il Tudor revival e l'architettura vittoriana...."", ""*...Bronx (Contea del Bronx, 1\xa0397\xa0287 abitanti), è l'unico distretto a trovarsi quasi interamente sulla terraferma (fanno eccezione alcune isole minori). È delimitato a est dal Long Island Sound, a sud dall'East River e a ovest dall'estuario del fiume Hudson. Associato a immagini di povertà e violenza (che non corrispondono del tutto alla realtà dei fatti), è abitato per la maggior parte da immigrati dall'America latina e da loro discendenti, nonché da molti afro-americani. Non mancano, comunque, quartieri ad alto reddito, come Riverdale. Il Bronx è la culla della cultura hip hop e ospita lo stadio dei New York Yankees, lo Yankee Stadium...."", '*...Gli autobus indicati da una M vicino al numero, indicano che viaggia solo a Manhattan, B per Brooklyn, Q per Queens, Bx per Bronx e S per Staten Island....', '*...Il New York City FC gioca allo Yankee stadium, nel Bronx, e dunque è considerata la vera squadra di calcio della città, mentre i Red Bulls giocano le partite casalinghe alla Red Bull Arena, nei pressi di Harrison, New Jersey.....', '...Una Strada nel Bronx è stata rinominata Stickball Blvd, come tributo allo sport Strada più famoso di New York....']","Bronx Museum of the Arts, 1040, Grand Concourse, High Bridge, Bronx County, The Bronx, New York, 10456, Stati Uniti d'America","{""coordinates"": [-73.919947, 40.831091], ""type"": ""Point""}","Bronx Museum of the Arts, 1040, Grand Concourse, High Bridge, Bronx County, The Bronx, New York, 10456, Stati Uniti d'America",tourism,museum
3,Harlem River,Harlem River,"[""*...Queens e Brooklyn, rispettivamente nell'estremità nord-occidentale e sud-occidentale dell'isola di Long Island) e uno, Manhattan, sull'appendice inferiore della penisola su cui si trova anche il Bronx e che da esso è separato dall'Harlem River, fiume-canale che collega l'Hudson all'East River....""]","Harlem River Drive, Manhattan Community Board 11, Manhattan, New York County, New York, 10030, Stati Uniti d'America","{""coordinates"": [-73.93431, 40.807791], ""type"": ""Point""}","Harlem River Drive, Manhattan Community Board 11, Manhattan, New York County, New York, 10030, Stati Uniti d'America",highway,motorway
4,East River,East River,"[""*...Queens e Brooklyn, rispettivamente nell'estremità nord-occidentale e sud-occidentale dell'isola di Long Island) e uno, Manhattan, sull'appendice inferiore della penisola su cui si trova anche il Bronx e che da esso è separato dall'Harlem River, fiume-canale che collega l'Hudson all'East River...."", ""...Il Ponte di Brooklyn, che attraversando l'East River collega Manhattan e Brooklyn;..."", ""...Manhattan coincide con l'isola omonima, situata fra il corso dell'Hudson e lo East River (un piccolo braccio di mare);..."", ""*...Liberty Island, l'isola dove è collocata la Statua della Libertà; Governors Island, Rikers Island, situata nell'East River a nord di Manhattan e sede di un enorme complesso carcerario;..."", ""*...Roosevelt Island, una piccola isola allungata nell'East River...."", ""*...Bronx (Contea del Bronx, 1\xa0397\xa0287 abitanti), è l'unico distretto a trovarsi quasi interamente sulla terraferma (fanno eccezione alcune isole minori). È delimitato a est dal Long Island Sound, a sud dall'East River e a ovest dall'estuario del fiume Hudson. Associato a immagini di povertà e violenza (che non corrispondono del tutto alla realtà dei fatti), è abitato per la maggior parte da immigrati dall'America latina e da loro discendenti, nonché da molti afro-americani. Non mancano, comunque, quartieri ad alto reddito, come Riverdale. Il Bronx è la culla della cultura hip hop e ospita lo stadio dei New York Yankees, lo Yankee Stadium...."", ""*...New York infatti dispone di più di 680\xa0km di piste ciclabili, dislocate maggiormente nei ponti dell'East River e nella Manhattan Waterfront Greenway....""]","East River, 1364, York Avenue, Lenox Hill, Manhattan, New York County, New York, 10128, Stati Uniti d'America","{""coordinates"": [-73.953219, 40.767234], ""type"": ""Point""}","East River, 1364, York Avenue, Lenox Hill, Manhattan, New York County, New York, 10128, Stati Uniti d'America",shop,alcohol
6,Statua della Libertà,Statua della Libertà,"[""...Alcuni dei suoi simboli più famosi sono la Statua della Libertà, che si trova su Liberty Island, un'isola alla foce del fiume Hudson;..."", '...New York aveva assunto il ruolo di ""porta"" degli Stati Uniti, riconosciuto ufficialmente con la donazione, da parte della Francia, della Statua della Libertà (inaugurata nel 1886)....', ""...Liberty Island, l'isola dove è collocata la Statua della Libertà; Governors Island, Rikers Island, situata nell'East River a nord di Manhattan e sede di un enorme complesso carcerario;..."", ""...Altri celebri parchi, benché decisamente più piccoli sono Bryant Park che funge da Giardino di lettura della New York Public Library, Battery Park, da dove partono i traghetti per la Statua della Libertà, e Washington Square Park, celebre per l'arco di trionfo dedicato a George Washington e per i gruppi di artisti di Strada che si esibiscono all'interno:..."", ""...Non lontano da Liberty Island (l'isola che ospita la Statua della Libertà) vi è Ellis Island che è stato per anni il principale punto d'ingresso per gli immigranti che sbarcavano negli Stati Uniti...."", ""...Le principali destinazioni sono l'Empire State Building, la Statua della Libertà, Ellis Island, i teatri di Broadway, musei come il Metropolitan Museum of Art, spazi verdi come Central Park, il Rockefeller Center, Times Square, la Chinatown di Manhattan;..."", '*...Il sistema dei trasporti terrestri, è poi integrato da una serie di molto economici traghetti (ferries), che collegano soprattutto Manhattan verso ovest allo stato del New Jersey (attraversando il fiume Hudson) e verso sud a Staten Island (traghetto gratuito, in servizio 24 ore al giorno, che fornisce una buona vista della Statua della Libertà e di Ellis Island)....']","Statua della Libertà, Flagpole Plaza, Manhattan Community Board 1, Manhattan, New York County, New York, 10004, Stati Uniti d'America","{""coordinates"": [-74.044548, 40.689253], ""type"": ""Point""}","Statua della Libertà, Flagpole Plaza, Manhattan Community Board 1, Manhattan, New York County, New York, 10004, Stati Uniti d'America",tourism,attraction
8,Empire State Building,Empire State Building,"[""...L'Empire State Building, grattacielo in stile art déco di 443 metri di altezza, situato a Midtown Manhattan...."", ""...Lo stile Art déco del Chrysler Building (1930) e dell'Empire State Building (1931), con le loro cime e guglie coniche in acciaio, riflette i requisiti di tale regolamento...."", ""...Benché non sia il più grande della città, il Parco più conosciuto è sicuramente Central Park, diventato ormai un'icona della città al pari di Times Square o dell'Empire State Building, e spesso inquadrato nei numerosi telefilm ambientati a Manhattan...."", ""...Le principali destinazioni sono l'Empire State Building, la Statua della Libertà, Ellis Island, i teatri di Broadway, musei come il Metropolitan Museum of Art, spazi verdi come Central Park, il Rockefeller Center, Times Square, la Chinatown di Manhattan;...""]","Empire State Building, 350, 5th Avenue, Manhattan Community Board 5, Manhattan, New York County, New York, 10018, Stati Uniti d'America","{""coordinates"": [-73.985659, 40.748442], ""type"": ""Point""}","Empire State Building, 350, 5th Avenue, Manhattan Community Board 5, Manhattan, New York County, New York, 10018, Stati Uniti d'America",tourism,attraction
10,West side,West side,"[""*...In concomitanza all'occupazione militare britannica la città di New York fu colpita da un incendio, divampato il 20 settembre nel West side della città, incendio che distrusse tra il 10 e il 25% della città...."", ""...Il Fantasma dell'Opera, Les Miserables, Cats e West Side Story....""]","West Side, Town of Thurman, Warren County, New York, Stati Uniti d'America","{""coordinates"": [-73.876758, 43.568979], ""type"": ""Point""}","West Side, Town of Thurman, Warren County, New York, Stati Uniti d'America",highway,path
11,Federal Hall,Federal Hall,"[""...Subito dopo la sua creazione, prevista dalla Costituzione, il Congresso degli Stati Uniti d'America ebbe come sede la Federal Hall, in Wall Street....""]","Federal Hall National Memorial, Wall Street, Manhattan Community Board 1, Manhattan, New York County, New York, 10005, Stati Uniti d'America","{""coordinates"": [-74.010253, 40.707322], ""type"": ""Point""}","Federal Hall National Memorial, Wall Street, Manhattan Community Board 1, Manhattan, New York County, New York, 10005, Stati Uniti d'America",historic,building
13,Europa,Europa,"[""...Insieme a Ginevra (CICR e sede europea dell'ONU), Basilea (Banca dei Regolamenti Internazionali) e Strasburgo (Consiglio d'Europa), New York è una delle poche città al mondo che funge da sede di una delle più importanti organizzazioni internazionali (nel suo caso dell'ONU), senza essere la capitale di un paese...."", ""*...L'Immigrazione dall'Europa riprese vigore, dopo un certo calo nei primi anni del secolo, e raggiunse punte notevoli negli anni della grande carestia irlandese del 1845-1849...."", ""*...Fra le maggiori vi sono Ellis Island, l'isola in cui un tempo sbarcavano le navi piene di immigrati provenienti dall'Europa, e dove questi venivano tenuti in quarantena per un certo periodo prima di essere ammessi al resto degli Stati Uniti;...""]","Europa Cafe, 3, Times Square, Manhattan, New York County, New York, 10036, Stati Uniti d'America","{""coordinates"": [-73.986719, 40.756692], ""type"": ""Point""}","Europa Cafe, 3, Times Square, Manhattan, New York County, New York, 10036, Stati Uniti d'America",amenity,cafe
14,Tammany Hall,Tammany Hall,"[""*...L'assistenza fornita a queste grandi masse di immigrati poveri e bisognosi fu fra le cause dell'ascesa della Tammany Hall, un'organizzazione interna al Partito Democratico, che assunse in pratica il controllo sulla città verso la metà del secolo mantenendolo fino alla metà del secolo successivo....""]","Tammany Hall Road, Town of Patterson, Putnam County, New York, 10509, Stati Uniti d'America","{""coordinates"": [-73.633007, 41.449117], ""type"": ""Point""}","Tammany Hall Road, Town of Patterson, Putnam County, New York, 10509, Stati Uniti d'America",highway,residential
15,Woolworth Building,Woolworth Building,"['...Lo sviluppo della città veniva esibito anche attraverso la costruzione di numerosissimi grattacieli, la cui costruzione, iniziata nel 1911 con il Woolworth Building, proseguì nei decenni seguenti rendendo i grattacieli uno degli elementi caratteristici dello skyline di New York....', '...Al 2011, New York possedeva 5\xa0937 grattacieli, di cui 550 strutture completate di almeno 100 metri di altezza - secondo posto al mondo dopo Hong Kong - e più di 50 grattacieli completati più alti di 200\xa0m. Questi ultimi includono il Woolworth Building (1913), un grattacielo costruito in architettura neogotica....']","Woolworth Building, Broadway, Manhattan Community Board 1, Manhattan, New York County, New York, 10003, Stati Uniti d'America","{""coordinates"": [-74.008135, 40.712455], ""type"": ""Point""}","Woolworth Building, Broadway, Manhattan Community Board 1, Manhattan, New York County, New York, 10003, Stati Uniti d'America",tourism,attraction
17,Sandy,Sandy,"[""*...La sera del 29 ottobre 2012 New York fu colpita dall'uragano Sandy, che provocò inondazioni di strade, gallerie e numerose linee della metropolitana a Lower Manhattan e altre zone della città togliendo la fornitura di elettricità in molte sue parti e nei sobborghi...."", '*...Il 4 novembre 2012, a seguito della cancellazione dell\'edizione annuale della Maratona di New York 2012, circa 20\xa0000 maratoneti hanno ""invaso"" il Parco cittadino dando vita ad una corsa benefica, in favore degli abitanti di Staten Island colpiti dalla furia dell\'uragano Sandy....']","Sandy Hollow Road, East Northport, Town of Huntington, Suffolk County, New York, 11768, Stati Uniti d'America","{""coordinates"": [-73.352628, 40.885279], ""type"": ""Point""}","Sandy Hollow Road, East Northport, Town of Huntington, Suffolk County, New York, 11768, Stati Uniti d'America",highway,residential
20,Labrador,Labrador,"['*...È caratterizzato da inverni lunghi e freddi relativamente alla sua latitudine, con temperature medie (tra la minima e la massima) di 0\xa0°C o poco superiori e punte di -20\xa0°C, burrasche di neve e tempeste a causa della corrente del Labrador e della assenza di ripari che possano proteggere la regione dagli impetuosi venti settentrionali....']","Labrador Hollow Unique Area, Markham Hollow Road, Town of Fabius, Onondaga County, New York, 13159, Stati Uniti d'America","{""coordinates"": [-76.047444, 42.784688], ""type"": ""Point""}","Labrador Hollow Unique Area, Markham Hollow Road, Town of Fabius, Onondaga County, New York, 13159, Stati Uniti d'America",leisure,nature_reserve
21,Central Park,Central Park,"['*...La temperatura media annua cittadina (stazione meteo di Central Park, medie 1961-1990), intorno ai 13\xa0°C, oscilla su base mensile fra i circa 0\xa0°C di gennaio (mese più freddo) e i circa 25\xa0°C di luglio (mese più caldo);...', ""*...Benché non sia il più grande della città, il Parco più conosciuto è sicuramente Central Park, diventato ormai un'icona della città al pari di Times Square o dell'Empire State Building, e spesso inquadrato nei numerosi telefilm ambientati a Manhattan...."", ""*...Al di fuori di Manhattan si trovano i parchi più grandi della città, come Pelham Bay Park, che con i suoi 11,2 chilometri quadrati (circa 2700 acri) è il più grande Parco della città, con un'estensione circa grande tre volte Central Park;..."", '*...A Central Park si svolgono infine spettacoli estivi di prosa e musica gratuiti....', ""*...Manhattan (Contea di New York, 1\xa0629\xa0054 abitanti), è il centro culturale, amministrativo e degli affari. Manhattan è la zona più densamente popolata della città e ospita gran parte dei luoghi e degli edifici che la caratterizzano maggiormente. A Manhattan si trova, ad esempio, la maggior parte dei grattacieli newyorkesi. Da menzionare il celebre Central Park. A Manhattan è presente il quartiere di Harlem, l'unica zona con prevalenza afro-americana...."", ""*...Le principali destinazioni sono l'Empire State Building, la Statua della Libertà, Ellis Island, i teatri di Broadway, musei come il Metropolitan Museum of Art, spazi verdi come Central Park, il Rockefeller Center, Times Square, la Chinatown di Manhattan;..."", '*...Alcune attività stagionali, come il pattinaggio su ghiaccio a Central Park in inverno, il Tribeca Film Festival, sono ulteriori eventi che attirano persone in città....']","Central Park, North Marketview Heights, City of Rochester, Monroe County, New York, 14605, Stati Uniti d'America","{""coordinates"": [-77.584667, 43.168385], ""type"": ""Point""}","Central Park, North Marketview Heights, City of Rochester, Monroe County, New York, 14605, Stati Uniti d'America",highway,secondary
24,One World Trade Center,One World Trade Center,"['*...New York possiede edifici architettonicamente degni di nota, disegnati in una vasta gamma di stili e progettati in tempi che vanno dal 1656, data a cui risale la più antica parte della città, fino al moderno One World Trade Center, il grattacielo costruito a Ground Zero a Lower Manhattan....']","One World Trade Center, 285, Fulton Street, Manhattan Community Board 1, Manhattan, New York County, New York, 10048, Stati Uniti d'America","{""coordinates"": [-74.013178, 40.713016], ""type"": ""Point""}","One World Trade Center, 285, Fulton Street, Manhattan Community Board 1, Manhattan, New York County, New York, 10048, Stati Uniti d'America",tourism,attraction
25,Ground Zero,Ground Zero,"['*...New York possiede edifici architettonicamente degni di nota, disegnati in una vasta gamma di stili e progettati in tempi che vanno dal 1656, data a cui risale la più antica parte della città, fino al moderno One World Trade Center, il grattacielo costruito a Ground Zero a Lower Manhattan....']","Ground Zero, 110, 8th Street, Downtown, City of Troy, Rensselaer County, New York, 12180, Stati Uniti d'America","{""coordinates"": [-73.675068, 42.727229], ""type"": ""Point""}","Ground Zero, 110, 8th Street, Downtown, City of Troy, Rensselaer County, New York, 12180, Stati Uniti d'America",amenity,theatre
28,Saint John the Divine,Saint John the Divine,"['*...Altra cattedrale della città, appartenente alla Chiesa episcopale, è la cattedrale di Saint John the Divine costruita sul modello delle cattedrali gotiche francesi, la sua costruzione va avanti a fasi alterne da più di cento anni:...']","Cathedral of Saint John the Divine, 1047, Amsterdam Avenue, Manhattan Community Board 9, Manhattan, New York County, New York, 10025, Stati Uniti d'America","{""coordinates"": [-73.961784, 40.803766], ""type"": ""Point""}","Cathedral of Saint John the Divine, 1047, Amsterdam Avenue, Manhattan Community Board 9, Manhattan, New York County, New York, 10025, Stati Uniti d'America",amenity,place_of_worship
30,Saint Paul's Chapel,Saint Paul's Chapel,"[""...Oltre alle decine di chiese minori presenti nella città, si possono citare la Saint Paul's Chapel, uno dei pochi edifici di epoca coloniale rimasti nella città, la Grace Church, benché fuori dai comuni circuiti turistici è considerata uno dei migliori esempi di architettura neogotica sacra della città, e Saint George's Episcopal Church in stile neoromanico, che fu di importanza fondamentale nella diffusione del Gospel nella liturgia delle comunità afroamericane....""]","Saint Paul's Chapel, 209, Broadway, Manhattan Community Board 1, Manhattan, New York County, New York, 10007, Stati Uniti d'America","{""coordinates"": [-74.00921, 40.711318], ""type"": ""Point""}","Saint Paul's Chapel, 209, Broadway, Manhattan Community Board 1, Manhattan, New York County, New York, 10007, Stati Uniti d'America",amenity,place_of_worship
31,Grace Church,Grace Church,"[""...Oltre alle decine di chiese minori presenti nella città, si possono citare la Saint Paul's Chapel, uno dei pochi edifici di epoca coloniale rimasti nella città, la Grace Church, benché fuori dai comuni circuiti turistici è considerata uno dei migliori esempi di architettura neogotica sacra della città, e Saint George's Episcopal Church in stile neoromanico, che fu di importanza fondamentale nella diffusione del Gospel nella liturgia delle comunità afroamericane....""]","Grace Church, 254, Hicks Street, Brooklyn, Kings County, New York, 11201, Stati Uniti d'America","{""coordinates"": [-73.99699, 40.693931], ""type"": ""Point""}","Grace Church, 254, Hicks Street, Brooklyn, Kings County, New York, 11201, Stati Uniti d'America",amenity,place_of_worship
32,Saint George's Episcopal Church,Saint George's Episcopal Church,"[""*...Oltre alle decine di chiese minori presenti nella città, si possono citare la Saint Paul's Chapel, uno dei pochi edifici di epoca coloniale rimasti nella città, la Grace Church, benché fuori dai comuni circuiti turistici è considerata uno dei migliori esempi di architettura neogotica sacra della città, e Saint George's Episcopal Church in stile neoromanico, che fu di importanza fondamentale nella diffusione del Gospel nella liturgia delle comunità afroamericane....""]","Saint George's Episcopal Church, 800, Marcy Avenue, Bedford-Stuyvesant, Brooklyn, Kings County, New York, 11216, Stati Uniti d'America","{""coordinates"": [-73.947807, 40.686264], ""type"": ""Point""}","Saint George's Episcopal Church, 800, Marcy Avenue, Bedford-Stuyvesant, Brooklyn, Kings County, New York, 11216, Stati Uniti d'America",amenity,place_of_worship
33,Times Square,Times Square,"[""*...Benché non sia il più grande della città, il Parco più conosciuto è sicuramente Central Park, diventato ormai un'icona della città al pari di Times Square o dell'Empire State Building, e spesso inquadrato nei numerosi telefilm ambientati a Manhattan...."", ""*...Le principali destinazioni sono l'Empire State Building, la Statua della Libertà, Ellis Island, i teatri di Broadway, musei come il Metropolitan Museum of Art, spazi verdi come Central Park, il Rockefeller Center, Times Square, la Chinatown di Manhattan;..."", '*...La Port Authority of New York and New Jersey, sotto il controllo congiunto degli stati di New York e New Jersey, che gestisce il PATH (Port Authority Trans Hudson), la metropolitana extracittadina che collega Manhattan al New Jersey 24 ore ogni giorno, e diverse linee di autobus che convergono al Port Authority Bus Terminal, vicino a Times Square;...']","Times Square, West 42nd Street, Theater District, Manhattan, New York County, New York, 10036, Stati Uniti d'America","{""coordinates"": [-73.985998, 40.755619], ""type"": ""Point""}","Times Square, West 42nd Street, Theater District, Manhattan, New York County, New York, 10036, Stati Uniti d'America",railway,buffer_stop
36,Bryant Park,Bryant Park,"[""*...Altri celebri parchi, benché decisamente più piccoli sono Bryant Park che funge da Giardino di lettura della New York Public Library, Battery Park, da dove partono i traghetti per la Statua della Libertà, e Washington Square Park, celebre per l'arco di trionfo dedicato a George Washington e per i gruppi di artisti di Strada che si esibiscono all'interno:...""]","Bryant Park, 6th Avenue, Manhattan Community Board 5, Manhattan, New York County, New York, 10018, Stati Uniti d'America","{""coordinates"": [-73.983543, 40.753751], ""type"": ""Point""}","Bryant Park, 6th Avenue, Manhattan Community Board 5, Manhattan, New York County, New York, 10018, Stati Uniti d'America",tourism,attraction
38,Battery Park,Battery Park,"[""*...Altri celebri parchi, benché decisamente più piccoli sono Bryant Park che funge da Giardino di lettura della New York Public Library, Battery Park, da dove partono i traghetti per la Statua della Libertà, e Washington Square Park, celebre per l'arco di trionfo dedicato a George Washington e per i gruppi di artisti di Strada che si esibiscono all'interno:...""]","Battery Park, Battery Park Underpass, Battery Park City, Manhattan, New York County, New York, 10004, Stati Uniti d'America","{""coordinates"": [-74.017464, 40.703113], ""type"": ""Point""}","Battery Park, Battery Park Underpass, Battery Park City, Manhattan, New York County, New York, 10004, Stati Uniti d'America",amenity,ferry_terminal
40,Pelham Bay Park,Pelham Bay Park,"[""*...Al di fuori di Manhattan si trovano i parchi più grandi della città, come Pelham Bay Park, che con i suoi 11,2 chilometri quadrati (circa 2700 acri) è il più grande Parco della città, con un'estensione circa grande tre volte Central Park;...""]","Pelham Bay Park, Westchester Avenue, Pelham Bay, Bronx County, The Bronx, New York, 10461, Stati Uniti d'America","{""coordinates"": [-73.827995, 40.852522], ""type"": ""Point""}","Pelham Bay Park, Westchester Avenue, Pelham Bay, Bronx County, The Bronx, New York, 10461, Stati Uniti d'America",railway,platform
43,East Coast,East Coast,"[""*...Così la University of New York, che ha diversi campus sparsi nella città è la più grande Università privata degli Stati Uniti con più di 40\xa0000 studenti, mentre la Fordham University è una delle Università gesuitiche più celebri dell'East Coast....""]","East Coast, Lego Ninjago World, Town of Goshen, Orange County, New York, 10924, Stati Uniti d'America","{""coordinates"": [-74.312665, 41.380611], ""type"": ""Point""}","East Coast, Lego Ninjago World, Town of Goshen, Orange County, New York, 10924, Stati Uniti d'America",leisure,garden
44,Upper East Side,Upper East Side,"[""*...Nell'Upper East Side ha sede il campus della Rockefeller University, che offre solo corsi di dottorato e post-dottorato ed è considerato uno dei migliori istituti di ricerca biologica e medica al mondo...."", ""*...Il più generoso in assoluto è il 10021, nell'Upper East Side e, nella campagna presidenziale del 2000, è stato il principale finanziatore sia per George W. Bush sia per Al Gore....""]","Upper East Side Historic District, East 69th Street, Manhattan Community Board 8, Manhattan, New York County, New York, 10021, Stati Uniti d'America","{""coordinates"": [-73.965556, 40.769167], ""type"": ""Point""}","Upper East Side Historic District, East 69th Street, Manhattan Community Board 8, Manhattan, New York County, New York, 10021, Stati Uniti d'America",historic,district
