,entity,to_search,snippet,address,coordinates,name_location,class,type
45,Museum of Modern Art,Museum of Modern Art,"['...Tra i più noti musei d\'arte e design, il ""Metropolitan Museum of Art"" (inaugurato nel 1880) espone oggetti d\'arte che vanno dai reperti dell\'antico Egitto all\'arte moderna, mentre il ""Museum of Modern Art"" (chiamato MoMA e aperto nel 1929) è considerato il più grande Museo al mondo di arte contemporanea ed è stato riaperto nel 2004 dopo un\'ampia espansione....']","Museum of Modern Art (MoMA) films, West 53rd Street, Manhattan Community Board 5, Manhattan, New York County, New York, 10019, Stati Uniti d'America","{""coordinates"": [-73.977814, 40.761634], ""type"": ""Point""}","Museum of Modern Art (MoMA) films, West 53rd Street, Manhattan Community Board 5, Manhattan, New York County, New York, 10019, Stati Uniti d'America",amenity,cinema
46,Museo Guggenheim,Museo Guggenheim,"['...Il ""Museo Guggenheim"" è ospitato in un edificio progettato dal famoso architetto Frank Lloyd Wright ed ha una forma che ricorda il guscio di una lumaca....']","Guggenheim Museum, 1071, 5th Avenue, Manhattan Community Board 8, Manhattan, New York County, New York, 10128, Stati Uniti d'America","{""coordinates"": [-73.958925, 40.782993], ""type"": ""Point""}","Guggenheim Museum, 1071, 5th Avenue, Manhattan Community Board 8, Manhattan, New York County, New York, 10128, Stati Uniti d'America",tourism,museum
47,Frick Collection,Frick Collection,"['...Altri musei d\'arte della città sono la ""Frick Collection"" (1935), il ""Whitney Museum of American Art"" (1931) e l\'""International Center of Photography""....']","Frick Collection, 1, East 70th Street, Manhattan Community Board 8, Manhattan, New York County, New York, 10021, Stati Uniti d'America","{""coordinates"": [-73.967096, 40.771254], ""type"": ""Point""}","Frick Collection, 1, East 70th Street, Manhattan Community Board 8, Manhattan, New York County, New York, 10021, Stati Uniti d'America",tourism,museum
48,Island Immigration Museum,Island Immigration Museum,"['...Nel 1990 fu oggetto di restauri che portarono all\'apertura dell\'""Ellis Island Immigration Museum""....']","Ellis Island Immigration Museum, Ellis Island Bridge, New York, Hudson County, New Jersey, 10004, Stati Uniti d'America","{""coordinates"": [-74.039548, 40.699131], ""type"": ""Point""}","Ellis Island Immigration Museum, Ellis Island Bridge, New York, Hudson County, New Jersey, 10004, Stati Uniti d'America",tourism,museum
49,Carnegie Hall,Carnegie Hall,"[""*...I ricchi industriali del XIX secolo hanno istituito una rete di importanti istituzioni culturali, come la famosa sala da concerto Carnegie Hall e il Metropolitan Museum of Art. L'avvento della luce elettrica ha portato a realizzare produzioni teatrali e nei teatri di New York, a Broadway e lungo la 42° Strada, è iniziato un nuovo tipo di intrattenimento che divenne noto come il musical di Broadway....""]","Carnegie Hall, West 57th Street, Manhattan Community Board 5, Manhattan, New York County, New York, 10019, Stati Uniti d'America","{""coordinates"": [-73.979887, 40.76503], ""type"": ""Point""}","Carnegie Hall, West 57th Street, Manhattan Community Board 5, Manhattan, New York County, New York, 10019, Stati Uniti d'America",building,commercial
50,Broadway,Broadway,"[""*...I ricchi industriali del XIX secolo hanno istituito una rete di importanti istituzioni culturali, come la famosa sala da concerto Carnegie Hall e il Metropolitan Museum of Art. L'avvento della luce elettrica ha portato a realizzare produzioni teatrali e nei teatri di New York, a Broadway e lungo la 42° Strada, è iniziato un nuovo tipo di intrattenimento che divenne noto come il musical di Broadway...."", '...La città ha 39 grandi teatri (con più di 500 posti ciascuno) e sono conosciuti collettivamente come ""Broadway""....', ""*...Le principali destinazioni sono l'Empire State Building, la Statua della Libertà, Ellis Island, i teatri di Broadway, musei come il Metropolitan Museum of Art, spazi verdi come Central Park, il Rockefeller Center, Times Square, la Chinatown di Manhattan;...""]","Broadway, Financial District, Manhattan, New York County, New York, 10003, Stati Uniti d'America","{""coordinates"": [-74.010628, 40.709103], ""type"": ""Point""}","Broadway, Financial District, Manhattan, New York County, New York, 10003, Stati Uniti d'America",highway,secondary
51,42° Strada,42° Strada,"[""...I ricchi industriali del XIX secolo hanno istituito una rete di importanti istituzioni culturali, come la famosa sala da concerto Carnegie Hall e il Metropolitan Museum of Art. L'avvento della luce elettrica ha portato a realizzare produzioni teatrali e nei teatri di New York, a Broadway e lungo la 42° Strada, è iniziato un nuovo tipo di intrattenimento che divenne noto come il musical di Broadway...."", '...A partire dagli anni sessanta, tuttavia, anche New York si incamminò lungo una Strada di declino, analogamente ad altre metropoli statunitensi....', '*...Nel corso degli anni settanta il livello di vita cittadino peggiorò ulteriormente, con la città (specialmente in alcuni quartieri) ostaggio della criminalità e delle gang di Strada;...', ""...La città di New York è situata sulla costa orientale dell'America settentrionale, sull'oceano Atlantico, alla foce del fiume Hudson (che costituisce il suo confine occidentale, separandola da una serie di sobborghi nel New Jersey), circa a metà Strada fra Boston e Washington...."", ""*...Altri celebri parchi, benché decisamente più piccoli sono Bryant Park che funge da Giardino di lettura della New York Public Library, Battery Park, da dove partono i traghetti per la Statua della Libertà, e Washington Square Park, celebre per l'arco di trionfo dedicato a George Washington e per i gruppi di artisti di Strada che si esibiscono all'interno:..."", '*...Il nome della Strada dove ha sede la Borsa, Wall Street (""Strada del muro""), risale alla colonizzazione, quando gli olandesi, per difendersi dagli attacchi dei nativi americani, eressero un muro in prossimità della Strada....', '...Lo shopping di lusso lungo la Quinta Strada e la Madison Avenue ed eventi come la parata di Halloween nel Greenwich Village e la parata di San Patrizio....', '...Una Strada nel Bronx è stata rinominata Stickball Blvd, come tributo allo sport Strada più famoso di New York....']","42, Stillerberg Strada, Town of Rochester, Ulster County, New York, 12446, Stati Uniti d'America","{""coordinates"": [-74.350563, 41.831641], ""type"": ""Point""}","42, Stillerberg Strada, Town of Rochester, Ulster County, New York, 12446, Stati Uniti d'America",place,house
52,Lincoln Center for the Performing Arts,Lincoln Center for the Performing Arts,"['...Il Lincoln Center for the Performing Arts ospita 12 importanti istituzioni artistiche, tra cui due teatri dell\'opera, il famoso ""Metropolitan"" e il ""New York State Theater"" nel quale si esibiscono la ""New York City Opera"" e il ""New York City Ballet"", ospita inoltre l\'""Avery Fisher Hall"" in cui si esibisce la ""New York Philharmonic Orchestra"", e ancora il ""Jazz at Lincoln Center"", il ""Vivian Beaumont Theatre"", la ""Juilliard School"" e l\'""Alice Tully Hall""....']","Lincoln Center for the Performing Arts, 10, West 61st Street, Manhattan Community Board 7, Manhattan, New York County, New York, 10023, Stati Uniti d'America","{""coordinates"": [-73.984224, 40.772518], ""type"": ""Point""}","Lincoln Center for the Performing Arts, 10, West 61st Street, Manhattan Community Board 7, Manhattan, New York County, New York, 10023, Stati Uniti d'America",amenity,arts_centre
56,Fisher Hall,Fisher Hall,"['...Il Lincoln Center for the Performing Arts ospita 12 importanti istituzioni artistiche, tra cui due teatri dell\'opera, il famoso ""Metropolitan"" e il ""New York State Theater"" nel quale si esibiscono la ""New York City Opera"" e il ""New York City Ballet"", ospita inoltre l\'""Avery Fisher Hall"" in cui si esibisce la ""New York Philharmonic Orchestra"", e ancora il ""Jazz at Lincoln Center"", il ""Vivian Beaumont Theatre"", la ""Juilliard School"" e l\'""Alice Tully Hall""....']","Fisher Hall, 4632, Tibbett Avenue, Fieldston, Bronx County, The Bronx, New York, 10471, Stati Uniti d'America","{""coordinates"": [-73.897384, 40.893703], ""type"": ""Point""}","Fisher Hall, 4632, Tibbett Avenue, Fieldston, Bronx County, The Bronx, New York, 10471, Stati Uniti d'America",building,yes
60,Tully Hall,Tully Hall,"['...Il Lincoln Center for the Performing Arts ospita 12 importanti istituzioni artistiche, tra cui due teatri dell\'opera, il famoso ""Metropolitan"" e il ""New York State Theater"" nel quale si esibiscono la ""New York City Opera"" e il ""New York City Ballet"", ospita inoltre l\'""Avery Fisher Hall"" in cui si esibisce la ""New York Philharmonic Orchestra"", e ancora il ""Jazz at Lincoln Center"", il ""Vivian Beaumont Theatre"", la ""Juilliard School"" e l\'""Alice Tully Hall""....']","Alice Tully Hall, Broadway, Manhattan Community Board 7, Manhattan, New York County, New York, 10023, Stati Uniti d'America","{""coordinates"": [-73.982579, 40.773503], ""type"": ""Point""}","Alice Tully Hall, Broadway, Manhattan Community Board 7, Manhattan, New York County, New York, 10023, Stati Uniti d'America",amenity,theatre
62,Radio City Music Hall,Radio City Music Hall,"['...Il Rockfeller Center ospita invece il Radio City Music Hall, che è il più famoso music-hall newyorchese, dove si sono esibiti anche tanti cantanti e gruppi italiani....']","Radio City Music Hall, West 51st Street, Manhattan Community Board 5, Manhattan, New York County, New York, 10019, Stati Uniti d'America","{""coordinates"": [-73.979279, 40.759812], ""type"": ""Point""}","Radio City Music Hall, West 51st Street, Manhattan Community Board 5, Manhattan, New York County, New York, 10019, Stati Uniti d'America",amenity,theatre
65,New York Yankees,New York Yankees,"[""*...Bronx (Contea del Bronx, 1\xa0397\xa0287 abitanti), è l'unico distretto a trovarsi quasi interamente sulla terraferma (fanno eccezione alcune isole minori). È delimitato a est dal Long Island Sound, a sud dall'East River e a ovest dall'estuario del fiume Hudson. Associato a immagini di povertà e violenza (che non corrispondono del tutto alla realtà dei fatti), è abitato per la maggior parte da immigrati dall'America latina e da loro discendenti, nonché da molti afro-americani. Non mancano, comunque, quartieri ad alto reddito, come Riverdale. Il Bronx è la culla della cultura hip hop e ospita lo stadio dei New York Yankees, lo Yankee Stadium...."", '...Le due principali squadre di baseball della città sono i New York Mets e i New York Yankees, che gareggiano in sei partite di ogni stagione regolare, una serie che ha preso il nome di ""serie metropolitana""....']","The Yankees Museum, 11, East 162nd Street, Bronx County, The Bronx, New York, 10452, Stati Uniti d'America","{""coordinates"": [-73.925893, 40.828571], ""type"": ""Point""}","The Yankees Museum, 11, East 162nd Street, Bronx County, The Bronx, New York, 10452, Stati Uniti d'America",tourism,museum
66,Shea Stadium,Shea Stadium,"['*...Queens (Contea del Queens, 2\xa0306\xa0712 abitanti) è il distretto più esteso e la contea degli Stati Uniti più varia dal punto di vista etnico. Si affaccia a nord sul Long Island Sound. Prima di unirsi a New York, era composto da piccole città e villaggi, fondati dagli olandesi. Due dei maggiori aeroporti della città hanno sede a Queens: si tratta del LaGuardia e del John F. Kennedy International. Nel Queens era situato il leggendario Shea Stadium....']","Site of Shea Stadium Home Plate 1964-2008, Roosevelt Avenue, Queens, New York, 11368, Stati Uniti d'America","{""coordinates"": [-73.848356, 40.755655], ""type"": ""Point""}","Site of Shea Stadium Home Plate 1964-2008, Roosevelt Avenue, Queens, New York, 11368, Stati Uniti d'America",historic,memorial
67,Wall Street,Wall Street,"[""...Subito dopo la sua creazione, prevista dalla Costituzione, il Congresso degli Stati Uniti d'America ebbe come sede la Federal Hall, in Wall Street...."", '...Il Wall Street Journal e il New York Times, che ha vinto il maggior numero di premi Pulitzer per il giornalismo....', '...I mercati borsistici cittadini (New York Stock Exchange detto ""Wall Street"" dal nome della via in cui ha sede, il NASDAQ, l\'American Stock Exchange, il New York Mercantile Exchange e la New York Board of Trade), ne fanno indubbiamente la più importante piazza borsistica del mondo....', '...Il nome della Strada dove ha sede la Borsa, Wall Street (""Strada del muro""), risale alla colonizzazione, quando gli olandesi, per difendersi dagli attacchi dei nativi americani, eressero un muro in prossimità della Strada....']","Wall Street, Broadway, Manhattan Community Board 1, Manhattan, New York County, New York, 10003, Stati Uniti d'America","{""coordinates"": [-74.011469, 40.707928], ""type"": ""Point""}","Wall Street, Broadway, Manhattan Community Board 1, Manhattan, New York County, New York, 10003, Stati Uniti d'America",railway,station
69,Metropolitan Museum of Art,Metropolitan Museum of Art,"['...Tra i più noti musei d\'arte e design, il ""Metropolitan Museum of Art"" (inaugurato nel 1880) espone oggetti d\'arte che vanno dai reperti dell\'antico Egitto all\'arte moderna, mentre il ""Museum of Modern Art"" (chiamato MoMA e aperto nel 1929) è considerato il più grande Museo al mondo di arte contemporanea ed è stato riaperto nel 2004 dopo un\'ampia espansione....', ""...Le principali destinazioni sono l'Empire State Building, la Statua della Libertà, Ellis Island, i teatri di Broadway, musei come il Metropolitan Museum of Art, spazi verdi come Central Park, il Rockefeller Center, Times Square, la Chinatown di Manhattan;..."", ""...I ricchi industriali del XIX secolo hanno istituito una rete di importanti istituzioni culturali, come la famosa sala da concerto Carnegie Hall e il Metropolitan Museum of Art. L'avvento della luce elettrica ha portato a realizzare produzioni teatrali e nei teatri di New York, a Broadway e lungo la 42° Strada, è iniziato un nuovo tipo di intrattenimento che divenne noto come il musical di Broadway...."", '...Il Lincoln Center for the Performing Arts ospita 12 importanti istituzioni artistiche, tra cui due teatri dell\'opera, il famoso ""Metropolitan"" e il ""New York State Theater"" nel quale si esibiscono la ""New York City Opera"" e il ""New York City Ballet"", ospita inoltre l\'""Avery Fisher Hall"" in cui si esibisce la ""New York Philharmonic Orchestra"", e ancora il ""Jazz at Lincoln Center"", il ""Vivian Beaumont Theatre"", la ""Juilliard School"" e l\'""Alice Tully Hall""....', ""...L'MTA (Metropolitan Transportation Authority), che fa capo principalmente alla città di New York e gestisce la metropolitana, la (Staten Island Railway) (anch'essa attiva 24 ore al giorno, 7 giorni alla settimana), gli autobus urbani e i treni verso Long Island (Long Island Rail Road) e verso Nord (Metro-North Railroad);...""]","The Metropolitan Museum of Art, 1000, 5th Avenue, Upper East Side, Manhattan, New York County, New York, 10035, Stati Uniti d'America","{""coordinates"": [-73.963382, 40.77944], ""type"": ""Point""}","The Metropolitan Museum of Art, 1000, 5th Avenue, Upper East Side, Manhattan, New York County, New York, 10035, Stati Uniti d'America",tourism,museum
70,Rockefeller Center,Rockefeller Center,"[""...Le principali destinazioni sono l'Empire State Building, la Statua della Libertà, Ellis Island, i teatri di Broadway, musei come il Metropolitan Museum of Art, spazi verdi come Central Park, il Rockefeller Center, Times Square, la Chinatown di Manhattan;...""]","Rockefeller Center, Rockefeller Plaza, Manhattan Community Board 5, Manhattan, New York County, New York, 10020, Stati Uniti d'America","{""coordinates"": [-73.978801, 40.758845], ""type"": ""Point""}","Rockefeller Center, Rockefeller Plaza, Manhattan Community Board 5, Manhattan, New York County, New York, 10020, Stati Uniti d'America",tourism,attraction
72,Madison Avenue,Madison Avenue,['...Lo shopping di lusso lungo la Quinta Strada e la Madison Avenue ed eventi come la parata di Halloween nel Greenwich Village e la parata di San Patrizio....'],"Madison Avenue, Flatiron District, Manhattan, New York County, New York, 10037, Stati Uniti d'America","{""coordinates"": [-73.987506, 40.741545], ""type"": ""Point""}","Madison Avenue, Flatiron District, Manhattan, New York County, New York, 10037, Stati Uniti d'America",highway,secondary
73,Greenwich Village,Greenwich Village,"['*...Lo shopping di lusso lungo la Quinta Strada e la Madison Avenue ed eventi come la parata di Halloween nel Greenwich Village e la parata di San Patrizio....', ""*...L'Uomo Ragno è nato e cresciuto nel Queens, Capitan America a Brooklyn, Daredevil a Hell's Kitchen, Luke Cage vive ad Harlem, il dottor Strange al Greenwich Village;...""]","Greenwich Village, 7th Avenue South, Manhattan Community Board 2, Manhattan, New York County, New York, 10014, Stati Uniti d'America","{""coordinates"": [-74.002817, 40.733584], ""type"": ""Point""}","Greenwich Village, 7th Avenue South, Manhattan Community Board 2, Manhattan, New York County, New York, 10014, Stati Uniti d'America",tourism,attraction
74,Manhattan Waterfront Greenway,Manhattan Waterfront Greenway,"[""*...New York infatti dispone di più di 680\xa0km di piste ciclabili, dislocate maggiormente nei ponti dell'East River e nella Manhattan Waterfront Greenway....""]","Harlem River Drive Greenway, Manhattan Community Board 10, Manhattan, New York County, New York, 10032, Stati Uniti d'America","{""coordinates"": [-73.936293, 40.83464], ""type"": ""Point""}","Harlem River Drive Greenway, Manhattan Community Board 10, Manhattan, New York County, New York, 10032, Stati Uniti d'America",highway,cycleway
75,Grand Central Terminal,Grand Central Terminal,['*...Le principali stazioni ferroviarie di New York sono Grand Central Terminal e la Penn Station....'],"Grand Central Terminal, 89, East 42nd Street, Midtown East, Manhattan, New York County, New York, 10017, Stati Uniti d'America","{""coordinates"": [-73.97725, 40.752701], ""type"": ""Point""}","Grand Central Terminal, 89, East 42nd Street, Midtown East, Manhattan, New York County, New York, 10017, Stati Uniti d'America",tourism,attraction
76,Penn Station,Penn Station,"['...Le principali stazioni ferroviarie di New York sono Grand Central Terminal e la Penn Station....', '*...Da lì si raggiunge Penn Station a Manhattan in circa 30 minuti....', '*...La New Jersey Transit, società dello stato del New Jersey, che gestisce le linee ferroviarie che dal New Jersey terminano a Penn Station (New Jersey Transit Rail), oltre che a molte linee di autobus....']","34th Street–Penn Station, 7th Avenue, Chelsea District, Manhattan, New York County, New York, 10001, Stati Uniti d'America","{""coordinates"": [-73.991203, 40.750347], ""type"": ""Point""}","34th Street–Penn Station, 7th Avenue, Chelsea District, Manhattan, New York County, New York, 10001, Stati Uniti d'America",railway,stop
78,JFK,JFK,"[""*...L'Aeroporto Internazionale John F. Kennedy (JFK), il principale scalo aeroportuale di New York, situato a Jamaica (nel Queens) e a 25\xa0km da Manhattan;...""]","JFK, JFK Access Road, Queens, New York, 11430, Stati Uniti d'America","{""coordinates"": [-73.787269, 40.653271], ""type"": ""Point""}","JFK, JFK Access Road, Queens, New York, 11430, Stati Uniti d'America",tourism,attraction
86,Long Island Rail Road,Long Island Rail Road,"[""*...L'MTA (Metropolitan Transportation Authority), che fa capo principalmente alla città di New York e gestisce la metropolitana, la (Staten Island Railway) (anch'essa attiva 24 ore al giorno, 7 giorni alla settimana), gli autobus urbani e i treni verso Long Island (Long Island Rail Road) e verso Nord (Metro-North Railroad);...""]","Long Island Rail Road, Archer Avenue, Jamaica, Queens, New York, 11435, Stati Uniti d'America","{""coordinates"": [-73.808088, 40.700246], ""type"": ""Point""}","Long Island Rail Road, Archer Avenue, Jamaica, Queens, New York, 11435, Stati Uniti d'America",building,train_station
88,Port Authority Bus Terminal,Port Authority Bus Terminal,"['*...La Port Authority of New York and New Jersey, sotto il controllo congiunto degli stati di New York e New Jersey, che gestisce il PATH (Port Authority Trans Hudson), la metropolitana extracittadina che collega Manhattan al New Jersey 24 ore ogni giorno, e diverse linee di autobus che convergono al Port Authority Bus Terminal, vicino a Times Square;...', '*...Per le corse suburbane, si parte dal Port Authority Bus Terminal....']","Port Authority Bus Terminal, 625, 8th Avenue, Manhattan Community Board 4, Manhattan, New York County, New York, 10018, Stati Uniti d'America","{""coordinates"": [-73.991448, 40.756835], ""type"": ""Point""}","Port Authority Bus Terminal, 625, 8th Avenue, Manhattan Community Board 4, Manhattan, New York County, New York, 10018, Stati Uniti d'America",amenity,bus_station
89,New York City Hall,New York City Hall,['...La New York City Hall è la sede del governo cittadino e luogo di riunione del Consiglio....'],"New York City Hall, 260, Broadway, Lower Manhattan, Manhattan Community Board 1, Manhattan, New York County, New York, 10000, Stati Uniti d'America","{""coordinates"": [-74.005939, 40.712739], ""type"": ""Point""}","New York City Hall, 260, Broadway, Lower Manhattan, Manhattan Community Board 1, Manhattan, New York County, New York, 10000, Stati Uniti d'America",amenity,townhall
90,Manhattan Municipal Building,Manhattan Municipal Building,"[""*...L'ufficio del sindaco si trova, assieme a circa altre tredici agenzie comunali, nel vicino Manhattan Municipal Building, uno degli edifici amministrativi più grandi del mondo....""]","David N. Dinkins Manhattan Municipal Building, 1, Centre Street, Lower Manhattan, Manhattan Community Board 1, Manhattan, New York County, New York, 10007, Stati Uniti d'America","{""coordinates"": [-74.003475, 40.713027], ""type"": ""Point""}","David N. Dinkins Manhattan Municipal Building, 1, Centre Street, Lower Manhattan, Manhattan Community Board 1, Manhattan, New York County, New York, 10007, Stati Uniti d'America",office,government
91,Madison Square Garden,Madison Square Garden,"['...Quattro dei dieci stadi più costosi mai costruiti in tutto il mondo (il Madison Square Garden, il nuovo Yankee Stadium, il MetLife Stadium e il Citi Field) si trovano nella zona metropolitana di New York....', '*...Il primo campionato di college basket a livello nazionale, il National Invitation Tournament, si tenne a New York nel 1938 (un anno prima della nascita del torneo NCAA) e le finali vengono giocate al Madison Square Garden....', ""*...La boxe riveste un ruolo importante nella scena sportiva della città, con eventi come il dilettante guantoni da boxe d'oro detenuti al Madison Square Garden di ogni anno....""]","Madison Square Garden, 4, Pennsylvania Plaza, Chelsea District, Manhattan, New York County, New York, 10001, Stati Uniti d'America","{""coordinates"": [-73.993516, 40.750513], ""type"": ""Point""}","Madison Square Garden, 4, Pennsylvania Plaza, Chelsea District, Manhattan, New York County, New York, 10001, Stati Uniti d'America",tourism,attraction
93,Citi Field,Citi Field,"['...Quattro dei dieci stadi più costosi mai costruiti in tutto il mondo (il Madison Square Garden, il nuovo Yankee Stadium, il MetLife Stadium e il Citi Field) si trovano nella zona metropolitana di New York....']","Citi Field, 41, Seaver Way, Queens, New York, 11368, Stati Uniti d'America","{""coordinates"": [-73.845879, 40.757278], ""type"": ""Point""}","Citi Field, 41, Seaver Way, Queens, New York, 11368, Stati Uniti d'America",leisure,stadium
94,Yankee stadium,Yankee stadium,"[""...Bronx (Contea del Bronx, 1\xa0397\xa0287 abitanti), è l'unico distretto a trovarsi quasi interamente sulla terraferma (fanno eccezione alcune isole minori). È delimitato a est dal Long Island Sound, a sud dall'East River e a ovest dall'estuario del fiume Hudson. Associato a immagini di povertà e violenza (che non corrispondono del tutto alla realtà dei fatti), è abitato per la maggior parte da immigrati dall'America latina e da loro discendenti, nonché da molti afro-americani. Non mancano, comunque, quartieri ad alto reddito, come Riverdale. Il Bronx è la culla della cultura hip hop e ospita lo stadio dei New York Yankees, lo Yankee Stadium...."", '...Quattro dei dieci stadi più costosi mai costruiti in tutto il mondo (il Madison Square Garden, il nuovo Yankee Stadium, il MetLife Stadium e il Citi Field) si trovano nella zona metropolitana di New York....', '*...Il New York City FC gioca allo Yankee stadium, nel Bronx, e dunque è considerata la vera squadra di calcio della città, mentre i Red Bulls giocano le partite casalinghe alla Red Bull Arena, nei pressi di Harrison, New Jersey.....', '*...Quattro dei dieci stadi più costosi mai costruiti in tutto il mondo (il Madison Square Garden, il nuovo Yankee Stadium, il MetLife Stadium e il Citi Field) si trovano nella zona metropolitana di New York....']","Yankee Stadium, 1, East 161st Street, Bronx County, The Bronx, New York, 10451, Stati Uniti d'America","{""coordinates"": [-73.926521, 40.829583], ""type"": ""Point""}","Yankee Stadium, 1, East 161st Street, Bronx County, The Bronx, New York, 10451, Stati Uniti d'America",leisure,stadium
