,entity,to_search,snippet,address,coordinates,name_location,class,type
195,Galleria civica d'arte moderna e contemporanea,Galleria civica d'arte moderna e contemporanea,"[""*...La Biblioteca nazionale di Torino e la Biblioteca Reale di proprietà dello Stato, la Biblioteca civica centrale e molte collezioni specializzate come la Biblioteca internazionale di Cinema e fotografia Mario Gromo, la Biblioteca Nazionale del Club Alpino Italiano, la Biblioteca della Fondazione Luigi Einaudi, le biblioteche d'arte della Galleria civica d'arte moderna e contemporanea e dell'Accademia Albertina...."", ""...Per l'arte moderna e contemporanea vi sono la Galleria civica d'arte moderna e contemporanea (il secondo Museo di arte moderna in Italia, con 5.000 dipinti e 400 sculture)...""]","Galleria civica d'Arte Moderna e Contemporanea, Corso Galileo Ferraris, San Secondo, Circoscrizione 1, Torino, Piemonte, 10100, Italia","{""coordinates"": [7.669153, 45.064812], ""type"": ""Point""}","Galleria civica d'Arte Moderna e Contemporanea, Corso Galileo Ferraris, San Secondo, Circoscrizione 1, Torino, Piemonte, 10100, Italia",tourism,museum
197,Fondazione Sandretto Re Rebaudengo,Fondazione Sandretto Re Rebaudengo,"[""..., il Museo civico d'arte antica di Palazzo Madama, la Fondazione Sandretto Re Rebaudengo contenente esposizioni degli artisti contemporanei provenienti da tutto il mondo e la Pinacoteca Giovanni e Marella Agnelli e la Fondazione Merz....""]","Fondazione Sandretto Re Rebaudengo, 16, Via Modane, Polo Nord, Circoscrizione 3, Torino, Piemonte, 10141, Italia","{""coordinates"": [7.652335, 45.057395], ""type"": ""Point""}","Fondazione Sandretto Re Rebaudengo, 16, Via Modane, Polo Nord, Circoscrizione 3, Torino, Piemonte, 10141, Italia",amenity,arts_centre
198,Fondazione Merz,Fondazione Merz,"[""..., il Museo civico d'arte antica di Palazzo Madama, la Fondazione Sandretto Re Rebaudengo contenente esposizioni degli artisti contemporanei provenienti da tutto il mondo e la Pinacoteca Giovanni e Marella Agnelli e la Fondazione Merz....""]","Fondazione Merz, 24, Via Limone, Borgo San Paolo, Circoscrizione 3, Torino, Piemonte, 10141, Italia","{""coordinates"": [7.642805, 45.062092], ""type"": ""Point""}","Fondazione Merz, 24, Via Limone, Borgo San Paolo, Circoscrizione 3, Torino, Piemonte, 10141, Italia",tourism,museum
199,Museo d'Arte Contemporanea,Museo d'Arte Contemporanea,"[""...Considerando che la vicina Rivoli ospita nell'omonimo castello il Museo d'Arte Contemporanea, Torino può essere considerata come il più importante polo museale italiano per l'arte contemporanea....""]","Museo d'Arte Contemporanea, 1, Piazzale Mafalda di Savoia, Borgo Nuovo, Rivoli, Torino, Piemonte, 10098, Italia","{""coordinates"": [7.510297, 45.06966], ""type"": ""Point""}","Museo d'Arte Contemporanea, 1, Piazzale Mafalda di Savoia, Borgo Nuovo, Rivoli, Torino, Piemonte, 10098, Italia",tourism,museum
200,Museo di antichità,Museo di antichità,"['*...Le collezioni di arte antica, la cui raccolta fu iniziata dal duca Emanuele Filiberto di Savoia nella seconda metà del Cinquecento, sono conservate nel Museo di antichità, che raccoglie anche le principali testimonianze archeologiche piemontesi dal Paleolitico al Tardo Medioevo....', ""...Dal Museo di Antichità furono separate, negli anni quaranta del Novecento, le collezioni egizie che costituirono il Museo egizio, il più importante d'Europa (nonché il più antico al mondo), in quanto custode della seconda collezione di arte egizia del mondo per vastità e importanza dopo quella del Museo del Cairo....""]","Museo di Antichità, Corso Regina Margherita, Quadrilatero Romano, Circoscrizione 1, Torino, Piemonte, 10152, Italia","{""coordinates"": [7.687933, 45.074931], ""type"": ""Point""}","Museo di Antichità, Corso Regina Margherita, Quadrilatero Romano, Circoscrizione 1, Torino, Piemonte, 10152, Italia",tourism,museum
204,Museo Accorsi-Ometto,Museo Accorsi-Ometto,"['...Il Museo Accorsi-Ometto è una ricca collezione privata, ora aperta al pubblico, di opere collezionistiche e di arte decorativa....']","Museo Accorsi Ometto, 55, Via Po, Borgo Nuovo, Circoscrizione 1, Torino, Piemonte, 10124, Italia","{""coordinates"": [7.693273, 45.066392], ""type"": ""Point""}","Museo Accorsi Ometto, 55, Via Po, Borgo Nuovo, Circoscrizione 1, Torino, Piemonte, 10124, Italia",tourism,museum
205,Palazzo Bricherasio,Palazzo Bricherasio,['*...Mostre temporanee di rilievo si tengono a Palazzo Bricherasio e a Palazzo Madama....'],"Palazzo Bricherasio, Via Teofilo Rossi, Centro, Circoscrizione 1, Torino, Piemonte, 10123, Italia","{""coordinates"": [7.68255, 45.065964], ""type"": ""Point""}","Palazzo Bricherasio, Via Teofilo Rossi, Centro, Circoscrizione 1, Torino, Piemonte, 10123, Italia",building,yes
206,Museo nazionale del Risorgimento italiano,Museo nazionale del Risorgimento italiano,"['...Importanti sono poi dal punto di vista storico il Museo nazionale del Risorgimento italiano, presso Palazzo Carignano, e il Museo nazionale della montagna, presso il Monte dei Cappuccini, sulla riva destra del Po....']","Museo nazionale del Risorgimento italiano, 5, Via Accademia delle Scienze, Centro, Circoscrizione 1, Torino, Piemonte, 10123, Italia","{""coordinates"": [7.685886, 45.068842], ""type"": ""Point""}","Museo nazionale del Risorgimento italiano, 5, Via Accademia delle Scienze, Centro, Circoscrizione 1, Torino, Piemonte, 10123, Italia",tourism,museum
207,Museo nazionale della montagna,Museo nazionale della montagna,"['*...Importanti sono poi dal punto di vista storico il Museo nazionale del Risorgimento italiano, presso Palazzo Carignano, e il Museo nazionale della montagna, presso il Monte dei Cappuccini, sulla riva destra del Po....']","Museo Nazionale della Montagna Duca degli Abruzzi, 7, Piazzale Monte dei Cappuccini, Borgo Po, Circoscrizione 8, Torino, Piemonte, 10131, Italia","{""coordinates"": [7.697004, 45.05956], ""type"": ""Point""}","Museo Nazionale della Montagna Duca degli Abruzzi, 7, Piazzale Monte dei Cappuccini, Borgo Po, Circoscrizione 8, Torino, Piemonte, 10131, Italia",tourism,museum
208,Museo Regionale di Scienze Naturali,Museo Regionale di Scienze Naturali,"['...Per quanto riguarda le scienze, è sicuramente da ricordare il Museo Regionale di Scienze Naturali, tra i maggiori in Italia dello specifico settore, e il Museo della Sindone, che illustra al visitatore le scoperte scientifiche sul telo sindonico....']","Museo Regionale di Scienze Naturali, 36, Via Giovanni Giolitti, Borgo Nuovo, Circoscrizione 1, Torino, Piemonte, 10123, Italia","{""coordinates"": [7.688691, 45.064629], ""type"": ""Point""}","Museo Regionale di Scienze Naturali, 36, Via Giovanni Giolitti, Borgo Nuovo, Circoscrizione 1, Torino, Piemonte, 10123, Italia",tourism,museum
209,Museo della Sindone,Museo della Sindone,"['...Per quanto riguarda le scienze, è sicuramente da ricordare il Museo Regionale di Scienze Naturali, tra i maggiori in Italia dello specifico settore, e il Museo della Sindone, che illustra al visitatore le scoperte scientifiche sul telo sindonico....']","Museo Della Sindone, 28, Via San Domenico, Quadrilatero Romano, Circoscrizione 1, Torino, Piemonte, 10122, Italia","{""coordinates"": [7.676579, 45.07614], ""type"": ""Point""}","Museo Della Sindone, 28, Via San Domenico, Quadrilatero Romano, Circoscrizione 1, Torino, Piemonte, 10122, Italia",tourism,museum
210,Museo dell'astronomia e Planetario,Museo dell'astronomia e Planetario,"[""...Vi sono quattro musei nazionali (Museo del Cinema, Museo dell'automobile, Museo della montagna, Museo del Risorgimento) e numerosi altri musei di rilevanza nazionale ed internazionale come il Museo egizio, l'Armeria Reale, ora ricompresa nei Musei Reali, il Museo d'Arte Orientale, il Museo dell'Astronomia e Planetario, il J-Museum a cui si aggiungeva, fino al 2015, il Museo dello sport...."", ""...Da ricordare il Museo dell'astronomia e Planetario di Torino, che sorge accanto dell'Osservatorio astronomico di Torino a Pino Torinese, cittadina collinare nei pressi immediati del capoluogo piemontese....""]","Infini TO - Planetario e Museo dell'Astronomia e dello Spazio, 30, Via Osservatorio, Pino Torinese, Torino, Piemonte, 10025, Italia","{""coordinates"": [7.761884, 45.039553], ""type"": ""Point""}","Infini TO - Planetario e Museo dell'Astronomia e dello Spazio, 30, Via Osservatorio, Pino Torinese, Torino, Piemonte, 10025, Italia",tourism,museum
212,Museo A come Ambiente,Museo A come Ambiente,"['...Nel 2004 è stato inaugurato il Museo A come Ambiente, il primo in Europa interamente dedicato alle tematiche ambientali....']","MAca - Museo A come Ambiente, 90, Corso Umbria, Basso San Donato, Circoscrizione 4, Torino, Piemonte, 10144, Italia","{""coordinates"": [7.663713, 45.089994], ""type"": ""Point""}","MAca - Museo A come Ambiente, 90, Corso Umbria, Basso San Donato, Circoscrizione 4, Torino, Piemonte, 10144, Italia",tourism,museum
213,Museo della Radio e della Televisione,Museo della Radio e della Televisione,"[""...Assieme a queste tre sedi, da quando ha iniziato i suoi programmi nel 1954, il centro di Torino (ospitante il Museo della Radio e della Televisione) è stato anche il primo dell'azienda televisiva....""]","Museo della Radio e della Televisione, 16, Via Giuseppe Verdi, Borgo Nuovo, Circoscrizione 1, Torino, Piemonte, 10124, Italia","{""coordinates"": [7.691766, 45.0685], ""type"": ""Point""}","Museo della Radio e della Televisione, 16, Via Giuseppe Verdi, Borgo Nuovo, Circoscrizione 1, Torino, Piemonte, 10124, Italia",tourism,museum
214,Ospedale,Ospedale,"[""...Una delle più importanti produzioni ambientate a Torino è stata la soap opera CentoVetrine che ha utilizzato la gran parte delle location esterne per le case dei protagonisti, il commissariato Franco Balbis, il carcere, l'Ospedale e le principali piazze....""]","Ospedale, Corso Torino, Carignano, Torino, Piemonte, 10041, Italia","{""coordinates"": [7.67894, 44.910862], ""type"": ""Point""}","Ospedale, Corso Torino, Carignano, Torino, Piemonte, 10041, Italia",amenity,hospital
215,Palazzo Chiablese,Palazzo Chiablese,"[""*...Nel 1956 venne aperto il Museo nazionale del Cinema, dapprima ospitato a Palazzo Chiablese e poi, dal 2000, nell'imponente sede della Mole Antonelliana....""]","Palazzo Chiablese, Centro, Circoscrizione 1, Torino, Piemonte, 10122, Italia","{""coordinates"": [7.685054, 45.072926], ""type"": ""Point""}","Palazzo Chiablese, Centro, Circoscrizione 1, Torino, Piemonte, 10122, Italia",historic,manor
216,Eliseo,Eliseo,"[""...Sono nati a Torino il primo Cinema d'essai italiano (il Romano nella Galleria Subalpina, nel 1971), la principale associazione cinematografica nazionale (l'Aiace Torino) e la prima multisala del Paese (l'Eliseo, nel 1983)....""]","cinema Eliseo, 42, Via Monginevro, Cenisia, Circoscrizione 3, Torino, Piemonte, 10139, Italia","{""coordinates"": [7.650141, 45.065131], ""type"": ""Point""}","cinema Eliseo, 42, Via Monginevro, Cenisia, Circoscrizione 3, Torino, Piemonte, 10139, Italia",building,commercial
218,Piazza Statuto,Piazza Statuto,"[""...Nel 1765 Benedetto Alfieri ebbe l'incarico di rifare i portici di piazza Palazzo di Città mentre nel corso del XIX secolo si aggiunsero quelli dell'attuale piazza Vittorio Veneto, piazza Carlo Felice e piazza Statuto...."", '*...Torino violenta. Un poliziesco interamente girato a Torino. Sono numerosi i luoghi riconoscibili della città, come Piazza Statuto, Piazza Cavour e Corso Francia....', '*...La Fontana del Frejus di Piazza Statuto fu ideata dal conte Marcello Panissera per ricordare l\'inaugurazione dell\'omonimo traforo ed è indicata dagli esoteristi come il ""cuore nero"" della città, per due motivi:...', ""...Ospitava infatti il patibolo, che rimase per secoli in piazza Statuto e che venne poi spostato dai francesi all'incrocio tra corso Regina Margherita e Via Cigna:..."", ""*...Nel 1765 Benedetto Alfieri ebbe l'incarico di rifare i portici di piazza Palazzo di Città mentre nel corso del XIX secolo si aggiunsero quelli dell'attuale piazza Vittorio Veneto, piazza Carlo Felice e piazza Statuto...."", ""*...Ospitava infatti il patibolo, che rimase per secoli in piazza Statuto e che venne poi spostato dai francesi all'incrocio tra corso Regina Margherita e Via Cigna:...""]","Piazza Statuto, Quadrilatero Romano, Circoscrizione 1, Torino, Piemonte, 10140, Italia","{""coordinates"": [7.67221, 45.076028], ""type"": ""Point""}","Piazza Statuto, Quadrilatero Romano, Circoscrizione 1, Torino, Piemonte, 10140, Italia",highway,residential
219,Piazza Cavour,Piazza Cavour,"['*...Torino violenta. Un poliziesco interamente girato a Torino. Sono numerosi i luoghi riconoscibili della città, come Piazza Statuto, Piazza Cavour e Corso Francia....']","Piazza Camillo Benso Conte di Cavour, Borgo Nuovo, Circoscrizione 1, Torino, Piemonte, 10123, Italia","{""coordinates"": [7.688865, 45.063039], ""type"": ""Point""}","Piazza Camillo Benso Conte di Cavour, Borgo Nuovo, Circoscrizione 1, Torino, Piemonte, 10123, Italia",highway,pedestrian
221,Palazzo Saluzzo Paesana,Palazzo Saluzzo Paesana,"['*...Il divo. Le riprese sono state effettuate a Palazzo Saluzzo Paesana, a Palazzo Birago di Borgaro, a Palazzo dei Draghi, in via Carlo Alberto, nella Casa Circondariale ""Lorusso e Cutugno"", al Palazzo Civico e al Ponte Rossini....']","Palazzo Saluzzo di Paesana, Via Giuseppe Garibaldi, Quadrilatero Romano, Circoscrizione 1, Torino, Piemonte, 10122, Italia","{""coordinates"": [7.676808, 45.074715], ""type"": ""Point""}","Palazzo Saluzzo di Paesana, Via Giuseppe Garibaldi, Quadrilatero Romano, Circoscrizione 1, Torino, Piemonte, 10122, Italia",building,yes
222,Palazzo Birago di Borgaro,Palazzo Birago di Borgaro,"['*...Il divo. Le riprese sono state effettuate a Palazzo Saluzzo Paesana, a Palazzo Birago di Borgaro, a Palazzo dei Draghi, in via Carlo Alberto, nella Casa Circondariale ""Lorusso e Cutugno"", al Palazzo Civico e al Ponte Rossini....']","Palazzo Birago di Borgaro, Via Carlo Alberto, Centro, Circoscrizione 1, Torino, Piemonte, 10123, Italia","{""coordinates"": [7.685069, 45.066919], ""type"": ""Point""}","Palazzo Birago di Borgaro, Via Carlo Alberto, Centro, Circoscrizione 1, Torino, Piemonte, 10123, Italia",tourism,information
224,via Carlo Alberto,via Carlo Alberto,"['*...Il divo. Le riprese sono state effettuate a Palazzo Saluzzo Paesana, a Palazzo Birago di Borgaro, a Palazzo dei Draghi, in via Carlo Alberto, nella Casa Circondariale ""Lorusso e Cutugno"", al Palazzo Civico e al Ponte Rossini....']","Via Carlo Alberto, Centro, Circoscrizione 1, Torino, Piemonte, 10123, Italia","{""coordinates"": [7.683242, 45.063854], ""type"": ""Point""}","Via Carlo Alberto, Centro, Circoscrizione 1, Torino, Piemonte, 10123, Italia",highway,pedestrian
225,"Casa Circondariale ""Lorusso e Cutugno""","Casa Circondariale ""Lorusso e Cutugno""","['*...Il divo. Le riprese sono state effettuate a Palazzo Saluzzo Paesana, a Palazzo Birago di Borgaro, a Palazzo dei Draghi, in via Carlo Alberto, nella Casa Circondariale ""Lorusso e Cutugno"", al Palazzo Civico e al Ponte Rossini....']","Casa circondariale Lorusso e Cutugno (Le Vallette), Piazzale Vallette, Vallette, Circoscrizione 5, Torino, Piemonte, 10151, Italia","{""coordinates"": [7.618904, 45.103432], ""type"": ""Point""}","Casa circondariale Lorusso e Cutugno (Le Vallette), Piazzale Vallette, Vallette, Circoscrizione 5, Torino, Piemonte, 10151, Italia",amenity,prison
226,Palazzo Civico,Palazzo Civico,"['*...Il divo. Le riprese sono state effettuate a Palazzo Saluzzo Paesana, a Palazzo Birago di Borgaro, a Palazzo dei Draghi, in via Carlo Alberto, nella Casa Circondariale ""Lorusso e Cutugno"", al Palazzo Civico e al Ponte Rossini....']","Palazzo Civico, Via Camillo Benso di Cavour, Vigone, Torino, Piemonte, 10067, Italia","{""coordinates"": [7.494509, 44.842234], ""type"": ""Point""}","Palazzo Civico, Via Camillo Benso di Cavour, Vigone, Torino, Piemonte, 10067, Italia",building,civic
227,Ponte Rossini,Ponte Rossini,"['*...Il divo. Le riprese sono state effettuate a Palazzo Saluzzo Paesana, a Palazzo Birago di Borgaro, a Palazzo dei Draghi, in via Carlo Alberto, nella Casa Circondariale ""Lorusso e Cutugno"", al Palazzo Civico e al Ponte Rossini....']","Ponte Gioachino Rossini, Rossini, Circoscrizione 7, Torino, Piemonte, 10124, Italia","{""coordinates"": [7.694406, 45.074109], ""type"": ""Point""}","Ponte Gioachino Rossini, Rossini, Circoscrizione 7, Torino, Piemonte, 10124, Italia",highway,residential
228,via Palazzo di Città,via Palazzo di Città,"['*...Vincere. Il film è stato girato in diverse location torinesi, tra cui via Palazzo di Città, Galleria San Federico, l\'ex manicomio di Collegno e l\'ex cronicario denominato popolarmente ""Poveri Vecchi""....']","Via Palazzo di Città, Centro, Circoscrizione 1, Torino, Piemonte, 10123, Italia","{""coordinates"": [7.684916, 45.071909], ""type"": ""Point""}","Via Palazzo di Città, Centro, Circoscrizione 1, Torino, Piemonte, 10123, Italia",highway,pedestrian
229,Galleria San Federico,Galleria San Federico,"['*...Vincere. Il film è stato girato in diverse location torinesi, tra cui via Palazzo di Città, Galleria San Federico, l\'ex manicomio di Collegno e l\'ex cronicario denominato popolarmente ""Poveri Vecchi""....']","Galleria San Federico, Centro, Circoscrizione 1, Torino, Piemonte, 10123, Italia","{""coordinates"": [7.683076, 45.0689], ""type"": ""Point""}","Galleria San Federico, Centro, Circoscrizione 1, Torino, Piemonte, 10123, Italia",highway,footway
231,Galleria Umberto I,Galleria Umberto I,"['*...Lazzaro felice. Nelle ultime settimane la regista ha girato la città focalizzando le riprese tra Galleria Umberto I, Porta Palazzo e la periferia nord....']","Galleria Umberto I, Quadrilatero Romano, Circoscrizione 1, Torino, Piemonte, 10122, Italia","{""coordinates"": [7.683036, 45.074593], ""type"": ""Point""}","Galleria Umberto I, Quadrilatero Romano, Circoscrizione 1, Torino, Piemonte, 10122, Italia",highway,footway
232,PalaRuffini,PalaRuffini,"['...Il PalaRuffini, conosciuto anche come Palazzetto dello Sport;...', '...Decisamente più piccolo (circa 4000 posti), ma ugualmente importante per la storia sportiva cittadina, è il PalaRuffini....']","Palazzetto dello Sport Gianni Asti, Viale Burdin, Rione Lancia, Circoscrizione 3, Torino, Piemonte, 10141, Italia","{""coordinates"": [7.632421, 45.057686], ""type"": ""Point""}","Palazzetto dello Sport Gianni Asti, Viale Burdin, Rione Lancia, Circoscrizione 3, Torino, Piemonte, 10141, Italia",leisure,stadium
233,Palazzetto dello Sport,Palazzetto dello Sport,"['*...Il PalaRuffini, conosciuto anche come Palazzetto dello Sport;...']","Palazzetto dello Sport, Via Luigi Burgo, Pescarito, San Mauro Torinese, Torino, Piemonte, 10099, Italia","{""coordinates"": [7.742028, 45.110522], ""type"": ""Point""}","Palazzetto dello Sport, Via Luigi Burgo, Pescarito, San Mauro Torinese, Torino, Piemonte, 10099, Italia",leisure,sports_centre
235,PalaStampa,PalaStampa,"['*...Il PalaTorino, già PalaStampa e Mazda Palace (chiuso dal 2011);...']","Palastampa, Strada della Continassa, Continassa, Circoscrizione 5, Torino, Piemonte, 10151, Italia","{""coordinates"": [7.633924, 45.10806], ""type"": ""Point""}","Palastampa, Strada della Continassa, Continassa, Circoscrizione 5, Torino, Piemonte, 10151, Italia",building,yes
236,Palasport Olimpico,Palasport Olimpico,"[""...Il Palasport Olimpico, oggi PalaAlpitour per motivi di sponsorizzazione (detto anche PalaIsozaki dal nome del suo ideatore, l'architetto Arata Isozaki)...."", '*...Campionato mondiale di pallavolo maschile 2018, svoltosi nel Settembre 2018, nel quale la terza fase e la fase finale sono state disputate al Palasport Olimpico (PalaAlpitour o PalaIsozaki) di Torino....', ""...Fra le strutture con una capienza superiore ai 10000 posti si citino l'Allianz Stadium, lo stadio Olimpico Grande Torino, il Palasport Olimpico e il PalaTorino, quest'ultimo chiuso però dal 2011;...""]","PalaAlpitour - Palasport Olimpico, Piazzale Grande Torino, Santa Rita, Circoscrizione 2, Torino, Piemonte, 10134, Italia","{""coordinates"": [7.652357, 45.041726], ""type"": ""Point""}","PalaAlpitour - Palasport Olimpico, Piazzale Grande Torino, Santa Rita, Circoscrizione 2, Torino, Piemonte, 10134, Italia",amenity,events_venue
237,PalaAlpitour,PalaAlpitour,"[""*...Il Palasport Olimpico, oggi PalaAlpitour per motivi di sponsorizzazione (detto anche PalaIsozaki dal nome del suo ideatore, l'architetto Arata Isozaki)...."", '*...""EUROMINERALEXPO"": fiera dedicata a minerali, fossili, pietre preziose e bigiotteria, vero punto di riferimento per studiosi e appassionati di geologia, che si svolge a Torino da oltre cinquant\'anni, solitamente il primo fine settimana di Ottobre, ospitata nel corso degli anni in varie sedi, dal vecchio ""Palazzo a Vela"", al Lingotto Fiere, fino al PalaAlpitour....', '*...Campionato mondiale di pallavolo maschile 2018, svoltosi nel Settembre 2018, nel quale la terza fase e la fase finale sono state disputate al Palasport Olimpico (PalaAlpitour o PalaIsozaki) di Torino....', ""*...Eurovision Song Contest 2022 (10, 12 e 14 Maggio 2022): la Città di Torino ha ospitato l'Eurofestival presso il PalaOlimpico (PalaAlpitour o PalaIsozaki), in seguito alla vittoria dei Måneskin con Zitti e buoni nell'edizione precedente; è stata la terza edizione della manifestazione musicale a svolgersi in Italia, dopo le due edizioni del 1965 e del 1991....""]","PalaAlpitour - Palasport Olimpico, Piazzale Grande Torino, Santa Rita, Circoscrizione 2, Torino, Piemonte, 10134, Italia","{""coordinates"": [7.652357, 45.041726], ""type"": ""Point""}","PalaAlpitour - Palasport Olimpico, Piazzale Grande Torino, Santa Rita, Circoscrizione 2, Torino, Piemonte, 10134, Italia",amenity,events_venue
238,PalaIsozaki,PalaIsozaki,"[""*...Il Palasport Olimpico, oggi PalaAlpitour per motivi di sponsorizzazione (detto anche PalaIsozaki dal nome del suo ideatore, l'architetto Arata Isozaki)...."", '*...Campionato mondiale di pallavolo maschile 2018, svoltosi nel Settembre 2018, nel quale la terza fase e la fase finale sono state disputate al Palasport Olimpico (PalaAlpitour o PalaIsozaki) di Torino....', ""*...Eurovision Song Contest 2022 (10, 12 e 14 Maggio 2022): la Città di Torino ha ospitato l'Eurofestival presso il PalaOlimpico (PalaAlpitour o PalaIsozaki), in seguito alla vittoria dei Måneskin con Zitti e buoni nell'edizione precedente; è stata la terza edizione della manifestazione musicale a svolgersi in Italia, dopo le due edizioni del 1965 e del 1991....""]","PalaAlpitour - Palasport Olimpico, Piazzale Grande Torino, Santa Rita, Circoscrizione 2, Torino, Piemonte, 10134, Italia","{""coordinates"": [7.652357, 45.041726], ""type"": ""Point""}","PalaAlpitour - Palasport Olimpico, Piazzale Grande Torino, Santa Rita, Circoscrizione 2, Torino, Piemonte, 10134, Italia",amenity,events_venue
240,Parco Dora,Parco Dora,"['*...Kappa FuturFestival: nato come evento artistico nel 2009, è, dal 2012, un festival di musica elettronica diurno che si svolge al Parco Dora....']","Parco commerciale Dora, Salita Michelangelo Garove, Parco Dora (Spina 3), Circoscrizione 4, Torino, Piemonte, 10144, Italia","{""coordinates"": [7.668373, 45.087884], ""type"": ""Point""}","Parco commerciale Dora, Salita Michelangelo Garove, Parco Dora (Spina 3), Circoscrizione 4, Torino, Piemonte, 10144, Italia",shop,mall
241,Cimitero monumentale,Cimitero monumentale,"['...Fra questi, quello maggiore per importanza e dimensioni è certamente il Cimitero Monumentale, il quale contiene numerosi monumenti funebri di personaggi famosi e di pregevole fattura....', '*...Simboli massonici sono presenti in molti palazzi e in alcune tombe del Cimitero monumentale di Torino....']","Cimitero Monumentale, Corso Novara, Rossini, Circoscrizione 7, Torino, Piemonte, 10153, Italia","{""coordinates"": [7.702657, 45.077302], ""type"": ""Point""}","Cimitero Monumentale, Corso Novara, Rossini, Circoscrizione 7, Torino, Piemonte, 10153, Italia",highway,bus_stop
243,corso Regina Margherita,corso Regina Margherita,"['...Di norma i più antichi, come Corso Vittorio Emanuele, Corso Francia e Corso Regina Margherita, presentano una carreggiata centrale con almeno due corsie per senso di marcia, divisa da alberate dalle altre due carreggiate laterali, dette controviali....', ""*...Ospitava infatti il patibolo, che rimase per secoli in piazza Statuto e che venne poi spostato dai francesi all'incrocio tra corso Regina Margherita e Via Cigna:..."", '*...Di norma i più antichi, come Corso Vittorio Emanuele, Corso Francia e Corso Regina Margherita, presentano una carreggiata centrale con almeno due corsie per senso di marcia, divisa da alberate dalle altre due carreggiate laterali, dette controviali....']","Corso Regina Margherita, Quadrilatero Romano, Circoscrizione 1, Torino, Piemonte, 10152, Italia","{""coordinates"": [7.685203, 45.076026], ""type"": ""Point""}","Corso Regina Margherita, Quadrilatero Romano, Circoscrizione 1, Torino, Piemonte, 10152, Italia",highway,tertiary
244,Via Cigna,Via Cigna,"[""*...Ospitava infatti il patibolo, che rimase per secoli in piazza Statuto e che venne poi spostato dai francesi all'incrocio tra corso Regina Margherita e Via Cigna:...""]","Via Francesco Cigna, Valdocco, Circoscrizione 7, Torino, Piemonte, 10122, Italia","{""coordinates"": [7.676598, 45.07958], ""type"": ""Point""}","Via Francesco Cigna, Valdocco, Circoscrizione 7, Torino, Piemonte, 10122, Italia",highway,tertiary
