,entity,to_search,snippet,address,coordinates,name_location,class,type
63,Armenian Church,Armenian Church,['*...Saint Mary Armenian Church (1983) - Chiesa armena di Santa Maria ;...'],"Armenian Emmanuel Church of the Nazarene, 2537, Bayview Avenue, St. Andrew, Don Valley West, North York, Toronto, Golden Horseshoe, Ontario, M2L 0A3, Canada","{""coordinates"": [-79.383286, 43.745674], ""type"": ""Point""}","Armenian Emmanuel Church of the Nazarene, 2537, Bayview Avenue, St. Andrew, Don Valley West, North York, Toronto, Golden Horseshoe, Ontario, M2L 0A3, Canada",amenity,place_of_worship
64,Times Square,Times Square,"['*...Yonge Dundas Square, piazza costruita nel 1998, considerata la Times Square della città....']","New Times Square, 109, Front Street East, St. Lawrence, Toronto Centre, Old Toronto, Toronto, Golden Horseshoe, Ontario, M5A 4S5, Canada","{""coordinates"": [-79.370718, 43.64949], ""type"": ""Point""}","New Times Square, 109, Front Street East, St. Lawrence, Toronto Centre, Old Toronto, Toronto, Golden Horseshoe, Ontario, M5A 4S5, Canada",place,house
66,Miami,Miami,"[""*...Secondo il censimento del 2016 Toronto conta 2\xa0731\xa0571 abitanti, diventando la città più popolosa del Canada e la quinta di tutto il Nord America, inoltre, da uno studio fatto dal Programma delle Nazioni Unite per lo sviluppo, risulta essere la seconda città al mondo per numero di residenti nati all'estero, dopo Miami in Florida....""]","Miami Fades, Yonge Street, Yonge & Eglinton, Don Valley West, Old Toronto, Toronto, Golden Horseshoe, Ontario, M4P 2H7, Canada","{""coordinates"": [-79.399955, 43.713405], ""type"": ""Point""}","Miami Fades, Yonge Street, Yonge & Eglinton, Don Valley West, Old Toronto, Toronto, Golden Horseshoe, Ontario, M4P 2H7, Canada",shop,hairdresser
67,Florida,Florida,"[""*...Secondo il censimento del 2016 Toronto conta 2\xa0731\xa0571 abitanti, diventando la città più popolosa del Canada e la quinta di tutto il Nord America, inoltre, da uno studio fatto dal Programma delle Nazioni Unite per lo sviluppo, risulta essere la seconda città al mondo per numero di residenti nati all'estero, dopo Miami in Florida....""]","Florida Crescent, Humber River—Black Creek, North York, Toronto, Golden Horseshoe, Ontario, M9M 1S3, Canada","{""coordinates"": [-79.541445, 43.734557], ""type"": ""Point""}","Florida Crescent, Humber River—Black Creek, North York, Toronto, Golden Horseshoe, Ontario, M9M 1S3, Canada",highway,residential
75,punjabi,punjabi,"['*...Omni Television appartiene al gruppo ""Rogers Communications"" e iniziò a trasmettere nel 1979. Trasmette in italiano, portoghese, cantonese, cinese, inglese (per l\'edizione del Sud dell\'Asia), punjabi, coreano, tagalog....', '...CHIN trasmette dalla rete CITY-TV per dieci ore alla settimana, le mattine del sabato e della domenica. La CHIN produce programmi televisivi in portoghese, lingue caraibiche, pakistano, hindi, polacco, persiano, russo, punjabi, cinese e italiano. La CHIN ha iniziato a trasmettere nel 1967, originariamente su ""CIII-TV"", successivamente su ""CKVR-TV""....']","Punjabi Chaat Palace, Gerrard Street East, Gerrard India Bazaar, Toronto—Danforth, Old Toronto, Toronto, Golden Horseshoe, Ontario, M4L 1Y9, Canada","{""coordinates"": [-79.321463, 43.672517], ""type"": ""Point""}","Punjabi Chaat Palace, Gerrard Street East, Gerrard India Bazaar, Toronto—Danforth, Old Toronto, Toronto, Golden Horseshoe, Ontario, M4L 1Y9, Canada",amenity,cafe
76,CITY-TV,CITY-TV,"['*...CHIN trasmette dalla rete CITY-TV per dieci ore alla settimana, le mattine del sabato e della domenica. La CHIN produce programmi televisivi in portoghese, lingue caraibiche, pakistano, hindi, polacco, persiano, russo, punjabi, cinese e italiano. La CHIN ha iniziato a trasmettere nel 1967, originariamente su ""CIII-TV"", successivamente su ""CKVR-TV""....']","City TV/OMNI TV, Victoria Street, Downtown Yonge, Toronto Centre, Old Toronto, Toronto, Golden Horseshoe, Ontario, M5B 1T8, Canada","{""coordinates"": [-79.379079, 43.655974], ""type"": ""Point""}","City TV/OMNI TV, Victoria Street, Downtown Yonge, Toronto Centre, Old Toronto, Toronto, Golden Horseshoe, Ontario, M5B 1T8, Canada",building,yes
80,West End,West End,"['*...È il terzo più grande quartiere dei teatri di lingua inglese al mondo, dopo il West End di Londra e Broadway a New York....']","West End Alternative School, 777, Bloor Street West, Koreatown, University—Rosedale, Old Toronto, Toronto, Golden Horseshoe, Ontario, M6G 1L6, Canada","{""coordinates"": [-79.419423, 43.662625], ""type"": ""Point""}","West End Alternative School, 777, Bloor Street West, Koreatown, University—Rosedale, Old Toronto, Toronto, Golden Horseshoe, Ontario, M6G 1L6, Canada",amenity,school
82,Broadway,Broadway,"['*...È il terzo più grande quartiere dei teatri di lingua inglese al mondo, dopo il West End di Londra e Broadway a New York....']","Broadway Avenue, Yonge & Eglinton, Toronto—St. Paul's, Old Toronto, Toronto, Golden Horseshoe, Ontario, M4P 1T4, Canada","{""coordinates"": [-79.396396, 43.710094], ""type"": ""Point""}","Broadway Avenue, Yonge & Eglinton, Toronto—St. Paul's, Old Toronto, Toronto, Golden Horseshoe, Ontario, M4P 1T4, Canada",highway,residential
83,New York,New York,"['*...È il terzo più grande quartiere dei teatri di lingua inglese al mondo, dopo il West End di Londra e Broadway a New York....']","New York Fries, 260, Yonge Street, Downtown Yonge, Toronto Centre, Old Toronto, Toronto, Golden Horseshoe, Ontario, M5B 2L9, Canada","{""coordinates"": [-79.381689, 43.655638], ""type"": ""Point""}","New York Fries, 260, Yonge Street, Downtown Yonge, Toronto Centre, Old Toronto, Toronto, Golden Horseshoe, Ontario, M5B 2L9, Canada",amenity,fast_food
86,Memphis,Memphis,['*...Insieme ai Raptors vennero istituiti anche i Vancouver Grizzlies ma lo scarso interesse del pubblico e i fondi ristretti convinsero la società a trasferirsi a Memphis nel Tennessee....'],"Memphis Condominium, 942, Yonge Street, Yorkville, University—Rosedale, Old Toronto, Toronto, Golden Horseshoe, Ontario, M4Y 2H2, Canada","{""coordinates"": [-79.389007, 43.674654], ""type"": ""Point""}","Memphis Condominium, 942, Yonge Street, Yorkville, University—Rosedale, Old Toronto, Toronto, Golden Horseshoe, Ontario, M4Y 2H2, Canada",place,house
88,Lamport Stadium,Lamport Stadium,['*...Giocano le loro partite al Lamport Stadium....'],"Allan Lamport Stadium, 1151, King Street West, Little Tibet, Spadina—Fort York, Old Toronto, Toronto, Golden Horseshoe, Ontario, M6K 0C7, Canada","{""coordinates"": [-79.423209, 43.638993], ""type"": ""Point""}","Allan Lamport Stadium, 1151, King Street West, Little Tibet, Spadina—Fort York, Old Toronto, Toronto, Golden Horseshoe, Ontario, M6K 0C7, Canada",leisure,stadium
