,entity,to_search,snippet,address,coordinates,name_location,class,type
78,Commerce Court,Commerce Court,"['*...The Financial District contains the First Canadian Place, Toronto-Dominion Centre, Scotia Plaza, Royal Bank Plaza, Commerce Court and Brookfield Place....']","Commerce Court, PATH, Financial District, Toronto Centre, Old Toronto, Toronto, Golden Horseshoe, Ontario, M5L 1A9, Canada","{""coordinates"": [-79.378981, 43.648019], ""type"": ""Point""}","Commerce Court, PATH, Financial District, Toronto Centre, Old Toronto, Toronto, Golden Horseshoe, Ontario, M5L 1A9, Canada",amenity,food_court
79,Brookfield Place,Brookfield Place,"['*...The Financial District contains the First Canadian Place, Toronto-Dominion Centre, Scotia Plaza, Royal Bank Plaza, Commerce Court and Brookfield Place....']","Brookfield Place, Wellington Street West, Financial District, Toronto Centre, Old Toronto, Toronto, Golden Horseshoe, Ontario, M5L 1A0, Canada","{""coordinates"": [-79.378349, 43.647348], ""type"": ""Point""}","Brookfield Place, Wellington Street West, Financial District, Toronto Centre, Old Toronto, Toronto, Golden Horseshoe, Ontario, M5L 1A0, Canada",building,office
81,St. Lawrence,St. Lawrence,"['*...This area includes, among others, the neighbourhoods of St. James Town, Garden District, St. Lawrence, Corktown, and Church and Wellesley....', ""...Other commercial areas popular with tourists include the PATH network, which is the world's largest underground shopping complex, as well as Kensington Market and St. Lawrence Market...."", '...City shopping areas include the Yorkville neighbourhood, Queen West, Harbourfront, the Entertainment District, the Financial District, and the St. Lawrence Market neighbourhood....']","St. Lawrence Centre for the Arts, 27, Front Street East, King East, Toronto Centre, Old Toronto, Toronto, Golden Horseshoe, Ontario, M5E 1C9, Canada","{""coordinates"": [-79.375174, 43.647355], ""type"": ""Point""}","St. Lawrence Centre for the Arts, 27, Front Street East, King East, Toronto Centre, Old Toronto, Toronto, Golden Horseshoe, Ontario, M5E 1C9, Canada",amenity,theatre
84,Kensington Market,Kensington Market,"['*...East and west of downtown, neighbourhoods such as Kensington Market, Chinatown, Leslieville, Cabbagetown and Riverdale are home to bustling commercial and cultural areas as well as communities of artists with studio lofts, with many middle- and upper-class professionals.[citation needed]...', ""*...This diversity is reflected in Toronto's ethnic neighbourhoods, which include Chinatown, Corso Italia, Greektown, Kensington Market, Koreatown, Little India, Little Italy, Little Jamaica, Little Portugal and Roncesvalles (Polish community).\nAccording to the 2021 census, religious groups in Toronto included:..."", ""*...Other commercial areas popular with tourists include the PATH network, which is the world's largest underground shopping complex, as well as Kensington Market and St. Lawrence Market...."", '*...Other notable neighbourhoods and attractions in Toronto include The Beaches, the Toronto Islands, Kensington Market, Fort York, and the Hockey Hall of Fame....']","Kensington Market Community Marker, St. Andrew Street, Kensington Market, University—Rosedale, Old Toronto, Toronto, Golden Horseshoe, Ontario, M5T 1K6, Canada","{""coordinates"": [-79.398899, 43.654378], ""type"": ""Point""}","Kensington Market Community Marker, St. Andrew Street, Kensington Market, University—Rosedale, Old Toronto, Toronto, Golden Horseshoe, Ontario, M5T 1K6, Canada",historic,monument
86,Little Italy,Little Italy,"['*...Other neighbourhoods in the central city retain an ethnic identity, including two smaller Chinatowns, the Greektown area, Little Italy, Portugal Village, and Little India, among others.[citation needed]...', ""*...This diversity is reflected in Toronto's ethnic neighbourhoods, which include Chinatown, Corso Italia, Greektown, Kensington Market, Koreatown, Little India, Little Italy, Little Jamaica, Little Portugal and Roncesvalles (Polish community).\nAccording to the 2021 census, religious groups in Toronto included:...""]","Little Italy Dental Practice, 536, College Street, Little Italy, University—Rosedale, Old Toronto, Toronto, Golden Horseshoe, Ontario, M6G 1A6, Canada","{""coordinates"": [-79.411118, 43.655916], ""type"": ""Point""}","Little Italy Dental Practice, 536, College Street, Little Italy, University—Rosedale, Old Toronto, Toronto, Golden Horseshoe, Ontario, M6G 1A6, Canada",amenity,dentist
87,Little India,Little India,"['*...Other neighbourhoods in the central city retain an ethnic identity, including two smaller Chinatowns, the Greektown area, Little Italy, Portugal Village, and Little India, among others.[citation needed]...', ""*...This diversity is reflected in Toronto's ethnic neighbourhoods, which include Chinatown, Corso Italia, Greektown, Kensington Market, Koreatown, Little India, Little Italy, Little Jamaica, Little Portugal and Roncesvalles (Polish community).\nAccording to the 2021 census, religious groups in Toronto included:...""]","Little India, 255, Queen Street West, Entertainment District, Spadina—Fort York, Old Toronto, Toronto, Golden Horseshoe, Ontario, M5V 1Z4, Canada","{""coordinates"": [-79.388925, 43.650225], ""type"": ""Point""}","Little India, 255, Queen Street West, Entertainment District, Spadina—Fort York, Old Toronto, Toronto, Golden Horseshoe, Ontario, M5V 1Z4, Canada",amenity,restaurant
88,Crescent Town,Crescent Town,"['*...Neighbourhoods such as Crescent Town, Thorncliffe Park, Weston, and Oakwood Village consist mainly of high-rise apartments, which are home to many new immigrant families....']","Crescent Town, Victoria Park Avenue, Scarborough Southwest, Scarborough, Toronto, Golden Horseshoe, Ontario, M4C 5M9, Canada","{""coordinates"": [-79.290433, 43.696142], ""type"": ""Point""}","Crescent Town, Victoria Park Avenue, Scarborough Southwest, Scarborough, Toronto, Golden Horseshoe, Ontario, M4C 5M9, Canada",highway,bus_stop
89,Leaside,Leaside,"['*...The first neighbourhoods affected were Leaside and North Toronto, gradually progressing into the western neighbourhoods in York.[citation needed]...']","Leaside, Redway Road, Leaside, Don Valley West, East York, Toronto, Golden Horseshoe, Ontario, M4G 1X6, Canada","{""coordinates"": [-79.359754, 43.701311], ""type"": ""Point""}","Leaside, Redway Road, Leaside, Don Valley West, East York, Toronto, Golden Horseshoe, Ontario, M4G 1X6, Canada",railway,junction
90,North Toronto,North Toronto,"['*...The first neighbourhoods affected were Leaside and North Toronto, gradually progressing into the western neighbourhoods in York.[citation needed]...']","Metro Toronto Convention Centre - North Building, Station Street, Harbourfront, Spadina—Fort York, Old Toronto, Toronto, Golden Horseshoe, Ontario, M5V 2X3, Canada","{""coordinates"": [-79.386692, 43.643838], ""type"": ""Point""}","Metro Toronto Convention Centre - North Building, Station Street, Harbourfront, Spadina—Fort York, Old Toronto, Toronto, Golden Horseshoe, Ontario, M5V 2X3, Canada",amenity,convention_centre
91,Bridle Path,Bridle Path,"['...Upscale neighbourhoods were built such as the Bridle Path in North York, the area surrounding the Scarborough Bluffs in Guildwood, and most of central Etobicoke, such as Humber Valley Village, and The Kingsway....']","Old Bridle Path, Moore Park, University—Rosedale, Old Toronto, Toronto, Golden Horseshoe, Ontario, M4T 1C7, Canada","{""coordinates"": [-79.376995, 43.686735], ""type"": ""Point""}","Old Bridle Path, Moore Park, University—Rosedale, Old Toronto, Toronto, Golden Horseshoe, Ontario, M4T 1C7, Canada",highway,residential
92,Humber Valley Village,Humber Valley Village,"['*...Upscale neighbourhoods were built such as the Bridle Path in North York, the area surrounding the Scarborough Bluffs in Guildwood, and most of central Etobicoke, such as Humber Valley Village, and The Kingsway....']","Humber Valley Village Junior Middle School, 65, Hartfield Road, Humber Valley, Etobicoke Centre, Etobicoke, Toronto, Golden Horseshoe, Ontario, M9A 3E1, Canada","{""coordinates"": [-79.526501, 43.665415], ""type"": ""Point""}","Humber Valley Village Junior Middle School, 65, Hartfield Road, Humber Valley, Etobicoke Centre, Etobicoke, Toronto, Golden Horseshoe, Ontario, M9A 3E1, Canada",amenity,school
93,Kingsway,Kingsway,"['...Upscale neighbourhoods were built such as the Bridle Path in North York, the area surrounding the Scarborough Bluffs in Guildwood, and most of central Etobicoke, such as Humber Valley Village, and The Kingsway....']","South Kingsway, Parkdale—High Park, Old Toronto, Toronto, Golden Horseshoe, Ontario, M6S, Canada","{""coordinates"": [-79.47323, 43.635345], ""type"": ""Point""}","South Kingsway, Parkdale—High Park, Old Toronto, Toronto, Golden Horseshoe, Ontario, M6S, Canada",highway,secondary
94,Don Mills,Don Mills,"['*...One of largest and earliest ""planned communities"" was Don Mills, parts of which were first built in the 1950s....']","Don Mills, Gervais Drive, Flemingdon Park, Don Valley East, North York, Toronto, Golden Horseshoe, Ontario, M3C 1V4, Canada","{""coordinates"": [-79.337426, 43.726835], ""type"": ""Point""}","Don Mills, Gervais Drive, Flemingdon Park, Don Valley East, North York, Toronto, Golden Horseshoe, Ontario, M3C 1V4, Canada",railway,junction
98,Downtown Toronto,Downtown Toronto,"['...The Great Toronto Fire of 1904 destroyed a large section of downtown Toronto....', '*...Over the late 20th century and early 21st century, North York City Centre, Etobicoke City Centre and Scarborough City Centre have emerged as secondary business districts outside Downtown Toronto....', '...The Toronto Islands are close to downtown Toronto, and do not permit private motor vehicles beyond the airport....', ""...Four of these universities are based in downtown Toronto: OCAD, Toronto Metropolitan University, the Université de l'Ontario français, and the University of Toronto...."", '...York University is the only Toronto-based university not situated in downtown Toronto, operating a campus in the northwestern portion of North York, and a secondary campus in midtown Toronto....', '...The University of Toronto in downtown Toronto was where the first recorded college football game was held in November 1861....', '...The Toronto Coach Terminal in downtown Toronto also serves as a hub for intercity bus services in Southern Ontario, served by multiple companies and providing a comprehensive network of services in Ontario and neighbouring provinces and states....']","EDKENT® Media SEO Toronto Downtown, 439, University Avenue, Queen West, Spadina—Fort York, Old Toronto, Toronto, Golden Horseshoe, Ontario, M5G 1Y8, Canada","{""coordinates"": [-79.387426, 43.654438], ""type"": ""Point""}","EDKENT® Media SEO Toronto Downtown, 439, University Avenue, Queen West, Spadina—Fort York, Old Toronto, Toronto, Golden Horseshoe, Ontario, M5G 1Y8, Canada",office,Internet marketing service
99,Spadina Avenue,Spadina Avenue,"['*...A garment industry developed along lower Spadina Avenue, the ""Fashion District""....']","Spadina Avenue, Queen West, Spadina—Fort York, Old Toronto, Toronto, Golden Horseshoe, Ontario, M5V 2L6, Canada","{""coordinates"": [-79.396304, 43.648878], ""type"": ""Point""}","Spadina Avenue, Queen West, Spadina—Fort York, Old Toronto, Toronto, Golden Horseshoe, Ontario, M5V 2L6, Canada",highway,secondary
100,Fashion District,Fashion District,"['...A garment industry developed along lower Spadina Avenue, the ""Fashion District""....', '...Similar areas that retain their industrial character, but are now largely residential are the Fashion District, Corktown, and parts of South Riverdale and Leslieville....']","Fashion District Dental, Richmond Street West, Queen West, Spadina—Fort York, Old Toronto, Toronto, Golden Horseshoe, Ontario, M5V 3P1, Canada","{""coordinates"": [-79.395071, 43.648147], ""type"": ""Point""}","Fashion District Dental, Richmond Street West, Queen West, Spadina—Fort York, Old Toronto, Toronto, Golden Horseshoe, Ontario, M5V 3P1, Canada",amenity,dentist
102,Stockyards,Stockyards,"['...Examples included the Gooderham and Worts Distillery, Canadian Malting Company, the Toronto Rolling Mills, the Union Stockyards and the Davies pork processing facility (the inspiration for the ""Hogtown"" nickname)....', '*...Beginning in the late 19th century, industrial areas were set up on the outskirts, such as West Toronto/The Junction, where the Stockyards relocated in 1903....', ""...In the west end of Old Toronto and York, the Weston/Mount Dennis and The Junction areas still contain factories, meat-packing facilities and rail yards close to medium-density residential, although the Junction's Union Stockyards moved out of Toronto in 1994....""]","The Stockyards, St. Clair Avenue West, Hillcrest Village, Toronto—St. Paul's, Old Toronto, Toronto, Golden Horseshoe, Ontario, M6C 1B1, Canada","{""coordinates"": [-79.426236, 43.681406], ""type"": ""Point""}","The Stockyards, St. Clair Avenue West, Hillcrest Village, Toronto—St. Paul's, Old Toronto, Toronto, Golden Horseshoe, Ontario, M6C 1B1, Canada",amenity,restaurant
103,King Street,King Street,"['*...Some of the companies moved west along King Street, some as far west as Dufferin Street; where the large Massey-Harris farm equipment manufacturing complex was located....', ""*...Canada's Walk of Fame acknowledges the achievements of successful Canadians, with a series of stars on designated blocks of sidewalks along King Street and Simcoe Street....""]","King Street, Yonge Street, Financial District, Toronto Centre, Old Toronto, Toronto, Golden Horseshoe, Ontario, M5C 1B5, Canada","{""coordinates"": [-79.378029, 43.649268], ""type"": ""Point""}","King Street, Yonge Street, Financial District, Toronto Centre, Old Toronto, Toronto, Golden Horseshoe, Ontario, M5C 1B5, Canada",highway,bus_stop
104,Dufferin Street,Dufferin Street,"['*...Some of the companies moved west along King Street, some as far west as Dufferin Street; where the large Massey-Harris farm equipment manufacturing complex was located....']","Dufferin Street, Brockton Village, Little Portugal, Old Toronto, Toronto, Golden Horseshoe, Ontario, M6K 0B9, Canada","{""coordinates"": [-79.429079, 43.64347], ""type"": ""Point""}","Dufferin Street, Brockton Village, Little Portugal, Old Toronto, Toronto, Golden Horseshoe, Ontario, M6K 0B9, Canada",highway,secondary
105,Massey-Harris,Massey-Harris,"['*...Some of the companies moved west along King Street, some as far west as Dufferin Street; where the large Massey-Harris farm equipment manufacturing complex was located....', '*...Many of Toronto\'s former industrial sites close to (or in) downtown have been redeveloped including parts of the Toronto waterfront, the rail yards west of downtown, and Liberty Village, the Massey-Harris district and large-scale development is underway in the West Don Lands.[citation needed]\nThe Gooderham & Worts Distillery produced spirits until 1990, and is preserved today as the ""Distillery District"", the largest and best-preserved collection of Victorian industrial architecture in North America....']","Massey-Harris Company, King Street West, West Queen West, Spadina—Fort York, Old Toronto, Toronto, Golden Horseshoe, Ontario, M6K 1E4, Canada","{""coordinates"": [-79.412695, 43.641781], ""type"": ""Point""}","Massey-Harris Company, King Street West, West Queen West, Spadina—Fort York, Old Toronto, Toronto, Golden Horseshoe, Ontario, M6K 1E4, Canada",historic,memorial
106,Pearson Airport,Pearson Airport,"['*...This trend continues to this day, the largest factories and distribution warehouses are in the suburban environs of Peel and York Regions; but also within the current city: Etobicoke (concentrated around Pearson Airport), North York, and Scarborough.[citation needed]...', '...In 2019, the Government of Ontario released a transit plan for the Greater Toronto Area which includes a new 16-kilometres Ontario Line, Line 1 extension to Richmond Hill Centre and an extension for Line 5 Eglinton to Toronto Pearson Airport....']","Pearson Hotel and Conference Centre Toronto Airport, 240, Belfield Road, Etobicoke North, Etobicoke, Toronto, Golden Horseshoe, Ontario, M9W 5B1, Canada","{""coordinates"": [-79.585913, 43.700306], ""type"": ""Point""}","Pearson Hotel and Conference Centre Toronto Airport, 240, Belfield Road, Etobicoke North, Etobicoke, Toronto, Golden Horseshoe, Ontario, M9W 5B1, Canada",tourism,hotel
109,South Riverdale,South Riverdale,"['*...Similar areas that retain their industrial character, but are now largely residential are the Fashion District, Corktown, and parts of South Riverdale and Leslieville....']","South Riverdale Community Health Centre, 955, Queen Street East, Leslieville, Toronto—Danforth, Old Toronto, Toronto, Golden Horseshoe, Ontario, M4M 1K2, Canada","{""coordinates"": [-79.339191, 43.661143], ""type"": ""Point""}","South Riverdale Community Health Centre, 955, Queen Street East, Leslieville, Toronto—Danforth, Old Toronto, Toronto, Golden Horseshoe, Ontario, M4M 1K2, Canada",amenity,clinic
110,Old Toronto,Old Toronto,"['...Old Toronto is also home to many historically wealthy residential enclaves, such as Yorkville, Rosedale, The Annex, Forest Hill, Lawrence Park, Lytton Park, Deer Park, Moore Park, and Casa Loma, most stretching away from downtown to the north.[citation needed]...', ""*...In the west end of Old Toronto and York, the Weston/Mount Dennis and The Junction areas still contain factories, meat-packing facilities and rail yards close to medium-density residential, although the Junction's Union Stockyards moved out of Toronto in 1994...."", '*...Bay-and-gable houses, mainly found in Old Toronto, are a distinct architectural feature of the city....']","West Toronto St at Old Stock Yards Rd, West Toronto Street, The Junction, York South—Weston, Old Toronto, Toronto, Golden Horseshoe, Ontario, M6N 3E2, Canada","{""coordinates"": [-79.469845, 43.669328], ""type"": ""Point""}","West Toronto St at Old Stock Yards Rd, West Toronto Street, The Junction, York South—Weston, Old Toronto, Toronto, Golden Horseshoe, Ontario, M6N 3E2, Canada",highway,bus_stop
111,Junction,Junction,"['...Beginning in the late 19th century, industrial areas were set up on the outskirts, such as West Toronto/The Junction, where the Stockyards relocated in 1903....', ""*...In the west end of Old Toronto and York, the Weston/Mount Dennis and The Junction areas still contain factories, meat-packing facilities and rail yards close to medium-density residential, although the Junction's Union Stockyards moved out of Toronto in 1994....""]","4Cats Arts Studio (The Junction), 1615, Dupont Street, Junction Triangle, Davenport, Old Toronto, Toronto, Golden Horseshoe, Ontario, M6P 3S5, Canada","{""coordinates"": [-79.454884, 43.664824], ""type"": ""Point""}","4Cats Arts Studio (The Junction), 1615, Dupont Street, Junction Triangle, Davenport, Old Toronto, Toronto, Golden Horseshoe, Ontario, M6P 3S5, Canada",shop,art
113,Portlands Energy Centre,Portlands Energy Centre,"['*...It still contains numerous industrial uses, such as the Portlands Energy Centre power plant, some port facilities, some movie and TV production studios, a concrete processing facility and various low-density industrial facilities....']","Portlands Energy Centre, 470, Unwin Avenue, Port Lands, Toronto—Danforth, Old Toronto, Toronto, Golden Horseshoe, Ontario, M5A 1A1, Canada","{""coordinates"": [-79.331199, 43.649526], ""type"": ""Point""}","Portlands Energy Centre, 470, Unwin Avenue, Port Lands, Toronto—Danforth, Old Toronto, Toronto, Golden Horseshoe, Ontario, M5A 1A1, Canada",building,industrial
114,Don,Don,"[""...The flat land is interrupted by the Toronto ravine system, which is cut by numerous creeks and rivers of the Toronto waterway system, most notably the Humber River in the west end, the Don River east of downtown (these two rivers flanking and defining the Toronto Harbour), and the Rouge River at the city's eastern limits...."", '...Other observable sections include the area near St. Clair Avenue West between Bathurst Street and the Don River, and north of Davenport Road from Caledonia to Spadina Road; the Casa Loma grounds sit above this escarpment....', '...The other source of sediment for the Port Lands wetland and the peninsula was the deposition of the Don River, which carved a wide valley through the sedimentary land of Toronto and deposited it in the shallow harbour....', '...The harbour and the channel of the Don River have been dredged numerous times for shipping....', '...The lower section of the Don River was straightened and channelled in the 19th century....', '...The former mouth drained into a wetland; today, the Don River drains into the harbour through a concrete waterway, the Keating Channel....', '...One of largest and earliest ""planned communities"" was Don Mills, parts of which were first built in the 1950s....', '...In the 1800s, a thriving industrial area developed around Toronto Harbour and lower Don River mouth, linked by rail and water to Canada and the United States....', '...Many of Toronto\'s former industrial sites close to (or in) downtown have been redeveloped including parts of the Toronto waterfront, the rail yards west of downtown, and Liberty Village, the Massey-Harris district and large-scale development is underway in the West Don Lands.[citation needed]\nThe Gooderham & Worts Distillery produced spirits until 1990, and is preserved today as the ""Distillery District"", the largest and best-preserved collection of Victorian industrial architecture in North America....', '*...The Waterfront Toronto agency has developed plans for a naturalized mouth to the Don River and to create a flood barrier around the Don, making more of the land on the harbour suitable for higher-value residential and commercial development....', '...A former chemicals plant site along the Don River is slated to become a large commercial complex and transportation hub....', '...The Don Valley Brick Works is a former industrial site that opened in 1889 and was partly restored as a park and heritage site in 1996, with further restoration being completed in stages since then....', '...Examples include the Pedestrian Committee, Waste Diversion Task Force 2010, and the Task Force to Bring Back the Don....', '...This arrangement is sometimes broken by geographical accidents, most notably the Don River ravines....', '...Other provincial highways include Highway 400 which connects the city with Northern Ontario and beyond and Highway 404, an extension of the Don Valley Parkway into the northern suburbs....', '...The main municipal expressways in Toronto include the Gardiner Expressway, the Don Valley Parkway, and to some extent, Allen Road....']","Don Valley Parkway, Spadina—Fort York, Old Toronto, Toronto, Golden Horseshoe, Ontario, M4M 3P2, Canada","{""coordinates"": [-79.349465, 43.650032], ""type"": ""Point""}","Don Valley Parkway, Spadina—Fort York, Old Toronto, Toronto, Golden Horseshoe, Ontario, M4M 3P2, Canada",highway,motorway
116,Nathan Phillips Square,Nathan Phillips Square,"[""*...Nathan Phillips Square is the city's main square in downtown, contains the Toronto Sign, and forms the entrance to City Hall...."", ""*...In recent years, Nathan Phillips Square has been refurbished with new facilities, and the central waterfront along Queen's Quay West has been updated recently with a new street architecture and a new square next to Harbourfront Centre...."", '*...In the winter, Nathan Phillips Square, Harbourfront Centre, and Mel Lastman Square feature popular rinks for public ice-skating....']","Nathan Phillips Square, Albert Street, Little Tokyo, Toronto Centre, Old Toronto, Toronto, Golden Horseshoe, Ontario, M5B 2H6, Canada","{""coordinates"": [-79.383842, 43.652708], ""type"": ""Point""}","Nathan Phillips Square, Albert Street, Little Tokyo, Toronto Centre, Old Toronto, Toronto, Golden Horseshoe, Ontario, M5B 2H6, Canada",tourism,attraction
118,City Hall,City Hall,"[""*...Nathan Phillips Square is the city's main square in downtown, contains the Toronto Sign, and forms the entrance to City Hall...."", '*...Yonge–Dundas Square, near City Hall, has also gained attention in recent years as one of the busiest gathering spots in the city....']","Toronto City Hall, 100, Queen Street West, Financial District, Spadina—Fort York, Old Toronto, Toronto, Golden Horseshoe, Ontario, M5H 2N2, Canada","{""coordinates"": [-79.384005, 43.653603], ""type"": ""Point""}","Toronto City Hall, 100, Queen Street West, Financial District, Spadina—Fort York, Old Toronto, Toronto, Golden Horseshoe, Ontario, M5H 2N2, Canada",amenity,townhall
119,Yonge–Dundas Square,Yonge–Dundas Square,"['*...Yonge–Dundas Square, near City Hall, has also gained attention in recent years as one of the busiest gathering spots in the city....']","Yonge-Dundas Square, Dundas Street East, Downtown Yonge, Toronto Centre, Old Toronto, Toronto, Golden Horseshoe, Ontario, M5B 2G9, Canada","{""coordinates"": [-79.380125, 43.656028], ""type"": ""Point""}","Yonge-Dundas Square, Dundas Street East, Downtown Yonge, Toronto Centre, Old Toronto, Toronto, Golden Horseshoe, Ontario, M5B 2G9, Canada",tourism,attraction
