,entity,to_search,snippet,address,coordinates,name_location,class,type
0,Mälaren,Mälaren,"['*...La città è situata lungo la costa orientale della Svezia, sviluppandosi su quattordici isole che affiorano lì dove il lago Mälaren incontra il Mar Baltico....', '*...In quel periodo la città era compresa nelle zone di Helgeandsholmen, Staden e Riddarholmen, che oggi formano la cosiddetta Gamla stan, o città vecchia, insieme a quella di Sigtuna, situata sulle rive del lago Mälaren, e successivamente si estese lentamente sulla terraferma verso nord e verso sud....']","Målaren, Stadshusträdgården, Kungsholmen, Kungsholmens stadsdelsområde, Stoccolma, Stockholms kommun, Stockholms län, 104 22, Svezia","{""coordinates"": [18.054437, 59.326979], ""type"": ""Point""}","Målaren, Stadshusträdgården, Kungsholmen, Kungsholmens stadsdelsområde, Stoccolma, Stockholms kommun, Stockholms län, 104 22, Svezia",tourism,artwork
9,Katarina kyrka,Katarina kyrka,"['...Chiesa di Caterina, la Katarina kyrka, in stile barocco....']","Katarina kyrka, Högbergsgatan, Södermalm, Södermalms stadsdelsområde, Stoccolma, Stockholms kommun, Stockholms län, 116 25, Svezia","{""coordinates"": [18.078154, 59.317058], ""type"": ""Point""}","Katarina kyrka, Högbergsgatan, Södermalm, Södermalms stadsdelsområde, Stoccolma, Stockholms kommun, Stockholms län, 116 25, Svezia",amenity,place_of_worship
10,Sankt Jacobs kyrka,Sankt Jacobs kyrka,"['*...Sankt Jacobs kyrka, la Chiesa di San Giacomo, che unisce stili diversi, dal gotico baltico, al rinascimentale, al barocco....']","Jakobs kyrka, Jakobs Torg, Klara, Norrmalm, Norrmalms stadsdelsområde, Stoccolma, Stockholms kommun, Stockholms län, 111 47, Svezia","{""coordinates"": [18.070489, 59.330435], ""type"": ""Point""}","Jakobs kyrka, Jakobs Torg, Klara, Norrmalm, Norrmalms stadsdelsområde, Stoccolma, Stockholms kommun, Stockholms län, 111 47, Svezia",amenity,place_of_worship
14,Stockholms slott,Stockholms slott,"['*...Stockholms slott, il Palazzo reale di Stoccolma, è una grande costruzione barocca eretta a partire dal 1697, residenza ufficiale dei Sovrani svedesi....']","Palazzo di Stoccolma, 1, Slottsbacken, Gamla stan, Södermalms stadsdelsområde, Stoccolma, Stockholms kommun, Stockholms län, 111 29, Svezia","{""coordinates"": [18.070352, 59.326895], ""type"": ""Point""}","Palazzo di Stoccolma, 1, Slottsbacken, Gamla stan, Södermalms stadsdelsområde, Stoccolma, Stockholms kommun, Stockholms län, 111 29, Svezia",tourism,attraction
22,Nord,Nord,"['...In quel periodo la città era compresa nelle zone di Helgeandsholmen, Staden e Riddarholmen, che oggi formano la cosiddetta Gamla stan, o città vecchia, insieme a quella di Sigtuna, situata sulle rive del lago Mälaren, e successivamente si estese lentamente sulla terraferma verso nord e verso sud....', ""*...Scuola superiore di Södertörns. Fondato nella parte Sud dell'area metropolitana di Stoccolma per bilanciare la maggior presenza di Istituti universitari nella parte Nord...."", '...Nel nord della città, a Kista, si trova un importante centro di Information Technology....', ""...Aeroporto di Stoccolma-Arlanda. Situato a 42 km a nord di Stoccolma, è il principale scalo della città, nonché l'hub della compagnia di bandiera Scandinavian Airlines...."", '...AIK: istituita nel 1896, la sezione calcistica ha vinto 12 campionati, 8 coppe e una Supercoppa di Svezia. I suoi colori sociali sono il nero e il giallo. È considerata la squadra più popolare nella parte nord-ovest della città....']","Norrbro, Gamla stan, Södermalms stadsdelsområde, Stoccolma, Stockholms kommun, Stockholms län, 111 29, Svezia","{""coordinates"": [18.070772, 59.327582], ""type"": ""Point""}","Norrbro, Gamla stan, Södermalms stadsdelsområde, Stoccolma, Stockholms kommun, Stockholms län, 111 29, Svezia",highway,tertiary
23,Museo Vasa,Museo Vasa,"[""...Il Museo Vasa in cui è conservato il relitto dell'omonimo veliero del XVII secolo,...""]","Vasamuseet, Djurgårdsstrand, Djurgårdsstaden, Djurgården, Östermalms stadsdelsområde, Stoccolma, Stockholms kommun, Stockholms län, 115 21, Svezia","{""coordinates"": [18.091366, 59.328059], ""type"": ""Point""}","Vasamuseet, Djurgårdsstrand, Djurgårdsstaden, Djurgården, Östermalms stadsdelsområde, Stoccolma, Stockholms kommun, Stockholms län, 115 21, Svezia",tourism,museum
25,Tekniska museet,Tekniska museet,['...Il Tekniska museet dedicato alla scienza e alla tecnica....'],"Tekniska museet, Museivägen, Lindarängen, Ladugårdsgärdet, Östermalms stadsdelsområde, Stoccolma, Stockholms kommun, Stockholms län, 115 27, Svezia","{""coordinates"": [18.11884, 59.332515], ""type"": ""Point""}","Tekniska museet, Museivägen, Lindarängen, Ladugårdsgärdet, Östermalms stadsdelsområde, Stoccolma, Stockholms kommun, Stockholms län, 115 27, Svezia",tourism,museum
26,Nationalmuseum,Nationalmuseum,"['...Il Nationalmuseum,...']","Nationalmuseum, Strömkajen, Norrmalm, Norrmalms stadsdelsområde, Stoccolma, Stockholms kommun, Stockholms län, 103 27, Svezia","{""coordinates"": [18.076845, 59.328659], ""type"": ""Point""}","Nationalmuseum, Strömkajen, Norrmalm, Norrmalms stadsdelsområde, Stoccolma, Stockholms kommun, Stockholms län, 103 27, Svezia",highway,bus_stop
28,Museo Tre Kronor,Museo Tre Kronor,"[""...Dedicati ai patrimoni della famiglia reale, vi sono il Museo Tre Kronor presso le fondamenta del palazzo reale, lo Skattkammaren ossia la tesoreria Reale, il Gustav III antikmuseum con i tesori dell'antico monarca, il Livrustkammaren, ossia l'Armeria Reale, e il Kungliga Myntkabinettet la Zecca Reale con le sue monete....""]","Tre Kronor, Slottskajen, Gamla stan, Södermalms stadsdelsområde, Stoccolma, Stockholms kommun, Stockholms län, 111 29, Svezia","{""coordinates"": [18.071053, 59.327411], ""type"": ""Point""}","Tre Kronor, Slottskajen, Gamla stan, Södermalms stadsdelsområde, Stoccolma, Stockholms kommun, Stockholms län, 111 29, Svezia",tourism,museum
29,Gustav III antikmuseum,Gustav III antikmuseum,"[""...Dedicati ai patrimoni della famiglia reale, vi sono il Museo Tre Kronor presso le fondamenta del palazzo reale, lo Skattkammaren ossia la tesoreria Reale, il Gustav III antikmuseum con i tesori dell'antico monarca, il Livrustkammaren, ossia l'Armeria Reale, e il Kungliga Myntkabinettet la Zecca Reale con le sue monete....""]","Gustav III:s antikmuseum, 1, Slottsbacken, Gamla stan, Södermalms stadsdelsområde, Stoccolma, Stockholms kommun, Stockholms län, 111 31, Svezia","{""coordinates"": [18.072054, 59.327542], ""type"": ""Point""}","Gustav III:s antikmuseum, 1, Slottsbacken, Gamla stan, Södermalms stadsdelsområde, Stoccolma, Stockholms kommun, Stockholms län, 111 31, Svezia",tourism,museum
41,Stockholms Stadsteater,Stockholms Stadsteater,"[""...Altri importanti teatri sono il Teatro Bollhuset (Stora Bollhuset), lo Stockholms Stadsteater, la Folkoperan, il Teatro Moderno di Danza (Moderna dansteatern), il Teatro Cinese (China Teatern), lo Göta Lejon, il Teatro Södra, e l'Oscarsteatern....""]","Stockholms Stadsteater, 5, Beridarebanan, Klara, Norrmalm, Norrmalms stadsdelsområde, Stoccolma, Stockholms kommun, Stockholms län, 111 51, Svezia","{""coordinates"": [18.064506, 59.331899], ""type"": ""Point""}","Stockholms Stadsteater, 5, Beridarebanan, Klara, Norrmalm, Norrmalms stadsdelsområde, Stoccolma, Stockholms kommun, Stockholms län, 111 51, Svezia",amenity,theatre
42,Folkoperan,Folkoperan,"[""...Altri importanti teatri sono il Teatro Bollhuset (Stora Bollhuset), lo Stockholms Stadsteater, la Folkoperan, il Teatro Moderno di Danza (Moderna dansteatern), il Teatro Cinese (China Teatern), lo Göta Lejon, il Teatro Södra, e l'Oscarsteatern....""]","Folkoperan, Hornsgatan, Zinkensdamm, Södermalm, Södermalms stadsdelsområde, Stoccolma, Stockholms kommun, Stockholms län, 118 49, Svezia","{""coordinates"": [18.058252, 59.318468], ""type"": ""Point""}","Folkoperan, Hornsgatan, Zinkensdamm, Södermalm, Södermalms stadsdelsområde, Stoccolma, Stockholms kommun, Stockholms län, 118 49, Svezia",amenity,theatre
45,Göta Lejon,Göta Lejon,"[""...Altri importanti teatri sono il Teatro Bollhuset (Stora Bollhuset), lo Stockholms Stadsteater, la Folkoperan, il Teatro Moderno di Danza (Moderna dansteatern), il Teatro Cinese (China Teatern), lo Göta Lejon, il Teatro Södra, e l'Oscarsteatern....""]","Göta Lejon, Götgatan, Skanstull, Södermalm, Södermalms stadsdelsområde, Stoccolma, Stockholms kommun, Stockholms län, 116 62, Svezia","{""coordinates"": [18.073847, 59.313916], ""type"": ""Point""}","Göta Lejon, Götgatan, Skanstull, Södermalm, Södermalms stadsdelsområde, Stoccolma, Stockholms kommun, Stockholms län, 116 62, Svezia",amenity,theatre
47,Oscarsteatern,Oscarsteatern,"[""...Altri importanti teatri sono il Teatro Bollhuset (Stora Bollhuset), lo Stockholms Stadsteater, la Folkoperan, il Teatro Moderno di Danza (Moderna dansteatern), il Teatro Cinese (China Teatern), lo Göta Lejon, il Teatro Södra, e l'Oscarsteatern....""]","Oscarsteatern, Kungsgatan, Klara, Norrmalm, Norrmalms stadsdelsområde, Stoccolma, Stockholms kommun, Stockholms län, 111 22, Svezia","{""coordinates"": [18.056028, 59.333467], ""type"": ""Point""}","Oscarsteatern, Kungsgatan, Klara, Norrmalm, Norrmalms stadsdelsområde, Stoccolma, Stockholms kommun, Stockholms län, 111 22, Svezia",amenity,theatre
51,Arlanda Express,Arlanda Express,"[""...Esiste inoltre l'Arlanda Express, linea ferroviaria diretta che collega la stazione ferroviaria centrale all'Aeroporto di Stoccolma-Arlanda...."", ""*...Inoltre esiste un collegamento ferroviario diretto fra l'Aeroporto di Arlanda e la Stazione Centrale di Stoccolma, tramite il treno veloce Arlanda Express oppure il servizio ferroviario suburbano di Stoccolma....""]","Arlanda Express, Östra Järnvägsgatan, Klara, Norrmalm, Norrmalms stadsdelsområde, Stoccolma, Stockholms kommun, Stockholms län, 107 24, Svezia","{""coordinates"": [18.056156, 59.332007], ""type"": ""Point""}","Arlanda Express, Östra Järnvägsgatan, Klara, Norrmalm, Norrmalms stadsdelsområde, Stoccolma, Stockholms kommun, Stockholms län, 107 24, Svezia",shop,ticket
62,Stockholms centralstation,Stockholms centralstation,['*...La stazione centrale di Stoccolma (Stockholms centralstation) è il principale scalo ferroviario dalla Svezia....'],"Stockholms centralstation, Klarabergsviadukten, Klara, Norrmalm, Norrmalms stadsdelsområde, Stoccolma, Stockholms kommun, Stockholms län, 111 81, Svezia","{""coordinates"": [18.058265, 59.33015], ""type"": ""Point""}","Stockholms centralstation, Klarabergsviadukten, Klara, Norrmalm, Norrmalms stadsdelsområde, Stoccolma, Stockholms kommun, Stockholms län, 111 81, Svezia",building,train_station
64,Tele2 Arena,Tele2 Arena,"['...In città sono presenti importanti strutture sportive polifunzionali, come la Friends Arena, la Tele2 Arena e il Globen....']","Tele2 Arena, Arenaslingan, Johanneshov, Enskede-Årsta-Vantörs stadsdelsområde, Stoccolma, Stockholms kommun, Stockholms län, 121 77, Svezia","{""coordinates"": [18.084543, 59.291033], ""type"": ""Point""}","Tele2 Arena, Arenaslingan, Johanneshov, Enskede-Årsta-Vantörs stadsdelsområde, Stoccolma, Stockholms kommun, Stockholms län, 121 77, Svezia",leisure,stadium
65,Globen,Globen,"['...In città sono presenti importanti strutture sportive polifunzionali, come la Friends Arena, la Tele2 Arena e il Globen....']","Globen, Globenbron, Johanneshov, Enskede-Årsta-Vantörs stadsdelsområde, Stoccolma, Stockholms kommun, Stockholms län, 121 44, Svezia","{""coordinates"": [18.078018, 59.294395], ""type"": ""Point""}","Globen, Globenbron, Johanneshov, Enskede-Årsta-Vantörs stadsdelsområde, Stoccolma, Stockholms kommun, Stockholms län, 121 44, Svezia",building,transportation
