Bolognina,"Bolognina, Navile, Bologna, Emilia-Romagna, 40129, Italia",place,suburb,0.49500000000000005,"Al centro del Fiera District fu progettata una zona pedonale, piazza della Costituzione, la cui costruzione fu affidata a Isamu Noguchi. Fra gli ultimi esempi di architettura contemporanea e interventi urbanistici (spesso oggetto di accese discussioni) troviamo la Porta Europa dell'architetto Ettore Masi in via Stalingrado, il complesso del nuovo palazzo comunale nella zona della Bolognina (Palazzo Bonaccorso e piazza Liber Paradisus) e la Torre Unipol, un grattacielo alto 127 metri sito nella periferia est della città.  Economia Bologna ospita un'importante rete di industrie meccaniche, elettroniche e alimentari e un gran numero di imprese di artigianato."
via Ferrarese,"Via Ferrarese, Fornace, Navile, Dozza, Bologna, Emilia-Romagna, 40128, Italia",highway,primary,0.41000000000000003,"Etnie e minoranze straniere Secondo i dati ISTAT, al 31 dicembre 2020 i cittadini stranieri a Bologna risultavano 62 422 (15,9% tra tutti i residenti).Le prime dieci comunità sono quelle provenienti da:  Romania, 9 726 Bangladesh, 4 990 Filippine, 4 966 Cina, 4 547 Pakistan, 4 368 Ucraina, 3 815 Marocco, 3 439 Moldavia, 3 381 Albania, 2 657 Sri Lanka, 1 297A Bologna è nata una delle prime chinatown italiane, con i primi insediamenti di cittadini cinesi risalenti agli anni trenta, ampliatisi negli anni cinquanta e ottanta. L'area dove si concentrarono fin dall'inizio le comunità cinesi comprende le zone della Bolognina e di Corticella (soprattutto attorno a via Ferrarese). La Bolognina ed il Pilastro sono statisticamente i quartieri ove si concentra maggiormente la popolazione straniera di Bologna."
Pratello,"Via del Pratello, Malpighi, Saragozza-Porto, Bologna, Emilia-Romagna, 40122, Italia",highway,living_street,0.31,"Esso si distingue in dialetto bolognese cittadino (originario della zona intramuraria) e varianti cosiddette ""ariose"" della provincia. Come già notava Dante Alighieri nel suo De Vulgari Eloquentia, esistevano un tempo differenze di parlata persino fra gli abitanti del centro, ovvero fra il borgo San Felice (corrispondente alla zona del Pratello) e quelli di Strada Maggiore (zona dove nell’VIII secolo si erano insediati i Longobardi).A partire dagli anni 1960 e 1970, con la modernizzazione della società e la progressiva messa in minoranza della popolazione nativa a causa dell'aumento dell'immigrazione da altre regioni italiane, l'uso del dialetto è andato via via scomparendo, sopravvivendo quasi esclusivamente nelle sue versioni ariose nei comuni della provincia. Un rinnovato interesse si ebbe negli anni Ottanta, con l'organizzazione, supportata dal Comune e da artisti quali Andrea Mingardi, di festival della canzone bolognese."
Strada Maggiore,"Strada Maggiore, Galvani, Santo Stefano, Bologna, Emilia-Romagna, 40125, Italia",highway,tertiary,0.41000000000000003,"Esso si distingue in dialetto bolognese cittadino (originario della zona intramuraria) e varianti cosiddette ""ariose"" della provincia. Come già notava Dante Alighieri nel suo De Vulgari Eloquentia, esistevano un tempo differenze di parlata persino fra gli abitanti del centro, ovvero fra il borgo San Felice (corrispondente alla zona del Pratello) e quelli di Strada Maggiore (zona dove nell’VIII secolo si erano insediati i Longobardi).A partire dagli anni 1960 e 1970, con la modernizzazione della società e la progressiva messa in minoranza della popolazione nativa a causa dell'aumento dell'immigrazione da altre regioni italiane, l'uso del dialetto è andato via via scomparendo, sopravvivendo quasi esclusivamente nelle sue versioni ariose nei comuni della provincia. Un rinnovato interesse si ebbe negli anni Ottanta, con l'organizzazione, supportata dal Comune e da artisti quali Andrea Mingardi, di festival della canzone bolognese."
Strada Maggiore,"Strada Maggiore, Galvani, Santo Stefano, Bologna, Emilia-Romagna, 40125, Italia",highway,tertiary,0.41000000000000003,"Sono presenti, inoltre, moltissime attività di abbigliamento, gioielli, artigianato, bistrot, oltre a numerose boutique di alta moda, concentrate in particolar modo fra Galleria Cavour, via Farini, il Pavaglione e via D'Azeglio. Ad esse si aggiunge Corte Isolani, una galleria medievale che collega piazza Santo Stefano a Strada Maggiore, sede di piccole boutique, caffè, ristoranti e un laboratorio di marionette. Altre strade dedicate allo shopping, ma di carattere più mainstream, sono le tre vie che formano la cosiddetta ""T"":"
Firenze,"Firenze, Due Madonne, Savena, Bologna, Emilia-Romagna, 40139, Italia",highway,platform,0.32,"Nonostante ciò non abbia invertito la tendenza verso una marginalizzazione del dialetto bolognese, ne è aumentato l'interesse - soprattutto accademico - con la pubblicazione di dizionari, grammatiche, studi e l'istituzione di corsi di dialetto bolognese da parte di associazioni locali. Istituzioni, enti e associazioni Bologna è fra le città italiane con più alto tasso di cittadinanza attiva, con più di 570 associazioni registrate nel comune, una forte diffusione di istituzioni non profit, pari a 58,3 ogni 10.000 abitanti (seconda città metropolitana in Italia dopo Firenze) e di cittadini impegnati nel volontariato, pari al 11,4% (terza dopo Firenze e Genova). Comunità LGBT Bologna è la città italiana pioniera del movimento per i diritti LGBT."
Firenze,"Firenze, Due Madonne, Savena, Bologna, Emilia-Romagna, 40139, Italia",highway,platform,0.32,"La conferma di questo arriva da uno studio condotto nel 1989 dal gruppo Reclus di Montpellier e commissionato della DATAR (Délégation à l'Amenagement du Territoire et à l'Action Régionale), nel quale si formula una classificazione per grado d'importanza delle città con più di duecentomila abitanti di quattordici Stati dell'Europa Occidentale e mediterranea: Bologna, con Firenze e Venezia, si situava in posizione più avanzata di città più popolose, quali Dublino, Leeds, Liverpool, Lilla, Norimberga, Essen, Dortmund, Brema, Hannover, Saragozza, Malaga, Bilbao, Salonicco, Palermo, ecc. Nonostante l'esigua popolazione comunale Bologna è stata anche inserita, dal gruppo di studio GaWC, tra le cento città globali (o Città del Mondo), in virtù della sua importanza culturale ed economica (invero in categoria D, cioè città globali in formazione, con bassa evidenza)."
Firenze,"Firenze, Due Madonne, Savena, Bologna, Emilia-Romagna, 40139, Italia",highway,platform,0.32," Infrastrutture e trasporti La città e la sua area metropolitana sono poste al centro dei traffici dell'Italia produttiva. In linea generale si può affermare che questa funzione di crocevia è resa possibile dalla particolare posizione geografica che, pur collocandola al margine meridionale della Pianura Padana, la pone, quasi come punto di passaggio obbligato, al centro delle vie di comunicazione che collegano il Nord dell'Italia col Mezzogiorno, sia attraverso la direttrice ""adriatica"" da Torino, Milano, il Veneto fino alla Puglia, assai più rilevante per traffico di quella ""tirrenica"" da Genova a Roma, sia attraverso la cosiddetta ""dorsale appenninica"" per Firenze e Roma (che sfrutta, almeno nel primo tratto, la storica ed importante via di penetrazione appenninica rappresentata dalla valle del fiume Reno): infatti proprio queste due direttrici s'incontrano a Bologna."
Firenze,"Firenze, Due Madonne, Savena, Bologna, Emilia-Romagna, 40139, Italia",highway,platform,0.32,"l'ex Strada statale 253 San Vitale che la collega con Ravenna; l'ex Strada statale 65 della Futa che la collega con Firenze e la Strada statale 64 Porrettana che proviene da Pistoia e prosegue per Ferrara.  Ferrovie  Bologna costituisce un nodo ferroviario di rilevanza nazionale, attraverso il quale si stima che transiti oltre l'85% del traffico nazionale fra Nord e Sud, escludendo i traffici via La Spezia (per Milano e la Francia) e quelli via Ravenna - Ferrara e via Ferrara - Suzzara - Parma."
Firenze,"Firenze, Due Madonne, Savena, Bologna, Emilia-Romagna, 40139, Italia",highway,platform,0.32,"la Bologna-Ancona-Bari (che dirigendosi verso la Romagna ne tocca tutti i capoluoghi ad eccezione di Ravenna, per poi seguire l'intera lunghezza della costa adriatica verso sud fino in Puglia); la Bologna-Firenze-Roma (detta ""Direttissima""), affiancata dal dicembre 2009 dalla nuova linea ad alta velocità fra Bologna e Firenze, che prosegue per Napoli e la Calabria; la Bologna-Verona, che la collega anche al Trentino-Alto Adige e al Nord Europa; la Bologna-Venezia, che la collega anche al Friuli-Venezia Giulia e all'Est Europa;Le altre linee di importanza regionale che si attestano a Bologna Centrale sono:  la Bologna-Porretta Terme-Pistoia (detta ""Porrettana""), realizzata nel 1864."
Firenze,"Firenze, Due Madonne, Savena, Bologna, Emilia-Romagna, 40139, Italia",highway,platform,0.32,"L'importanza dell'aeroporto (il cui bacino d'utenza è stimato in almeno dieci milioni di persone) è dovuto prevalentemente alla posizione nel ""baricentro produttivo"" d'Italia. Oltre alla sua funzione al servizio dell'intera zona produttiva emiliana e marchigiana, l'aumento delle rotte da parte di compagnie aeree low cost e la realizzazione della linea ad Alta Velocità per Firenze hanno portato ad un massiccio aumento dell'utenza turistica. L'aeroporto è collegato alla stazione di Bologna Centrale tramite il Marconi Express, un people mover sopraelevato."
Firenze,"Firenze, Due Madonne, Savena, Bologna, Emilia-Romagna, 40139, Italia",highway,platform,0.32,"  Lipsia, dal 3 maggio 1962  Zagabria, dal 5 maggio 1963  Charkiv, dal 5 agosto 1966  Valencia, dal 27 marzo 1976  San Fele, dal 27 gennaio 1981  Salonicco, dal 29 ottobre 1981  Tolosa, dal 23 novembre 1981  Coventry, dal 21 aprile 1984  St. Louis, dal 30 luglio 1987  San Carlos, dal 21 maggio 1988  La Plata, dal 23 novembre 1988  Saint-Louis, dal 9 dicembre 1991  Tuzla, dal 21 luglio 1994  Portland, dal 28 aprile 2004  Bari, dal 18 novembre 2009  Pollica, dal 23 giugno 2012Inoltre sono stati sottoscritti vari protocolli di cooperazione con le città di:  Barcellona, dal 26 novembre 2018  Belo Horizonte, dal 10 ottobre 1997  Chengdu, dal 15 luglio 2019  Chongqing, dal 1989  Craiova, dal 26 gennaio 2006  Firenze  Hamamatsu, dal 23 aprile 2014  Itabashi, dal 7 luglio 2005  Le Kef, dal 2020  Meknès, dal 2020  Nižnij Novgorod, dall'8 ottobre 1998. Relazioni inattive dal 2001."
Cassero di Porta Saragozza,"Il Cassero, Mura di Porta Lame, Marconi, Saragozza-Porto, Bologna, Emilia-Romagna, 40122, Italia",building,yes,0.511,"Il primo movimento gay, il ""Circolo di cultura omosessuale 28 giugno"", si è attivato in città già nel 1978 e nel 1982 ottenne spazi aggregativi dal Comune. L'Arcigay, la più grande associazione nazionale per la tutela dei diritti LGBT in Italia, si è costituita a Bologna nel 1985 con sede presso il Cassero di Porta Saragozza. Ha sede in città anche il MIT - Movimento Identità Trans, una onlus fondata nel 1982, di cui è stata presidente fino alla sua scomparsa Marcella Di Folco, prima associazione di questo tipo in Italia."
Mediterraneo,"Mediterraneo, 32a, Via Giuseppe Petroni, Irnerio, Santo Stefano, Bologna, Emilia-Romagna, 40126, Italia",amenity,fast_food,0.22100000000000003,"Nel 2008 lo Zecchino d'Oro dell'Antoniano di Bologna è diventato ""Patrimonio UNESCO per una cultura di pace"", prima trasmissione televisiva al mondo a ricevere un riconoscimento di questo tipo. Nel 1988 a Bologna si è tenuta la Biennale dei giovani artisti dell'Europa e del Mediterraneo, considerata la più importante vetrina mediterranea della creatività giovanile. Molte istituzioni culturali e universitarie hanno sede alla Manifattura delle Arti, un'area recuperata negli spazi dell'ex Manifattura Tabacchi e dell'ex macello."
Mediterraneo,"Mediterraneo, 32a, Via Giuseppe Petroni, Irnerio, Santo Stefano, Bologna, Emilia-Romagna, 40126, Italia",amenity,fast_food,0.22100000000000003,vi parteciparono filosofi italiani e provenienti da ogni parte del mondo. Nel 1988 si tenne la Biennale dei giovani artisti dell'Europa e del Mediterraneo.  Festival musicali Alma Jazz Festival (si svolge in autunno):
Manifattura Tabacchi,"Manifattura Tabacchi, Via della Manifattura, Casaralta, Navile, Dozza, Bologna, Emilia-Romagna, 40128, Italia",amenity,parking,0.31100000000000005,"Nel 1988 a Bologna si è tenuta la Biennale dei giovani artisti dell'Europa e del Mediterraneo, considerata la più importante vetrina mediterranea della creatività giovanile. Molte istituzioni culturali e universitarie hanno sede alla Manifattura delle Arti, un'area recuperata negli spazi dell'ex Manifattura Tabacchi e dell'ex macello.  Istruzione Università L'Università di Bologna è considerata la più antica università del mondo occidentale."
Collegio di Spagna,"Collegio Di Spagna, Malpighi, Saragozza-Porto, Bologna, Emilia-Romagna, 40123, Italia",highway,platform,0.51,"Sono poi presenti altre sedi di università straniere o programmi di studi, come ad esempio l'Alliance Française, il Bologna Consortial Studies Program (BCSP) dell'Indiana University, la Brown University, l'Eastern College Consortium (E.C.CO.) del Vassar College, l'Istituto di Cultura Germanica e la University of California. Il più longevo esempio di istituzione accademica straniera è il Collegio di Spagna, il più antico collegio al mondo aperto a studenti stranieri, erede del fenomeno delle nationes nella tradizione dell'Università medievale, ed è anche l'unico, di tale tipo, sopravvissuto nell'Europa continentale (altri esempi hanno resistito solo nel Regno Unito).Il capoluogo emiliano ospita anche alcune università private riconosciute, come la Libera Università delle Arti (L.UN.A.) o l'Università Primo Levi.  Accademie Nel Cinque-Seicento Bologna fu sede di numerose accademie, come quella letteraria degli Oziosi, quella artistica degli Incamminati fondata dai Carracci nel 1582, e quella musicale dei Floridi."
Accademia di Belle Arti di Bologna,"Accademia di Belle Arti, Via delle Belle Arti, Irnerio, Santo Stefano, Bologna, Emilia-Romagna, 40126, Italia",amenity,university,0.721," Accademie Nel Cinque-Seicento Bologna fu sede di numerose accademie, come quella letteraria degli Oziosi, quella artistica degli Incamminati fondata dai Carracci nel 1582, e quella musicale dei Floridi. L'Accademia di Belle Arti di Bologna affonda le sue radici nell'Accademia Clementina fondata nel 1710. Importanti maestri hanno insegnato presso la scuola bolognese, fra i quali:"
Conservatorio,"Conservatorio, Irnerio, Santo Stefano, Bologna, Emilia-Romagna, 40126, Italia",highway,platform,0.32,"Ospita ogni anno circa millecinquecento studenti. Il Conservatorio Giovanni Battista Martini di Bologna è uno dei più antichi conservatori statali italiani. La fondazione del conservatorio (Liceo musicale di Bologna, che raccolse l'eredità dell'Accademia Filarmonica di Bologna) risale al 1804 ed è considerata la prima scuola musicale pubblica in Italia."
Conservatorio,"Conservatorio, Irnerio, Santo Stefano, Bologna, Emilia-Romagna, 40126, Italia",highway,platform,0.32," Musica Nel 2006 Bologna ha ottenuto il riconoscimento UNESCO di ""città creativa per la musica"".  Musica classica A Bologna sono presenti il Museo Internazionale e Biblioteca della Musica, il Conservatorio Giovanni Battista Martini, l'Accademia Filarmonica di Bologna e il Teatro Comunale di Bologna, sede dell'autorevole Orchestra della Fondazione Teatro Comunale di Bologna, attiva dal dopoguerra. Dal 1905 è attiva la casa musicale Bongiovanni, una delle più importanti nel campo dell'editoria e della discografia di musica classica."
Istituto di Bologna,"ISTAT Ufficio Regionale Emilia Romagna, 9, Via Luigi Carlo Farini, Galvani, Santo Stefano, Bologna, Emilia-Romagna, 40124, Italia",office,research,0.9233236828671947,"Fra i suoi studenti di rilievo, si annovera Gioachino Rossini. L'Accademia delle scienze dell'Istituto di Bologna è stata fondata nel 1714. L'istituzione continuava la precedente ""Accademia degli inquieti"" che era stata fondata intorno al 1690 da Eustachio Manfredi."
Biblioteca Comunale dell'Archiginnasio,"Biblioteca Comunale dell'Archiginnasio, 1, Piazza Galvani, Galvani, Santo Stefano, Bologna, Emilia-Romagna, 40124, Italia",amenity,library,0.7535246308816305,"Biblioteche A Bologna si trovano più di cento biblioteche, fra cui 4 comunali, 11 di quartiere e più di 70 universitarie, dislocate in diverse zone della città. Fra le più note e frequentate vi sono la Biblioteca Comunale dell'Archiginnasio (ex sede dell'Università) e la Biblioteca Sala Borsa (inaugurata nel 2001). La più fornita, con oltre 1 300 000 volumi, è la Biblioteca universitaria di Bologna."
Biblioteca universitaria di Bologna,"Biblioteca Universitaria, 33, Via Zamboni, Irnerio, Santo Stefano, Bologna, Emilia-Romagna, 40126, Italia",amenity,library,0.6253717591619115,"Fra le più note e frequentate vi sono la Biblioteca Comunale dell'Archiginnasio (ex sede dell'Università) e la Biblioteca Sala Borsa (inaugurata nel 2001). La più fornita, con oltre 1 300 000 volumi, è la Biblioteca universitaria di Bologna. Di notevole interesse, e di capitale importanza in ambito nazionale ed europeo, è anche la Cineteca di Bologna, istituzione comunale dedicata al cinema e alla filmografia."
Cineteca di Bologna,"Cineteca di Bologna, Via Riva di Reno, Marconi, Saragozza-Porto, Bologna, Emilia-Romagna, 40122, Italia",amenity,cinema,0.7705019363834118,"La più fornita, con oltre 1 300 000 volumi, è la Biblioteca universitaria di Bologna. Di notevole interesse, e di capitale importanza in ambito nazionale ed europeo, è anche la Cineteca di Bologna, istituzione comunale dedicata al cinema e alla filmografia. Vi sono inoltre diverse biblioteche tematiche come quella sulla storia del Novecento dell'Istituto storico Parri Emilia-Romagna, quella dell'Istituto Gramsci, la Biblioteca Italiana delle Donne, la biblioteca del Museo internazionale della musica, la biblioteca emeroteca del MAMbo e numerose altre."
Museo internazionale della musica,"Museo internazionale e biblioteca della musica, 34, Strada Maggiore, Galvani, Santo Stefano, Bologna, Emilia-Romagna, 40125, Italia",tourism,museum,0.7602548452552094,"Di notevole interesse, e di capitale importanza in ambito nazionale ed europeo, è anche la Cineteca di Bologna, istituzione comunale dedicata al cinema e alla filmografia. Vi sono inoltre diverse biblioteche tematiche come quella sulla storia del Novecento dell'Istituto storico Parri Emilia-Romagna, quella dell'Istituto Gramsci, la Biblioteca Italiana delle Donne, la biblioteca del Museo internazionale della musica, la biblioteca emeroteca del MAMbo e numerose altre. Nel luglio 2020 Bologna ha ottenuto il riconoscimento di ""Città che legge"" 2020-2021."
Città,"Bologna, Emilia-Romagna, Italia",boundary,administrative,0.7905771109268431,"Vi sono inoltre diverse biblioteche tematiche come quella sulla storia del Novecento dell'Istituto storico Parri Emilia-Romagna, quella dell'Istituto Gramsci, la Biblioteca Italiana delle Donne, la biblioteca del Museo internazionale della musica, la biblioteca emeroteca del MAMbo e numerose altre. Nel luglio 2020 Bologna ha ottenuto il riconoscimento di ""Città che legge"" 2020-2021. Musei Bologna possiede oltre quaranta musei nei quali, accanto alle collezioni permanenti, sono organizzate mostre temporanee."
Città,"Bologna, Emilia-Romagna, Italia",boundary,administrative,0.7905771109268431,"Abbonda anche l'uso di latticini, quali il burro, il formaggio molle e il Parmigiano Reggiano. Le numerose ricette di origine bolognese, diffuse in tutto il mondo come eccellenze della cucina italiana, e la proliferazione in città di attività commerciali legate al cibo, hanno spesso condotto la stampa italiana e straniera ad attribuire a Bologna l'appellativo di Città del cibo (City of food).Fra i prodotti tipici della cucina bolognese troviamo:  Sui colli bolognesi vi sono numerose aziende vinicole che producono varie tipologie di vino tipiche, fra cui il Pignoletto DOCG."
Città,"Bologna, Emilia-Romagna, Italia",boundary,administrative,0.7905771109268431,"Festa Internazionale della Storia, si svolge nella terza settimana di ottobre, con eventi da settembre a dicembre Falò del vecchione, tradizionale celebrazione del Capodanno consistente nel rogo di un grande fantoccio rappresentante l'anno vecchio. Partecipazione all'Expo 2010 di Shanghai La città di Bologna, insieme ad altre 45 città del mondo, ha partecipato, previa selezione e invito, all'Esposizione Universale di Shanghai 2010 intitolata Better city, better life (Città migliore, Vita migliore), tenutasi dal 1º maggio al 31 ottobre 2010 nella metropoli cinese. La giuria internazionale dell'Expo ha inserito la città felsinea nell'area Liveable city (Città vivibile), giudicandola esempio di eccellenza nelle categorie:"
Città,"Bologna, Emilia-Romagna, Italia",boundary,administrative,0.7905771109268431,"Partecipazione all'Expo 2010 di Shanghai La città di Bologna, insieme ad altre 45 città del mondo, ha partecipato, previa selezione e invito, all'Esposizione Universale di Shanghai 2010 intitolata Better city, better life (Città migliore, Vita migliore), tenutasi dal 1º maggio al 31 ottobre 2010 nella metropoli cinese. La giuria internazionale dell'Expo ha inserito la città felsinea nell'area Liveable city (Città vivibile), giudicandola esempio di eccellenza nelle categorie: Cultura e creatività;"
Pinacoteca Nazionale di Bologna,"Pinacoteca nazionale di Bologna, 56, Via delle Belle Arti, Irnerio, Santo Stefano, Bologna, Emilia-Romagna, 40126, Italia",tourism,museum,0.5877101113307118,"Musei Bologna possiede oltre quaranta musei nei quali, accanto alle collezioni permanenti, sono organizzate mostre temporanee. La Pinacoteca Nazionale di Bologna, nata nel 1802 in seno all'Accademia di Belle Arti, è un museo statale dotato di autonomia gestionale. I musei civici sono gestiti dall'Istituzione Bologna Musei, i più importanti dei quali sono: le Collezioni comunali d'arte, il Museo civico archeologico, il Museo civico medievale, il Museo Morandi, il Museo civico d'arte industriale Davia Bargellini, il Museo del patrimonio industriale di Bologna, il MAMbo (Museo d'arte moderna di Bologna) e il Museo internazionale e biblioteca della musica."
Pinacoteca Nazionale di Bologna,"Pinacoteca nazionale di Bologna, 56, Via delle Belle Arti, Irnerio, Santo Stefano, Bologna, Emilia-Romagna, 40126, Italia",tourism,museum,0.5877101113307118,"Ma è fra la seconda metà del Cinquecento e l'inizio del Settecento (ovvero dal Manierismo al Barocco) che la scuola bolognese di pittura raggiunse il suo culmine con artisti del calibro del Domenichino, i Carracci (fondatori dell'Accademia degli Incamminati), Domenico Tibaldi, il Guercino, Guido Reni, Elisabetta Sirani, Prospero Fontana, Lavinia Fontana e moltissimi altri, mentre vi operarono anche il Parmigianino e Donato Creti. Le opere di questi artisti si possono ammirare nelle chiese e palazzi cittadini, nonché nella Pinacoteca Nazionale di Bologna. In epoca moderna e contemporanea, Bologna ha dato i natali a Luigi Serra, Giorgio Morandi (a cui è dedicato l'omonimo museo), Mario Bonazzi, Ilario Rossi, Aldo Borgonzoni, Carlo Gajani, Sergio Romiti, Vasco Bendini, Pirro Cuniberti, Sergio Vacchi, Vittorio Mascalchi, Valerio Adami, Pier Paolo Calzolari e Piero Manai, mentre vi operarono e operano artisti quali Giovanni Romagnoli, Germano Sartelli, Concetto Pozzati, Luciano De Vita e molti altri."
Accademia di Belle Arti,"Accademia di Belle Arti, Via delle Belle Arti, Irnerio, Santo Stefano, Bologna, Emilia-Romagna, 40126, Italia",amenity,university,0.511,"Musei Bologna possiede oltre quaranta musei nei quali, accanto alle collezioni permanenti, sono organizzate mostre temporanee. La Pinacoteca Nazionale di Bologna, nata nel 1802 in seno all'Accademia di Belle Arti, è un museo statale dotato di autonomia gestionale. I musei civici sono gestiti dall'Istituzione Bologna Musei, i più importanti dei quali sono: le Collezioni comunali d'arte, il Museo civico archeologico, il Museo civico medievale, il Museo Morandi, il Museo civico d'arte industriale Davia Bargellini, il Museo del patrimonio industriale di Bologna, il MAMbo (Museo d'arte moderna di Bologna) e il Museo internazionale e biblioteca della musica."
Museo civico medievale,"Museo Civico Medievale, Via Alessandro Manzoni, Marconi, Saragozza-Porto, Bologna, Emilia-Romagna, 40121, Italia",tourism,museum,0.6546986168413892,"La Pinacoteca Nazionale di Bologna, nata nel 1802 in seno all'Accademia di Belle Arti, è un museo statale dotato di autonomia gestionale. I musei civici sono gestiti dall'Istituzione Bologna Musei, i più importanti dei quali sono: le Collezioni comunali d'arte, il Museo civico archeologico, il Museo civico medievale, il Museo Morandi, il Museo civico d'arte industriale Davia Bargellini, il Museo del patrimonio industriale di Bologna, il MAMbo (Museo d'arte moderna di Bologna) e il Museo internazionale e biblioteca della musica. Ad essi si aggiungono i musei religiosi e quelli di fondazioni private come Genus Bononiae - un'istituzione culturale della Fondazione Cassa di Risparmio in Bologna che gestisce tra gli altri il Museo della storia di Bologna presso Palazzo Pepoli e il palazzo delle esposizioni in Palazzo Fava - e il MAST."
