Dublino,"Via Dublino, Granarolo dell'Emilia, Unione Terre di Pianura, Bologna, Emilia-Romagna, 40057, Italia",highway,residential,0.31,"La conferma di questo arriva da uno studio condotto nel 1989 dal gruppo Reclus di Montpellier e commissionato della DATAR (Délégation à l'Amenagement du Territoire et à l'Action Régionale), nel quale si formula una classificazione per grado d'importanza delle città con più di duecentomila abitanti di quattordici Stati dell'Europa Occidentale e mediterranea: Bologna, con Firenze e Venezia, si situava in posizione più avanzata di città più popolose, quali Dublino, Leeds, Liverpool, Lilla, Norimberga, Essen, Dortmund, Brema, Hannover, Saragozza, Malaga, Bilbao, Salonicco, Palermo, ecc. Nonostante l'esigua popolazione comunale Bologna è stata anche inserita, dal gruppo di studio GaWC, tra le cento città globali (o Città del Mondo), in virtù della sua importanza culturale ed economica (invero in categoria D, cioè città globali in formazione, con bassa evidenza)."
Saragozza,"Saragozza, Saragozza-Porto, Bologna, Emilia-Romagna, 40134, Italia",place,suburb,0.4354981504372133,"La conferma di questo arriva da uno studio condotto nel 1989 dal gruppo Reclus di Montpellier e commissionato della DATAR (Délégation à l'Amenagement du Territoire et à l'Action Régionale), nel quale si formula una classificazione per grado d'importanza delle città con più di duecentomila abitanti di quattordici Stati dell'Europa Occidentale e mediterranea: Bologna, con Firenze e Venezia, si situava in posizione più avanzata di città più popolose, quali Dublino, Leeds, Liverpool, Lilla, Norimberga, Essen, Dortmund, Brema, Hannover, Saragozza, Malaga, Bilbao, Salonicco, Palermo, ecc. Nonostante l'esigua popolazione comunale Bologna è stata anche inserita, dal gruppo di studio GaWC, tra le cento città globali (o Città del Mondo), in virtù della sua importanza culturale ed economica (invero in categoria D, cioè città globali in formazione, con bassa evidenza)."
D,"Accesso Ambulanze Padiglioni A, B, C, D, F, Via Altura, Savena, Bologna, Emilia-Romagna, 40139, Italia",amenity,hospital,0.22100000000000003,"Bologna, con Firenze e Venezia, si situava in posizione più avanzata di città più popolose, quali Dublino, Leeds, Liverpool, Lilla, Norimberga, Essen, Dortmund, Brema, Hannover, Saragozza, Malaga, Bilbao, Salonicco, Palermo, ecc. Nonostante l'esigua popolazione comunale Bologna è stata anche inserita, dal gruppo di studio GaWC, tra le cento città globali (o Città del Mondo), in virtù della sua importanza culturale ed economica (invero in categoria D, cioè città globali in formazione, con bassa evidenza).  Suddivisioni amministrative Il comune è suddiviso amministrativamente in sei circoscrizioni di decentramento, a cui lo statuto attribuisce il nome di ""quartieri"":"
Borgo Panigale-Reno,"Borgo Panigale-Reno, Bologna, Emilia-Romagna, Italia",boundary,administrative,0.6599999999999999," Suddivisioni amministrative Il comune è suddiviso amministrativamente in sei circoscrizioni di decentramento, a cui lo statuto attribuisce il nome di ""quartieri"": Borgo Panigale-Reno, San Donato-San Vitale, Savena, Navile, Porto-Saragozza, Santo Stefano.  Urbanistica Il centro storico di Bologna è uno dei più antichi e vasti d'Europa."
San Donato-San Vitale,"San Donato-San Vitale, Bologna, Emilia-Romagna, Italia",boundary,administrative,0.7083870403687118," Suddivisioni amministrative Il comune è suddiviso amministrativamente in sei circoscrizioni di decentramento, a cui lo statuto attribuisce il nome di ""quartieri"": Borgo Panigale-Reno, San Donato-San Vitale, Savena, Navile, Porto-Saragozza, Santo Stefano.  Urbanistica Il centro storico di Bologna è uno dei più antichi e vasti d'Europa."
Navile,"Navile, Bologna, Emilia-Romagna, Italia",boundary,administrative,0.43912463163390336," Suddivisioni amministrative Il comune è suddiviso amministrativamente in sei circoscrizioni di decentramento, a cui lo statuto attribuisce il nome di ""quartieri"": Borgo Panigale-Reno, San Donato-San Vitale, Savena, Navile, Porto-Saragozza, Santo Stefano.  Urbanistica Il centro storico di Bologna è uno dei più antichi e vasti d'Europa."
Porto-Saragozza,"Bologna Centrale, Piazza delle Medaglie d'Oro, Marconi, Saragozza-Porto, Bologna, Emilia-Romagna, 40100, Italia",railway,station,0.7078493758844653," Suddivisioni amministrative Il comune è suddiviso amministrativamente in sei circoscrizioni di decentramento, a cui lo statuto attribuisce il nome di ""quartieri"": Borgo Panigale-Reno, San Donato-San Vitale, Savena, Navile, Porto-Saragozza, Santo Stefano.  Urbanistica Il centro storico di Bologna è uno dei più antichi e vasti d'Europa."
Mercato di Mezzo,"Mercato Di Mezzo, 9, Via Francesco Rizzoli, Irnerio, Santo Stefano, Bologna, Emilia-Romagna, 40121, Italia",shop,supermarket,0.411," Urbanistica Il centro storico di Bologna è uno dei più antichi e vasti d'Europa. In virtù di un'attenta politica di restauro e conservazione avviata dalla fine degli anni sessanta del secolo scorso, esso ha conservato gran parte della città medievale, a dispetto dei gravi danni causati dagli sventramenti urbanistici della fine del XIX secolo, tra cui quello del centrale Mercato di Mezzo, e dalle distruzioni belliche della seconda guerra mondiale. In alcune case si trovano ancora le fondazioni della città romana risalente al II secolo a.C., e in altre abitazioni pare addirittura che vi siano tracce datate all'età del ferro."
via Emilia,"Via Emilia, Centro, Imola, Nuovo Circondario Imolese, Bologna, Emilia-Romagna, 40026, Italia",highway,residential,0.41000000000000003,"In alcune case si trovano ancora le fondazioni della città romana risalente al II secolo a.C., e in altre abitazioni pare addirittura che vi siano tracce datate all'età del ferro. La struttura del centro storico composta dalla sovrapposizione di due modelli planimetrici, quello romano ortogonale e quello medievale a raggiera, con piazza Maggiore posta in mezzo e i ""raggi"", a partire dalle due strade centrali della via Emilia - via Rizzoli e via Ugo Bassi - che si sviluppano fino alle varie porte che si aprono lungo i resti delle mura. Caratteristica principale delle abitazioni, ereditata dall'architettura del passato e riproposta anche in chiave moderna in quasi tutta la città, è quella di avere all'esterno i portici."
Novecento,"Galleria Nick Novecento, Via Borgonuovo, Borgonuovo, Sasso Marconi, Unione dei comuni Valli del Reno, Lavino e Samoggia, Bologna, Emilia-Romagna, 40044, Italia",shop,mall,0.21100000000000002,"La città ha infatti la più alta concentrazione di portici al mondo, circa 42 km. L'espansione demografica dovuta alla forte immigrazione dalla provincia e dalle regioni del sud Italia ha portato, soprattutto negli anni sessanta e settanta del Novecento, a un’intensa urbanizzazione delle aree un tempo rurali all'esterno delle mura cittadine. Nacquero così popolosi quartieri periferici come la Barca (1962), il Pilastro (1966) o il Fossolo (1968), e si realizzarono grandi progetti di edilizia popolare, come ad esempio il grattacielo di San Vitale (1958-60), l'insediamento ""Levante Emilia"" in via Napoli (1961), il Treno (1957-62) e lo Steccone (1968) alla Barca, il Virgolone (1976) al Pilastro."
Barca,"Barca, Borgo Panigale-Reno, Casteldebole, Bologna, Emilia-Romagna, 40133, Italia",place,suburb,0.49500000000000005,"L'espansione demografica dovuta alla forte immigrazione dalla provincia e dalle regioni del sud Italia ha portato, soprattutto negli anni sessanta e settanta del Novecento, a un’intensa urbanizzazione delle aree un tempo rurali all'esterno delle mura cittadine. Nacquero così popolosi quartieri periferici come la Barca (1962), il Pilastro (1966) o il Fossolo (1968), e si realizzarono grandi progetti di edilizia popolare, come ad esempio il grattacielo di San Vitale (1958-60), l'insediamento ""Levante Emilia"" in via Napoli (1961), il Treno (1957-62) e lo Steccone (1968) alla Barca, il Virgolone (1976) al Pilastro. In un'area destinata allo sviluppo della città, fra via Stalingrado e il quartiere San Donato, nel 1967 l'amministrazione comunale commissionò al noto architetto giapponese Kenzō Tange la progettazione del Centro direzionale nell'area della fiera, la cui costruzione iniziò nel 1975."
San Vitale,"San Vitale, Irnerio, Santo Stefano, Bologna, Emilia-Romagna, 40125, Italia",highway,platform,0.41000000000000003,"L'espansione demografica dovuta alla forte immigrazione dalla provincia e dalle regioni del sud Italia ha portato, soprattutto negli anni sessanta e settanta del Novecento, a un’intensa urbanizzazione delle aree un tempo rurali all'esterno delle mura cittadine. Nacquero così popolosi quartieri periferici come la Barca (1962), il Pilastro (1966) o il Fossolo (1968), e si realizzarono grandi progetti di edilizia popolare, come ad esempio il grattacielo di San Vitale (1958-60), l'insediamento ""Levante Emilia"" in via Napoli (1961), il Treno (1957-62) e lo Steccone (1968) alla Barca, il Virgolone (1976) al Pilastro. In un'area destinata allo sviluppo della città, fra via Stalingrado e il quartiere San Donato, nel 1967 l'amministrazione comunale commissionò al noto architetto giapponese Kenzō Tange la progettazione del Centro direzionale nell'area della fiera, la cui costruzione iniziò nel 1975."
Levante Emilia,"Rizzola Levante, Bargellino, Calderara di Reno, Unione Terre d'Acqua, Bologna, Emilia-Romagna, 40012, Italia",place,hamlet,0.56,"L'espansione demografica dovuta alla forte immigrazione dalla provincia e dalle regioni del sud Italia ha portato, soprattutto negli anni sessanta e settanta del Novecento, a un’intensa urbanizzazione delle aree un tempo rurali all'esterno delle mura cittadine. Nacquero così popolosi quartieri periferici come la Barca (1962), il Pilastro (1966) o il Fossolo (1968), e si realizzarono grandi progetti di edilizia popolare, come ad esempio il grattacielo di San Vitale (1958-60), l'insediamento ""Levante Emilia"" in via Napoli (1961), il Treno (1957-62) e lo Steccone (1968) alla Barca, il Virgolone (1976) al Pilastro. In un'area destinata allo sviluppo della città, fra via Stalingrado e il quartiere San Donato, nel 1967 l'amministrazione comunale commissionò al noto architetto giapponese Kenzō Tange la progettazione del Centro direzionale nell'area della fiera, la cui costruzione iniziò nel 1975."
via Napoli,"Via Napoli, Due Madonne, Savena, Bologna, Emilia-Romagna, 40139, Italia",highway,residential,0.41000000000000003,"L'espansione demografica dovuta alla forte immigrazione dalla provincia e dalle regioni del sud Italia ha portato, soprattutto negli anni sessanta e settanta del Novecento, a un’intensa urbanizzazione delle aree un tempo rurali all'esterno delle mura cittadine. Nacquero così popolosi quartieri periferici come la Barca (1962), il Pilastro (1966) o il Fossolo (1968), e si realizzarono grandi progetti di edilizia popolare, come ad esempio il grattacielo di San Vitale (1958-60), l'insediamento ""Levante Emilia"" in via Napoli (1961), il Treno (1957-62) e lo Steccone (1968) alla Barca, il Virgolone (1976) al Pilastro. In un'area destinata allo sviluppo della città, fra via Stalingrado e il quartiere San Donato, nel 1967 l'amministrazione comunale commissionò al noto architetto giapponese Kenzō Tange la progettazione del Centro direzionale nell'area della fiera, la cui costruzione iniziò nel 1975."
Treno,"Treno, Belcantone, Borgo Panigale-Reno, Casteldebole, Bologna, Emilia-Romagna, 40133, Italia",highway,platform,0.32,"L'espansione demografica dovuta alla forte immigrazione dalla provincia e dalle regioni del sud Italia ha portato, soprattutto negli anni sessanta e settanta del Novecento, a un’intensa urbanizzazione delle aree un tempo rurali all'esterno delle mura cittadine. Nacquero così popolosi quartieri periferici come la Barca (1962), il Pilastro (1966) o il Fossolo (1968), e si realizzarono grandi progetti di edilizia popolare, come ad esempio il grattacielo di San Vitale (1958-60), l'insediamento ""Levante Emilia"" in via Napoli (1961), il Treno (1957-62) e lo Steccone (1968) alla Barca, il Virgolone (1976) al Pilastro. In un'area destinata allo sviluppo della città, fra via Stalingrado e il quartiere San Donato, nel 1967 l'amministrazione comunale commissionò al noto architetto giapponese Kenzō Tange la progettazione del Centro direzionale nell'area della fiera, la cui costruzione iniziò nel 1975."
Stalingrado,"Stalingrado, Casaralta, Navile, Bologna, Emilia-Romagna, 14007, Italia",highway,platform,0.32,"Nacquero così popolosi quartieri periferici come la Barca (1962), il Pilastro (1966) o il Fossolo (1968), e si realizzarono grandi progetti di edilizia popolare, come ad esempio il grattacielo di San Vitale (1958-60), l'insediamento ""Levante Emilia"" in via Napoli (1961), il Treno (1957-62) e lo Steccone (1968) alla Barca, il Virgolone (1976) al Pilastro. In un'area destinata allo sviluppo della città, fra via Stalingrado e il quartiere San Donato, nel 1967 l'amministrazione comunale commissionò al noto architetto giapponese Kenzō Tange la progettazione del Centro direzionale nell'area della fiera, la cui costruzione iniziò nel 1975. Nacque così il Fiera District, destinato a diventare la sede della Regione Emilia-Romagna, del Palazzo degli Affari, della Fiera di Bologna e di altre importanti istituzioni economiche."
Regione Emilia-Romagna,"Regione Emilia-Romagna, 44, Viale Aldo Moro, San Donato, San Donato-San Vitale, San Nicolò di Villola, Bologna, Emilia-Romagna, 40127, Italia",office,government,0.411,"In un'area destinata allo sviluppo della città, fra via Stalingrado e il quartiere San Donato, nel 1967 l'amministrazione comunale commissionò al noto architetto giapponese Kenzō Tange la progettazione del Centro direzionale nell'area della fiera, la cui costruzione iniziò nel 1975. Nacque così il Fiera District, destinato a diventare la sede della Regione Emilia-Romagna, del Palazzo degli Affari, della Fiera di Bologna e di altre importanti istituzioni economiche. Al centro del Fiera District fu progettata una zona pedonale, piazza della Costituzione, la cui costruzione fu affidata a Isamu Noguchi."
piazza della Costituzione,"Piazza della Costituzione, Casaralta, Navile, Bologna, Emilia-Romagna, 14007, Italia",highway,residential,0.51,"Nacque così il Fiera District, destinato a diventare la sede della Regione Emilia-Romagna, del Palazzo degli Affari, della Fiera di Bologna e di altre importanti istituzioni economiche. Al centro del Fiera District fu progettata una zona pedonale, piazza della Costituzione, la cui costruzione fu affidata a Isamu Noguchi. Fra gli ultimi esempi di architettura contemporanea e interventi urbanistici (spesso oggetto di accese discussioni) troviamo la Porta Europa dell'architetto Ettore Masi in via Stalingrado, il complesso del nuovo palazzo comunale nella zona della Bolognina (Palazzo Bonaccorso e piazza Liber Paradisus) e la Torre Unipol, un grattacielo alto 127 metri sito nella periferia est della città."
via Stalingrado,"Via Stalingrado, San Donato-San Vitale, Dozza, Bologna, Emilia-Romagna, 40128, Italia",highway,primary,0.41000000000000003,"Al centro del Fiera District fu progettata una zona pedonale, piazza della Costituzione, la cui costruzione fu affidata a Isamu Noguchi. Fra gli ultimi esempi di architettura contemporanea e interventi urbanistici (spesso oggetto di accese discussioni) troviamo la Porta Europa dell'architetto Ettore Masi in via Stalingrado, il complesso del nuovo palazzo comunale nella zona della Bolognina (Palazzo Bonaccorso e piazza Liber Paradisus) e la Torre Unipol, un grattacielo alto 127 metri sito nella periferia est della città.  Economia Bologna ospita un'importante rete di industrie meccaniche, elettroniche e alimentari e un gran numero di imprese di artigianato."
Palazzo Bonaccorso,"Comune di Bologna - Palazzo Bonaccorso, Piazza Liber Paradisus, Bolognina, Navile, Bologna, Emilia-Romagna, 40129, Italia",amenity,townhall,0.31100000000000005,"Al centro del Fiera District fu progettata una zona pedonale, piazza della Costituzione, la cui costruzione fu affidata a Isamu Noguchi. Fra gli ultimi esempi di architettura contemporanea e interventi urbanistici (spesso oggetto di accese discussioni) troviamo la Porta Europa dell'architetto Ettore Masi in via Stalingrado, il complesso del nuovo palazzo comunale nella zona della Bolognina (Palazzo Bonaccorso e piazza Liber Paradisus) e la Torre Unipol, un grattacielo alto 127 metri sito nella periferia est della città.  Economia Bologna ospita un'importante rete di industrie meccaniche, elettroniche e alimentari e un gran numero di imprese di artigianato."
piazza Liber Paradisus,"Piazza Liber Paradisus, Bolognina, Navile, Bologna, Emilia-Romagna, Italia",highway,pedestrian,0.5680839831692663,"Al centro del Fiera District fu progettata una zona pedonale, piazza della Costituzione, la cui costruzione fu affidata a Isamu Noguchi. Fra gli ultimi esempi di architettura contemporanea e interventi urbanistici (spesso oggetto di accese discussioni) troviamo la Porta Europa dell'architetto Ettore Masi in via Stalingrado, il complesso del nuovo palazzo comunale nella zona della Bolognina (Palazzo Bonaccorso e piazza Liber Paradisus) e la Torre Unipol, un grattacielo alto 127 metri sito nella periferia est della città.  Economia Bologna ospita un'importante rete di industrie meccaniche, elettroniche e alimentari e un gran numero di imprese di artigianato."
Torre Unipol,"Torre Unipol, 6, Via Larga, Massarenti, San Donato-San Vitale, Croce del Biacco, Bologna, Emilia-Romagna, 40138, Italia",building,office,0.48088129542472813,"Al centro del Fiera District fu progettata una zona pedonale, piazza della Costituzione, la cui costruzione fu affidata a Isamu Noguchi. Fra gli ultimi esempi di architettura contemporanea e interventi urbanistici (spesso oggetto di accese discussioni) troviamo la Porta Europa dell'architetto Ettore Masi in via Stalingrado, il complesso del nuovo palazzo comunale nella zona della Bolognina (Palazzo Bonaccorso e piazza Liber Paradisus) e la Torre Unipol, un grattacielo alto 127 metri sito nella periferia est della città.  Economia Bologna ospita un'importante rete di industrie meccaniche, elettroniche e alimentari e un gran numero di imprese di artigianato."
Economia Bologna,"Università di Bologna Facoltà di Economia, Via Camillo Ranzani, Cirenaica, San Donato-San Vitale, Bologna, Emilia-Romagna, 14007, Italia",amenity,university,0.32100000000000006,"Fra gli ultimi esempi di architettura contemporanea e interventi urbanistici (spesso oggetto di accese discussioni) troviamo la Porta Europa dell'architetto Ettore Masi in via Stalingrado, il complesso del nuovo palazzo comunale nella zona della Bolognina (Palazzo Bonaccorso e piazza Liber Paradisus) e la Torre Unipol, un grattacielo alto 127 metri sito nella periferia est della città.  Economia Bologna ospita un'importante rete di industrie meccaniche, elettroniche e alimentari e un gran numero di imprese di artigianato. La città metropolitana ospita, in proporzione, il maggior numero di imprese per abitanti in Italia."
Malaguti,"Malaguti, La Campana, San Lazzaro di Savena, Bologna, Emilia-Romagna, 40068, Italia",landuse,industrial,0.42,"Nell'area metropolitana, inoltre, si trovano la Lamborghini (a Sant'Agata Bolognese) e la sede italiana della Saab (a Casalecchio di Reno). A Bologna vennero fondate la Maserati, la Malaguti e la Moto Morini. Nel settore del packaging, sviluppatosi a partire dagli anni '20, spiccano il gruppo Coesia (G.D - A.C.M.A. Volpak - Cima - Sasib), e, nel territorio metropolitano, l'IMA (a Ozzano) e la Marchesini Group (a Pianoro)."
Ozzano,"Ozzano, Tolara, Ozzano dell'Emilia, Unione dei comuni Savena-Idice, Bologna, Emilia-Romagna, 40064, Italia",highway,platform,0.32,"A Bologna vennero fondate la Maserati, la Malaguti e la Moto Morini. Nel settore del packaging, sviluppatosi a partire dagli anni '20, spiccano il gruppo Coesia (G.D - A.C.M.A. Volpak - Cima - Sasib), e, nel territorio metropolitano, l'IMA (a Ozzano) e la Marchesini Group (a Pianoro). In ambito metalmeccanico vi si trova la Cesab, mentre nella zona metropolitana hanno sede la Malossi e la Minarelli (entrambe a Calderara di Reno), la Marzocchi e la Viro (a Zola Predosa), la Paioli (a Sant’Agata Bolognese)."
Cesab,"BT CESAB - Toyota Material Handling, 10, Via Persicetana Vecchia, Borgo Panigale-Reno, Bargellino, Calderara di Reno, Unione Terre d'Acqua, Bologna, Emilia-Romagna, 40132, Italia",building,industrial,0.21100000000000002,"Nel settore del packaging, sviluppatosi a partire dagli anni '20, spiccano il gruppo Coesia (G.D - A.C.M.A. Volpak - Cima - Sasib), e, nel territorio metropolitano, l'IMA (a Ozzano) e la Marchesini Group (a Pianoro). In ambito metalmeccanico vi si trova la Cesab, mentre nella zona metropolitana hanno sede la Malossi e la Minarelli (entrambe a Calderara di Reno), la Marzocchi e la Viro (a Zola Predosa), la Paioli (a Sant’Agata Bolognese). Nel più ampio settore delle produzioni industriali vi è il Gruppo Industriale Maccaferri."
Malossi,"Rotonda Cesare Malossi, Massarenti, San Donato-San Vitale, Croce del Biacco, Bologna, Emilia-Romagna, Italia",highway,secondary,0.31,"Nel settore del packaging, sviluppatosi a partire dagli anni '20, spiccano il gruppo Coesia (G.D - A.C.M.A. Volpak - Cima - Sasib), e, nel territorio metropolitano, l'IMA (a Ozzano) e la Marchesini Group (a Pianoro). In ambito metalmeccanico vi si trova la Cesab, mentre nella zona metropolitana hanno sede la Malossi e la Minarelli (entrambe a Calderara di Reno), la Marzocchi e la Viro (a Zola Predosa), la Paioli (a Sant’Agata Bolognese). Nel più ampio settore delle produzioni industriali vi è il Gruppo Industriale Maccaferri."
Marzocchi,"Marzocchi, 24b, Via Luigi Carlo Farini, Galvani, Santo Stefano, Bologna, Emilia-Romagna, 40124, Italia",shop,kitchen,0.22100000000000003,"Nel settore del packaging, sviluppatosi a partire dagli anni '20, spiccano il gruppo Coesia (G.D - A.C.M.A. Volpak - Cima - Sasib), e, nel territorio metropolitano, l'IMA (a Ozzano) e la Marchesini Group (a Pianoro). In ambito metalmeccanico vi si trova la Cesab, mentre nella zona metropolitana hanno sede la Malossi e la Minarelli (entrambe a Calderara di Reno), la Marzocchi e la Viro (a Zola Predosa), la Paioli (a Sant’Agata Bolognese). Nel più ampio settore delle produzioni industriali vi è il Gruppo Industriale Maccaferri."
Viro,"Viro, Via Giuseppe Garibaldi, Gesso, Zola Predosa, Unione dei comuni Valli del Reno, Lavino e Samoggia, Bologna, Emilia-Romagna, 40069, Italia",man_made,works,0.22100000000000003,"Nel settore del packaging, sviluppatosi a partire dagli anni '20, spiccano il gruppo Coesia (G.D - A.C.M.A. Volpak - Cima - Sasib), e, nel territorio metropolitano, l'IMA (a Ozzano) e la Marchesini Group (a Pianoro). In ambito metalmeccanico vi si trova la Cesab, mentre nella zona metropolitana hanno sede la Malossi e la Minarelli (entrambe a Calderara di Reno), la Marzocchi e la Viro (a Zola Predosa), la Paioli (a Sant’Agata Bolognese). Nel più ampio settore delle produzioni industriali vi è il Gruppo Industriale Maccaferri."
Montenegro,"Montenegro, Strada Provinciale di Vignola ""Nuova Bazzanese"", Zola Predosa, Unione dei comuni Valli del Reno, Lavino e Samoggia, Bologna, Emilia-Romagna, 40033, Italia",building,industrial,0.22100000000000003,"a Pianoro la Segafredo Zanetti; a Zola Predosa la Montenegro, l'Alcisa; a Crespellano la Majani;"
Montenegro,"Montenegro, Strada Provinciale di Vignola ""Nuova Bazzanese"", Zola Predosa, Unione dei comuni Valli del Reno, Lavino e Samoggia, Bologna, Emilia-Romagna, 40033, Italia",building,industrial,0.22100000000000003,"Vi si trovano inoltre i seguenti consoli onorari: Austria, Bulgaria, Costa Rica, Francia, Grecia, Malta, Messico, Monaco, Montenegro, Norvegia, Paesi Bassi, Polonia, Portogallo, Regno Unito, Russia, San Marino, Spagna, Sudafrica, Svezia, Svizzera, Ungheria, Uruguay. Gemellaggi Bologna è gemellata con tredici città estere e tre comuni italiani:"
Cereglio,"Cereglio, Vergato, Unione dell'Appennino Bolognese, Bologna, Emilia-Romagna, 40038, Italia",place,village,0.49500000000000005,"ad Anzola dell'Emilia la Carpigiani; a Cereglio la Cerelia Acqua Minerale. Vi si trovano infine le sedi nazionali delle cooperative alimentari Conad e Sigma, mentre nell'adiacente comune di Casalecchio hanno sede la Coop e Despar, e a Funo di Argelato la SISA."
Sigma,"Sigma, Via San Pio quinto, Saffi, Saragozza-Porto, Bologna, Emilia-Romagna, 40134, Italia",shop,supermarket,0.22100000000000003,"a Cereglio la Cerelia Acqua Minerale. Vi si trovano infine le sedi nazionali delle cooperative alimentari Conad e Sigma, mentre nell'adiacente comune di Casalecchio hanno sede la Coop e Despar, e a Funo di Argelato la SISA.  Commercio L'area di Bologna è un polo commerciale di primaria importanza (con il Centergross nell'area metropolitana, che per un lungo periodo è stato dalla fondazione nel 1977 la più grande cittadella commerciale all'ingrosso d'Europa, e l'Interporto)."
Casalecchio,"Casalecchio di Reno, Unione dei comuni Valli del Reno, Lavino e Samoggia, Bologna, Emilia-Romagna, 40033, Italia",boundary,administrative,0.701170639098151,"a Cereglio la Cerelia Acqua Minerale. Vi si trovano infine le sedi nazionali delle cooperative alimentari Conad e Sigma, mentre nell'adiacente comune di Casalecchio hanno sede la Coop e Despar, e a Funo di Argelato la SISA.  Commercio L'area di Bologna è un polo commerciale di primaria importanza (con il Centergross nell'area metropolitana, che per un lungo periodo è stato dalla fondazione nel 1977 la più grande cittadella commerciale all'ingrosso d'Europa, e l'Interporto)."
