Museo egizio,"Museo Egizio, 6, Via Accademia delle Scienze, Centro, Circoscrizione 1, Torino, Piemonte, 10123, Italia",tourism,museum,0.5027787078968705,"Le collezioni di arte antica, la cui raccolta fu iniziata dal duca Emanuele Filiberto di Savoia nella seconda metà del Cinquecento, sono conservate nel Museo di antichità, che raccoglie anche le principali testimonianze archeologiche piemontesi dal Paleolitico al Tardo Medioevo. Dal Museo di Antichità furono separate, negli anni quaranta del Novecento, le collezioni egizie che costituirono il Museo egizio, il più importante d'Europa (nonché il più antico al mondo), in quanto custode della seconda collezione di arte egizia del mondo per vastità e importanza dopo quella del Museo del Cairo. Inoltre, l'apertura del MAO - Museo d'Arte Orientale nel dicembre 2008 ha permesso di ospitare ricche collezioni provenienti dal Vicino Oriente, dall'India, dalla Cina e dal Giappone, oltre che dall'Asia centrale."
Museo del Cairo,"متحف الخزف الإسلامي, شارع الشيخ المرصفي, السبتية, القاهرة, 11211, مصر",tourism,museum,0.3380411950818732,"Le collezioni di arte antica, la cui raccolta fu iniziata dal duca Emanuele Filiberto di Savoia nella seconda metà del Cinquecento, sono conservate nel Museo di antichità, che raccoglie anche le principali testimonianze archeologiche piemontesi dal Paleolitico al Tardo Medioevo. Dal Museo di Antichità furono separate, negli anni quaranta del Novecento, le collezioni egizie che costituirono il Museo egizio, il più importante d'Europa (nonché il più antico al mondo), in quanto custode della seconda collezione di arte egizia del mondo per vastità e importanza dopo quella del Museo del Cairo. Inoltre, l'apertura del MAO - Museo d'Arte Orientale nel dicembre 2008 ha permesso di ospitare ricche collezioni provenienti dal Vicino Oriente, dall'India, dalla Cina e dal Giappone, oltre che dall'Asia centrale."
Vicino,"Vicino, 1, Rössligasse, Muttenz, Bezirk Arlesheim, Basel-Landschaft, 4132, Schweiz/Suisse/Svizzera/Svizra",amenity,restaurant,0.11010000000000002,"Dal Museo di Antichità furono separate, negli anni quaranta del Novecento, le collezioni egizie che costituirono il Museo egizio, il più importante d'Europa (nonché il più antico al mondo), in quanto custode della seconda collezione di arte egizia del mondo per vastità e importanza dopo quella del Museo del Cairo. Inoltre, l'apertura del MAO - Museo d'Arte Orientale nel dicembre 2008 ha permesso di ospitare ricche collezioni provenienti dal Vicino Oriente, dall'India, dalla Cina e dal Giappone, oltre che dall'Asia centrale. Il museo Accorsi-Ometto è una ricca collezione privata, ora aperta al pubblico, di opere collezionistiche e di arte decorativa."
Giappone,"Giappone, Villa Collemandina, Unione Comuni Garfagnana, Lucca, Toscana, 55038, Italia",place,isolated_dwelling,0.30999999999999994,"Dal Museo di Antichità furono separate, negli anni quaranta del Novecento, le collezioni egizie che costituirono il Museo egizio, il più importante d'Europa (nonché il più antico al mondo), in quanto custode della seconda collezione di arte egizia del mondo per vastità e importanza dopo quella del Museo del Cairo. Inoltre, l'apertura del MAO - Museo d'Arte Orientale nel dicembre 2008 ha permesso di ospitare ricche collezioni provenienti dal Vicino Oriente, dall'India, dalla Cina e dal Giappone, oltre che dall'Asia centrale. Il museo Accorsi-Ometto è una ricca collezione privata, ora aperta al pubblico, di opere collezionistiche e di arte decorativa."
museo Accorsi-Ometto,"Museo Accorsi Ometto, 55, Via Po, Borgo Nuovo, Circoscrizione 1, Torino, Piemonte, 10124, Italia",tourism,museum,0.30010000000000003,"Inoltre, l'apertura del MAO - Museo d'Arte Orientale nel dicembre 2008 ha permesso di ospitare ricche collezioni provenienti dal Vicino Oriente, dall'India, dalla Cina e dal Giappone, oltre che dall'Asia centrale. Il museo Accorsi-Ometto è una ricca collezione privata, ora aperta al pubblico, di opere collezionistiche e di arte decorativa. Mostre temporanee di rilievo si tengono a Palazzo Bricherasio e a Palazzo Madama."
Palazzo Bricherasio,"Palazzo Bricherasio, Via Piero Gobetti, Centro, Circoscrizione 1, Torino, Piemonte, 10123, Italia",building,yes,0.40962395537124985,"Il museo Accorsi-Ometto è una ricca collezione privata, ora aperta al pubblico, di opere collezionistiche e di arte decorativa. Mostre temporanee di rilievo si tengono a Palazzo Bricherasio e a Palazzo Madama. Importanti sono poi dal punto di vista storico il Museo nazionale del Risorgimento italiano, presso Palazzo Carignano, e il Museo nazionale della montagna, presso il Monte dei Cappuccini, sulla riva destra del Po."
Museo nazionale del Risorgimento italiano,"Museo nazionale del Risorgimento italiano, 5, Via Accademia delle Scienze, Centro, Circoscrizione 1, Torino, Piemonte, 10123, Italia",tourism,museum,0.7745321115064417,"Mostre temporanee di rilievo si tengono a Palazzo Bricherasio e a Palazzo Madama. Importanti sono poi dal punto di vista storico il Museo nazionale del Risorgimento italiano, presso Palazzo Carignano, e il Museo nazionale della montagna, presso il Monte dei Cappuccini, sulla riva destra del Po. Testimonianze della storia di Torino sono a disposizione presso l'Istituto Storico della Resistenza, che gestisce inoltre il Museo diffuso della Resistenza, della deportazione, della guerra, dei diritti e della libertà."
Museo nazionale della montagna,"Museo Nazionale della Montagna Duca degli Abruzzi, 7, Piazzale Monte dei Cappuccini, Borgo Po, Circoscrizione 8, Torino, Piemonte, 10131, Italia",tourism,museum,0.6075345213990273,"Mostre temporanee di rilievo si tengono a Palazzo Bricherasio e a Palazzo Madama. Importanti sono poi dal punto di vista storico il Museo nazionale del Risorgimento italiano, presso Palazzo Carignano, e il Museo nazionale della montagna, presso il Monte dei Cappuccini, sulla riva destra del Po. Testimonianze della storia di Torino sono a disposizione presso l'Istituto Storico della Resistenza, che gestisce inoltre il Museo diffuso della Resistenza, della deportazione, della guerra, dei diritti e della libertà."
Monte dei Cappuccini,"Monte dei Cappuccini, Borgo Po, Circoscrizione 8, Torino, Piemonte, Italia",natural,wood,0.5,"Mostre temporanee di rilievo si tengono a Palazzo Bricherasio e a Palazzo Madama. Importanti sono poi dal punto di vista storico il Museo nazionale del Risorgimento italiano, presso Palazzo Carignano, e il Museo nazionale della montagna, presso il Monte dei Cappuccini, sulla riva destra del Po. Testimonianze della storia di Torino sono a disposizione presso l'Istituto Storico della Resistenza, che gestisce inoltre il Museo diffuso della Resistenza, della deportazione, della guerra, dei diritti e della libertà."
Istituto Storico della Resistenza,"Biblioteca dell'Istituto Storico della Resistenza e dell'Et Contemporanea, Piazza Ricci, Borgo Foce, Porto Maurizio, Caramagnetta, Imperia, Liguria, 18100, Italia",amenity,library,0.4001,"Importanti sono poi dal punto di vista storico il Museo nazionale del Risorgimento italiano, presso Palazzo Carignano, e il Museo nazionale della montagna, presso il Monte dei Cappuccini, sulla riva destra del Po. Testimonianze della storia di Torino sono a disposizione presso l'Istituto Storico della Resistenza, che gestisce inoltre il Museo diffuso della Resistenza, della deportazione, della guerra, dei diritti e della libertà. Per quanto riguarda le scienze, è sicuramente da ricordare il Museo Regionale di Scienze Naturali, tra i maggiori in Italia dello specifico settore, e il Museo della Sindone, che illustra al visitatore le scoperte scientifiche sul telo sindonico."
Museo Regionale di Scienze Naturali,"Museo Regionale di Scienze Naturali, 36, Via Giovanni Giolitti, Borgo Nuovo, Circoscrizione 1, Torino, Piemonte, 10123, Italia",tourism,museum,0.5001,"Testimonianze della storia di Torino sono a disposizione presso l'Istituto Storico della Resistenza, che gestisce inoltre il Museo diffuso della Resistenza, della deportazione, della guerra, dei diritti e della libertà. Per quanto riguarda le scienze, è sicuramente da ricordare il Museo Regionale di Scienze Naturali, tra i maggiori in Italia dello specifico settore, e il Museo della Sindone, che illustra al visitatore le scoperte scientifiche sul telo sindonico. Da ricordare il Museo dell'astronomia e Planetario di Torino, che sorge accanto dell'Osservatorio astronomico di Torino a Pino Torinese, cittadina collinare nei pressi immediati del capoluogo piemontese."
Museo della Sindone,"Museo Della Sindone, 28, Via San Domenico, Quadrilatero Romano, Circoscrizione 1, Torino, Piemonte, 10122, Italia",tourism,museum,0.4983870403687118,"Testimonianze della storia di Torino sono a disposizione presso l'Istituto Storico della Resistenza, che gestisce inoltre il Museo diffuso della Resistenza, della deportazione, della guerra, dei diritti e della libertà. Per quanto riguarda le scienze, è sicuramente da ricordare il Museo Regionale di Scienze Naturali, tra i maggiori in Italia dello specifico settore, e il Museo della Sindone, che illustra al visitatore le scoperte scientifiche sul telo sindonico. Da ricordare il Museo dell'astronomia e Planetario di Torino, che sorge accanto dell'Osservatorio astronomico di Torino a Pino Torinese, cittadina collinare nei pressi immediati del capoluogo piemontese."
Planetario di Torino,"Impianto di Risalita Planetario, Via Torino, Cento Croci, Pino Torinese, Torino, Piemonte, 10025, Italia",building,yes,0.31010000000000004,"Per quanto riguarda le scienze, è sicuramente da ricordare il Museo Regionale di Scienze Naturali, tra i maggiori in Italia dello specifico settore, e il Museo della Sindone, che illustra al visitatore le scoperte scientifiche sul telo sindonico. Da ricordare il Museo dell'astronomia e Planetario di Torino, che sorge accanto dell'Osservatorio astronomico di Torino a Pino Torinese, cittadina collinare nei pressi immediati del capoluogo piemontese. Nel 2004 è stato inaugurato il Museo A come Ambiente, il primo in Europa interamente dedicato alle tematiche ambientali."
Osservatorio astronomico di Torino,"Parco Astronomico dell'Osservatorio di Torino, Cento Croci, Pino Torinese, Torino, Piemonte, Italia",landuse,observatory,0.7196338106604421,"Per quanto riguarda le scienze, è sicuramente da ricordare il Museo Regionale di Scienze Naturali, tra i maggiori in Italia dello specifico settore, e il Museo della Sindone, che illustra al visitatore le scoperte scientifiche sul telo sindonico. Da ricordare il Museo dell'astronomia e Planetario di Torino, che sorge accanto dell'Osservatorio astronomico di Torino a Pino Torinese, cittadina collinare nei pressi immediati del capoluogo piemontese. Nel 2004 è stato inaugurato il Museo A come Ambiente, il primo in Europa interamente dedicato alle tematiche ambientali."
Museo A,"Museo, Szent Borbála tér, Újváros, Tatabánya, Tatabányai járás, Komárom-Esztergom megye, Közép-Dunántúl, Dunántúl, 2800, Magyarország",tourism,museum,0.2101,"Da ricordare il Museo dell'astronomia e Planetario di Torino, che sorge accanto dell'Osservatorio astronomico di Torino a Pino Torinese, cittadina collinare nei pressi immediati del capoluogo piemontese. Nel 2004 è stato inaugurato il Museo A come Ambiente, il primo in Europa interamente dedicato alle tematiche ambientali. Da segnalare, infine, che tutti i musei sopra indicati, più numerosi altri all'interno della Regione Piemonte per un totale di circa 200 siti, sono gratuitamente e illimitatamente accessibili tramite l'Abbonamento Musei regionale, che fin dagli anni '90 è stato sviluppato per permettere la fruizione dei luoghi museali sul territorio previo acquisto annuale forfettario, e che nel 2017 ha raggiunto l'importante obiettivo delle oltre 136.000 tessere vendute e i circa 900.000 ingressi nei siti convenzionati."
Comune di Torino,"Ex Economato Ripartizione 5 del Comune di Torino, 33, Strada Basse di Stura, Rebaudengo, Circoscrizione 6, Torino, Piemonte, 10154, Italia",historic,ruins,0.31010000000000004,"Sono presenti in città anche le redazioni di svariati periodici dedicati ad arte e cultura come Il Giornale dell'Arte , Il Giornale dell'Architettura e Il Giornale della Musica . Il Comune di Torino, dal 2004, pubblica il periodico CittAgorà . Torino è stata per decenni la sede dell'EIAR e poi della Rai e perciò è la città da cui partiva la maggior parte delle trasmissioni radiofoniche nell'epoca in cui non c'era ancora la televisione (1927-1954)."
Museo della Radio,"Museo della Radio, Via Roma, Arcagna, Montanaso Lombardo, Lodi, Lombardia, 26836, Italia",tourism,museum,0.30010000000000003,"Torino è tra le sedi principali del Centro di Produzione Televisiva Rai, come quelli di Roma, Milano e Napoli. Assieme a queste tre sedi, da quando ha iniziato i suoi programmi nel 1954, il centro di Torino (ospitante il Museo della Radio e della Televisione) è stato anche il primo dell'azienda televisiva. Torino, inoltre, prima che si trasformasse in RAI, già ospitava il centro di direzione dell'EIAR dal 1927."
Rete 7 Piemonte,"lungo la rete, Briccalone, Serravalle, Asti, Piemonte, Italia",highway,path,0.285,"Torino, inoltre, prima che si trasformasse in RAI, già ospitava il centro di direzione dell'EIAR dal 1927. Altre emittenti, a diffusione regionale, sono Quartarete TV, GRP Televisione, TST, Quinta Rete, Videogruppo Piemonte, Rete 7 Piemonte e Telesubalpina (quest'ultima chiusa nel 2019 e sostituita da Radio Bianconera TV). Una delle più importanti produzioni ambientate a Torino è la soap opera CentoVetrine che utilizza la gran parte delle location esterne per le case dei protagonisti, il commissariato Franco Balbis, il carcere, l'ospedale e le principali piazze."
via Po,"Via Po, Vogliotti, Castagneto Po, Torino, Piemonte, 10034, Italia",highway,tertiary,0.3,"Torino è la città italiana in cui fu per prima stabilita l'industria cinematografica, in ragione della storica vicinanza geografica e culturale con la Francia dei fratelli Lumière. Proprio nel capoluogo piemontese, nel marzo 1896, gli inventori del cinematografo esibirono la prima proiezione di un film in Italia ed in via Po, a novembre, la prima davanti ad un pubblico pagante. I primi studi cinematografici italiani aprirono a Torino nel 1907."
Cabiria,"Cabiria, Strada Provinciale 589 dei Laghi di Avigliana, Cumiana, Torino, Piemonte, 10040, Italia",amenity,restaurant,0.11010000000000002,"Giovanni Pastrone vi girò uno dei primi colossal della storia del cinema: Cabiria del 1914. Le produzioni delle principali case, come l'Ambrosio Film, l'Itala Film, l'Aquila e gli studi Fert, proseguirono fino al 1937, anno di inaugurazione di Cinecittà a Roma."
Palazzo Chiablese,"Palazzo Chiablese, Piazza San Giovanni, Centro, Circoscrizione 1, Torino, Piemonte, 10122, Italia",historic,manor,0.5071516336244855,"La vocazione cinematografica di Torino non cessò. Nel 1956 venne aperto il Museo nazionale del cinema, dapprima ospitato a Palazzo Chiablese e poi, dal 2000, nell'imponente sede della Mole Antonelliana. Negli anni ottanta un gruppo di professori universitari e critici cinematografici torinesi diede luogo, con il sostegno degli enti locali, alla rassegna cinematografica Festival Cinema Giovani che dal 1997 assunse la denominazione di Torino Film Festival, conquistandosi un punto di riferimento a livello internazionale specialmente per il cinema sperimentale, secondo in Italia soltanto allo storico Festival di Venezia."
Mole Antonelliana,"Mole Antonelliana, Via Alessandro Riberi, Borgo Nuovo, Circoscrizione 1, Torino, Piemonte, 10124, Italia",tourism,viewpoint,0.2001,"La vocazione cinematografica di Torino non cessò. Nel 1956 venne aperto il Museo nazionale del cinema, dapprima ospitato a Palazzo Chiablese e poi, dal 2000, nell'imponente sede della Mole Antonelliana. Negli anni ottanta un gruppo di professori universitari e critici cinematografici torinesi diede luogo, con il sostegno degli enti locali, alla rassegna cinematografica Festival Cinema Giovani che dal 1997 assunse la denominazione di Torino Film Festival, conquistandosi un punto di riferimento a livello internazionale specialmente per il cinema sperimentale, secondo in Italia soltanto allo storico Festival di Venezia."
Mole Antonelliana,"Mole Antonelliana, Via Alessandro Riberi, Borgo Nuovo, Circoscrizione 1, Torino, Piemonte, 10124, Italia",tourism,viewpoint,0.2001,"Da qualche tempo vi sono in città dei tour operator che organizzano anche visite guidate sui misteri di Torino. Per gli esoteristi la magia positiva di Torino nasce dal ""cuore bianco"" di piazza Castello, dal Duomo che custodisce la Sacra Sindone alla Gran Madre di Dio e fino alla Mole Antonelliana, che indica il cielo. Ai lati della scalinata che conduce all'ingresso della chiesa della Gran Madre di Dio troviamo le due statue raffiguranti la Fede e la Religione, tra le quali si troverebbe il nascondiglio del Graal."
Galleria Subalpina,"Galleria dell'Industria Subalpina, Centro, Circoscrizione 1, Torino, Piemonte, 10123, Italia",highway,footway,0.4031303339921358,"entrambi hanno cessato la loro attività nel 2013. Sono nati a Torino il primo cinema d'essai italiano (il Romano nella Galleria Subalpina, nel 1971), la principale associazione cinematografica nazionale (l'Aiace Torino) e la prima multisala del Paese (l'Eliseo, nel 1983). Nel 2007 è stata fondata a Torino la casa di distribuzione cinematografica italiana Movies Inspired, con sede legale (dal 2014) nello storico Cinema Classico (già Impero - Vittorio Veneto - Empire )."
Eliseo,"Eliseo, 64, Via Torino, Duomo, Municipio 1, Milano, Lombardia, 20121, Italia",amenity,cinema,0.11010000000000002,"entrambi hanno cessato la loro attività nel 2013. Sono nati a Torino il primo cinema d'essai italiano (il Romano nella Galleria Subalpina, nel 1971), la principale associazione cinematografica nazionale (l'Aiace Torino) e la prima multisala del Paese (l'Eliseo, nel 1983). Nel 2007 è stata fondata a Torino la casa di distribuzione cinematografica italiana Movies Inspired, con sede legale (dal 2014) nello storico Cinema Classico (già Impero - Vittorio Veneto - Empire )."
Cinema Classico,"Classico, 5, Piazza Vittorio Veneto, Borgo Nuovo, Circoscrizione 1, Torino, Piemonte, 10124, Italia",amenity,cinema,0.11010000000000002,"Sono nati a Torino il primo cinema d'essai italiano (il Romano nella Galleria Subalpina, nel 1971), la principale associazione cinematografica nazionale (l'Aiace Torino) e la prima multisala del Paese (l'Eliseo, nel 1983). Nel 2007 è stata fondata a Torino la casa di distribuzione cinematografica italiana Movies Inspired, con sede legale (dal 2014) nello storico Cinema Classico (già Impero - Vittorio Veneto - Empire ). A San Giusto Canavese è presente un importante centro di produzione cine-televisiva i Telecittà Studios, mentre a Torino c'è il Cineporto una struttura riservata alle società di produzioni cinematografiche che vengono in città a girare film."
Cineporto,"Cineporto, 500, Avenida Leovigildo Dias Vieira, Jardim Paula Nobre, Itaguá, Ubatuba, Região Imediata de Caraguatatuba-Ubatuba-São Sebastião, Região Metropolitana do Vale do Paraíba e Litoral Norte, Região Geográfica Intermediária de São José dos Campos, São Paulo, Região Sudeste, 11680-000, Brasil",amenity,cinema,0.11010000000000002,"Nel 2007 è stata fondata a Torino la casa di distribuzione cinematografica italiana Movies Inspired, con sede legale (dal 2014) nello storico Cinema Classico (già Impero - Vittorio Veneto - Empire ). A San Giusto Canavese è presente un importante centro di produzione cine-televisiva i Telecittà Studios, mentre a Torino c'è il Cineporto una struttura riservata alle società di produzioni cinematografiche che vengono in città a girare film. Citazioni cinematografiche Guerra e Pace ."
Cineporto,"Cineporto, 500, Avenida Leovigildo Dias Vieira, Jardim Paula Nobre, Itaguá, Ubatuba, Região Imediata de Caraguatatuba-Ubatuba-São Sebastião, Região Metropolitana do Vale do Paraíba e Litoral Norte, Região Geográfica Intermediária de São José dos Campos, São Paulo, Região Sudeste, 11680-000, Brasil",amenity,cinema,0.11010000000000002,"All'interno della Mole è ospitato il Museo nazionale del cinema. Nel capoluogo sabaudo è inoltre attivo il Cineporto, una struttura polifunzionale dedicata alle produzioni cinematografiche unica in Italia. Nel 2016 è stata classificata da GaWC come una città mondiale ""Gamma""."
Aeroporto di Torino-Caselle,"Caselle (str. Aeroporto 36), Strada Aeroporto, Caselle Torinese, Torino, Piemonte, 10072, Italia",highway,bus_stop,0.31010000000000004,Un colpo all'italiana . Un gruppo di ladri inglesi arriva a Torino a bordo di tre Mini Cooper per organizzare una rapina ai danni di un convoglio che trasporta i ricavi della FIAT dall'Aeroporto di Torino-Caselle fino alla città. Profondo Rosso.
Aeroporto di Torino-Caselle,"Caselle (str. Aeroporto 36), Strada Aeroporto, Caselle Torinese, Torino, Piemonte, 10072, Italia",highway,bus_stop,0.31010000000000004,"Attualmente la città di Torino dispone di uno scalo aereo internazionale: l'Aeroporto di Torino-Caselle, un aeroporto di medie dimensioni (200-300 ettari, 1-5 milioni di passeggeri all'anno) inaugurato nel 1953. È presente anche l'Aeroporto di Torino-Cuneo, in provincia di Cuneo, che fa riferimento al capoluogo piemontese come secondo aeroporto del Piemonte."
Piazza Statuto,"Piazza Statuto, Quadrilatero Romano, Circoscrizione 1, Torino, Piemonte, 10140, Italia",highway,residential,0.4652698587495282,"Un poliziesco interamente girato a Torino. Sono numerosi i luoghi riconoscibili della città, come Piazza Statuto, Piazza Cavour e Corso Francia. American Gigolò ."
Piazza Statuto,"Piazza Statuto, Quadrilatero Romano, Circoscrizione 1, Torino, Piemonte, 10140, Italia",highway,residential,0.4652698587495282,"il rondò 'd la forca (Rotonda della forca). La tradizione racconta che l'angelo che sovrasta l'obelisco, e sul cui capo è posta una stella a cinque punte, sia Lucifero, in effetti l'angelo più bello, e che quindi in Piazza Statuto, sotto la Fontana del Frejus, si trovi la porta dell'inferno. Dal 1998 esistono tour notturni ispirati alle tradizioni letterarie che hanno fatto di Torino una città magica;"
Piazza Cavour,"Piazza Cavour, Livorno, Toscana, Italia",highway,pedestrian,0.41164487082682943,"Un poliziesco interamente girato a Torino. Sono numerosi i luoghi riconoscibili della città, come Piazza Statuto, Piazza Cavour e Corso Francia. American Gigolò ."
American Gigolò,"American Gigolo - Birreria Pub, Via del Lavoro, Bussolengo, Verona, Veneto, 37012, Italia",amenity,pub,0.10010000000000001,"Sono numerosi i luoghi riconoscibili della città, come Piazza Statuto, Piazza Cavour e Corso Francia. American Gigolò . La città viene citata nel film."
Teatro Regio,"Teatro Regio, Via Carlo Alberto, Centro, Circoscrizione 1, Torino, Piemonte, 10123, Italia",tourism,attraction,0.6445110130745724,"I protagonisti Holly e David si incontrano per la prima volta al Metropolitan Opera di New York mentre è in scena il Manon Lescaut di Giacomo Puccini. Le scene all’interno del teatro, però, sono state girate al Teatro Regio di Torino. A che punto è la notte ."
Teatro Regio,"Teatro Regio, Via Carlo Alberto, Centro, Circoscrizione 1, Torino, Piemonte, 10123, Italia",tourism,attraction,0.6445110130745724,"Soap opera. Cuori rubati CentoVetrine (dal 2007 in numerosi cambi di scene si possono osservare i principali monumenti della città) Vivere Il bene e il male Elisa di Rivombrosa L'ente lirico di Torino è il Teatro Regio, mentre la principale orchestra sinfonica cittadina è l'Orchestra sinfonica nazionale della RAI, che si esibisce all'Auditorium della RAI. Nell'ambito della musica classica sono attive anche l'Orchestra Filarmonica di Torino, la Filarmonica del Regio e l'Accademia Musicale Stefano Tempia, specializzata nel repertorio barocco."
Palazzo Saluzzo Paesana,"Palazzo Saluzzo di Paesana, Via Bligny, Quadrilatero Romano, Circoscrizione 1, Torino, Piemonte, 10122, Italia",building,yes,0.44778803910650133,"Il divo . Le riprese sono state effettuate a Palazzo Saluzzo Paesana, a Palazzo Birago di Borgaro, a Palazzo dei Draghi, in via Carlo Alberto, nella Casa Circondariale “Lorusso e Cutugno”, al Palazzo Civico e al Ponte Rossini. Vincere ."
Palazzo Birago di Borgaro,"Palazzo Birago di Borgaro, Via Carlo Alberto, Centro, Circoscrizione 1, Torino, Piemonte, 10123, Italia",tourism,information,0.4001,"Il divo . Le riprese sono state effettuate a Palazzo Saluzzo Paesana, a Palazzo Birago di Borgaro, a Palazzo dei Draghi, in via Carlo Alberto, nella Casa Circondariale “Lorusso e Cutugno”, al Palazzo Civico e al Ponte Rossini. Vincere ."
Casa Circondariale “Lorusso,"Casa Circondariale di Torino ""Lorusso e Cotugno"", 35, Via Maria Adelaide Aglietta, Vallette, Circoscrizione 5, Torino, Piemonte, 10151, Italia",place,house,0.30010000000000003,"Il divo . Le riprese sono state effettuate a Palazzo Saluzzo Paesana, a Palazzo Birago di Borgaro, a Palazzo dei Draghi, in via Carlo Alberto, nella Casa Circondariale “Lorusso e Cutugno”, al Palazzo Civico e al Ponte Rossini. Vincere ."
Palazzo Civico,"Palazzo Civico, Via Camillo Benso di Cavour, Vigone, Torino, Piemonte, 10067, Italia",building,civic,0.2001,"Il divo . Le riprese sono state effettuate a Palazzo Saluzzo Paesana, a Palazzo Birago di Borgaro, a Palazzo dei Draghi, in via Carlo Alberto, nella Casa Circondariale “Lorusso e Cutugno”, al Palazzo Civico e al Ponte Rossini. Vincere ."
