San Salvario,"San Salvario, Circoscrizione 8, Torino, Piemonte, 10125, Italia",place,suburb,0.4372938346316069,"In più, grazie a un indice di verde visibile del 16,2%, Torino si piazza al tredicesimo posto tra le diciassette città con più alberi nel mondo. Nel quartiere San Salvario, caratteristico è il Condominio 25 Verde, il cui principio è lo stesso del più imponente (perché grattacielo) Bosco Verticale di Milano. È inoltre la prima città italiana, tra quelle con più di 500.000 abitanti, per quanto riguarda la quota di raccolta differenziata dei rifiuti, giunta nel 2014 al 42,2%."
piazza San Carlo,"Piazza San Carlo, Centro, Circoscrizione 1, Torino, Piemonte, Italia",place,square,0.6422422228371537,La prima testimonianza è l'ordinanza di Carlo Emanuele I di Savoia del 16 giugno 1606 in merito alla costruzione di piazza Castello secondo il progetto di Ascanio Vittozzi che comprendeva portici attorno a tutta la piazza. Anche nel progetto di piazza San Carlo di Amedeo di Castellamonte di qualche anno successivo erano previsti portici tutt'attorno. Negli stessi anni Filippo Juvarra costruì i portici di porta Palazzo.
Palazzo di Città,"Palazzo di Città, Via Milano, Quadrilatero Romano, Circoscrizione 1, Torino, Piemonte, 10122, Italia",building,government,0.30010000000000003,"Negli stessi anni Filippo Juvarra costruì i portici di porta Palazzo. Nel 1765 Benedetto Alfieri ebbe l'incarico di rifare i portici di piazza Palazzo di Città mentre nel corso del XIX secolo si aggiunsero quelli dell'attuale piazza Vittorio Veneto, piazza Carlo Felice e piazza Statuto. Le stazioni ferroviarie di Porta Nuova e Porta Susa vennero congiunte con un percorso porticato attraverso via Nizza, via Sacchi, Corso Vittorio Emanuele II, Corso Vinzaglio e via Cernaia."
Palazzo di Città,"Palazzo di Città, Via Milano, Quadrilatero Romano, Circoscrizione 1, Torino, Piemonte, 10122, Italia",building,government,0.30010000000000003,"Vincere . Il film è stato girato in diverse location torinesi, tra cui via Palazzo di Città, Galleria San Federico, l’ex manicomio di Collegno e l’ex “Poveri Vecchi”. La solitudine dei numeri primi ."
Porta Nuova,"Porta Nuova, Corso Vittorio Emanuele II, San Secondo, Circoscrizione 1, Torino, Piemonte, 10125, Italia",railway,station,0.4874189406975713,"Nel 1765 Benedetto Alfieri ebbe l'incarico di rifare i portici di piazza Palazzo di Città mentre nel corso del XIX secolo si aggiunsero quelli dell'attuale piazza Vittorio Veneto, piazza Carlo Felice e piazza Statuto. Le stazioni ferroviarie di Porta Nuova e Porta Susa vennero congiunte con un percorso porticato attraverso via Nizza, via Sacchi, Corso Vittorio Emanuele II, Corso Vinzaglio e via Cernaia. Il portico che unisce piazza Castello con Piazza Vittorio Veneto attraverso via Po sul lato sinistro fu progettato in modo tale da proseguire anche nell'attraversamento delle vie per permettere al re di giungere fino al Po senza bagnarsi in caso di pioggia."
Piazza Vittorio Veneto,"Piazza Vittorio Veneto, Via Alfonso Bonafous, Borgo Nuovo, Circoscrizione 1, Torino, Piemonte, 10124, Italia",tourism,attraction,0.5692995550804913,"Le stazioni ferroviarie di Porta Nuova e Porta Susa vennero congiunte con un percorso porticato attraverso via Nizza, via Sacchi, Corso Vittorio Emanuele II, Corso Vinzaglio e via Cernaia. Il portico che unisce piazza Castello con Piazza Vittorio Veneto attraverso via Po sul lato sinistro fu progettato in modo tale da proseguire anche nell'attraversamento delle vie per permettere al re di giungere fino al Po senza bagnarsi in caso di pioggia. Le residenze sabaude in Piemonte sono l'insieme degli edifici residenziali commissionati dai Savoia a Torino e dintorni a partire dal trasferimento della capitale del Ducato di Savoia nel 1563."
Basilica di Superga,"Basilica Superga Capolinea, Strada alla Parrocchia di Superga, Tetti Rocco, Circoscrizione 7, Torino, Piemonte, 10099, Italia",highway,bus_stop,0.30010000000000003,"All'interno del perimetro cittadino figurano cinque siti iscritti nella lista del Patrimonio Mondiale dell'UNESCO: Palazzo Reale e la zona di comando (o musei reali) Palazzo Madama Palazzo Carignano Castello del Valentino Villa della Regina A questi si aggiunge la Basilica di Superga la quale, pur facendo parte del circuito delle residenze sabaude, non è compresa nella lista UNESCO. Carceri Nuove Cisternone Galleria Subalpina Lingotto Opera per Torino Grattacielo Intesa Sanpaolo Grattacielo della Regione Piemonte Cascina Giajone Cascina Roccafranca Numerosi sono gli edifici di culto presenti nella città di Torino."
Basilica di Superga,"Basilica Superga Capolinea, Strada alla Parrocchia di Superga, Tetti Rocco, Circoscrizione 7, Torino, Piemonte, 10099, Italia",highway,bus_stop,0.30010000000000003,"Alla progettazione e realizzazione delle opere relative hanno contribuito architetti di chiara fama, fra i quali: Amedeo di Castellamonte (Cappella della Sacra Sindone, Basilica del Corpus Domini) Carlo di Castellamonte (Cappella della Sacra Sindone, Chiesa di Santa Cristina) Andrea Costaguta (Chiesa di San Francesco da Paola, Chiesa di Santa Teresa) Guarino Guarini (Cappella della Sacra Sindone, Santuario della Consolata, Chiesa di San Lorenzo) Filippo Juvarra (Basilica di Superga, Chiesa di San Filippo Neri, Santuario della Consolata, Chiesa di Santa Cristina, Chiesa della Madonna del Carmine) Filippo Giovanni Battista Nicolis di Robilant (Chiesa di Santa Pelagia, Chiesa della Misericordia) Bernardo Antonio Vittone (Chiesa della Santissima Annunziata, Chiesa di Santa Maria di Piazza, Chiesa di San Francesco d'Assisi, Chiesa di Santa Chiara, Cappella Anselmetti) Ascanio Vittozzi (Basilica del Corpus Domini, Chiesa della Santissima Trinità) Pietro Bonvicini (Chiesa di San Michele Arcangelo) Giuseppe e Bartolomeo Gallo (Chiesa di Gesù Nazareno, Chiesa di San Bernardino da Siena) Nicola Mosso (Chiesa del Gesù Redentore) Cimitero Monumentale (già Cimitero Generale): sito in Corso Novara, 135 (quartiere Regio Parco), è il primo cimitero di Torino per dimensioni;"
Regione Piemonte,"Regione Piemonte, Via Palazzo di Città, Centro, Circoscrizione 1, Torino, Piemonte, 10122, Italia",emergency,defibrillator,0.2101,"Palazzo Reale e la zona di comando (o musei reali) Palazzo Madama Palazzo Carignano Castello del Valentino Villa della Regina A questi si aggiunge la Basilica di Superga la quale, pur facendo parte del circuito delle residenze sabaude, non è compresa nella lista UNESCO. Carceri Nuove Cisternone Galleria Subalpina Lingotto Opera per Torino Grattacielo Intesa Sanpaolo Grattacielo della Regione Piemonte Cascina Giajone Cascina Roccafranca Numerosi sono gli edifici di culto presenti nella città di Torino. Si tratta, nella stragrande maggioranza, di chiese cattoliche."
Regione Piemonte,"Regione Piemonte, Via Palazzo di Città, Centro, Circoscrizione 1, Torino, Piemonte, 10122, Italia",emergency,defibrillator,0.2101,"Nel 2004 è stato inaugurato il Museo A come Ambiente, il primo in Europa interamente dedicato alle tematiche ambientali. Da segnalare, infine, che tutti i musei sopra indicati, più numerosi altri all'interno della Regione Piemonte per un totale di circa 200 siti, sono gratuitamente e illimitatamente accessibili tramite l'Abbonamento Musei regionale, che fin dagli anni '90 è stato sviluppato per permettere la fruizione dei luoghi museali sul territorio previo acquisto annuale forfettario, e che nel 2017 ha raggiunto l'importante obiettivo delle oltre 136.000 tessere vendute e i circa 900.000 ingressi nei siti convenzionati. Torino ha una storica tradizione in campo editoriale."
Regione Piemonte,"Regione Piemonte, Via Palazzo di Città, Centro, Circoscrizione 1, Torino, Piemonte, 10122, Italia",emergency,defibrillator,0.2101,"Ci sono poi linee minori verso Ivrea-Aosta, Mondovì-Savona, Pinerolo-Torre Pellice, Trofarello-Chieri, Cirié-Lanzo Torinese-Ceres e Rivarolo Canavese-Cuorgnè-Pont Canavese. Il servizio ferroviario metropolitano di Torino (SFM) è un sistema di trasporto pubblico locale della Città Metropolitana di Torino coordinato dall'Agenzia Mobilità Metropolitana ed interamente finanziato dalla Regione Piemonte. Il servizio è composto da 8 linee gestite da Trenitalia e dal Gruppo Torinese Trasporti, per un'estensione di circa 500 km, 365 collegamenti giornalieri e 93 stazioni collegate."
Cappella della Sacra Sindone,"Cappella della Sacra Sindone, SP47, Cavagnole, Ingria, Torino, Piemonte, Italia",amenity,place_of_worship,0.4001,"Alla progettazione e realizzazione delle opere relative hanno contribuito architetti di chiara fama, fra i quali: Amedeo di Castellamonte (Cappella della Sacra Sindone, Basilica del Corpus Domini) Carlo di Castellamonte (Cappella della Sacra Sindone, Chiesa di Santa Cristina) Andrea Costaguta (Chiesa di San Francesco da Paola, Chiesa di Santa Teresa) Guarino Guarini (Cappella della Sacra Sindone, Santuario della Consolata, Chiesa di San Lorenzo) Filippo Juvarra (Basilica di Superga, Chiesa di San Filippo Neri, Santuario della Consolata, Chiesa di Santa Cristina, Chiesa della Madonna del Carmine) Filippo Giovanni Battista Nicolis di Robilant (Chiesa di Santa Pelagia, Chiesa della Misericordia) Bernardo Antonio Vittone (Chiesa della Santissima Annunziata, Chiesa di Santa Maria di Piazza, Chiesa di San Francesco d'Assisi, Chiesa di Santa Chiara, Cappella Anselmetti) Ascanio Vittozzi (Basilica del Corpus Domini, Chiesa della Santissima Trinità) Pietro Bonvicini (Chiesa di San Michele Arcangelo) Giuseppe e Bartolomeo Gallo (Chiesa di Gesù Nazareno, Chiesa di San Bernardino da Siena) Nicola Mosso (Chiesa del Gesù Redentore) Cimitero Monumentale (già Cimitero Generale): sito in Corso Novara, 135 (quartiere Regio Parco), è il primo cimitero di Torino per dimensioni;"
Basilica del Corpus Domini,"Basilica del Corpus Domini, Piazza Corpus Domini, Centro, Circoscrizione 1, Torino, Piemonte, 10122, Italia",amenity,place_of_worship,0.7004701084431998,"Alla progettazione e realizzazione delle opere relative hanno contribuito architetti di chiara fama, fra i quali: Amedeo di Castellamonte (Cappella della Sacra Sindone, Basilica del Corpus Domini) Carlo di Castellamonte (Cappella della Sacra Sindone, Chiesa di Santa Cristina) Andrea Costaguta (Chiesa di San Francesco da Paola, Chiesa di Santa Teresa) Guarino Guarini (Cappella della Sacra Sindone, Santuario della Consolata, Chiesa di San Lorenzo) Filippo Juvarra (Basilica di Superga, Chiesa di San Filippo Neri, Santuario della Consolata, Chiesa di Santa Cristina, Chiesa della Madonna del Carmine) Filippo Giovanni Battista Nicolis di Robilant (Chiesa di Santa Pelagia, Chiesa della Misericordia) Bernardo Antonio Vittone (Chiesa della Santissima Annunziata, Chiesa di Santa Maria di Piazza, Chiesa di San Francesco d'Assisi, Chiesa di Santa Chiara, Cappella Anselmetti) Ascanio Vittozzi (Basilica del Corpus Domini, Chiesa della Santissima Trinità) Pietro Bonvicini (Chiesa di San Michele Arcangelo) Giuseppe e Bartolomeo Gallo (Chiesa di Gesù Nazareno, Chiesa di San Bernardino da Siena) Nicola Mosso (Chiesa del Gesù Redentore) Cimitero Monumentale (già Cimitero Generale): sito in Corso Novara, 135 (quartiere Regio Parco), è il primo cimitero di Torino per dimensioni;"
Chiesa di Santa Cristina,"Chiesa di Santa Cristina, Piazza C.L.N., Centro, Circoscrizione 1, Torino, Piemonte, 10123, Italia",amenity,place_of_worship,0.66358119422997,"Alla progettazione e realizzazione delle opere relative hanno contribuito architetti di chiara fama, fra i quali: Amedeo di Castellamonte (Cappella della Sacra Sindone, Basilica del Corpus Domini) Carlo di Castellamonte (Cappella della Sacra Sindone, Chiesa di Santa Cristina) Andrea Costaguta (Chiesa di San Francesco da Paola, Chiesa di Santa Teresa) Guarino Guarini (Cappella della Sacra Sindone, Santuario della Consolata, Chiesa di San Lorenzo) Filippo Juvarra (Basilica di Superga, Chiesa di San Filippo Neri, Santuario della Consolata, Chiesa di Santa Cristina, Chiesa della Madonna del Carmine) Filippo Giovanni Battista Nicolis di Robilant (Chiesa di Santa Pelagia, Chiesa della Misericordia) Bernardo Antonio Vittone (Chiesa della Santissima Annunziata, Chiesa di Santa Maria di Piazza, Chiesa di San Francesco d'Assisi, Chiesa di Santa Chiara, Cappella Anselmetti) Ascanio Vittozzi (Basilica del Corpus Domini, Chiesa della Santissima Trinità) Pietro Bonvicini (Chiesa di San Michele Arcangelo) Giuseppe e Bartolomeo Gallo (Chiesa di Gesù Nazareno, Chiesa di San Bernardino da Siena) Nicola Mosso (Chiesa del Gesù Redentore) Cimitero Monumentale (già Cimitero Generale): sito in Corso Novara, 135 (quartiere Regio Parco), è il primo cimitero di Torino per dimensioni;"
Chiesa di San Francesco da Paola,"Chiesa di San Francesco da Paola, Via San Francesco da Paola, Borgo Nuovo, Circoscrizione 1, Torino, Piemonte, 10123, Italia",amenity,place_of_worship,0.8346137428457798,"Alla progettazione e realizzazione delle opere relative hanno contribuito architetti di chiara fama, fra i quali: Amedeo di Castellamonte (Cappella della Sacra Sindone, Basilica del Corpus Domini) Carlo di Castellamonte (Cappella della Sacra Sindone, Chiesa di Santa Cristina) Andrea Costaguta (Chiesa di San Francesco da Paola, Chiesa di Santa Teresa) Guarino Guarini (Cappella della Sacra Sindone, Santuario della Consolata, Chiesa di San Lorenzo) Filippo Juvarra (Basilica di Superga, Chiesa di San Filippo Neri, Santuario della Consolata, Chiesa di Santa Cristina, Chiesa della Madonna del Carmine) Filippo Giovanni Battista Nicolis di Robilant (Chiesa di Santa Pelagia, Chiesa della Misericordia) Bernardo Antonio Vittone (Chiesa della Santissima Annunziata, Chiesa di Santa Maria di Piazza, Chiesa di San Francesco d'Assisi, Chiesa di Santa Chiara, Cappella Anselmetti) Ascanio Vittozzi (Basilica del Corpus Domini, Chiesa della Santissima Trinità) Pietro Bonvicini (Chiesa di San Michele Arcangelo) Giuseppe e Bartolomeo Gallo (Chiesa di Gesù Nazareno, Chiesa di San Bernardino da Siena) Nicola Mosso (Chiesa del Gesù Redentore) Cimitero Monumentale (già Cimitero Generale): sito in Corso Novara, 135 (quartiere Regio Parco), è il primo cimitero di Torino per dimensioni;"
Chiesa di Santa Teresa,"Chiesa di Santa Teresa, Piazzetta Santa Teresa, Centro, Circoscrizione 1, Torino, Piemonte, 10121, Italia",amenity,place_of_worship,0.6793549821575413,"Alla progettazione e realizzazione delle opere relative hanno contribuito architetti di chiara fama, fra i quali: Amedeo di Castellamonte (Cappella della Sacra Sindone, Basilica del Corpus Domini) Carlo di Castellamonte (Cappella della Sacra Sindone, Chiesa di Santa Cristina) Andrea Costaguta (Chiesa di San Francesco da Paola, Chiesa di Santa Teresa) Guarino Guarini (Cappella della Sacra Sindone, Santuario della Consolata, Chiesa di San Lorenzo) Filippo Juvarra (Basilica di Superga, Chiesa di San Filippo Neri, Santuario della Consolata, Chiesa di Santa Cristina, Chiesa della Madonna del Carmine) Filippo Giovanni Battista Nicolis di Robilant (Chiesa di Santa Pelagia, Chiesa della Misericordia) Bernardo Antonio Vittone (Chiesa della Santissima Annunziata, Chiesa di Santa Maria di Piazza, Chiesa di San Francesco d'Assisi, Chiesa di Santa Chiara, Cappella Anselmetti) Ascanio Vittozzi (Basilica del Corpus Domini, Chiesa della Santissima Trinità) Pietro Bonvicini (Chiesa di San Michele Arcangelo) Giuseppe e Bartolomeo Gallo (Chiesa di Gesù Nazareno, Chiesa di San Bernardino da Siena) Nicola Mosso (Chiesa del Gesù Redentore) Cimitero Monumentale (già Cimitero Generale): sito in Corso Novara, 135 (quartiere Regio Parco), è il primo cimitero di Torino per dimensioni;"
Santuario della Consolata,"Santuario della Consolata, Via della Consolata, Quadrilatero Romano, Circoscrizione 1, Torino, Piemonte, 10122, Italia",amenity,place_of_worship,0.6220753060137234,"Alla progettazione e realizzazione delle opere relative hanno contribuito architetti di chiara fama, fra i quali: Amedeo di Castellamonte (Cappella della Sacra Sindone, Basilica del Corpus Domini) Carlo di Castellamonte (Cappella della Sacra Sindone, Chiesa di Santa Cristina) Andrea Costaguta (Chiesa di San Francesco da Paola, Chiesa di Santa Teresa) Guarino Guarini (Cappella della Sacra Sindone, Santuario della Consolata, Chiesa di San Lorenzo) Filippo Juvarra (Basilica di Superga, Chiesa di San Filippo Neri, Santuario della Consolata, Chiesa di Santa Cristina, Chiesa della Madonna del Carmine) Filippo Giovanni Battista Nicolis di Robilant (Chiesa di Santa Pelagia, Chiesa della Misericordia) Bernardo Antonio Vittone (Chiesa della Santissima Annunziata, Chiesa di Santa Maria di Piazza, Chiesa di San Francesco d'Assisi, Chiesa di Santa Chiara, Cappella Anselmetti) Ascanio Vittozzi (Basilica del Corpus Domini, Chiesa della Santissima Trinità) Pietro Bonvicini (Chiesa di San Michele Arcangelo) Giuseppe e Bartolomeo Gallo (Chiesa di Gesù Nazareno, Chiesa di San Bernardino da Siena) Nicola Mosso (Chiesa del Gesù Redentore) Cimitero Monumentale (già Cimitero Generale): sito in Corso Novara, 135 (quartiere Regio Parco), è il primo cimitero di Torino per dimensioni;"
Chiesa di San Lorenzo,"Chiesa di San Lorenzo, Via Palazzo di Città, Centro, Circoscrizione 1, Torino, Piemonte, 10122, Italia",amenity,place_of_worship,0.6940287400552381,"Alla progettazione e realizzazione delle opere relative hanno contribuito architetti di chiara fama, fra i quali: Amedeo di Castellamonte (Cappella della Sacra Sindone, Basilica del Corpus Domini) Carlo di Castellamonte (Cappella della Sacra Sindone, Chiesa di Santa Cristina) Andrea Costaguta (Chiesa di San Francesco da Paola, Chiesa di Santa Teresa) Guarino Guarini (Cappella della Sacra Sindone, Santuario della Consolata, Chiesa di San Lorenzo) Filippo Juvarra (Basilica di Superga, Chiesa di San Filippo Neri, Santuario della Consolata, Chiesa di Santa Cristina, Chiesa della Madonna del Carmine) Filippo Giovanni Battista Nicolis di Robilant (Chiesa di Santa Pelagia, Chiesa della Misericordia) Bernardo Antonio Vittone (Chiesa della Santissima Annunziata, Chiesa di Santa Maria di Piazza, Chiesa di San Francesco d'Assisi, Chiesa di Santa Chiara, Cappella Anselmetti) Ascanio Vittozzi (Basilica del Corpus Domini, Chiesa della Santissima Trinità) Pietro Bonvicini (Chiesa di San Michele Arcangelo) Giuseppe e Bartolomeo Gallo (Chiesa di Gesù Nazareno, Chiesa di San Bernardino da Siena) Nicola Mosso (Chiesa del Gesù Redentore) Cimitero Monumentale (già Cimitero Generale): sito in Corso Novara, 135 (quartiere Regio Parco), è il primo cimitero di Torino per dimensioni;"
Chiesa di San Filippo Neri,"Chiesa di San Filippo Neri, 63, Via Vittorio Emanuele II, Chieri, Torino, Piemonte, 10023, Italia",amenity,place_of_worship,0.653150759043076,"Alla progettazione e realizzazione delle opere relative hanno contribuito architetti di chiara fama, fra i quali: Amedeo di Castellamonte (Cappella della Sacra Sindone, Basilica del Corpus Domini) Carlo di Castellamonte (Cappella della Sacra Sindone, Chiesa di Santa Cristina) Andrea Costaguta (Chiesa di San Francesco da Paola, Chiesa di Santa Teresa) Guarino Guarini (Cappella della Sacra Sindone, Santuario della Consolata, Chiesa di San Lorenzo) Filippo Juvarra (Basilica di Superga, Chiesa di San Filippo Neri, Santuario della Consolata, Chiesa di Santa Cristina, Chiesa della Madonna del Carmine) Filippo Giovanni Battista Nicolis di Robilant (Chiesa di Santa Pelagia, Chiesa della Misericordia) Bernardo Antonio Vittone (Chiesa della Santissima Annunziata, Chiesa di Santa Maria di Piazza, Chiesa di San Francesco d'Assisi, Chiesa di Santa Chiara, Cappella Anselmetti) Ascanio Vittozzi (Basilica del Corpus Domini, Chiesa della Santissima Trinità) Pietro Bonvicini (Chiesa di San Michele Arcangelo) Giuseppe e Bartolomeo Gallo (Chiesa di Gesù Nazareno, Chiesa di San Bernardino da Siena) Nicola Mosso (Chiesa del Gesù Redentore) Cimitero Monumentale (già Cimitero Generale): sito in Corso Novara, 135 (quartiere Regio Parco), è il primo cimitero di Torino per dimensioni;"
Chiesa di Santa Pelagia,"Chiesa di Santa Pelagia, Via San Massimo, Borgo Nuovo, Circoscrizione 1, Torino, Piemonte, 10123, Italia",amenity,place_of_worship,0.4001,"Alla progettazione e realizzazione delle opere relative hanno contribuito architetti di chiara fama, fra i quali: Amedeo di Castellamonte (Cappella della Sacra Sindone, Basilica del Corpus Domini) Carlo di Castellamonte (Cappella della Sacra Sindone, Chiesa di Santa Cristina) Andrea Costaguta (Chiesa di San Francesco da Paola, Chiesa di Santa Teresa) Guarino Guarini (Cappella della Sacra Sindone, Santuario della Consolata, Chiesa di San Lorenzo) Filippo Juvarra (Basilica di Superga, Chiesa di San Filippo Neri, Santuario della Consolata, Chiesa di Santa Cristina, Chiesa della Madonna del Carmine) Filippo Giovanni Battista Nicolis di Robilant (Chiesa di Santa Pelagia, Chiesa della Misericordia) Bernardo Antonio Vittone (Chiesa della Santissima Annunziata, Chiesa di Santa Maria di Piazza, Chiesa di San Francesco d'Assisi, Chiesa di Santa Chiara, Cappella Anselmetti) Ascanio Vittozzi (Basilica del Corpus Domini, Chiesa della Santissima Trinità) Pietro Bonvicini (Chiesa di San Michele Arcangelo) Giuseppe e Bartolomeo Gallo (Chiesa di Gesù Nazareno, Chiesa di San Bernardino da Siena) Nicola Mosso (Chiesa del Gesù Redentore) Cimitero Monumentale (già Cimitero Generale): sito in Corso Novara, 135 (quartiere Regio Parco), è il primo cimitero di Torino per dimensioni;"
Chiesa della Misericordia,"Chiesa della Misericordia, Via Giuseppe Barbaroux, Quadrilatero Romano, Circoscrizione 1, Torino, Piemonte, 10122, Italia",amenity,place_of_worship,0.44778803910650133,"Alla progettazione e realizzazione delle opere relative hanno contribuito architetti di chiara fama, fra i quali: Amedeo di Castellamonte (Cappella della Sacra Sindone, Basilica del Corpus Domini) Carlo di Castellamonte (Cappella della Sacra Sindone, Chiesa di Santa Cristina) Andrea Costaguta (Chiesa di San Francesco da Paola, Chiesa di Santa Teresa) Guarino Guarini (Cappella della Sacra Sindone, Santuario della Consolata, Chiesa di San Lorenzo) Filippo Juvarra (Basilica di Superga, Chiesa di San Filippo Neri, Santuario della Consolata, Chiesa di Santa Cristina, Chiesa della Madonna del Carmine) Filippo Giovanni Battista Nicolis di Robilant (Chiesa di Santa Pelagia, Chiesa della Misericordia) Bernardo Antonio Vittone (Chiesa della Santissima Annunziata, Chiesa di Santa Maria di Piazza, Chiesa di San Francesco d'Assisi, Chiesa di Santa Chiara, Cappella Anselmetti) Ascanio Vittozzi (Basilica del Corpus Domini, Chiesa della Santissima Trinità) Pietro Bonvicini (Chiesa di San Michele Arcangelo) Giuseppe e Bartolomeo Gallo (Chiesa di Gesù Nazareno, Chiesa di San Bernardino da Siena) Nicola Mosso (Chiesa del Gesù Redentore) Cimitero Monumentale (già Cimitero Generale): sito in Corso Novara, 135 (quartiere Regio Parco), è il primo cimitero di Torino per dimensioni;"
Chiesa della Santissima Annunziata,"Chiesa della Santissima Annunziata, Salita San Francesco, Levanto, La Spezia, Liguria, 19015, Italia",amenity,place_of_worship,0.553150759043076,"Alla progettazione e realizzazione delle opere relative hanno contribuito architetti di chiara fama, fra i quali: Amedeo di Castellamonte (Cappella della Sacra Sindone, Basilica del Corpus Domini) Carlo di Castellamonte (Cappella della Sacra Sindone, Chiesa di Santa Cristina) Andrea Costaguta (Chiesa di San Francesco da Paola, Chiesa di Santa Teresa) Guarino Guarini (Cappella della Sacra Sindone, Santuario della Consolata, Chiesa di San Lorenzo) Filippo Juvarra (Basilica di Superga, Chiesa di San Filippo Neri, Santuario della Consolata, Chiesa di Santa Cristina, Chiesa della Madonna del Carmine) Filippo Giovanni Battista Nicolis di Robilant (Chiesa di Santa Pelagia, Chiesa della Misericordia) Bernardo Antonio Vittone (Chiesa della Santissima Annunziata, Chiesa di Santa Maria di Piazza, Chiesa di San Francesco d'Assisi, Chiesa di Santa Chiara, Cappella Anselmetti) Ascanio Vittozzi (Basilica del Corpus Domini, Chiesa della Santissima Trinità) Pietro Bonvicini (Chiesa di San Michele Arcangelo) Giuseppe e Bartolomeo Gallo (Chiesa di Gesù Nazareno, Chiesa di San Bernardino da Siena) Nicola Mosso (Chiesa del Gesù Redentore) Cimitero Monumentale (già Cimitero Generale): sito in Corso Novara, 135 (quartiere Regio Parco), è il primo cimitero di Torino per dimensioni;"
Chiesa di Santa Maria di Piazza,"Chiesa di Santa Maria di Piazza, Vicolo Santa Maria, Quadrilatero Romano, Circoscrizione 1, Torino, Piemonte, 10122, Italia",amenity,place_of_worship,0.7814728390918961,"Alla progettazione e realizzazione delle opere relative hanno contribuito architetti di chiara fama, fra i quali: Amedeo di Castellamonte (Cappella della Sacra Sindone, Basilica del Corpus Domini) Carlo di Castellamonte (Cappella della Sacra Sindone, Chiesa di Santa Cristina) Andrea Costaguta (Chiesa di San Francesco da Paola, Chiesa di Santa Teresa) Guarino Guarini (Cappella della Sacra Sindone, Santuario della Consolata, Chiesa di San Lorenzo) Filippo Juvarra (Basilica di Superga, Chiesa di San Filippo Neri, Santuario della Consolata, Chiesa di Santa Cristina, Chiesa della Madonna del Carmine) Filippo Giovanni Battista Nicolis di Robilant (Chiesa di Santa Pelagia, Chiesa della Misericordia) Bernardo Antonio Vittone (Chiesa della Santissima Annunziata, Chiesa di Santa Maria di Piazza, Chiesa di San Francesco d'Assisi, Chiesa di Santa Chiara, Cappella Anselmetti) Ascanio Vittozzi (Basilica del Corpus Domini, Chiesa della Santissima Trinità) Pietro Bonvicini (Chiesa di San Michele Arcangelo) Giuseppe e Bartolomeo Gallo (Chiesa di Gesù Nazareno, Chiesa di San Bernardino da Siena) Nicola Mosso (Chiesa del Gesù Redentore) Cimitero Monumentale (già Cimitero Generale): sito in Corso Novara, 135 (quartiere Regio Parco), è il primo cimitero di Torino per dimensioni;"
