teatro Rossini,"Teatro Rossini, Vicolo del Teatro, Lugo, Unione dei comuni della Bassa Romagna, Ravenna, Emilia-Romagna, 48022, Italia",amenity,theatre,0.39838704036871175,"Auditorium Rai ""Arturo Toscanini"", sede dell'Orchestra sinfonica nazionale della RAI Auditorium ""Gianni Agnelli"" del Lingotto Auditorium Intesa-Sanpaolo (interno dell'omonimo grattacielo) Auditorium ""Vivaldi"" (Biblioteca Nazionale) Educatorio della Provvidenza - Auditorium Orpheus Diversi edifici teatrali sono andati distrutti o caduti in disuso. Fra questi il teatro Balbo e il teatro di Torino, distrutti durante un bombardamento nel 1943, il teatro Rossini, bruciato in un incendio nel 1941, i teatri Adua, Gianduja, Gerbino e Arena torinese, smantellati, e, infine, il teatro Nazionale riconvertito a cinema; inoltre v'è una sala teatrale, oggi in disuso, nell'edificio storico della Cavallerizza Reale."
Gianduja,"Caffè Wine Gianduja, 3, Via Giacomo Matteotti, San Maurizio Canavese, Torino, Piemonte, 10077, Italia",amenity,cafe,0.10010000000000001,"Auditorium Rai ""Arturo Toscanini"", sede dell'Orchestra sinfonica nazionale della RAI Auditorium ""Gianni Agnelli"" del Lingotto Auditorium Intesa-Sanpaolo (interno dell'omonimo grattacielo) Auditorium ""Vivaldi"" (Biblioteca Nazionale) Educatorio della Provvidenza - Auditorium Orpheus Diversi edifici teatrali sono andati distrutti o caduti in disuso. Fra questi il teatro Balbo e il teatro di Torino, distrutti durante un bombardamento nel 1943, il teatro Rossini, bruciato in un incendio nel 1941, i teatri Adua, Gianduja, Gerbino e Arena torinese, smantellati, e, infine, il teatro Nazionale riconvertito a cinema; inoltre v'è una sala teatrale, oggi in disuso, nell'edificio storico della Cavallerizza Reale."
Cavallerizza Reale,"Cavallerizza Reale, Via Giuseppe Verdi, Borgo Nuovo, Circoscrizione 1, Torino, Piemonte, 10123, Italia",tourism,attraction,0.2001,"Fra questi il teatro Balbo e il teatro di Torino, distrutti durante un bombardamento nel 1943, il teatro Rossini, bruciato in un incendio nel 1941, i teatri Adua, Gianduja, Gerbino e Arena torinese, smantellati, e, infine, il teatro Nazionale riconvertito a cinema; inoltre v'è una sala teatrale, oggi in disuso, nell'edificio storico della Cavallerizza Reale. A Torino sono presenti 49 mercati rionali."
Piazza Benefica,"Giardino Luigi Martini, Cit Turin, Circoscrizione 3, Torino, Piemonte, Italia",leisure,park,0.15000000000000002,"Sebbene non sia la città che ne ospita il maggior numero, il record è tuttavia costituito dal fatto che sono fissi, aperti tutti i giorni e dislocati in tutti i quartieri. I più importanti per ampiezza e giro d'affari si svolgono in Piazza Benefica, in Corso Alcide De Gasperi, in via Onorato Vigliani, in corso Svizzera, in Corso Racconigi e in piazza Barcellona. Il mercato più famoso è Porta Palazzo ( Pòrta Pila in Lingua piemontese), che è il mercato all'aperto più grande d'Europa."
Piazza Benefica,"Giardino Luigi Martini, Cit Turin, Circoscrizione 3, Torino, Piemonte, Italia",leisure,park,0.15000000000000002,"Ogni sabato nei pressi si tiene il Balon, un grande mercato all'aperto dell'usato, che la seconda domenica di ogni mese diventa Gran Balon , in cui si vendono anche oggetti di antiquariato. Nel 2011 il regista torinese Daniele Gaglianone ha realizzato il film documentario Uomini e mercati centrato sui mercati di Porta Palazzo, Piazza Benefica e Corso Spezia. In contrasto ad una prima impressione della zona centrale e ai vecchi pregiudizi sulla città grigia e industriale, Torino è una delle città italiane con più verde pubblico per abitante."
Corso Alcide De Gasperi,"Corso Alcide De Gasperi, Vigevano, Pavia, Lombardia, 27029, Italia",highway,secondary,0.5,"Sebbene non sia la città che ne ospita il maggior numero, il record è tuttavia costituito dal fatto che sono fissi, aperti tutti i giorni e dislocati in tutti i quartieri. I più importanti per ampiezza e giro d'affari si svolgono in Piazza Benefica, in Corso Alcide De Gasperi, in via Onorato Vigliani, in corso Svizzera, in Corso Racconigi e in piazza Barcellona. Il mercato più famoso è Porta Palazzo ( Pòrta Pila in Lingua piemontese), che è il mercato all'aperto più grande d'Europa."
Corso Racconigi,"Corso Racconigi, Cenisia, Circoscrizione 3, Torino, Piemonte, 10139, Italia",highway,tertiary,0.3,"Sebbene non sia la città che ne ospita il maggior numero, il record è tuttavia costituito dal fatto che sono fissi, aperti tutti i giorni e dislocati in tutti i quartieri. I più importanti per ampiezza e giro d'affari si svolgono in Piazza Benefica, in Corso Alcide De Gasperi, in via Onorato Vigliani, in corso Svizzera, in Corso Racconigi e in piazza Barcellona. Il mercato più famoso è Porta Palazzo ( Pòrta Pila in Lingua piemontese), che è il mercato all'aperto più grande d'Europa."
Barcellona,"Barcellona, Via Giacomo Matteotti, Crema Nuova, Crema, Cremona, Lombardia, 26013, Italia",amenity,bar,0.11010000000000002,"Sebbene non sia la città che ne ospita il maggior numero, il record è tuttavia costituito dal fatto che sono fissi, aperti tutti i giorni e dislocati in tutti i quartieri. I più importanti per ampiezza e giro d'affari si svolgono in Piazza Benefica, in Corso Alcide De Gasperi, in via Onorato Vigliani, in corso Svizzera, in Corso Racconigi e in piazza Barcellona. Il mercato più famoso è Porta Palazzo ( Pòrta Pila in Lingua piemontese), che è il mercato all'aperto più grande d'Europa."
Porta Palazzo,"Porta Palazzo, Piazza della Repubblica, Porta Palazzo, Circoscrizione 7, Torino, Piemonte, 10152, Italia",amenity,marketplace,0.2001,"I più importanti per ampiezza e giro d'affari si svolgono in Piazza Benefica, in Corso Alcide De Gasperi, in via Onorato Vigliani, in corso Svizzera, in Corso Racconigi e in piazza Barcellona. Il mercato più famoso è Porta Palazzo ( Pòrta Pila in Lingua piemontese), che è il mercato all'aperto più grande d'Europa. Ogni sabato nei pressi si tiene il Balon, un grande mercato all'aperto dell'usato, che la seconda domenica di ogni mese diventa Gran Balon , in cui si vendono anche oggetti di antiquariato."
Porta Palazzo,"Porta Palazzo, Piazza della Repubblica, Porta Palazzo, Circoscrizione 7, Torino, Piemonte, 10152, Italia",amenity,marketplace,0.2001,"Ogni sabato nei pressi si tiene il Balon, un grande mercato all'aperto dell'usato, che la seconda domenica di ogni mese diventa Gran Balon , in cui si vendono anche oggetti di antiquariato. Nel 2011 il regista torinese Daniele Gaglianone ha realizzato il film documentario Uomini e mercati centrato sui mercati di Porta Palazzo, Piazza Benefica e Corso Spezia. In contrasto ad una prima impressione della zona centrale e ai vecchi pregiudizi sulla città grigia e industriale, Torino è una delle città italiane con più verde pubblico per abitante."
Porta Palazzo,"Porta Palazzo, Piazza della Repubblica, Porta Palazzo, Circoscrizione 7, Torino, Piemonte, 10152, Italia",amenity,marketplace,0.2001,"Lazzaro felice . Nelle ultime settimane la regista ha girato la città focalizzando le riprese tra Galleria Umberto I, Porta Palazzo e la periferia nord. Soap opera."
Gran Balon,"hala sportowa, balon, Kcyńska, Nowe Miasto, Wągrowiec, powiat wągrowiecki, województwo wielkopolskie, 62-100, Polska",building,yes,0.10010000000000001,"Il mercato più famoso è Porta Palazzo ( Pòrta Pila in Lingua piemontese), che è il mercato all'aperto più grande d'Europa. Ogni sabato nei pressi si tiene il Balon, un grande mercato all'aperto dell'usato, che la seconda domenica di ogni mese diventa Gran Balon , in cui si vendono anche oggetti di antiquariato. Nel 2011 il regista torinese Daniele Gaglianone ha realizzato il film documentario Uomini e mercati centrato sui mercati di Porta Palazzo, Piazza Benefica e Corso Spezia."
Corso Spezia,"Corso Spezia, Molinette, Circoscrizione 8, Cavoretto, Torino, Piemonte, 10126, Italia",highway,tertiary,0.3,"Ogni sabato nei pressi si tiene il Balon, un grande mercato all'aperto dell'usato, che la seconda domenica di ogni mese diventa Gran Balon , in cui si vendono anche oggetti di antiquariato. Nel 2011 il regista torinese Daniele Gaglianone ha realizzato il film documentario Uomini e mercati centrato sui mercati di Porta Palazzo, Piazza Benefica e Corso Spezia. In contrasto ad una prima impressione della zona centrale e ai vecchi pregiudizi sulla città grigia e industriale, Torino è una delle città italiane con più verde pubblico per abitante."
Bosco Verticale,"Bosco Verticale, 15, Via Federico Confalonieri, Isola, Municipio 9, Milano, Lombardia, 20124, Italia",amenity,restaurant,0.2001,"In più, grazie a un indice di verde visibile del 16,2%, Torino si piazza al tredicesimo posto tra le diciassette città con più alberi nel mondo. Nel quartiere San Salvario, caratteristico è il Condominio 25 Verde, il cui principio è lo stesso del più imponente (perché grattacielo) Bosco Verticale di Milano. È inoltre la prima città italiana, tra quelle con più di 500.000 abitanti, per quanto riguarda la quota di raccolta differenziata dei rifiuti, giunta nel 2014 al 42,2%."
Discarica,"Discarica, Roasio, Vercelli, Piemonte, Italia",landuse,landfill,0.30999999999999994,"È inoltre la prima città italiana, tra quelle con più di 500.000 abitanti, per quanto riguarda la quota di raccolta differenziata dei rifiuti, giunta nel 2014 al 42,2%. L'igiene urbana e la raccolta rifiuti sono gestiti dal 1969 da Amiat, società che si occupa anche del recupero ambientale della Discarica Basse di Stura, di cui la parte più vecchia - esaurita nel 1983 e con una superficie complessiva di 300.000 m² - è diventata parco fluviale, nota come Parco urbano della Marmorina. Torino dispone di 51 parchi nell'area urbana e quelli più grandi e frequentati sono:"
Basse di Stura,"Strada Basse di Stura, Rebaudengo, Circoscrizione 6, Torino, Piemonte, Italia",highway,residential,0.4,"È inoltre la prima città italiana, tra quelle con più di 500.000 abitanti, per quanto riguarda la quota di raccolta differenziata dei rifiuti, giunta nel 2014 al 42,2%. L'igiene urbana e la raccolta rifiuti sono gestiti dal 1969 da Amiat, società che si occupa anche del recupero ambientale della Discarica Basse di Stura, di cui la parte più vecchia - esaurita nel 1983 e con una superficie complessiva di 300.000 m² - è diventata parco fluviale, nota come Parco urbano della Marmorina. Torino dispone di 51 parchi nell'area urbana e quelli più grandi e frequentati sono:"
Parco del Valentino,"Parco del Valentino, Circoscrizione 8, Torino, Piemonte, Italia",leisure,park,0.6507105064618923,"Torino dispone di 51 parchi nell'area urbana e quelli più grandi e frequentati sono: il Parco del Valentino, il Parco della Pellerina, il Parco Colletta, il Parco Rignon e i più recenti Parco Ruffini e Parco Colonnetti. Attorno alla città, ad anello, vi sono il Parco della Mandria e il Parco della Palazzina di caccia di Stupinigi, antiche riserve di caccia dei Savoia, e quelli situati sulla collina torinese quali il Parco della Rimembranza o il Parco Europa."
Parco del Valentino,"Parco del Valentino, Circoscrizione 8, Torino, Piemonte, Italia",leisure,park,0.6507105064618923,"Torino ospita diversi grandi alberi. Dal grande platano del Parco della Tesoriera (660 cm di circonferenza del tronco, oltre due secoli di vita) ai platani del Parco del Valentino, dalle metasequoie del Giardino Roccioso inaugurato nel 1961 agli alberi più annosi dell'Orto Botanico fondato nel 1729, adiacente alle mura del Castello del Valentino. Torino ospita anche alberi esotici secolari come le sequoie costali ( Sequoia sempervirens ) dei parchi collinari di Villa Genero e Giacomo Leopardi, i numerosi esemplari di Noce del Caucaso ( Pterocarya fraxinifolia ) che costeggiano il Po e compaiono in parchi pubblici come i Giardini Cavour, il giardino Sambuy, i Giardini Reali Bassi (lungo Corso San Maurizio), il parco Millefonti."
Parco della Pellerina,"Parco della Pellerina, Torino, Piemonte, Italia",leisure,park,0.45000000000000007,"Torino dispone di 51 parchi nell'area urbana e quelli più grandi e frequentati sono: il Parco del Valentino, il Parco della Pellerina, il Parco Colletta, il Parco Rignon e i più recenti Parco Ruffini e Parco Colonnetti. Attorno alla città, ad anello, vi sono il Parco della Mandria e il Parco della Palazzina di caccia di Stupinigi, antiche riserve di caccia dei Savoia, e quelli situati sulla collina torinese quali il Parco della Rimembranza o il Parco Europa."
Parco Colletta,"Passerella del Parco Pietro Colletta, Vanchiglietta, Circoscrizione 7, Sassi, Torino, Piemonte, 10132, Italia",highway,cycleway,0.27499999999999997,"Torino dispone di 51 parchi nell'area urbana e quelli più grandi e frequentati sono: il Parco del Valentino, il Parco della Pellerina, il Parco Colletta, il Parco Rignon e i più recenti Parco Ruffini e Parco Colonnetti. Attorno alla città, ad anello, vi sono il Parco della Mandria e il Parco della Palazzina di caccia di Stupinigi, antiche riserve di caccia dei Savoia, e quelli situati sulla collina torinese quali il Parco della Rimembranza o il Parco Europa."
Parco Colletta,"Passerella del Parco Pietro Colletta, Vanchiglietta, Circoscrizione 7, Sassi, Torino, Piemonte, 10132, Italia",highway,cycleway,0.27499999999999997,"Per Torino passa la Via Francigena, ramo del Moncenisio. L'itinerario, fra i preferiti nel Medioevo, valicato lo spartiacque Francia/Italia al Colle del Moncenisio, giunge dalla Valle di Susa terra delle grandi abbazie come Novalesa, Sacra di San Michele e Sant'Antonio di Ranverso e passando per Torino lungo il Parco Colletta tende a San Mauro Torinese e poi verso Chivasso e successivamente a Vercelli, dove si congiunge con l'altro ramo della Francigena, quella proveniente dal Colle del Gran San Bernardo. A partire dal secondo dopoguerra, in particolare nel decennio 1951-1961, la popolazione della città conobbe un'improvvisa e repentina espansione (306.000 abitanti in più nel 1961 rispetto al 1951), dovuta alla migrazione interna dal Mezzogiorno, dal Veneto e, seppur in misura minore, dalle vallate e dalle campagne di tutto il Piemonte, da dove la gente si spostava in cerca di lavoro nelle fabbriche cittadine (segnatamente la FIAT)."
Parco Rignon,"Parco Rignon, Santa Rita, Circoscrizione 2, Torino, Piemonte, 10137, Italia",highway,pedestrian,0.3,"Torino dispone di 51 parchi nell'area urbana e quelli più grandi e frequentati sono: il Parco del Valentino, il Parco della Pellerina, il Parco Colletta, il Parco Rignon e i più recenti Parco Ruffini e Parco Colonnetti. Attorno alla città, ad anello, vi sono il Parco della Mandria e il Parco della Palazzina di caccia di Stupinigi, antiche riserve di caccia dei Savoia, e quelli situati sulla collina torinese quali il Parco della Rimembranza o il Parco Europa."
Parco Ruffini,"Parco Francesco Ruffini, Circoscrizione 3, Torino, Piemonte, Italia",leisure,park,0.4173380601845065,"Torino dispone di 51 parchi nell'area urbana e quelli più grandi e frequentati sono: il Parco del Valentino, il Parco della Pellerina, il Parco Colletta, il Parco Rignon e i più recenti Parco Ruffini e Parco Colonnetti. Attorno alla città, ad anello, vi sono il Parco della Mandria e il Parco della Palazzina di caccia di Stupinigi, antiche riserve di caccia dei Savoia, e quelli situati sulla collina torinese quali il Parco della Rimembranza o il Parco Europa."
anello,"Anello, SP44b, Livata, Subiaco, Roma Capitale, Lazio, 00028, Italia",leisure,playground,0.10010000000000001,"il Parco del Valentino, il Parco della Pellerina, il Parco Colletta, il Parco Rignon e i più recenti Parco Ruffini e Parco Colonnetti. Attorno alla città, ad anello, vi sono il Parco della Mandria e il Parco della Palazzina di caccia di Stupinigi, antiche riserve di caccia dei Savoia, e quelli situati sulla collina torinese quali il Parco della Rimembranza o il Parco Europa. Nei vari quartieri della città sono presenti molti piccoli parchi, in cui sono presenti 240 aree gioco per bimbi."
Parco della Mandria,"Sentiero della Costa Mandria, Cascine Spino, Toscolano Maderno, Comunità Montana Parco Alto Garda bresciano, Brescia, Lombardia, Italia",highway,path,0.375,"il Parco del Valentino, il Parco della Pellerina, il Parco Colletta, il Parco Rignon e i più recenti Parco Ruffini e Parco Colonnetti. Attorno alla città, ad anello, vi sono il Parco della Mandria e il Parco della Palazzina di caccia di Stupinigi, antiche riserve di caccia dei Savoia, e quelli situati sulla collina torinese quali il Parco della Rimembranza o il Parco Europa. Nei vari quartieri della città sono presenti molti piccoli parchi, in cui sono presenti 240 aree gioco per bimbi."
Parco della Rimembranza,"Parco della Rimembranza, Circoscrizione 8, Torino, Piemonte, Italia",leisure,park,0.46265143530572955,"il Parco del Valentino, il Parco della Pellerina, il Parco Colletta, il Parco Rignon e i più recenti Parco Ruffini e Parco Colonnetti. Attorno alla città, ad anello, vi sono il Parco della Mandria e il Parco della Palazzina di caccia di Stupinigi, antiche riserve di caccia dei Savoia, e quelli situati sulla collina torinese quali il Parco della Rimembranza o il Parco Europa. Nei vari quartieri della città sono presenti molti piccoli parchi, in cui sono presenti 240 aree gioco per bimbi."
Parco della Rimembranza,"Parco della Rimembranza, Circoscrizione 8, Torino, Piemonte, Italia",leisure,park,0.46265143530572955,"Torino ospita anche alberi esotici secolari come le sequoie costali ( Sequoia sempervirens ) dei parchi collinari di Villa Genero e Giacomo Leopardi, i numerosi esemplari di Noce del Caucaso ( Pterocarya fraxinifolia ) che costeggiano il Po e compaiono in parchi pubblici come i Giardini Cavour, il giardino Sambuy, i Giardini Reali Bassi (lungo Corso San Maurizio), il parco Millefonti. Due spettacolari esemplari di carpino bianco ( Carpinus betulus ) arricchiscono il grande Parco della Rimembranza che si dispiega lungo il Colle della Maddalena. Per Torino passa la Via Francigena, ramo del Moncenisio."
Parco Europa,"Parco Europa, Circoscrizione 8, Cavoretto, Torino, Piemonte, Italia",leisure,park,0.35000000000000003,"il Parco del Valentino, il Parco della Pellerina, il Parco Colletta, il Parco Rignon e i più recenti Parco Ruffini e Parco Colonnetti. Attorno alla città, ad anello, vi sono il Parco della Mandria e il Parco della Palazzina di caccia di Stupinigi, antiche riserve di caccia dei Savoia, e quelli situati sulla collina torinese quali il Parco della Rimembranza o il Parco Europa. Nei vari quartieri della città sono presenti molti piccoli parchi, in cui sono presenti 240 aree gioco per bimbi."
Parco della Tesoriera,"Parco della Tesoriera, Circoscrizione 4, Torino, Piemonte, Italia",leisure,park,0.45000000000000007,"Torino ospita diversi grandi alberi. Dal grande platano del Parco della Tesoriera (660 cm di circonferenza del tronco, oltre due secoli di vita) ai platani del Parco del Valentino, dalle metasequoie del Giardino Roccioso inaugurato nel 1961 agli alberi più annosi dell'Orto Botanico fondato nel 1729, adiacente alle mura del Castello del Valentino. Torino ospita anche alberi esotici secolari come le sequoie costali ( Sequoia sempervirens ) dei parchi collinari di Villa Genero e Giacomo Leopardi, i numerosi esemplari di Noce del Caucaso ( Pterocarya fraxinifolia ) che costeggiano il Po e compaiono in parchi pubblici come i Giardini Cavour, il giardino Sambuy, i Giardini Reali Bassi (lungo Corso San Maurizio), il parco Millefonti."
Giardino Roccioso,"Giardino roccioso, Viale Virgilio, San Salvario, Circoscrizione 8, Torino, Piemonte, 10125, Italia",leisure,garden,0.2001,"Torino ospita diversi grandi alberi. Dal grande platano del Parco della Tesoriera (660 cm di circonferenza del tronco, oltre due secoli di vita) ai platani del Parco del Valentino, dalle metasequoie del Giardino Roccioso inaugurato nel 1961 agli alberi più annosi dell'Orto Botanico fondato nel 1729, adiacente alle mura del Castello del Valentino. Torino ospita anche alberi esotici secolari come le sequoie costali ( Sequoia sempervirens ) dei parchi collinari di Villa Genero e Giacomo Leopardi, i numerosi esemplari di Noce del Caucaso ( Pterocarya fraxinifolia ) che costeggiano il Po e compaiono in parchi pubblici come i Giardini Cavour, il giardino Sambuy, i Giardini Reali Bassi (lungo Corso San Maurizio), il parco Millefonti."
Orto Botanico,"Orto Botanico, 14, Via Sant'Epifanio, San Giovannino, Pavia, Lombardia, 27100, Italia",tourism,attraction,0.5463987907893358,"Torino ospita diversi grandi alberi. Dal grande platano del Parco della Tesoriera (660 cm di circonferenza del tronco, oltre due secoli di vita) ai platani del Parco del Valentino, dalle metasequoie del Giardino Roccioso inaugurato nel 1961 agli alberi più annosi dell'Orto Botanico fondato nel 1729, adiacente alle mura del Castello del Valentino. Torino ospita anche alberi esotici secolari come le sequoie costali ( Sequoia sempervirens ) dei parchi collinari di Villa Genero e Giacomo Leopardi, i numerosi esemplari di Noce del Caucaso ( Pterocarya fraxinifolia ) che costeggiano il Po e compaiono in parchi pubblici come i Giardini Cavour, il giardino Sambuy, i Giardini Reali Bassi (lungo Corso San Maurizio), il parco Millefonti."
Villa Genero,"Parco Villa Genero, Circoscrizione 8, Torino, Piemonte, Italia",leisure,park,0.35000000000000003,"Dal grande platano del Parco della Tesoriera (660 cm di circonferenza del tronco, oltre due secoli di vita) ai platani del Parco del Valentino, dalle metasequoie del Giardino Roccioso inaugurato nel 1961 agli alberi più annosi dell'Orto Botanico fondato nel 1729, adiacente alle mura del Castello del Valentino. Torino ospita anche alberi esotici secolari come le sequoie costali ( Sequoia sempervirens ) dei parchi collinari di Villa Genero e Giacomo Leopardi, i numerosi esemplari di Noce del Caucaso ( Pterocarya fraxinifolia ) che costeggiano il Po e compaiono in parchi pubblici come i Giardini Cavour, il giardino Sambuy, i Giardini Reali Bassi (lungo Corso San Maurizio), il parco Millefonti. Due spettacolari esemplari di carpino bianco ( Carpinus betulus ) arricchiscono il grande Parco della Rimembranza che si dispiega lungo il Colle della Maddalena."
Noce del Caucaso,"Pterocarya fraxinifolia, SP153, Gemerello, Campiglione-Fenile, Torino, Piemonte, 10061, Italia",natural,tree,0.0001,"Dal grande platano del Parco della Tesoriera (660 cm di circonferenza del tronco, oltre due secoli di vita) ai platani del Parco del Valentino, dalle metasequoie del Giardino Roccioso inaugurato nel 1961 agli alberi più annosi dell'Orto Botanico fondato nel 1729, adiacente alle mura del Castello del Valentino. Torino ospita anche alberi esotici secolari come le sequoie costali ( Sequoia sempervirens ) dei parchi collinari di Villa Genero e Giacomo Leopardi, i numerosi esemplari di Noce del Caucaso ( Pterocarya fraxinifolia ) che costeggiano il Po e compaiono in parchi pubblici come i Giardini Cavour, il giardino Sambuy, i Giardini Reali Bassi (lungo Corso San Maurizio), il parco Millefonti. Due spettacolari esemplari di carpino bianco ( Carpinus betulus ) arricchiscono il grande Parco della Rimembranza che si dispiega lungo il Colle della Maddalena."
Corso San Maurizio,"Corso San Maurizio, Centro, Circoscrizione 1, Torino, Piemonte, 10124, Italia",highway,secondary,0.4,"Dal grande platano del Parco della Tesoriera (660 cm di circonferenza del tronco, oltre due secoli di vita) ai platani del Parco del Valentino, dalle metasequoie del Giardino Roccioso inaugurato nel 1961 agli alberi più annosi dell'Orto Botanico fondato nel 1729, adiacente alle mura del Castello del Valentino. Torino ospita anche alberi esotici secolari come le sequoie costali ( Sequoia sempervirens ) dei parchi collinari di Villa Genero e Giacomo Leopardi, i numerosi esemplari di Noce del Caucaso ( Pterocarya fraxinifolia ) che costeggiano il Po e compaiono in parchi pubblici come i Giardini Cavour, il giardino Sambuy, i Giardini Reali Bassi (lungo Corso San Maurizio), il parco Millefonti. Due spettacolari esemplari di carpino bianco ( Carpinus betulus ) arricchiscono il grande Parco della Rimembranza che si dispiega lungo il Colle della Maddalena."
parco Millefonti,"PAV Parco Arte Vivente, Via Giordano Bruno, Filadelfia, Circoscrizione 8, Torino, Piemonte, 10134, Italia",tourism,museum,0.2199311114495475,"Dal grande platano del Parco della Tesoriera (660 cm di circonferenza del tronco, oltre due secoli di vita) ai platani del Parco del Valentino, dalle metasequoie del Giardino Roccioso inaugurato nel 1961 agli alberi più annosi dell'Orto Botanico fondato nel 1729, adiacente alle mura del Castello del Valentino. Torino ospita anche alberi esotici secolari come le sequoie costali ( Sequoia sempervirens ) dei parchi collinari di Villa Genero e Giacomo Leopardi, i numerosi esemplari di Noce del Caucaso ( Pterocarya fraxinifolia ) che costeggiano il Po e compaiono in parchi pubblici come i Giardini Cavour, il giardino Sambuy, i Giardini Reali Bassi (lungo Corso San Maurizio), il parco Millefonti. Due spettacolari esemplari di carpino bianco ( Carpinus betulus ) arricchiscono il grande Parco della Rimembranza che si dispiega lungo il Colle della Maddalena."
