,entity,to_search,snippet,address,coordinates,name_location,class,type
172,Penn Station,Penn Station,"['*...Le principali stazioni ferroviarie di New York sono Grand Central Terminal e la Penn Station....', '*...Da lì si raggiunge Penn Station a Manhattan in circa 30 minuti....', '*...La New Jersey Transit, società dello stato del New Jersey, che gestisce le linee ferroviarie che dal New Jersey terminano a Penn Station (New Jersey Transit Rail), oltre che a molte linee di autobus....', ""..., in inglese americano ), spesso chiamata New York City per distinguerla dallo stato omonimo, e in italiano anche Nuova York, è una città degli Stati Uniti d'America situata nello stato di New York...."", '...Conosciuta nel mondo anche come ""Grande mela"" (Big Apple), sorge su un\'area di circa 785\xa0km² alla foce del fiume Hudson, sull\'oceano Atlantico, mentre l\'area metropolitana comprende anche aree situate nei due adiacenti stati del New Jersey e del Connecticut....', '...Con 8,8 milioni di abitanti, è la città più popolosa dello stato di New York e degli Stati Uniti superando doppiamente Los Angeles, seconda città nazionale per popolazione....', ""...Molti degli abitanti di New York, chiamati newyorkesi o nuovaiorchesi, provengono dall'estero, sono nati in altre zone degli Stati Uniti o sono di origine straniera, il che la rende una delle città più cosmopolite e multietniche del mondo...."", ""...La dominazione inglese durò (a parte una breve parentesi nuovamente sotto gli olandesi fra il 1673 e il 1674) fino all'ottenimento dell'indipendenza delle colonie, che segnò la data di nascita degli Stati Uniti d'America;..."", ""...Subito dopo la sua creazione, prevista dalla Costituzione, il Congresso degli Stati Uniti d'America ebbe come sede la Federal Hall, in Wall Street...."", ""...Nel settembre 1788 la città divenne la prima capitale degli Stati Uniti d'America;..."", '...New York aveva assunto il ruolo di ""porta"" degli Stati Uniti, riconosciuto ufficialmente con la donazione, da parte della Francia, della Statua della Libertà (inaugurata nel 1886)....', '*...A partire dagli anni venti, inoltre, New York divenne la meta di più di un milione di neri americani, provenienti dagli Stati razzisti del sud, come parte della grande migrazione afroamericana....', ""*...L'attentato, che ebbe una possente risonanza in tutto il mondo, causò quasi 3\xa0000 vittime e diede l'inizio ad una serie di violente reazioni americane contro gli Stati accusati di ospitare le basi operative dei terroristi...."", '...Fra gli eventi più significativi che hanno interessato la città in questo scorcio di XXI secolo sono il blackout del 2003, che ha interessato il nordest degli Stati Uniti, e la corsa alle Olimpiadi del 2012, in una competizione poi vinta dalla città di Londra....', ""...Fra le maggiori vi sono Ellis Island, l'isola in cui un tempo sbarcavano le navi piene di immigrati provenienti dall'Europa, e dove questi venivano tenuti in quarantena per un certo periodo prima di essere ammessi al resto degli Stati Uniti;..."", '...New York è una città marittima, ma il suo clima ha spiccate caratteristiche di continentalità, analogamente al resto della fascia costiera atlantica degli Stati Uniti nordorientali....', '...In genere, tuttavia, data la posizione della città, gli uragani arrivano dopo aver perso gran parte della loro potenza ed essere stati declassati a tempeste tropicali....', '...Esteso per 840 acri, fu il primo Parco pubblico negli Stati Uniti ed è uno dei luoghi più visitati della città, con stimati ogni anno più di 25 milioni di visitatori;...', '...Inoltre ha la più vasta comunità afroamericana degli Stati Uniti, la più numerosa comunità ebraica al di fuori di Israele e la più numerosa comunità portoricana al di fuori di Porto Rico....', ""...Nel 2005 New York ha fatto registrare il più basso tasso di criminalità tra le 25 più grandi città degli Stati Uniti, dopo aver trascorso un periodo di picco della criminalità tra il 1980 e l'inizio del 1990, a causa dell'epidemia del crack che ha interessato molti quartieri...."", '...Nel 2002, New York ha avuto circa il tasso di criminalità di Provo, nello Utah, ed è stata classificata 197ª sulle 216 città degli Stati Uniti con una popolazione superiore ai 100\xa0000 abitanti....', ""...Così la University of New York, che ha diversi campus sparsi nella città è la più grande Università privata degli Stati Uniti con più di 40\xa0000 studenti, mentre la Fordham University è una delle Università gesuitiche più celebri dell'East Coast...."", '...Infatti la City of New York University è la più grande Università comunale degli Stati Uniti, mentre il City College of New York, che ha sede nel quartiere di Harlem, è stimato per aver educato molti premi Nobel....', ""...Non lontano da Liberty Island (l'isola che ospita la Statua della Libertà) vi è Ellis Island che è stato per anni il principale punto d'ingresso per gli immigranti che sbarcavano negli Stati Uniti...."", ""...New York è il secondo più grande centro per l'industria cinematografica negli Stati Uniti, e per volume, New York è il leader mondiale nella produzione cinematografica indipendente...."", '...Due dei tre quotidiani a diffusione nazionale negli Stati Uniti sono di New York:...', '...Nel 2005, ci sono stati più di 100 spettacoli televisivi registrati a New York....', '...Il più antico canale televisivo ad accesso pubblico negli Stati Uniti è Manhattan Neighborhood Network, fondato nel 1971....', '...WNYC è una stazione radio pubblica, fino al 1997 di proprietà comunale, possiede il più vasto pubblico radiofonico negli Stati Uniti....', '...Queens (Contea del Queens, 2\xa0306\xa0712 abitanti) è il distretto più esteso e la contea degli Stati Uniti più varia dal punto di vista etnico. Si affaccia a nord sul Long Island Sound. Prima di unirsi a New York, era composto da piccole città e villaggi, fondati dagli olandesi. Due dei maggiori aeroporti della città hanno sede a Queens: si tratta del LaGuardia e del John F. Kennedy International. Nel Queens era situato il leggendario Shea Stadium....', '...Da sola produce un prodotto interno lordo di 1300 miliardi di dollari, il più alto tra le grandi città degli Stati Uniti....', '...Oltre ad essere la città che ospita il maggior numero di corporations della lista Fortune 500, il numero di aziende estere che operano a New York non ha eguali negli Stati Uniti....', '...La Port Authority of New York and New Jersey, sotto il controllo congiunto degli stati di New York e New Jersey, che gestisce il PATH (Port Authority Trans Hudson), la metropolitana extracittadina che collega Manhattan al New Jersey 24 ore ogni giorno, e diverse linee di autobus che convergono al Port Authority Bus Terminal, vicino a Times Square;...', '...Come in gran parte degli Stati Uniti, il governo cittadino si articola in un ramo esecutivo, uno legislativo ed uno giudiziario....', '...Dal punto di vista giudiziario, poiché New York si estende su 5 diverse contee (corrispondenti alle 5 circoscrizioni o boroughs), essa è leggermente anomala rispetto al resto degli Stati Uniti:...', '...Praticamente tutti coloro che rivestono cariche nello Stato di New York, compreso il Governatore e il Procuratore Generale, hanno uffici a Manhattan e lo stesso si può dire per entrambi i senatori degli Stati Uniti eletti nello Stato....', '...Essa, comunque, è la più importante fonte di finanziamenti alla politica di tutti gli Stati Uniti....', '...Molti sono stati i letterati e i musicisti che hanno trovato ispirazione in New York e nei suoi quartieri....']","34th Street–Penn Station, 7th Avenue, Chelsea District, Manhattan, New York County, New York, 10001, Stati Uniti d'America","{""coordinates"": [-73.991203, 40.750347], ""type"": ""Point""}","34th Street–Penn Station, 7th Avenue, Chelsea District, Manhattan, New York County, New York, 10001, Stati Uniti d'America",railway,stop
175,Bx,Bx,"['*...Gli autobus indicati da una M vicino al numero, indicano che viaggia solo a Manhattan, B per Brooklyn, Q per Queens, Bx per Bronx e S per Staten Island....']","BX Dental, 2466, Arthur Avenue, Belmont, Bronx County, The Bronx, New York, 10458, Stati Uniti d'America","{""coordinates"": [-73.886172, 40.856946], ""type"": ""Point""}","BX Dental, 2466, Arthur Avenue, Belmont, Bronx County, The Bronx, New York, 10458, Stati Uniti d'America",amenity,dentist
176,City Hall,City Hall,['*...La New York City Hall è la sede del governo cittadino e luogo di riunione del Consiglio....'],"City Hall, Steve Flanders Square, Lower Manhattan, Manhattan Community Board 1, Manhattan, New York County, New York, 10000, Stati Uniti d'America","{""coordinates"": [-74.006681, 40.712639], ""type"": ""Point""}","City Hall, Steve Flanders Square, Lower Manhattan, Manhattan Community Board 1, Manhattan, New York County, New York, 10000, Stati Uniti d'America",historic,railway_station
177,Manhattan Municipal Building,Manhattan Municipal Building,"[""*...L'ufficio del sindaco si trova, assieme a circa altre tredici agenzie comunali, nel vicino Manhattan Municipal Building, uno degli edifici amministrativi più grandi del mondo....""]","David N. Dinkins Manhattan Municipal Building, 1, Centre Street, Lower Manhattan, Manhattan Community Board 1, Manhattan, New York County, New York, 10007, Stati Uniti d'America","{""coordinates"": [-74.003475, 40.713027], ""type"": ""Point""}","David N. Dinkins Manhattan Municipal Building, 1, Centre Street, Lower Manhattan, Manhattan Community Board 1, Manhattan, New York County, New York, 10007, Stati Uniti d'America",office,government
179,Roma,Roma,"['*...Esistono accordi stipulati con Roma fin dal 1992, anche se non si tratta di un vero e proprio gemellaggio....']","Roma, 25, Union Street, Village of Sidney, Town of Sidney, Delaware County, New York, 13838, Stati Uniti d'America","{""coordinates"": [-75.394194, 42.310737], ""type"": ""Point""}","Roma, 25, Union Street, Village of Sidney, Town of Sidney, Delaware County, New York, 13838, Stati Uniti d'America",amenity,restaurant
180,Madison Square Garden,Madison Square Garden,"['*...Quattro dei dieci stadi più costosi mai costruiti in tutto il mondo (il Madison Square Garden, il nuovo Yankee Stadium, il MetLife Stadium e il Citi Field) si trovano nella zona metropolitana di New York....', '*...Il primo campionato di college basket a livello nazionale, il National Invitation Tournament, si tenne a New York nel 1938 (un anno prima della nascita del torneo NCAA) e le finali vengono giocate al Madison Square Garden....', ""*...La boxe riveste un ruolo importante nella scena sportiva della città, con eventi come il dilettante guantoni da boxe d'oro detenuti al Madison Square Garden di ogni anno....""]","Madison Square Garden, 4, Pennsylvania Plaza, Chelsea District, Manhattan, New York County, New York, 10001, Stati Uniti d'America","{""coordinates"": [-73.993516, 40.750513], ""type"": ""Point""}","Madison Square Garden, 4, Pennsylvania Plaza, Chelsea District, Manhattan, New York County, New York, 10001, Stati Uniti d'America",tourism,attraction
183,California,California,['*...Entrambe le squadre si sono trasferite in California nel 1958....'],"California, Town of Elizabethtown, Essex County, New York, 12932, Stati Uniti d'America","{""coordinates"": [-73.596316, 44.193997], ""type"": ""Point""}","California, Town of Elizabethtown, Essex County, New York, 12932, Stati Uniti d'America",highway,path
186,Harrison,Harrison,"['*...Il New York City FC gioca allo Yankee stadium, nel Bronx, e dunque è considerata la vera squadra di calcio della città, mentre i Red Bulls giocano le partite casalinghe alla Red Bull Arena, nei pressi di Harrison, New Jersey.....']","Harrison, Harrison Avenue, Town/Village of Harrison, Westchester County, New York, 10528, Stati Uniti d'America","{""coordinates"": [-73.712539, 40.969596], ""type"": ""Point""}","Harrison, Harrison Avenue, Town/Village of Harrison, Westchester County, New York, 10528, Stati Uniti d'America",railway,stop
187,New Jersey..,New Jersey..,"['*...Il New York City FC gioca allo Yankee stadium, nel Bronx, e dunque è considerata la vera squadra di calcio della città, mentre i Red Bulls giocano le partite casalinghe alla Red Bull Arena, nei pressi di Harrison, New Jersey.....']","New Jersey, Town of Ancram, Columbia County, New York, 12503, Stati Uniti d'America","{""coordinates"": [-73.601633, 42.075346], ""type"": ""Point""}","New Jersey, Town of Ancram, Columbia County, New York, 12503, Stati Uniti d'America",highway,residential
188,Coney Island,Coney Island,"[""*...Il Rugby New York rappresenta la città nella Major League Rugby giocando le partite all' MCU Park di Coney Island....""]","Coney Island Avenue, Gravesend, Kings County, New York, 11235, Stati Uniti d'America","{""coordinates"": [-73.960965, 40.595349], ""type"": ""Point""}","Coney Island Avenue, Gravesend, Kings County, New York, 11235, Stati Uniti d'America",highway,secondary
189,Nassau,Nassau,"[""*...La città è rappresentata anche nell'Indoor lacrosse con i New York Riptide della National Lacrosse League che giocano al Nassau Veterans Memorial di Uniondale....""]","Nassau 2, Front Street, Village of Mineola, Town of North Hempstead, Nassau County, New York, 11501, Stati Uniti d'America","{""coordinates"": [-73.638491, 40.740912], ""type"": ""Point""}","Nassau 2, Front Street, Village of Mineola, Town of North Hempstead, Nassau County, New York, 11501, Stati Uniti d'America",railway,junction
194,Castle,Castle,"['*...Castle, CSI:...']","Castle, 440, 4th Avenue, Brooklyn, Kings County, New York, 11215, Stati Uniti d'America","{""coordinates"": [-73.988704, 40.670701], ""type"": ""Point""}","Castle, 440, 4th Avenue, Brooklyn, Kings County, New York, 11215, Stati Uniti d'America",office,taxi
