,entity,to_search,snippet,address,coordinates,name_location,class,type
110,Sea-Air-Space Museum,Sea-Air-Space Museum,"['*...Tra i più importanti musei del settore scientifico, storico e tecnico, troviamo il ""Brooklyn Museum"" e l\'""Intrepid Sea-Air-Space Museum"", quest\'ultimo ospitato su un\'autentica portaerei ormeggiata nella baia di Manhattan....']","Intrepid Museum, 86, West 46th Street, Manhattan Community Board 4, Manhattan, New York County, New York, 10036, Stati Uniti d'America","{""coordinates"": [-73.999597, 40.764597], ""type"": ""Point""}","Intrepid Museum, 86, West 46th Street, Manhattan Community Board 4, Manhattan, New York County, New York, 10036, Stati Uniti d'America",tourism,museum
111,Museum of Natural History,Museum of Natural History,"['*...L\'""American Museum of Natural History"" è uno dei più grandi musei di storia naturale del mondo....']","Museo americano di storia naturale, 180, Central Park West, Manhattan Community Board 7, Manhattan, New York County, New York, 10024, Stati Uniti d'America","{""coordinates"": [-73.974236, 40.781101], ""type"": ""Point""}","Museo americano di storia naturale, 180, Central Park West, Manhattan Community Board 7, Manhattan, New York County, New York, 10024, Stati Uniti d'America",tourism,museum
113,Museum of Modern Art,Museum of Modern Art,"['*...Tra i più noti musei d\'arte e design, il ""Metropolitan Museum of Art"" (inaugurato nel 1880) espone oggetti d\'arte che vanno dai reperti dell\'antico Egitto all\'arte moderna, mentre il ""Museum of Modern Art"" (chiamato MoMA e aperto nel 1929) è considerato il più grande Museo al mondo di arte contemporanea ed è stato riaperto nel 2004 dopo un\'ampia espansione....']","Museum of Modern Art (MoMA) films, West 53rd Street, Manhattan Community Board 5, Manhattan, New York County, New York, 10019, Stati Uniti d'America","{""coordinates"": [-73.977814, 40.761634], ""type"": ""Point""}","Museum of Modern Art (MoMA) films, West 53rd Street, Manhattan Community Board 5, Manhattan, New York County, New York, 10019, Stati Uniti d'America",amenity,cinema
114,Museo Guggenheim,Museo Guggenheim,"['*...Il ""Museo Guggenheim"" è ospitato in un edificio progettato dal famoso architetto Frank Lloyd Wright ed ha una forma che ricorda il guscio di una lumaca....', '*...Tra i più noti musei d\'arte e design, il ""Metropolitan Museum of Art"" (inaugurato nel 1880) espone oggetti d\'arte che vanno dai reperti dell\'antico Egitto all\'arte moderna, mentre il ""Museum of Modern Art"" (chiamato MoMA e aperto nel 1929) è considerato il più grande Museo al mondo di arte contemporanea ed è stato riaperto nel 2004 dopo un\'ampia espansione....']","Guggenheim Museum, 1071, 5th Avenue, Manhattan Community Board 8, Manhattan, New York County, New York, 10128, Stati Uniti d'America","{""coordinates"": [-73.958925, 40.782993], ""type"": ""Point""}","Guggenheim Museum, 1071, 5th Avenue, Manhattan Community Board 8, Manhattan, New York County, New York, 10128, Stati Uniti d'America",tourism,museum
115,Whitney Museum of American Art,Whitney Museum of American Art,"['*...Altri musei d\'arte della città sono la ""Frick Collection"" (1935), il ""Whitney Museum of American Art"" (1931) e l\'""International Center of Photography""....']","Whitney Museum of American Art, 99, Gansevoort Street, Manhattan Community Board 2, Manhattan, New York County, New York, 10014, Stati Uniti d'America","{""coordinates"": [-74.008921, 40.739645], ""type"": ""Point""}","Whitney Museum of American Art, 99, Gansevoort Street, Manhattan Community Board 2, Manhattan, New York County, New York, 10014, Stati Uniti d'America",tourism,museum
116,Center of Photography,Center of Photography,"['...Altri musei d\'arte della città sono la ""Frick Collection"" (1935), il ""Whitney Museum of American Art"" (1931) e l\'""International Center of Photography""....']","International Center of Photography Library, 79, Essex Street, Manhattan Community Board 3, Manhattan, New York County, New York, 10002, Stati Uniti d'America","{""coordinates"": [-73.989124, 40.718223], ""type"": ""Point""}","International Center of Photography Library, 79, Essex Street, Manhattan Community Board 3, Manhattan, New York County, New York, 10002, Stati Uniti d'America",amenity,library
117,Ellis Island,Ellis Island,"[""*...Fra le maggiori vi sono Ellis Island, l'isola in cui un tempo sbarcavano le navi piene di immigrati provenienti dall'Europa, e dove questi venivano tenuti in quarantena per un certo periodo prima di essere ammessi al resto degli Stati Uniti;..."", ""*...Non lontano da Liberty Island (l'isola che ospita la Statua della Libertà) vi è Ellis Island che è stato per anni il principale punto d'ingresso per gli immigranti che sbarcavano negli Stati Uniti...."", ""*...Le principali destinazioni sono l'Empire State Building, la Statua della Libertà, Ellis Island, i teatri di Broadway, musei come il Metropolitan Museum of Art, spazi verdi come Central Park, il Rockefeller Center, Times Square, la Chinatown di Manhattan;..."", '*...Il sistema dei trasporti terrestri, è poi integrato da una serie di molto economici traghetti (ferries), che collegano soprattutto Manhattan verso ovest allo stato del New Jersey (attraversando il fiume Hudson) e verso sud a Staten Island (traghetto gratuito, in servizio 24 ore al giorno, che fornisce una buona vista della Statua della Libertà e di Ellis Island)....']","Statue of Liberty & Ellis Island Tickets, Battery Park Underpass, Battery Park City, Manhattan, New York County, New York, 10004, Stati Uniti d'America","{""coordinates"": [-74.016928, 40.703517], ""type"": ""Point""}","Statue of Liberty & Ellis Island Tickets, Battery Park Underpass, Battery Park City, Manhattan, New York County, New York, 10004, Stati Uniti d'America",tourism,information
118,Island Immigration Museum,Island Immigration Museum,"['*...Nel 1990 fu oggetto di restauri che portarono all\'apertura dell\'""Ellis Island Immigration Museum""....']","Ellis Island Immigration Museum, Ellis Island Bridge, New York, Hudson County, New Jersey, 10004, Stati Uniti d'America","{""coordinates"": [-74.039548, 40.699131], ""type"": ""Point""}","Ellis Island Immigration Museum, Ellis Island Bridge, New York, Hudson County, New Jersey, 10004, Stati Uniti d'America",tourism,museum
119,New York City Fire Museum,New York City Fire Museum,"['*...Il ""New York Botanical Garden"", il ""New York City Police Museum"", il ""New York City Fire Museum"", il ""New York Historical Society"", il ""Garibaldi-Meucci Museum"" e il ""New York Transit Museum""....']","New York City Fire Museum, 278, Spring Street, Manhattan Community Board 2, Manhattan, New York County, New York, 10013, Stati Uniti d'America","{""coordinates"": [-74.00693, 40.725601], ""type"": ""Point""}","New York City Fire Museum, 278, Spring Street, Manhattan Community Board 2, Manhattan, New York County, New York, 10013, Stati Uniti d'America",tourism,museum
120,Garibaldi-Meucci Museum,Garibaldi-Meucci Museum,"['*...Il ""New York Botanical Garden"", il ""New York City Police Museum"", il ""New York City Fire Museum"", il ""New York Historical Society"", il ""Garibaldi-Meucci Museum"" e il ""New York Transit Museum""....']","Garibaldi-Meucci Museum, Chestnut Avenue, Rosebank, Staten Island, Richmond County, New York, 10305, Stati Uniti d'America","{""coordinates"": [-74.073826, 40.615182], ""type"": ""Point""}","Garibaldi-Meucci Museum, Chestnut Avenue, Rosebank, Staten Island, Richmond County, New York, 10305, Stati Uniti d'America",tourism,museum
121,New York Transit Museum,New York Transit Museum,"['*...Il ""New York Botanical Garden"", il ""New York City Police Museum"", il ""New York City Fire Museum"", il ""New York Historical Society"", il ""Garibaldi-Meucci Museum"" e il ""New York Transit Museum""....']","New York Transit Museum, 99, Schermerhorn Street, Cobble Hill, Downtown Brooklyn, Kings County, New York, 11201, Stati Uniti d'America","{""coordinates"": [-73.98998, 40.690518], ""type"": ""Point""}","New York Transit Museum, 99, Schermerhorn Street, Cobble Hill, Downtown Brooklyn, Kings County, New York, 11201, Stati Uniti d'America",tourism,museum
123,Broadway,Broadway,"[""*...I ricchi industriali del XIX secolo hanno istituito una rete di importanti istituzioni culturali, come la famosa sala da concerto Carnegie Hall e il Metropolitan Museum of Art. L'avvento della luce elettrica ha portato a realizzare produzioni teatrali e nei teatri di New York, a Broadway e lungo la 42° Strada, è iniziato un nuovo tipo di intrattenimento che divenne noto come il musical di Broadway...."", '*...La città ha 39 grandi teatri (con più di 500 posti ciascuno) e sono conosciuti collettivamente come ""Broadway""....', ""*...Le principali destinazioni sono l'Empire State Building, la Statua della Libertà, Ellis Island, i teatri di Broadway, musei come il Metropolitan Museum of Art, spazi verdi come Central Park, il Rockefeller Center, Times Square, la Chinatown di Manhattan;...""]","Broadway, Financial District, Manhattan, New York County, New York, 10003, Stati Uniti d'America","{""coordinates"": [-74.012489, 40.706841], ""type"": ""Point""}","Broadway, Financial District, Manhattan, New York County, New York, 10003, Stati Uniti d'America",highway,secondary
124,Lincoln Center for the Performing Arts,Lincoln Center for the Performing Arts,"['*...Il Lincoln Center for the Performing Arts ospita 12 importanti istituzioni artistiche, tra cui due teatri dell\'opera, il famoso ""Metropolitan"" e il ""New York State Theater"" nel quale si esibiscono la ""New York City Opera"" e il ""New York City Ballet"", ospita inoltre l\'""Avery Fisher Hall"" in cui si esibisce la ""New York Philharmonic Orchestra"", e ancora il ""Jazz at Lincoln Center"", il ""Vivian Beaumont Theatre"", la ""Juilliard School"" e l\'""Alice Tully Hall""....']","Lincoln Center for the Performing Arts, 10, West 61st Street, Manhattan Community Board 7, Manhattan, New York County, New York, 10023, Stati Uniti d'America","{""coordinates"": [-73.984224, 40.772518], ""type"": ""Point""}","Lincoln Center for the Performing Arts, 10, West 61st Street, Manhattan Community Board 7, Manhattan, New York County, New York, 10023, Stati Uniti d'America",amenity,arts_centre
129,Chicago,Chicago,"[""*...New York è un importante centro per la televisione, la pubblicità, l'editoria musicale, per il giornalismo per l'editoria, inoltre è il grande Mercato dei media in Nord America (seguita da Los Angeles, Chicago e Toronto)...."", '*...Inoltre, la città, è una delle quattro aree metropolitane (insieme a Los Angeles, Chicago, Washington e San Francisco Bay Area) ad avere due squadre professionistiche di baseball in MLB....']","Chicago Alley, Arrochar, Staten Island, Richmond County, New York, 10305, Stati Uniti d'America","{""coordinates"": [-74.070473, 40.601708], ""type"": ""Point""}","Chicago Alley, Arrochar, Staten Island, Richmond County, New York, 10305, Stati Uniti d'America",highway,residential
133,WNYC,WNYC,"['*...WNYC è una stazione radio pubblica, fino al 1997 di proprietà comunale, possiede il più vasto pubblico radiofonico negli Stati Uniti....', '*...Nel 2011 ben 20\xa0000 australiani risiedevano a NYC, rispetto ai 5\xa0537 di soli sei anni prima (2005)....', '...La città di New York, per mezzo della società NYC Media Group, gestisce un servizio pubblico di trasmissione, NYCTV, che ha prodotto diversi spettacoli vincitori di un Grammy Award, che coprono la musica e la cultura dei quartieri della città e notizie sulla amministrazione locale....', '...New York, New York, resa popolare da Liza Minnelli e da Frank Sinatra, NY State of Mind di Nas, Welcome to NYC ed Empire State of Mind di Jay-Z, Welcome to New York di Taylor Swift, New York City Serenade di Bruce Springsteen, New York di Bryan Adams, Harlem di Duke Ellington, Angel of Harlem degli U2, Leaving New York dei R.E.M., Shattered dei Rolling Stones, I Love New York di Madonna, New York Groove di Ace Frehley, New York State of Mind di Billy Joel, New York city di John Lennon....']","The Greene Space at WNYC/WQXR, 44, Charlton Street, Manhattan Community Board 2, Manhattan, New York County, New York, 10012, Stati Uniti d'America","{""coordinates"": [-74.005218, 40.726956], ""type"": ""Point""}","The Greene Space at WNYC/WQXR, 44, Charlton Street, Manhattan Community Board 2, Manhattan, New York County, New York, 10012, Stati Uniti d'America",amenity,arts_centre
138,Riverdale,Riverdale,"[""...In quartieri come Riverdale, The Bronx, Ditmas Park, Brooklyn, Douglaston, Queens, vi sono grandi case unifamiliari in vari stili architettonici come il Tudor revival e l'architettura vittoriana...."", ""*...Bronx (Contea del Bronx, 1\xa0397\xa0287 abitanti), è l'unico distretto a trovarsi quasi interamente sulla terraferma (fanno eccezione alcune isole minori). È delimitato a est dal Long Island Sound, a sud dall'East River e a ovest dall'estuario del fiume Hudson. Associato a immagini di povertà e violenza (che non corrispondono del tutto alla realtà dei fatti), è abitato per la maggior parte da immigrati dall'America latina e da loro discendenti, nonché da molti afro-americani. Non mancano, comunque, quartieri ad alto reddito, come Riverdale. Il Bronx è la culla della cultura hip hop e ospita lo stadio dei New York Yankees, lo Yankee Stadium....""]","Riverdale, Railroad Terrace, Riverdale, Bronx County, The Bronx, New York, 10471, Stati Uniti d'America","{""coordinates"": [-73.91386, 40.904332], ""type"": ""Point""}","Riverdale, Railroad Terrace, Riverdale, Bronx County, The Bronx, New York, 10471, Stati Uniti d'America",railway,stop
139,Yankee Stadium,Yankee Stadium,"[""*...Bronx (Contea del Bronx, 1\xa0397\xa0287 abitanti), è l'unico distretto a trovarsi quasi interamente sulla terraferma (fanno eccezione alcune isole minori). È delimitato a est dal Long Island Sound, a sud dall'East River e a ovest dall'estuario del fiume Hudson. Associato a immagini di povertà e violenza (che non corrispondono del tutto alla realtà dei fatti), è abitato per la maggior parte da immigrati dall'America latina e da loro discendenti, nonché da molti afro-americani. Non mancano, comunque, quartieri ad alto reddito, come Riverdale. Il Bronx è la culla della cultura hip hop e ospita lo stadio dei New York Yankees, lo Yankee Stadium...."", '*...Quattro dei dieci stadi più costosi mai costruiti in tutto il mondo (il Madison Square Garden, il nuovo Yankee Stadium, il MetLife Stadium e il Citi Field) si trovano nella zona metropolitana di New York....', '...Il New York City FC gioca allo Yankee stadium, nel Bronx, e dunque è considerata la vera squadra di calcio della città, mentre i Red Bulls giocano le partite casalinghe alla Red Bull Arena, nei pressi di Harrison, New Jersey.....']","Yankee Stadium, 1, East 161st Street, Bronx County, The Bronx, New York, 10451, Stati Uniti d'America","{""coordinates"": [-73.926521, 40.829583], ""type"": ""Point""}","Yankee Stadium, 1, East 161st Street, Bronx County, The Bronx, New York, 10451, Stati Uniti d'America",leisure,stadium
145,Rockefeller Center,Rockefeller Center,"[""*...Le principali destinazioni sono l'Empire State Building, la Statua della Libertà, Ellis Island, i teatri di Broadway, musei come il Metropolitan Museum of Art, spazi verdi come Central Park, il Rockefeller Center, Times Square, la Chinatown di Manhattan;...""]","Rockefeller Center, Rockefeller Plaza, Manhattan Community Board 5, Manhattan, New York County, New York, 10020, Stati Uniti d'America","{""coordinates"": [-73.978801, 40.758845], ""type"": ""Point""}","Rockefeller Center, Rockefeller Plaza, Manhattan Community Board 5, Manhattan, New York County, New York, 10020, Stati Uniti d'America",tourism,attraction
146,Chinatown,Chinatown,"[""*...Le principali destinazioni sono l'Empire State Building, la Statua della Libertà, Ellis Island, i teatri di Broadway, musei come il Metropolitan Museum of Art, spazi verdi come Central Park, il Rockefeller Center, Times Square, la Chinatown di Manhattan;...""]","Chinatown, Bayard Street, Chinatown, Manhattan, New York County, New York, 10013, Stati Uniti d'America","{""coordinates"": [-73.998472, 40.715626], ""type"": ""Point""}","Chinatown, Bayard Street, Chinatown, Manhattan, New York County, New York, 10013, Stati Uniti d'America",tourism,attraction
148,Madison Avenue,Madison Avenue,['*...Lo shopping di lusso lungo la Quinta Strada e la Madison Avenue ed eventi come la parata di Halloween nel Greenwich Village e la parata di San Patrizio....'],"Madison Avenue, Flatiron District, Manhattan, New York County, New York, 10037, Stati Uniti d'America","{""coordinates"": [-73.986639, 40.742715], ""type"": ""Point""}","Madison Avenue, Flatiron District, Manhattan, New York County, New York, 10037, Stati Uniti d'America",highway,secondary
149,Greenwich Village,Greenwich Village,"['*...Lo shopping di lusso lungo la Quinta Strada e la Madison Avenue ed eventi come la parata di Halloween nel Greenwich Village e la parata di San Patrizio....', ""*...L'Uomo Ragno è nato e cresciuto nel Queens, Capitan America a Brooklyn, Daredevil a Hell's Kitchen, Luke Cage vive ad Harlem, il dottor Strange al Greenwich Village;...""]","Greenwich Village, 7th Avenue South, Manhattan Community Board 2, Manhattan, New York County, New York, 10014, Stati Uniti d'America","{""coordinates"": [-74.002817, 40.733584], ""type"": ""Point""}","Greenwich Village, 7th Avenue South, Manhattan Community Board 2, Manhattan, New York County, New York, 10014, Stati Uniti d'America",tourism,attraction
150,Manhattan Waterfront Greenway,Manhattan Waterfront Greenway,"[""*...New York infatti dispone di più di 680\xa0km di piste ciclabili, dislocate maggiormente nei ponti dell'East River e nella Manhattan Waterfront Greenway....""]","Harlem River Drive Greenway, Manhattan Community Board 10, Manhattan, New York County, New York, 10032, Stati Uniti d'America","{""coordinates"": [-73.936293, 40.83464], ""type"": ""Point""}","Harlem River Drive Greenway, Manhattan Community Board 10, Manhattan, New York County, New York, 10032, Stati Uniti d'America",highway,cycleway
151,Grand Central Terminal,Grand Central Terminal,['*...Le principali stazioni ferroviarie di New York sono Grand Central Terminal e la Penn Station....'],"Grand Central Terminal, 89, East 42nd Street, Midtown East, Manhattan, New York County, New York, 10017, Stati Uniti d'America","{""coordinates"": [-73.97725, 40.752701], ""type"": ""Point""}","Grand Central Terminal, 89, East 42nd Street, Midtown East, Manhattan, New York County, New York, 10017, Stati Uniti d'America",tourism,attraction
153,Jamaica,Jamaica,"[""*...L'Aeroporto Internazionale John F. Kennedy (JFK), il principale scalo aeroportuale di New York, situato a Jamaica (nel Queens) e a 25\xa0km da Manhattan;...""]","Jamaica, 143rd Street, Queens, New York, 11435, Stati Uniti d'America","{""coordinates"": [-73.810176, 40.699218], ""type"": ""Point""}","Jamaica, 143rd Street, Queens, New York, 11435, Stati Uniti d'America",railway,stop
156,LGA,LGA,"['*...E il Fiorello LaGuardia Airport (LGA), situato invece a Jackson Heights (nel Queens), usato quasi esclusivamente per voli nazionali....']","LaGuardia Airport, 14th Road, Queens, New York, 11371, Stati Uniti d'America","{""coordinates"": [-73.873364, 40.775714], ""type"": ""Point""}","LaGuardia Airport, 14th Road, Queens, New York, 11371, Stati Uniti d'America",aeroway,aerodrome
157,Jackson Heights,Jackson Heights,"['*...E il Fiorello LaGuardia Airport (LGA), situato invece a Jackson Heights (nel Queens), usato quasi esclusivamente per voli nazionali....']","Jackson Heights–Roosevelt Avenue, Broadway, Queens, New York, 11373, Stati Uniti d'America","{""coordinates"": [-73.891338, 40.746644], ""type"": ""Point""}","Jackson Heights–Roosevelt Avenue, Broadway, Queens, New York, 11373, Stati Uniti d'America",railway,station
162,Islip,Islip,"[""*...Altri aeroporti nella zona di New York sono l'Aeroporto di New York-Stewart (a 97\xa0km) e l'Aeroporto di Long Island-MacArthur (a 11 kilometri a nordest dalla città di Islip)....""]","Islip, Nassau Avenue, Islip, Town of Islip, Suffolk County, New York, 11751, Stati Uniti d'America","{""coordinates"": [-73.210456, 40.735631], ""type"": ""Point""}","Islip, Nassau Avenue, Islip, Town of Islip, Suffolk County, New York, 11751, Stati Uniti d'America",railway,stop
165,Staten Island Railway,Staten Island Railway,"[""*...L'MTA (Metropolitan Transportation Authority), che fa capo principalmente alla città di New York e gestisce la metropolitana, la (Staten Island Railway) (anch'essa attiva 24 ore al giorno, 7 giorni alla settimana), gli autobus urbani e i treni verso Long Island (Long Island Rail Road) e verso Nord (Metro-North Railroad);...""]","Staten Island Railway, Victory Boulevard Overpass, Staten Island, Richmond County, New York, 10301, Stati Uniti d'America","{""coordinates"": [-74.075332, 40.638839], ""type"": ""Point""}","Staten Island Railway, Victory Boulevard Overpass, Staten Island, Richmond County, New York, 10301, Stati Uniti d'America",railway,subway
166,Long Island Rail Road,Long Island Rail Road,"[""*...L'MTA (Metropolitan Transportation Authority), che fa capo principalmente alla città di New York e gestisce la metropolitana, la (Staten Island Railway) (anch'essa attiva 24 ore al giorno, 7 giorni alla settimana), gli autobus urbani e i treni verso Long Island (Long Island Rail Road) e verso Nord (Metro-North Railroad);...""]","Long Island Rail Road, Archer Avenue, Jamaica, Queens, New York, 11435, Stati Uniti d'America","{""coordinates"": [-73.808088, 40.700246], ""type"": ""Point""}","Long Island Rail Road, Archer Avenue, Jamaica, Queens, New York, 11435, Stati Uniti d'America",building,train_station
167,Metro-North Railroad,Metro-North Railroad,"[""*...L'MTA (Metropolitan Transportation Authority), che fa capo principalmente alla città di New York e gestisce la metropolitana, la (Staten Island Railway) (anch'essa attiva 24 ore al giorno, 7 giorni alla settimana), gli autobus urbani e i treni verso Long Island (Long Island Rail Road) e verso Nord (Metro-North Railroad);...""]","Metro-North Railroad, Park Avenue, Manhattan Community Board 5, Manhattan, New York County, New York, 10037, Stati Uniti d'America","{""coordinates"": [-73.977573, 40.753005], ""type"": ""Point""}","Metro-North Railroad, Park Avenue, Manhattan Community Board 5, Manhattan, New York County, New York, 10037, Stati Uniti d'America",shop,ticket
171,Port Authority Bus Terminal,Port Authority Bus Terminal,"['*...La Port Authority of New York and New Jersey, sotto il controllo congiunto degli stati di New York e New Jersey, che gestisce il PATH (Port Authority Trans Hudson), la metropolitana extracittadina che collega Manhattan al New Jersey 24 ore ogni giorno, e diverse linee di autobus che convergono al Port Authority Bus Terminal, vicino a Times Square;...', '*...Per le corse suburbane, si parte dal Port Authority Bus Terminal....']","Port Authority Bus Terminal, 625, 8th Avenue, Manhattan Community Board 4, Manhattan, New York County, New York, 10018, Stati Uniti d'America","{""coordinates"": [-73.991448, 40.756835], ""type"": ""Point""}","Port Authority Bus Terminal, 625, 8th Avenue, Manhattan Community Board 4, Manhattan, New York County, New York, 10018, Stati Uniti d'America",amenity,bus_station
