,entity,to_search,snippet,address,coordinates,name_location,class,type
3,Connecticut,Connecticut,"['*...Conosciuta nel mondo anche come ""Grande mela"" (Big Apple), sorge su un\'area di circa 785\xa0km² alla foce del fiume Hudson, sull\'oceano Atlantico, mentre l\'area metropolitana comprende anche aree situate nei due adiacenti stati del New Jersey e del Connecticut....', '*...Grazie ad una rete di ferrovie e di autobus locali, poi, è possibile raggiungere diverse località, da Long Island al New Jersey al Connecticut e alla parte continentale dello Stato di New York....']","USS Connecticut Court, South Beach, Staten Island, Richmond County, New York, 10305, Stati Uniti d'America","{""coordinates"": [-74.060422, 40.596311], ""type"": ""Point""}","USS Connecticut Court, South Beach, Staten Island, Richmond County, New York, 10305, Stati Uniti d'America",highway,residential
4,Los Angeles,Los Angeles,"['*...Con 8,8 milioni di abitanti, è la città più popolosa dello stato di New York e degli Stati Uniti superando doppiamente Los Angeles, seconda città nazionale per popolazione....', ""*...New York è un importante centro per la televisione, la pubblicità, l'editoria musicale, per il giornalismo per l'editoria, inoltre è il grande Mercato dei media in Nord America (seguita da Los Angeles, Chicago e Toronto)...."", '*...Hanno sede a New York studi televisivi (ABC, CBS, NBC) e cinematografici (per quanto in misura decisamente inferiore rispetto a Los Angeles), oltre a numerosi gruppi editoriali (ad es. McGraw-Hill, The New York Times Company, Time Warner)....', '*...Inoltre, la città, è una delle quattro aree metropolitane (insieme a Los Angeles, Chicago, Washington e San Francisco Bay Area) ad avere due squadre professionistiche di baseball in MLB....', '...La città, un tempo, era anche sede dei Brooklyn Dodgers (poi diventati i Los Angeles Dodgers), che hanno vinto le World Series una volta, e i New York Giants (poi trasferitisi a San Francisco), che le hanno vinte per cinque volte....', '...Criminal Intent, White Collar, Elementary, Third Watch, Ncis Los Angeles, The Blacklist, Blue Bloods, NYPD Blue e Suits....']","Plaza de los Angeles, East 156th Street, Melrose, Bronx County, The Bronx, New York, 10451, Stati Uniti d'America","{""coordinates"": [-73.913514, 40.820375], ""type"": ""Point""}","Plaza de los Angeles, East 156th Street, Melrose, Bronx County, The Bronx, New York, 10451, Stati Uniti d'America",building,apartments
8,Harlem River,Harlem River,"[""*...Queens e Brooklyn, rispettivamente nell'estremità nord-occidentale e sud-occidentale dell'isola di Long Island) e uno, Manhattan, sull'appendice inferiore della penisola su cui si trova anche il Bronx e che da esso è separato dall'Harlem River, fiume-canale che collega l'Hudson all'East River...."", '...Numerosi movimenti culturali americani hanno avuto inizio in città, come ad esempio il Rinascimento di Harlem, che è stato riconosciuto nel canone letterario afro-americano statunitense....', '*...Infatti la City of New York University è la più grande Università comunale degli Stati Uniti, mentre il City College of New York, che ha sede nel quartiere di Harlem, è stimato per aver educato molti premi Nobel....', '*...Il New York Amsterdam News, pubblicato ad Harlem, è un importante giornale afro-americano....', ""*...Manhattan (Contea di New York, 1\xa0629\xa0054 abitanti), è il centro culturale, amministrativo e degli affari. Manhattan è la zona più densamente popolata della città e ospita gran parte dei luoghi e degli edifici che la caratterizzano maggiormente. A Manhattan si trova, ad esempio, la maggior parte dei grattacieli newyorkesi. Da menzionare il celebre Central Park. A Manhattan è presente il quartiere di Harlem, l'unica zona con prevalenza afro-americana...."", ""*...L'Uomo Ragno è nato e cresciuto nel Queens, Capitan America a Brooklyn, Daredevil a Hell's Kitchen, Luke Cage vive ad Harlem, il dottor Strange al Greenwich Village;..."", '*...New York, New York, resa popolare da Liza Minnelli e da Frank Sinatra, NY State of Mind di Nas, Welcome to NYC ed Empire State of Mind di Jay-Z, Welcome to New York di Taylor Swift, New York City Serenade di Bruce Springsteen, New York di Bryan Adams, Harlem di Duke Ellington, Angel of Harlem degli U2, Leaving New York dei R.E.M., Shattered dei Rolling Stones, I Love New York di Madonna, New York Groove di Ace Frehley, New York State of Mind di Billy Joel, New York city di John Lennon....']","Harlem River Drive, Manhattan Community Board 11, Manhattan, New York County, New York, 10030, Stati Uniti d'America","{""coordinates"": [-73.93431, 40.807791], ""type"": ""Point""}","Harlem River Drive, Manhattan Community Board 11, Manhattan, New York County, New York, 10030, Stati Uniti d'America",highway,motorway
9,East River,East River,"[""*...Queens e Brooklyn, rispettivamente nell'estremità nord-occidentale e sud-occidentale dell'isola di Long Island) e uno, Manhattan, sull'appendice inferiore della penisola su cui si trova anche il Bronx e che da esso è separato dall'Harlem River, fiume-canale che collega l'Hudson all'East River...."", ""*...Il Ponte di Brooklyn, che attraversando l'East River collega Manhattan e Brooklyn;..."", ""*...Manhattan coincide con l'isola omonima, situata fra il corso dell'Hudson e lo East River (un piccolo braccio di mare);..."", ""*...Liberty Island, l'isola dove è collocata la Statua della Libertà; Governors Island, Rikers Island, situata nell'East River a nord di Manhattan e sede di un enorme complesso carcerario;..."", ""*...Roosevelt Island, una piccola isola allungata nell'East River...."", ""*...Bronx (Contea del Bronx, 1\xa0397\xa0287 abitanti), è l'unico distretto a trovarsi quasi interamente sulla terraferma (fanno eccezione alcune isole minori). È delimitato a est dal Long Island Sound, a sud dall'East River e a ovest dall'estuario del fiume Hudson. Associato a immagini di povertà e violenza (che non corrispondono del tutto alla realtà dei fatti), è abitato per la maggior parte da immigrati dall'America latina e da loro discendenti, nonché da molti afro-americani. Non mancano, comunque, quartieri ad alto reddito, come Riverdale. Il Bronx è la culla della cultura hip hop e ospita lo stadio dei New York Yankees, lo Yankee Stadium...."", ""*...New York infatti dispone di più di 680\xa0km di piste ciclabili, dislocate maggiormente nei ponti dell'East River e nella Manhattan Waterfront Greenway....""]","East River, 1364, York Avenue, Lenox Hill, Manhattan, New York County, New York, 10128, Stati Uniti d'America","{""coordinates"": [-73.953219, 40.767234], ""type"": ""Point""}","East River, 1364, York Avenue, Lenox Hill, Manhattan, New York County, New York, 10128, Stati Uniti d'America",shop,alcohol
11,Jersey City,Jersey City,"[""*...Non fanno parte dei distretti di New York City, ma fanno parte della sua area metropolitana e gravitano intorno ad essa per ragioni economiche e culturali, alcune città del confinante Stato del New Jersey, come Jersey City, Newark e Hoboken, situate sulla riva occidentale dell'Hudson, di fronte a Manhattan....""]","Jersey City Post Office, York Street, Downtown Jersey City, Jersey City, Hudson County, New Jersey, 07311, Stati Uniti d'America","{""coordinates"": [-74.036916, 40.716288], ""type"": ""Point""}","Jersey City Post Office, York Street, Downtown Jersey City, Jersey City, Hudson County, New Jersey, 07311, Stati Uniti d'America",amenity,post_office
12,Hoboken,Hoboken,"[""*...Non fanno parte dei distretti di New York City, ma fanno parte della sua area metropolitana e gravitano intorno ad essa per ragioni economiche e culturali, alcune città del confinante Stato del New Jersey, come Jersey City, Newark e Hoboken, situate sulla riva occidentale dell'Hudson, di fronte a Manhattan....""]","Hoboken - World Trade Center, West Street, Manhattan Community Board 1, Manhattan, New York County, New York, 10281, Stati Uniti d'America","{""coordinates"": [-74.013777, 40.713038], ""type"": ""Point""}","Hoboken - World Trade Center, West Street, Manhattan Community Board 1, Manhattan, New York County, New York, 10281, Stati Uniti d'America",railway,subway
13,Statua della Libertà,Statua della Libertà,"[""*...Alcuni dei suoi simboli più famosi sono la Statua della Libertà, che si trova su Liberty Island, un'isola alla foce del fiume Hudson;..."", '*...New York aveva assunto il ruolo di ""porta"" degli Stati Uniti, riconosciuto ufficialmente con la donazione, da parte della Francia, della Statua della Libertà (inaugurata nel 1886)....', ""*...Liberty Island, l'isola dove è collocata la Statua della Libertà; Governors Island, Rikers Island, situata nell'East River a nord di Manhattan e sede di un enorme complesso carcerario;..."", ""*...Altri celebri parchi, benché decisamente più piccoli sono Bryant Park che funge da Giardino di lettura della New York Public Library, Battery Park, da dove partono i traghetti per la Statua della Libertà, e Washington Square Park, celebre per l'arco di trionfo dedicato a George Washington e per i gruppi di artisti di Strada che si esibiscono all'interno:..."", ""*...Non lontano da Liberty Island (l'isola che ospita la Statua della Libertà) vi è Ellis Island che è stato per anni il principale punto d'ingresso per gli immigranti che sbarcavano negli Stati Uniti...."", ""*...Le principali destinazioni sono l'Empire State Building, la Statua della Libertà, Ellis Island, i teatri di Broadway, musei come il Metropolitan Museum of Art, spazi verdi come Central Park, il Rockefeller Center, Times Square, la Chinatown di Manhattan;..."", '*...Il sistema dei trasporti terrestri, è poi integrato da una serie di molto economici traghetti (ferries), che collegano soprattutto Manhattan verso ovest allo stato del New Jersey (attraversando il fiume Hudson) e verso sud a Staten Island (traghetto gratuito, in servizio 24 ore al giorno, che fornisce una buona vista della Statua della Libertà e di Ellis Island)....']","Statua della Libertà, Flagpole Plaza, Manhattan Community Board 1, Manhattan, New York County, New York, 10004, Stati Uniti d'America","{""coordinates"": [-74.044548, 40.689253], ""type"": ""Point""}","Statua della Libertà, Flagpole Plaza, Manhattan Community Board 1, Manhattan, New York County, New York, 10004, Stati Uniti d'America",tourism,attraction
14,Liberty Island,Liberty Island,"[""*...Alcuni dei suoi simboli più famosi sono la Statua della Libertà, che si trova su Liberty Island, un'isola alla foce del fiume Hudson;..."", ""*...Liberty Island, l'isola dove è collocata la Statua della Libertà; Governors Island, Rikers Island, situata nell'East River a nord di Manhattan e sede di un enorme complesso carcerario;..."", ""*...Non lontano da Liberty Island (l'isola che ospita la Statua della Libertà) vi è Ellis Island che è stato per anni il principale punto d'ingresso per gli immigranti che sbarcavano negli Stati Uniti....""]","Liberty Island, Cafe Plaza, Manhattan Community Board 1, Manhattan, New York County, New York, 07302, Stati Uniti d'America","{""coordinates"": [-74.047667, 40.689851], ""type"": ""Point""}","Liberty Island, Cafe Plaza, Manhattan Community Board 1, Manhattan, New York County, New York, 07302, Stati Uniti d'America",amenity,ferry_terminal
16,Empire State Building,Empire State Building,"[""*...L'Empire State Building, grattacielo in stile art déco di 443 metri di altezza, situato a Midtown Manhattan...."", ""*...Lo stile Art déco del Chrysler Building (1930) e dell'Empire State Building (1931), con le loro cime e guglie coniche in acciaio, riflette i requisiti di tale regolamento...."", ""*...Benché non sia il più grande della città, il Parco più conosciuto è sicuramente Central Park, diventato ormai un'icona della città al pari di Times Square o dell'Empire State Building, e spesso inquadrato nei numerosi telefilm ambientati a Manhattan...."", ""*...Le principali destinazioni sono l'Empire State Building, la Statua della Libertà, Ellis Island, i teatri di Broadway, musei come il Metropolitan Museum of Art, spazi verdi come Central Park, il Rockefeller Center, Times Square, la Chinatown di Manhattan;...""]","Empire State Building, 350, 5th Avenue, Manhattan Community Board 5, Manhattan, New York County, New York, 10018, Stati Uniti d'America","{""coordinates"": [-73.985659, 40.748442], ""type"": ""Point""}","Empire State Building, 350, 5th Avenue, Manhattan Community Board 5, Manhattan, New York County, New York, 10018, Stati Uniti d'America",tourism,attraction
17,Midtown Manhattan,Midtown Manhattan,"[""*...L'Empire State Building, grattacielo in stile art déco di 443 metri di altezza, situato a Midtown Manhattan...."", '*...Diverse linee di autobus e bus-navetta, infine, collegano i vari aeroporti a Midtown....']","Fairfield Inn, 325, West 33rd Street, Manhattan Community Board 4, Manhattan, New York County, New York, 10001, Stati Uniti d'America","{""coordinates"": [-73.995116, 40.75226], ""type"": ""Point""}","Fairfield Inn, 325, West 33rd Street, Manhattan Community Board 4, Manhattan, New York County, New York, 10001, Stati Uniti d'America",tourism,hotel
21,Milano,Milano,"['*...Insieme a Milano, Londra e Parigi è considerata una delle capitali mondiali della moda....', ""*...Comprese Napoli e Milano, oltre San Paolo (Brasile), Buenos Aires, Toronto, Sydney ecc., dove pure arrivavano migranti da ogni borgo d'Italia....""]","Milano, Loudon Road, Newtonville, Latham, Town of Colonie, Albany County, New York, 12110, Stati Uniti d'America","{""coordinates"": [-73.761018, 42.727922], ""type"": ""Point""}","Milano, Loudon Road, Newtonville, Latham, Town of Colonie, Albany County, New York, 12110, Stati Uniti d'America",amenity,restaurant
23,Lenape,Lenape,"[""*...L'area dove sorge la città di New York era popolata, precedentemente all'arrivo dei colonizzatori europei, da gruppi di Lenape, una popolazione nativa americana algonchina, che vivevano di agricoltura, caccia e pesca nella zona del basso corso del fiume Hudson e dell'isola di Manhattan....""]","Lenape, Powerline trail, Town of Rockland, Sullivan County, New York, Stati Uniti d'America","{""coordinates"": [-74.76186, 41.960583], ""type"": ""Point""}","Lenape, Powerline trail, Town of Rockland, Sullivan County, New York, Stati Uniti d'America",tourism,camp_site
28,Albany,Albany,"['*...Il piccolo centro crebbe nei decenni successivi, sotto il dominio dei Paesi Bassi, attraverso la costruzione di un forte (Fort Amsterdam) e una serie di lotte con i nativi (chiamate guerra di Kieft, dal nome del direttore generale della colonia Willem Kieft) per il predominio sul territorio circostante,\nLa città di Nieuw Amsterdam passò nel 1665 sotto il dominio inglese e venne ribattezzata New York in onore di Giacomo II, al tempo Duca di York e Albany....', '*...Gli autobus indicati da una M vicino al numero, indicano che viaggia solo a Manhattan, B per Brooklyn, Q per Queens, Bx per Bronx e S per Staten Island....']","Albany, NY 12207, Hudson Avenue, Downtown, City of Albany, Albany County, New York, 12207, Stati Uniti d'America","{""coordinates"": [-73.75265, 42.647849], ""type"": ""Point""}","Albany, NY 12207, Hudson Avenue, Downtown, City of Albany, Albany County, New York, 12207, Stati Uniti d'America",amenity,post_office
29,West,West,"[""*...In concomitanza all'occupazione militare britannica la città di New York fu colpita da un incendio, divampato il 20 settembre nel West side della città, incendio che distrusse tra il 10 e il 25% della città...."", ""...Il Fantasma dell'Opera, Les Miserables, Cats e West Side Story....""]","West, Craig Road North, Nolan Park, Manhattan Community Board 1, Manhattan, New York County, New York, 10004, Stati Uniti d'America","{""coordinates"": [-74.021582, 40.690513], ""type"": ""Point""}","West, Craig Road North, Nolan Park, Manhattan Community Board 1, Manhattan, New York County, New York, 10004, Stati Uniti d'America",historic,memorial
30,Federal Hall,Federal Hall,"[""*...Subito dopo la sua creazione, prevista dalla Costituzione, il Congresso degli Stati Uniti d'America ebbe come sede la Federal Hall, in Wall Street....""]","Federal Hall National Memorial, Wall Street, Manhattan Community Board 1, Manhattan, New York County, New York, 10005, Stati Uniti d'America","{""coordinates"": [-74.010253, 40.707322], ""type"": ""Point""}","Federal Hall National Memorial, Wall Street, Manhattan Community Board 1, Manhattan, New York County, New York, 10005, Stati Uniti d'America",historic,building
32,Europa,Europa,"[""...Insieme a Ginevra (CICR e sede europea dell'ONU), Basilea (Banca dei Regolamenti Internazionali) e Strasburgo (Consiglio d'Europa), New York è una delle poche città al mondo che funge da sede di una delle più importanti organizzazioni internazionali (nel suo caso dell'ONU), senza essere la capitale di un paese...."", ""*...L'Immigrazione dall'Europa riprese vigore, dopo un certo calo nei primi anni del secolo, e raggiunse punte notevoli negli anni della grande carestia irlandese del 1845-1849...."", ""*...Fra le maggiori vi sono Ellis Island, l'isola in cui un tempo sbarcavano le navi piene di immigrati provenienti dall'Europa, e dove questi venivano tenuti in quarantena per un certo periodo prima di essere ammessi al resto degli Stati Uniti;...""]","Europa Cafe, 3, Times Square, Manhattan, New York County, New York, 10036, Stati Uniti d'America","{""coordinates"": [-73.986719, 40.756692], ""type"": ""Point""}","Europa Cafe, 3, Times Square, Manhattan, New York County, New York, 10036, Stati Uniti d'America",amenity,cafe
36,Boston,Boston,"[""*...La città di New York è situata sulla costa orientale dell'America settentrionale, sull'oceano Atlantico, alla foce del fiume Hudson (che costituisce il suo confine occidentale, separandola da una serie di sobborghi nel New Jersey), circa a metà Strada fra Boston e Washington....""]","Boston, Medford, Town of Brookhaven, Suffolk County, New York, 11763, Stati Uniti d'America","{""coordinates"": [-72.996637, 40.815436], ""type"": ""Point""}","Boston, Medford, Town of Brookhaven, Suffolk County, New York, 11763, Stati Uniti d'America",highway,residential
38,Roosevelt Island,Roosevelt Island,"[""*...Roosevelt Island, una piccola isola allungata nell'East River....""]","Roosevelt Island, Roosevelt Island Greenway, Roosevelt Island, Manhattan Community Board 8, Manhattan, New York County, New York, 10044, Stati Uniti d'America","{""coordinates"": [-73.952513, 40.756803], ""type"": ""Point""}","Roosevelt Island, Roosevelt Island Greenway, Roosevelt Island, Manhattan Community Board 8, Manhattan, New York County, New York, 10044, Stati Uniti d'America",amenity,ferry_terminal
40,Labrador,Labrador,"['*...È caratterizzato da inverni lunghi e freddi relativamente alla sua latitudine, con temperature medie (tra la minima e la massima) di 0\xa0°C o poco superiori e punte di -20\xa0°C, burrasche di neve e tempeste a causa della corrente del Labrador e della assenza di ripari che possano proteggere la regione dagli impetuosi venti settentrionali....']","Labrador Hollow Unique Area, Markham Hollow Road, Town of Fabius, Onondaga County, New York, 13159, Stati Uniti d'America","{""coordinates"": [-76.047444, 42.784688], ""type"": ""Point""}","Labrador Hollow Unique Area, Markham Hollow Road, Town of Fabius, Onondaga County, New York, 13159, Stati Uniti d'America",leisure,nature_reserve
42,Orlando,Orlando,"['*...Per esempio, New York e Orlando (Florida) rientrano entrambi in questo schema climatico nonostante enormi differenze, soprattutto termiche, tra i due luoghi....']","Orlando Street, South Beach, Staten Island, Richmond County, New York, 10305, Stati Uniti d'America","{""coordinates"": [-74.070427, 40.592827], ""type"": ""Point""}","Orlando Street, South Beach, Staten Island, Richmond County, New York, 10305, Stati Uniti d'America",highway,residential
43,Florida,Florida,"['*...Per esempio, New York e Orlando (Florida) rientrano entrambi in questo schema climatico nonostante enormi differenze, soprattutto termiche, tra i due luoghi....']","Florida, Town of Warwick, Orange County, New York, 10990, Stati Uniti d'America","{""coordinates"": [-74.337025, 41.319947], ""type"": ""Point""}","Florida, Town of Warwick, Orange County, New York, 10990, Stati Uniti d'America",highway,residential
44,Central Park,Central Park,"['*...La temperatura media annua cittadina (stazione meteo di Central Park, medie 1961-1990), intorno ai 13\xa0°C, oscilla su base mensile fra i circa 0\xa0°C di gennaio (mese più freddo) e i circa 25\xa0°C di luglio (mese più caldo);...', ""*...Benché non sia il più grande della città, il Parco più conosciuto è sicuramente Central Park, diventato ormai un'icona della città al pari di Times Square o dell'Empire State Building, e spesso inquadrato nei numerosi telefilm ambientati a Manhattan...."", ""*...Al di fuori di Manhattan si trovano i parchi più grandi della città, come Pelham Bay Park, che con i suoi 11,2 chilometri quadrati (circa 2700 acri) è il più grande Parco della città, con un'estensione circa grande tre volte Central Park;..."", '*...A Central Park si svolgono infine spettacoli estivi di prosa e musica gratuiti....', ""*...Manhattan (Contea di New York, 1\xa0629\xa0054 abitanti), è il centro culturale, amministrativo e degli affari. Manhattan è la zona più densamente popolata della città e ospita gran parte dei luoghi e degli edifici che la caratterizzano maggiormente. A Manhattan si trova, ad esempio, la maggior parte dei grattacieli newyorkesi. Da menzionare il celebre Central Park. A Manhattan è presente il quartiere di Harlem, l'unica zona con prevalenza afro-americana...."", ""*...Le principali destinazioni sono l'Empire State Building, la Statua della Libertà, Ellis Island, i teatri di Broadway, musei come il Metropolitan Museum of Art, spazi verdi come Central Park, il Rockefeller Center, Times Square, la Chinatown di Manhattan;..."", '*...Alcune attività stagionali, come il pattinaggio su ghiaccio a Central Park in inverno, il Tribeca Film Festival, sono ulteriori eventi che attirano persone in città....']","Central Park, North Marketview Heights, City of Rochester, Monroe County, New York, 14605, Stati Uniti d'America","{""coordinates"": [-77.584667, 43.168385], ""type"": ""Point""}","Central Park, North Marketview Heights, City of Rochester, Monroe County, New York, 14605, Stati Uniti d'America",highway,secondary
45,Napoli,Napoli,"['*...La nevosità media annua è intorno ai 71\xa0cm.\nGli inverni sono dunque freddi nonostante la latitudine relativamente meridionale della città (New York è posta alla stessa latitudine di Napoli)....', ""*...Comprese Napoli e Milano, oltre San Paolo (Brasile), Buenos Aires, Toronto, Sydney ecc., dove pure arrivavano migranti da ogni borgo d'Italia....""]","Napoli, East State Street, City of Ithaca, Tompkins County, New York, 14850, Stati Uniti d'America","{""coordinates"": [-76.49351, 42.439263], ""type"": ""Point""}","Napoli, East State Street, City of Ithaca, Tompkins County, New York, 14850, Stati Uniti d'America",amenity,restaurant
48,One World Trade Center,One World Trade Center,"['*...New York possiede edifici architettonicamente degni di nota, disegnati in una vasta gamma di stili e progettati in tempi che vanno dal 1656, data a cui risale la più antica parte della città, fino al moderno One World Trade Center, il grattacielo costruito a Ground Zero a Lower Manhattan....', ""*...Quattro aerei di linea vennero dirottati da alcuni terroristi legati all'organizzazione islamica Al-Qaida, e due di questi vennero fatti schiantare su ciascuna delle due Torri Gemelle del World Trade Center, causandone il crollo in meno di due ore....""]","One World Trade Center, 285, Fulton Street, Manhattan Community Board 1, Manhattan, New York County, New York, 10048, Stati Uniti d'America","{""coordinates"": [-74.013178, 40.713016], ""type"": ""Point""}","One World Trade Center, 285, Fulton Street, Manhattan Community Board 1, Manhattan, New York County, New York, 10048, Stati Uniti d'America",tourism,attraction
50,Hong Kong,Hong Kong,"['*...Al 2011, New York possedeva 5\xa0937 grattacieli, di cui 550 strutture completate di almeno 100 metri di altezza - secondo posto al mondo dopo Hong Kong - e più di 50 grattacieli completati più alti di 200\xa0m. Questi ultimi includono il Woolworth Building (1913), un grattacielo costruito in architettura neogotica....']","New Hong Kong Barber Shop, 18A, Doyers Street, Chinatown, Manhattan, New York County, New York, 10013, Stati Uniti d'America","{""coordinates"": [-73.99802, 40.714678], ""type"": ""Point""}","New Hong Kong Barber Shop, 18A, Doyers Street, Chinatown, Manhattan, New York County, New York, 10013, Stati Uniti d'America",shop,hairdresser
51,Douglaston,Douglaston,"[""*...In quartieri come Riverdale, The Bronx, Ditmas Park, Brooklyn, Douglaston, Queens, vi sono grandi case unifamiliari in vari stili architettonici come il Tudor revival e l'architettura vittoriana....""]","Douglaston, 41st Avenue, Douglaston, Queens, New York, 11363, Stati Uniti d'America","{""coordinates"": [-73.749306, 40.768175], ""type"": ""Point""}","Douglaston, 41st Avenue, Douglaston, Queens, New York, 11363, Stati Uniti d'America",railway,stop
55,Trinity Church,Trinity Church,"[""*...La Trinity Church, ricostruita in forme neogotiche a metà dell'ottocento su una Chiesa preesistente, al momento del suo completamento con il suo campanile rappresentava l'edificio più alto della città;...""]","Trinity Church, Broadway, Manhattan Community Board 1, Manhattan, New York County, New York, 10006, Stati Uniti d'America","{""coordinates"": [-74.012207, 40.708053], ""type"": ""Point""}","Trinity Church, Broadway, Manhattan Community Board 1, Manhattan, New York County, New York, 10006, Stati Uniti d'America",amenity,place_of_worship
