,entity,to_search,snippet,address,coordinates,name_location,class,type
98,Alexander Nevsky,Alexander Nevsky,"['*...Saint Petersburg has three skyscrapers: Leader Tower (140 m), Alexander Nevsky (124 m) and Atlantic City (105 m) all far from the historical centre....', '...Nevsky Prospekt crosses the Moika (Green Bridge), Griboyedov Canal (Kazansky Bridge), Garden Street, the Fontanka (Anichkov Bridge), meets Liteyny Prospekt and proceeds to Uprising Square near the Moskovsky railway station, where it meets Ligovsky Prospekt and turns to the Alexander Nevsky Lavra....', '...The Alexander Nevsky Lavra, intended to house the relics of St. Alexander Nevsky, is an important centre of Christian education in Russia....']","Male choir of Alexander Nevsky Lavra, 1, набережная реки Монастырки, округ Лиговка-Ямская, Saint Petersburg, Northwestern Federal District, 191167, Russia","{""coordinates"": [30.387989, 59.922102], ""type"": ""Point""}","Male choir of Alexander Nevsky Lavra, 1, набережная реки Монастырки, округ Лиговка-Ямская, Saint Petersburg, Northwestern Federal District, 191167, Russia",tourism,information
99,Atlantic City,Atlantic City,"['*...Saint Petersburg has three skyscrapers: Leader Tower (140 m), Alexander Nevsky (124 m) and Atlantic City (105 m) all far from the historical centre....']","Atlantic City, 126Б, улица Савушкина, Severo-Primorskaya Part, округ № 65, Saint Petersburg, Northwestern Federal District, 197345, Russia","{""coordinates"": [30.202723, 59.985881], ""type"": ""Point""}","Atlantic City, 126Б, улица Савушкина, Severo-Primorskaya Part, округ № 65, Saint Petersburg, Northwestern Federal District, 197345, Russia",building,office
102,Saint Petersburg Mosque,Saint Petersburg Mosque,"['...The Saint Petersburg Mosque, the largest mosque in Europe when opened in 1913, is on the right bank nearby....']","Saint Petersburg Mosque, 7, Кронверкский проспект, Petrograd Side, Посадский округ, Saint Petersburg, Northwestern Federal District, 197046, Russia","{""coordinates"": [30.32398, 59.955118], ""type"": ""Point""}","Saint Petersburg Mosque, 7, Кронверкский проспект, Petrograd Side, Посадский округ, Saint Petersburg, Northwestern Federal District, 197046, Russia",amenity,place_of_worship
103,Spit of Vasilievsky Island,Spit of Vasilievsky Island,"['...Jean-François Thomas de Thomon (Spit of Vasilievsky Island) ;...', '...The Spit of Vasilievsky Island, which splits the river into two largest armlets, the Bolshaya Neva and Malaya Neva, is connected to the northern bank (Petrogradsky Island) via the Exchange Bridge and occupied by the Old Saint Petersburg Stock Exchange and Rostral Columns....']","Spit of the Vasilievsky Island, Exchange Square, округ № 7, Saint Petersburg, Northwestern Federal District, 199034, Russia","{""coordinates"": [30.307249, 59.944298], ""type"": ""Point""}","Spit of the Vasilievsky Island, Exchange Square, округ № 7, Saint Petersburg, Northwestern Federal District, 199034, Russia",tourism,viewpoint
107,Exchange Bridge,Exchange Bridge,"['...The Spit of Vasilievsky Island, which splits the river into two largest armlets, the Bolshaya Neva and Malaya Neva, is connected to the northern bank (Petrogradsky Island) via the Exchange Bridge and occupied by the Old Saint Petersburg Stock Exchange and Rostral Columns....']","Exchange Bridge, округ № 7, Saint Petersburg, Northwestern Federal District, 199034, Russia","{""coordinates"": [30.303347, 59.945214], ""type"": ""Point""}","Exchange Bridge, округ № 7, Saint Petersburg, Northwestern Federal District, 199034, Russia",highway,primary
109,Palace Bridge,Palace Bridge,"['...On the southern, left bank of the Neva, connected to the spit of Vasilyevsky Island via the Palace Bridge, lie the Admiralty building, the vast Hermitage Museum complex stretching along the Palace Embankment, which includes the Baroque Winter Palace, former official residence of Russian emperors, as well as the neoclassical Marble Palace....', '...The Palace Bridge drawn at night is yet another symbol of the city....']","Palace Bridge, Palace District, Saint Petersburg, Northwestern Federal District, 190107, Russia","{""coordinates"": [30.309802, 59.940127], ""type"": ""Point""}","Palace Bridge, Palace District, Saint Petersburg, Northwestern Federal District, 190107, Russia",highway,primary
110,Palace Embankment,Palace Embankment,"['...On the southern, left bank of the Neva, connected to the spit of Vasilyevsky Island via the Palace Bridge, lie the Admiralty building, the vast Hermitage Museum complex stretching along the Palace Embankment, which includes the Baroque Winter Palace, former official residence of Russian emperors, as well as the neoclassical Marble Palace....']","Palace Embankment, Palace District, Saint Petersburg, Northwestern Federal District, 191186, Russia","{""coordinates"": [30.329879, 59.946406], ""type"": ""Point""}","Palace Embankment, Palace District, Saint Petersburg, Northwestern Federal District, 191186, Russia",highway,secondary
111,Moika,Moika,"['*...Nevsky Prospekt crosses the Moika (Green Bridge), Griboyedov Canal (Kazansky Bridge), Garden Street, the Fontanka (Anichkov Bridge), meets Liteyny Prospekt and proceeds to Uprising Square near the Moskovsky railway station, where it meets Ligovsky Prospekt and turns to the Alexander Nevsky Lavra....', '*...There are hundreds of smaller bridges in Saint Petersburg spanning numerous canals and distributaries of the Neva, some of the most important of which are the Moika, Fontanka, Griboyedov Canal, Obvodny Canal, Karpovka and Smolenka....']","Кемпински Мойка 22, набережная реки Мойки, Palace District, Saint Petersburg, Northwestern Federal District, 191186, Russia","{""coordinates"": [30.320627, 59.939516], ""type"": ""Point""}","Кемпински Мойка 22, набережная реки Мойки, Palace District, Saint Petersburg, Northwestern Federal District, 191186, Russia",tourism,hotel
115,Garden Street,Garden Street,"['*...Nevsky Prospekt crosses the Moika (Green Bridge), Griboyedov Canal (Kazansky Bridge), Garden Street, the Fontanka (Anichkov Bridge), meets Liteyny Prospekt and proceeds to Uprising Square near the Moskovsky railway station, where it meets Ligovsky Prospekt and turns to the Alexander Nevsky Lavra....']","Garden street, Зверинец, Pavlovsk, Saint Petersburg, Northwestern Federal District, 196621, Russia","{""coordinates"": [30.462395, 59.685182], ""type"": ""Point""}","Garden street, Зверинец, Pavlovsk, Saint Petersburg, Northwestern Federal District, 196621, Russia",highway,secondary
116,Fontanka,Fontanka,"['*...The city was divided into five boroughs, and the city centre was moved to the Admiralty borough, on the east bank between the Neva and Fontanka....', '*...The largest are Vasilyevsky Island (besides the artificial island between Obvodny canal and Fontanka, and Kotlin in the Neva Bay), Petrogradsky, Dekabristov and Krestovsky....', '*...Nevsky Prospekt crosses the Moika (Green Bridge), Griboyedov Canal (Kazansky Bridge), Garden Street, the Fontanka (Anichkov Bridge), meets Liteyny Prospekt and proceeds to Uprising Square near the Moskovsky railway station, where it meets Ligovsky Prospekt and turns to the Alexander Nevsky Lavra....', '*...There are hundreds of smaller bridges in Saint Petersburg spanning numerous canals and distributaries of the Neva, some of the most important of which are the Moika, Fontanka, Griboyedov Canal, Obvodny Canal, Karpovka and Smolenka....', ""*...It is on the Neva's southern bank at the head of the Fontanka and is famous for its cast iron railing and marble sculptures...."", '*...Учебный театр «На Моховой», Leteiny Theatre and Youth Theatre on the Fontanka....']","Фонтанка 5, Караванная улица, Palace District, Saint Petersburg, Northwestern Federal District, 191022, Russia","{""coordinates"": [30.341832, 59.937593], ""type"": ""Point""}","Фонтанка 5, Караванная улица, Palace District, Saint Petersburg, Northwestern Federal District, 191022, Russia",tourism,hotel
119,Moskovsky,Moskovsky,"['*...By the 1840s, neoclassical architecture had given way to various romanticist styles, which dominated until the 1890s, represented by such architects as Andrei Stackenschneider (Mariinsky Palace, Beloselsky-Belozersky Palace, Nicholas Palace, New Michael Palace) and Konstantin Thon (Moskovsky railway station).\nWith the emancipation of the serfs undertaken by Alexander\xa0II in 1861 and an Industrial Revolution...', '...Moving the city centre further from the border with Finland, Stalin adopted a plan to build a new city hall with a huge adjacent square at the southern end of Moskovsky Prospekt, designated as the new main street of Leningrad....', '*...Nevsky Prospekt crosses the Moika (Green Bridge), Griboyedov Canal (Kazansky Bridge), Garden Street, the Fontanka (Anichkov Bridge), meets Liteyny Prospekt and proceeds to Uprising Square near the Moskovsky railway station, where it meets Ligovsky Prospekt and turns to the Alexander Nevsky Lavra....', '*...The city is the final destination for a web of intercity and suburban railways, served by five different railway terminals (Baltiysky, Finlyandsky, Ladozhsky, Moskovsky and Vitebsky), as well as dozens of non-terminal railway stations within the federal subject....']","Moskovsky, 220, Московский проспект, Srednaya Rogatka, округ Звёздное, Saint Petersburg, Northwestern Federal District, 196066, Russia","{""coordinates"": [30.32242, 59.846892], ""type"": ""Point""}","Moskovsky, 220, Московский проспект, Srednaya Rogatka, округ Звёздное, Saint Petersburg, Northwestern Federal District, 196066, Russia",shop,department_store
121,Alexander Nevsky Lavra,Alexander Nevsky Lavra,"['...Nevsky Prospekt crosses the Moika (Green Bridge), Griboyedov Canal (Kazansky Bridge), Garden Street, the Fontanka (Anichkov Bridge), meets Liteyny Prospekt and proceeds to Uprising Square near the Moskovsky railway station, where it meets Ligovsky Prospekt and turns to the Alexander Nevsky Lavra....', '...The Alexander Nevsky Lavra, intended to house the relics of St. Alexander Nevsky, is an important centre of Christian education in Russia....']","Male choir of Alexander Nevsky Lavra, 1, набережная реки Монастырки, округ Лиговка-Ямская, Saint Petersburg, Northwestern Federal District, 191167, Russia","{""coordinates"": [30.387989, 59.922102], ""type"": ""Point""}","Male choir of Alexander Nevsky Lavra, 1, набережная реки Монастырки, округ Лиговка-Ямская, Saint Petersburg, Northwestern Federal District, 191167, Russia",tourism,information
122,Passage,Passage,"['...In 2012, following passage of a new federal law, restoring direct elections of heads of federal subjects, the city charter was again amended to provide for direct elections of governor....', ""*...The Passage, Catholic Church of St. Catherine, Book House (former Singer Manufacturing Company Building in the Art Nouveau style), Grand Hotel Europe, Lutheran Church of Saint Peter and Saint Paul, Great Gostiny Dvor, Russian National Library, Alexandrine Theatre behind Mikeshin's statue of Catherine the Great, Kazan Cathedral, Stroganov Palace, Anichkov Palace and Beloselsky-Belozersky Palace are all along that avenue....""]","Пассаж, 48, Невский проспект, Palace District, Saint Petersburg, Northwestern Federal District, 191023, Russia","{""coordinates"": [30.334669, 59.935738], ""type"": ""Point""}","Пассаж, 48, Невский проспект, Palace District, Saint Petersburg, Northwestern Federal District, 191023, Russia",shop,mall
124,Stroganov Palace,Stroganov Palace,"[""*...The Passage, Catholic Church of St. Catherine, Book House (former Singer Manufacturing Company Building in the Art Nouveau style), Grand Hotel Europe, Lutheran Church of Saint Peter and Saint Paul, Great Gostiny Dvor, Russian National Library, Alexandrine Theatre behind Mikeshin's statue of Catherine the Great, Kazan Cathedral, Stroganov Palace, Anichkov Palace and Beloselsky-Belozersky Palace are all along that avenue....""]","Stroganov Palace, 17, Невский проспект, Apraksin Dvor, округ № 78, Saint Petersburg, Northwestern Federal District, 191186, Russia","{""coordinates"": [30.320029, 59.93561], ""type"": ""Point""}","Stroganov Palace, 17, Невский проспект, Apraksin Dvor, округ № 78, Saint Petersburg, Northwestern Federal District, 191186, Russia",tourism,museum
125,Anichkov Palace,Anichkov Palace,"[""*...The Passage, Catholic Church of St. Catherine, Book House (former Singer Manufacturing Company Building in the Art Nouveau style), Grand Hotel Europe, Lutheran Church of Saint Peter and Saint Paul, Great Gostiny Dvor, Russian National Library, Alexandrine Theatre behind Mikeshin's statue of Catherine the Great, Kazan Cathedral, Stroganov Palace, Anichkov Palace and Beloselsky-Belozersky Palace are all along that avenue....""]","Anichkov Palace, 39, Невский проспект, Apraksin Dvor, округ № 78, Saint Petersburg, Northwestern Federal District, 191168, Russia","{""coordinates"": [30.339849, 59.932985], ""type"": ""Point""}","Anichkov Palace, 39, Невский проспект, Apraksin Dvor, округ № 78, Saint Petersburg, Northwestern Federal District, 191168, Russia",historic,palace
127,St. Michael's Castle,St. Michael's Castle,"[""*...On the territory between the Neva and Nevsky Prospekt the Church of the Savior on Blood, Mikhailovsky Palace housing the Russian Museum, Field of Mars, St. Michael's Castle, Summer Garden, Tauride Palace, Smolny Institute and Smolny Convent are located....""]","Saint Michael's Castle, 2, Садовая улица, Palace District, Saint Petersburg, Northwestern Federal District, 191168, Russia","{""coordinates"": [30.338538, 59.940383], ""type"": ""Point""}","Saint Michael's Castle, 2, Садовая улица, Palace District, Saint Petersburg, Northwestern Federal District, 191168, Russia",tourism,museum
128,Summer Garden,Summer Garden,"[""*...On the territory between the Neva and Nevsky Prospekt the Church of the Savior on Blood, Mikhailovsky Palace housing the Russian Museum, Field of Mars, St. Michael's Castle, Summer Garden, Tauride Palace, Smolny Institute and Smolny Convent are located...."", '...The Summer Garden is the oldest, dating back to the early 18th century and designed in the regular style....']","Summer Garden, набережная реки Мойки, Palace District, Saint Petersburg, Northwestern Federal District, 191168, Russia","{""coordinates"": [30.336954, 59.941953], ""type"": ""Point""}","Summer Garden, набережная реки Мойки, Palace District, Saint Petersburg, Northwestern Federal District, 191168, Russia",tourism,information
129,Tauride Palace,Tauride Palace,"[""*...On the territory between the Neva and Nevsky Prospekt the Church of the Savior on Blood, Mikhailovsky Palace housing the Russian Museum, Field of Mars, St. Michael's Castle, Summer Garden, Tauride Palace, Smolny Institute and Smolny Convent are located...."", '...Among other notable parks are the Maritime Victory Park on Krestovsky Island and the Moscow Victory Park in the south, both commemorating the victory over Nazi Germany in the Second World War, as well as the Central Park of Culture and Leisure occupying Yelagin Island and the Tauride Garden around the Tauride Palace....']","Tauride Palace, 47, Шпалерная улица, Peski, округ Смольнинское, Saint Petersburg, Northwestern Federal District, 191015, Russia","{""coordinates"": [30.37593, 59.947941], ""type"": ""Point""}","Tauride Palace, 47, Шпалерная улица, Peski, округ Смольнинское, Saint Petersburg, Northwestern Federal District, 191015, Russia",historic,palace
134,Western High-Speed Diameter,Western High-Speed Diameter,"['*...The most remarkable bridges of our days are Korabelny and Petrovsky cable-stayed bridges, which form the most spectacular part of the city toll road, Western High-Speed Diameter....', '...The construction of freeways such as the Saint Petersburg Ring Road, completed in 2011, and the Western High-Speed Diameter, completed in 2017, helped reduce the traffic in the city....']","Western High-Speed Diameter, округ Новоизмайловское, Saint Petersburg, Northwestern Federal District, 198128, Russia","{""coordinates"": [30.295215, 59.873882], ""type"": ""Point""}","Western High-Speed Diameter, округ Новоизмайловское, Saint Petersburg, Northwestern Federal District, 198128, Russia",highway,motorway
135,Karpovka,Karpovka,"['*...There are hundreds of smaller bridges in Saint Petersburg spanning numerous canals and distributaries of the Neva, some of the most important of which are the Moika, Fontanka, Griboyedov Canal, Obvodny Canal, Karpovka and Smolenka....']","Карповка, 4, набережная Мартынова, Ostrova, округ Чкаловское, Saint Petersburg, Northwestern Federal District, 197110, Russia","{""coordinates"": [30.263341, 59.973873], ""type"": ""Point""}","Карповка, 4, набережная Мартынова, Ostrova, округ Чкаловское, Saint Petersburg, Northwestern Federal District, 197110, Russia",amenity,clinic
136,Smolenka,Smolenka,"['*...There are hundreds of smaller bridges in Saint Petersburg spanning numerous canals and distributaries of the Neva, some of the most important of which are the Moika, Fontanka, Griboyedov Canal, Obvodny Canal, Karpovka and Smolenka....']","Smolenka, 52 к1, проспект Славы, округ № 72, Saint Petersburg, Northwestern Federal District, 192249, Russia","{""coordinates"": [30.410619, 59.865096], ""type"": ""Point""}","Smolenka, 52 к1, проспект Славы, округ № 72, Saint Petersburg, Northwestern Federal District, 192249, Russia",shop,fireplace
137,Petergof,Petergof,"['*...The area of the federal subject is 1,439\xa0km2 (556\xa0sq\xa0mi), which contains Saint Petersburg proper (consisting of eighty-one municipal okrugs), nine municipal towns – (Kolpino, Krasnoye Selo, Kronstadt, Lomonosov, Pavlovsk, Petergof, Pushkin, Sestroretsk, Zelenogorsk) – and twenty-one municipal settlements....', ""*...Southern suburbs of the city feature former imperial residences, including Petergof, with majestic fountain cascades and parks, Tsarskoe Selo, with the baroque Catherine Palace and the neoclassical Alexander Palace, and Pavlovsk, which has a domed palace of Emperor Paul and one of Europe's largest English-style parks....""]","Петергоф, Avenue of the Fountains, Peterhof, Saint Petersburg, Northwestern Federal District, 198516, Russia","{""coordinates"": [29.914173, 59.89173], ""type"": ""Point""}","Петергоф, Avenue of the Fountains, Peterhof, Saint Petersburg, Northwestern Federal District, 198516, Russia",amenity,ferry_terminal
139,Catherine Palace,Catherine Palace,"[""*...Southern suburbs of the city feature former imperial residences, including Petergof, with majestic fountain cascades and parks, Tsarskoe Selo, with the baroque Catherine Palace and the neoclassical Alexander Palace, and Pavlovsk, which has a domed palace of Emperor Paul and one of Europe's largest English-style parks....""]","Catherine Palace, Эрмитажная аллея, София, Pushkin, Saint Petersburg, Northwestern Federal District, 196601, Russia","{""coordinates"": [30.396352, 59.715784], ""type"": ""Point""}","Catherine Palace, Эрмитажная аллея, София, Pushkin, Saint Petersburg, Northwestern Federal District, 196601, Russia",tourism,attraction
140,Alexander Palace,Alexander Palace,"[""*...Southern suburbs of the city feature former imperial residences, including Petergof, with majestic fountain cascades and parks, Tsarskoe Selo, with the baroque Catherine Palace and the neoclassical Alexander Palace, and Pavlovsk, which has a domed palace of Emperor Paul and one of Europe's largest English-style parks....""]","Alexander Palace, 2, Дворцовая улица, Pushkin, Saint Petersburg, Northwestern Federal District, 196601, Russia","{""coordinates"": [30.39205, 59.721274], ""type"": ""Point""}","Alexander Palace, 2, Дворцовая улица, Pushkin, Saint Petersburg, Northwestern Federal District, 196601, Russia",tourism,museum
145,Yelagin Island,Yelagin Island,"['*...Among other notable parks are the Maritime Victory Park on Krestovsky Island and the Moscow Victory Park in the south, both commemorating the victory over Nazi Germany in the Second World War, as well as the Central Park of Culture and Leisure occupying Yelagin Island and the Tauride Garden around the Tauride Palace....']","Yelagin Island natural monument, набережная Мартынова, Ostrova, округ Чкаловское, Saint Petersburg, Northwestern Federal District, 197042, Russia","{""coordinates"": [30.258829, 59.978843], ""type"": ""Point""}","Yelagin Island natural monument, набережная Мартынова, Ostrova, округ Чкаловское, Saint Petersburg, Northwestern Federal District, 197042, Russia",leisure,nature_reserve
148,St. Isaac's Cathedral,St. Isaac's Cathedral,"[""*...The apartments of some famous Petersburgers, including Alexander Pushkin, Fyodor Dostoyevsky, Nikolai Rimsky-Korsakov, Feodor Chaliapin, Alexander Blok, Vladimir Nabokov, Anna Akhmatova, Mikhail Zoshchenko, Joseph Brodsky, as well as some palace and park ensembles of the southern suburbs and notable architectural monuments such as St. Isaac's Cathedral, have also been turned into public museums....""]","St Isaac's Cathedral, 4, Исаакиевская площадь, Адмиралтейский округ, Saint Petersburg, Northwestern Federal District, 190107, Russia","{""coordinates"": [30.306142, 59.934078], ""type"": ""Point""}","St Isaac's Cathedral, 4, Исаакиевская площадь, Адмиралтейский округ, Saint Petersburg, Northwestern Federal District, 190107, Russia",amenity,place_of_worship
157,Krestovsky Stadium,Krestovsky Stadium,"['...The stadium was knocked down in 2006, with Zenit temporarily moving to the Petrovsky Stadium before the Krestovsky Stadium was built on the same site as the Kirov Stadium....', '...The Krestovsky Stadium opened in 2017, hosting four matches at the 2017 FIFA Confederations Cup, including the final....']","Gazprom Arena, 1 с1, Футбольная аллея, округ Чкаловское, Saint Petersburg, Northwestern Federal District, 199397, Russia","{""coordinates"": [30.221061, 59.972377], ""type"": ""Point""}","Gazprom Arena, 1 с1, Футбольная аллея, округ Чкаловское, Saint Petersburg, Northwestern Federal District, 199397, Russia",leisure,stadium
158,Ice Palace,Ice Palace,['*...They play their home games at Ice Palace Saint Petersburg....'],"Ice Palace, 1, проспект Пятилеток, округ Правобережный, Saint Petersburg, Northwestern Federal District, 193318, Russia","{""coordinates"": [30.467488, 59.921618], ""type"": ""Point""}","Ice Palace, 1, проспект Пятилеток, округ Правобережный, Saint Petersburg, Northwestern Federal District, 193318, Russia",leisure,sports_centre
159,Pulkovo Airport,Pulkovo Airport,"['*...Pulkovo Airport serves most of the air passengers departing from or arriving to the city....', '...Pulkovo airport was opened to passengers as a small aerodrome in 1931....', ""...As of 2013[update], the Pulkovo airport, which handles over 12 million passengers annually, is the 3rd busiest in Russia after Moscow's Sheremetyevo and Domodedovo...."", '...A newly built Terminal 1 of the Pulkovo airport was put into operation on 4 December 2013 and integrated international flights of the former terminal Pulkovo-2....', '*...One of the oldest air carriers of the Russian Federation Rossiya is registered in Saint Petersburg and is the largest and the base carrier of Pulkovo Airport....', '...There is a regular rapid-bus connection (buses 39, 39E, K39) between Pulkovo airport and the Moskovskaya metro station as well as 24/7 taxi service....', '*...There is a regular rapid-bus connection (buses 39, 39E, K39) between Pulkovo airport and the Moskovskaya metro station as well as 24/7 taxi service....']","Pulkovo Airport, Saint Petersburg Ring Road, округ Пулковский меридиан, Saint Petersburg, Northwestern Federal District, 196158, Russia","{""coordinates"": [30.267601, 59.801699], ""type"": ""Point""}","Pulkovo Airport, Saint Petersburg Ring Road, округ Пулковский меридиан, Saint Petersburg, Northwestern Federal District, 196158, Russia",aeroway,aerodrome
160,Prospekt Slavy,Prospekt Slavy,"['*...As of 2018, the Saint Petersburg Metro will include new stations: Prospekt Slavy, Dunayskaya, Shushary, Begovaya, and Novokrestovskaya, the latter built specifically to offer convenient access to the stadium during the 2018 FIFA World Cup games and games played by FC Zenit....']","проспект Славы, округ Купчино, Saint Petersburg, Northwestern Federal District, 192212, Russia","{""coordinates"": [30.368805, 59.854655], ""type"": ""Point""}","проспект Славы, округ Купчино, Saint Petersburg, Northwestern Federal District, 192212, Russia",highway,primary
