,entity,to_search,snippet,address,coordinates,name_location,class,type
34,Chesme Church,Chesme Church,"['*...Yury Felten (Old Hermitage, Chesme Church) ;...']","Chesme Church, 12, улица Ленсовета, округ Звёздное, Saint Petersburg, Northwestern Federal District, 196135, Russia","{""coordinates"": [30.330896, 59.856948], ""type"": ""Point""}","Chesme Church, 12, улица Ленсовета, округ Звёздное, Saint Petersburg, Northwestern Federal District, 196135, Russia",amenity,place_of_worship
35,Hermitage Theatre,Hermitage Theatre,"['*...Giacomo Quarenghi (Academy of Sciences, Hermitage Theatre, Yusupov Palace) ;...']","Hermitage Theatre, 32, Palace Embankment, Palace District, Saint Petersburg, Northwestern Federal District, 191186, Russia","{""coordinates"": [30.317757, 59.942635], ""type"": ""Point""}","Hermitage Theatre, 32, Palace Embankment, Palace District, Saint Petersburg, Northwestern Federal District, 191186, Russia",amenity,theatre
37,Kazan Cathedral,Kazan Cathedral,"['*...Andrey Voronikhin (Mining Institute, Kazan Cathedral) ;...', '...The oldest cathedral in the city is the Peter and Paul Cathedral, built between 1712–1733, and the largest is the Kazan Cathedral, completed in 1811....', ""*...The Passage, Catholic Church of St. Catherine, Book House (former Singer Manufacturing Company Building in the Art Nouveau style), Grand Hotel Europe, Lutheran Church of Saint Peter and Saint Paul, Great Gostiny Dvor, Russian National Library, Alexandrine Theatre behind Mikeshin's statue of Catherine the Great, Kazan Cathedral, Stroganov Palace, Anichkov Palace and Beloselsky-Belozersky Palace are all along that avenue....""]","Kazansky Cathedral, 2, Казанская улица, Apraksin Dvor, округ № 78, Saint Petersburg, Northwestern Federal District, 191186, Russia","{""coordinates"": [30.324639, 59.934464], ""type"": ""Point""}","Kazansky Cathedral, 2, Казанская улица, Apraksin Dvor, округ № 78, Saint Petersburg, Northwestern Federal District, 191186, Russia",amenity,place_of_worship
38,Vasilievsky Island,Vasilievsky Island,"['*...Jean-François Thomas de Thomon (Spit of Vasilievsky Island) ;...', '...The Spit of Vasilievsky Island, which splits the river into two largest armlets, the Bolshaya Neva and Malaya Neva, is connected to the northern bank (Petrogradsky Island) via the Exchange Bridge and occupied by the Old Saint Petersburg Stock Exchange and Rostral Columns....']","Spit of the Vasilievsky Island, Exchange Square, округ № 7, Saint Petersburg, Northwestern Federal District, 199034, Russia","{""coordinates"": [30.307249, 59.944298], ""type"": ""Point""}","Spit of the Vasilievsky Island, Exchange Square, округ № 7, Saint Petersburg, Northwestern Federal District, 199034, Russia",tourism,viewpoint
39,Yelagin Palace,Yelagin Palace,"['*...Carlo Rossi (Yelagin Palace, Mikhailovsky Palace, Alexandrine Theatre, Senate and Synod Buildings, General staff Building, design of many streets and squares) ;...']","Yelagin Palace, 4 литА, Елагин остров, округ Чкаловское, Saint Petersburg, Northwestern Federal District, 197110, Russia","{""coordinates"": [30.270036, 59.979316], ""type"": ""Point""}","Yelagin Palace, 4 литА, Елагин остров, округ Чкаловское, Saint Petersburg, Northwestern Federal District, 197110, Russia",historic,palace
42,Moscow Triumphal Gate,Moscow Triumphal Gate,"['*...Vasily Stasov (Moscow Triumphal Gate, Trinity Cathedral) ;...']","The Moscow triumphal gate, площадь Московские Ворота, Blizhnyaya Rogatka, округ Московская застава, Saint Petersburg, Northwestern Federal District, 196006, Russia","{""coordinates"": [30.319429, 59.891404], ""type"": ""Point""}","The Moscow triumphal gate, площадь Московские Ворота, Blizhnyaya Rogatka, округ Московская застава, Saint Petersburg, Northwestern Federal District, 196006, Russia",tourism,attraction
43,Trinity Cathedral,Trinity Cathedral,"['*...Vasily Stasov (Moscow Triumphal Gate, Trinity Cathedral) ;...', ""...Many notable landmarks are to the west and south of the Admiralty Building, including the Trinity Cathedral, Mariinsky Palace, Hotel Astoria, famous Mariinsky Theatre, New Holland Island, Saint Isaac's Cathedral, the largest in the city, and Senate Square, with the Bronze Horseman, 18th-century equestrian monument to Peter the Great, which is considered among the city's most recognisable symbols....""]","Trinity Cathedral, 7А, Измайловский проспект, округ Измайловское, Saint Petersburg, Northwestern Federal District, 190005, Russia","{""coordinates"": [30.30585, 59.916467], ""type"": ""Point""}","Trinity Cathedral, 7А, Измайловский проспект, округ Измайловское, Saint Petersburg, Northwestern Federal District, 190005, Russia",amenity,place_of_worship
44,Saint Isaac's Cathedral,Saint Isaac's Cathedral,"[""*...Auguste de Montferrand (Saint Isaac's Cathedral, Alexander Column) ...."", ""*...Many notable landmarks are to the west and south of the Admiralty Building, including the Trinity Cathedral, Mariinsky Palace, Hotel Astoria, famous Mariinsky Theatre, New Holland Island, Saint Isaac's Cathedral, the largest in the city, and Senate Square, with the Bronze Horseman, 18th-century equestrian monument to Peter the Great, which is considered among the city's most recognisable symbols....""]","St Isaac's Cathedral, 4, Исаакиевская площадь, Адмиралтейский округ, Saint Petersburg, Northwestern Federal District, 190107, Russia","{""coordinates"": [30.306142, 59.934078], ""type"": ""Point""}","St Isaac's Cathedral, 4, Исаакиевская площадь, Адмиралтейский округ, Saint Petersburg, Northwestern Federal District, 190107, Russia",amenity,place_of_worship
45,Alexander Column,Alexander Column,"[""*...Auguste de Montferrand (Saint Isaac's Cathedral, Alexander Column) ...."", '...Many monuments commemorate the Russian victory over Napoleonic France in the Patriotic War of 1812, including the Alexander Column by Montferrand, erected in 1834, and the Narva Triumphal Arch....', ""...The Winter Palace faces Palace Square, the city's main square with the Alexander Column....""]","Alexander Column, Palace Square, Palace District, Saint Petersburg, Northwestern Federal District, 191186, Russia","{""coordinates"": [30.315816, 59.939043], ""type"": ""Point""}","Alexander Column, Palace Square, Palace District, Saint Petersburg, Northwestern Federal District, 191186, Russia",tourism,attraction
46,Narva Triumphal Arch,Narva Triumphal Arch,"['...Many monuments commemorate the Russian victory over Napoleonic France in the Patriotic War of 1812, including the Alexander Column by Montferrand, erected in 1834, and the Narva Triumphal Arch....']","Narva Triumphal arch, площадь Стачек, Нарвский округ, Saint Petersburg, Northwestern Federal District, 198020, Russia","{""coordinates"": [30.273853, 59.900912], ""type"": ""Point""}","Narva Triumphal arch, площадь Стачек, Нарвский округ, Saint Petersburg, Northwestern Federal District, 198020, Russia",tourism,museum
47,Senate Square,Senate Square,"['...In 1825, the suppressed Decembrist revolt against Nicholas\xa0I took place on the Senate Square in the city, a day after Nicholas assumed the throne....', ""*...Many notable landmarks are to the west and south of the Admiralty Building, including the Trinity Cathedral, Mariinsky Palace, Hotel Astoria, famous Mariinsky Theatre, New Holland Island, Saint Isaac's Cathedral, the largest in the city, and Senate Square, with the Bronze Horseman, 18th-century equestrian monument to Peter the Great, which is considered among the city's most recognisable symbols....""]","Senate square, Адмиралтейский округ, Saint Petersburg, Northwestern Federal District, 191011, Russia","{""coordinates"": [30.303246, 59.934919], ""type"": ""Point""}","Senate square, Адмиралтейский округ, Saint Petersburg, Northwestern Federal District, 191011, Russia",highway,secondary
48,Mariinsky Palace,Mariinsky Palace,"['*...By the 1840s, neoclassical architecture had given way to various romanticist styles, which dominated until the 1890s, represented by such architects as Andrei Stackenschneider (Mariinsky Palace, Beloselsky-Belozersky Palace, Nicholas Palace, New Michael Palace) and Konstantin Thon (Moskovsky railway station).\nWith the emancipation of the serfs undertaken by Alexander\xa0II in 1861 and an Industrial Revolution...', ""*...Many notable landmarks are to the west and south of the Admiralty Building, including the Trinity Cathedral, Mariinsky Palace, Hotel Astoria, famous Mariinsky Theatre, New Holland Island, Saint Isaac's Cathedral, the largest in the city, and Senate Square, with the Bronze Horseman, 18th-century equestrian monument to Peter the Great, which is considered among the city's most recognisable symbols....""]","Mariinsky Palace, 6, Исаакиевская площадь, Адмиралтейский округ, Saint Petersburg, Northwestern Federal District, 190107, Russia","{""coordinates"": [30.309842, 59.930703], ""type"": ""Point""}","Mariinsky Palace, 6, Исаакиевская площадь, Адмиралтейский округ, Saint Petersburg, Northwestern Federal District, 190107, Russia",historic,palace
49,Beloselsky-Belozersky Palace,Beloselsky-Belozersky Palace,"['*...By the 1840s, neoclassical architecture had given way to various romanticist styles, which dominated until the 1890s, represented by such architects as Andrei Stackenschneider (Mariinsky Palace, Beloselsky-Belozersky Palace, Nicholas Palace, New Michael Palace) and Konstantin Thon (Moskovsky railway station).\nWith the emancipation of the serfs undertaken by Alexander\xa0II in 1861 and an Industrial Revolution...', ""*...The Passage, Catholic Church of St. Catherine, Book House (former Singer Manufacturing Company Building in the Art Nouveau style), Grand Hotel Europe, Lutheran Church of Saint Peter and Saint Paul, Great Gostiny Dvor, Russian National Library, Alexandrine Theatre behind Mikeshin's statue of Catherine the Great, Kazan Cathedral, Stroganov Palace, Anichkov Palace and Beloselsky-Belozersky Palace are all along that avenue....""]","Beloselsky-Belozersky Palace, 41, Невский проспект, Владимирский округ, Saint Petersburg, Northwestern Federal District, 191002, Russia","{""coordinates"": [30.343941, 59.932696], ""type"": ""Point""}","Beloselsky-Belozersky Palace, 41, Невский проспект, Владимирский округ, Saint Petersburg, Northwestern Federal District, 191002, Russia",historic,palace
50,Nicholas Palace,Nicholas Palace,"['*...By the 1840s, neoclassical architecture had given way to various romanticist styles, which dominated until the 1890s, represented by such architects as Andrei Stackenschneider (Mariinsky Palace, Beloselsky-Belozersky Palace, Nicholas Palace, New Michael Palace) and Konstantin Thon (Moskovsky railway station).\nWith the emancipation of the serfs undertaken by Alexander\xa0II in 1861 and an Industrial Revolution...']","Nicholas Palace, 4 литВ, площадь Труда, Адмиралтейский округ, Saint Petersburg, Northwestern Federal District, 197000, Russia","{""coordinates"": [30.293092, 59.932445], ""type"": ""Point""}","Nicholas Palace, 4 литВ, площадь Труда, Адмиралтейский округ, Saint Petersburg, Northwestern Federal District, 197000, Russia",historic,palace
52,Baltic,Baltic,"['...It is situated on the Neva River, at the head of the Gulf of Finland on the Baltic Sea....', ""...Saint Petersburg is the fourth-most populous city in Europe, the most populous city on the Baltic Sea, and the world's northernmost city of more than 1\xa0million residents...."", ""*...Saint Petersburg surpassed Moscow in population and industrial growth; it became one of the largest industrial cities in Europe, with a major naval base (in Kronstadt), the Neva River, and a seaport on the Baltic.\nThe names of Saints Peter and Paul, bestowed upon the original city's citadel and its cathedral (from 1725—a burial vault of Russian emperors) coincidentally were the names of the first two assassinated Russian emperors, Peter\xa0III (1762, supposedly killed in a conspiracy led by his wife, Catherine the Great) and Paul\xa0I (1801, Nikolay Alexandrovich Zubov and other conspirators who brought to power Alexander\xa0I, the son of their victim)...."", '...In the south, Saint Petersburg crosses the Baltic-Ladoga Klint and meets the Izhora Plateau....', '...Floods in Saint Petersburg are triggered by a long wave in the Baltic Sea, caused by meteorological conditions, winds and shallowness of the Neva Bay....', '...The distinct moderating influence of Baltic Sea cyclones results in warm, humid, and short summers and long, moderately cold wet winters....', ""...It was also home to Lessner, one of Russia's two pioneering automobile manufacturers (along with Russo-Baltic); it was founded by machine tool and boilermaker G.A. Lessner in 1904, with designs by Boris Loutsky, and it survived until 1910...."", '...Major local industries are Admiralty Shipyard, Baltic Shipyard, LOMO, Kirov Plant, Elektrosila, Izhorskiye Zavody; also registered in Saint Petersburg are Sovkomflot, Petersburg Fuel Company and SIBUR among other major Russian and international companies....', '...A complex system of riverports on both banks of the Neva River are interconnected with the system of seaports, thus making Saint Petersburg the main link between the Baltic Sea and the rest of Russia through the Volga-Baltic Waterway....', '...From April to November, 22 bridges across the Neva and main canals are drawn to let ships pass in and out of the Baltic Sea according to a schedule....', '...The city is also served by passenger and cargo seaports[clarification needed] in the Neva Bay of the Gulf of Finland, Baltic Sea, the river port higher up the Neva and tens of smaller passenger stations on both banks of the Neva river....', '...It is a terminus of both the Volga-Baltic and White Sea-Baltic waterways.[citation needed]...', '...List of sister cities to Saint Petersburg as it appears on the official portal of the City Government, listing both sister cities and partnership ties:\nNon CIS/Baltic states sister cities of Saint Petersburg (from official government list)...', '*...Sister cities in the Commonwealth of Independent States and Baltic states...']","Baltic House, 4 литТ, Александровский парк, Alexander Park, Petrograd Side, округ Кронверкское, Saint Petersburg, Northwestern Federal District, 197198, Russia","{""coordinates"": [30.312814, 59.955652], ""type"": ""Point""}","Baltic House, 4 литТ, Александровский парк, Alexander Park, Petrograd Side, округ Кронверкское, Saint Petersburg, Northwestern Federal District, 197198, Russia",amenity,theatre
54,Nevsky Prospekt,Nevsky Prospekt,"['*...Nevsky Prospekt with Palace Square maintained the functions and the role of a city centre....', ""*...Nevsky Prospekt, also on the left bank of the Neva, is the city's main avenue...."", '*...Nevsky Prospekt crosses the Moika (Green Bridge), Griboyedov Canal (Kazansky Bridge), Garden Street, the Fontanka (Anichkov Bridge), meets Liteyny Prospekt and proceeds to Uprising Square near the Moskovsky railway station, where it meets Ligovsky Prospekt and turns to the Alexander Nevsky Lavra....', ""*...On the territory between the Neva and Nevsky Prospekt the Church of the Savior on Blood, Mikhailovsky Palace housing the Russian Museum, Field of Mars, St. Michael's Castle, Summer Garden, Tauride Palace, Smolny Institute and Smolny Convent are located....""]","Metro station ""Nevsky Prospect"", Невский проспект, Palace District, Saint Petersburg, Northwestern Federal District, 191023, Russia","{""coordinates"": [30.32943, 59.935132], ""type"": ""Point""}","Metro station ""Nevsky Prospect"", Невский проспект, Palace District, Saint Petersburg, Northwestern Federal District, 191023, Russia",highway,bus_stop
55,Palace Square,Palace Square,"['*...Nevsky Prospekt with Palace Square maintained the functions and the role of a city centre....', ""*...The Winter Palace faces Palace Square, the city's main square with the Alexander Column...."", '*...It starts at the Admiralty and runs eastwards next to Palace Square....', '*...An art symbol of the twinning was unveiled on Palace Square in Saint Petersburg, defaced and removed...']","Palace Square, Palace District, Saint Petersburg, Northwestern Federal District, 191186, Russia","{""coordinates"": [30.315757, 59.939146], ""type"": ""Point""}","Palace Square, Palace District, Saint Petersburg, Northwestern Federal District, 191186, Russia",highway,living_street
64,Hero-City Obelisk,Hero-City Obelisk,['...The Hero-City Obelisk bearing the Gold Star sign was installed in April 1985....'],"Leningrad Hero City Obelisk, Невский проспект, округ Лиговка-Ямская, Saint Petersburg, Northwestern Federal District, 191036, Russia","{""coordinates"": [30.361826, 59.930937], ""type"": ""Point""}","Leningrad Hero City Obelisk, Невский проспект, округ Лиговка-Ямская, Saint Petersburg, Northwestern Federal District, 191036, Russia",man_made,obelisk
71,Lakhta,Lakhta,"['...Saint Petersburg is home to the Hermitage, one of the largest art museums in the world, the Lakhta Center, the tallest skyscraper in Europe, and was one of the host cities of the 2018 FIFA World Cup and the UEFA Euro 2020....', '*...In the same year, the new location for the project was relocated to Lakhta, a historical area northwest of the city centre, and the new project would be named Lakhta Center....', '...The 462\xa0m (1,516\xa0ft) high Lakhta Center has become the first tallest skyscraper in Russia and Europe outside of Moscow....', ""...The Okhta Center project was cancelled at the end of 2010 and the Lakhta Center project began in the city's outskirts...."", '...The Lakhta Center project has caused much less controversy....', ""...It is planned to connect the park with the pedestrian bridge to the territory of Lakhta Center's recreation areas....""]","Lakhta, Вокзальная улица, Olgino, округ Лахта-Ольгино, Saint Petersburg, Northwestern Federal District, 197229, Russia","{""coordinates"": [30.152535, 59.994576], ""type"": ""Point""}","Lakhta, Вокзальная улица, Olgino, округ Лахта-Ольгино, Saint Petersburg, Northwestern Federal District, 197229, Russia",railway,stop
72,Neva Bay,Neva Bay,"['...Petersburg is on the middle taiga lowlands along the shores of the Neva Bay of the Gulf of Finland, and islands of the river delta....', '...The largest are Vasilyevsky Island (besides the artificial island between Obvodny canal and Fontanka, and Kotlin in the Neva Bay), Petrogradsky, Dekabristov and Krestovsky....', '...Floods in Saint Petersburg are triggered by a long wave in the Baltic Sea, caused by meteorological conditions, winds and shallowness of the Neva Bay....', '...The city is also served by passenger and cargo seaports[clarification needed] in the Neva Bay of the Gulf of Finland, Baltic Sea, the river port higher up the Neva and tens of smaller passenger stations on both banks of the Neva river....']","North Coast of the Neva Bay, Кольцевая улица, Dubki, Lisy Nos, Saint Petersburg, Northwestern Federal District, 189645, Russia","{""coordinates"": [30.049234, 60.000763], ""type"": ""Point""}","North Coast of the Neva Bay, Кольцевая улица, Dubki, Lisy Nos, Saint Petersburg, Northwestern Federal District, 189645, Russia",leisure,nature_reserve
74,Yelagin,Yelagin,"['...Carlo Rossi (Yelagin Palace, Mikhailovsky Palace, Alexandrine Theatre, Senate and Synod Buildings, General staff Building, design of many streets and squares) ;...', '*...The latter together with Yelagin and Kamenny Island are covered mostly by parks....', '...Among other notable parks are the Maritime Victory Park on Krestovsky Island and the Moscow Victory Park in the south, both commemorating the victory over Nazi Germany in the Second World War, as well as the Central Park of Culture and Leisure occupying Yelagin Island and the Tauride Garden around the Tauride Palace....']","Yelagin Palace, 4 литА, Елагин остров, округ Чкаловское, Saint Petersburg, Northwestern Federal District, 197110, Russia","{""coordinates"": [30.270036, 59.979316], ""type"": ""Point""}","Yelagin Palace, 4 литА, Елагин остров, округ Чкаловское, Saint Petersburg, Northwestern Federal District, 197110, Russia",historic,palace
82,Sestra,Sestra,"['*...Besides the Neva and its tributaries, other important rivers of the federal subject of Saint Petersburg are Sestra, Okhta and Izhora....']","Сестрорецкая рыббаза ООО ""Сестра"", улица Инструментальщиков, Razliv, Sestroretsk, Saint Petersburg, Northwestern Federal District, 197706, Russia","{""coordinates"": [29.945157, 60.087308], ""type"": ""Point""}","Сестрорецкая рыббаза ООО ""Сестра"", улица Инструментальщиков, Razliv, Sestroretsk, Saint Petersburg, Northwestern Federal District, 197706, Russia",shop,seafood
83,Okhta,Okhta,"['...In 2006 Gazprom announced an ambitious project to erect a 403\xa0m (1,322\xa0ft) skyscraper (the Okhta Center) opposite to Smolny, which[according to whom?] could result in the loss of the unique line of Petersburg landscape.[citation needed]...', '*...Besides the Neva and its tributaries, other important rivers of the federal subject of Saint Petersburg are Sestra, Okhta and Izhora....', '...However, there was a controversial project endorsed by the city authorities, and known as the Okhta Center, to build a 396 meters (1,299\xa0ft) supertall skyscraper....', ""...The Okhta Center project was cancelled at the end of 2010 and the Lakhta Center project began in the city's outskirts....""]","Okhta tram line overhead catenary truss mast, Большеохтинский проспект, Bolshaya Okhta, округ Большая Охта, Saint Petersburg, Northwestern Federal District, 195027, Russia","{""coordinates"": [30.410105, 59.953803], ""type"": ""Point""}","Okhta tram line overhead catenary truss mast, Большеохтинский проспект, Bolshaya Okhta, округ Большая Охта, Saint Petersburg, Northwestern Federal District, 195027, Russia",historic,memorial
88,M10,M10,"['*...Saint Petersburg is about 165\xa0km (103 miles) from the border with Finland, connected to it via the M10 highway (E18), along which there is also a connection to the historic city of Vyborg. \nUnder the Köppen climate classification...']","Saint Petersburg Ring Road, Rybatskoe village, округ Полюстрово, Saint Petersburg, Northwestern Federal District, 195043, Russia","{""coordinates"": [30.476288, 60.004393], ""type"": ""Point""}","Saint Petersburg Ring Road, Rybatskoe village, округ Полюстрово, Saint Petersburg, Northwestern Federal District, 195043, Russia",highway,motorway
89,E18,E18,"['*...Saint Petersburg is about 165\xa0km (103 miles) from the border with Finland, connected to it via the M10 highway (E18), along which there is also a connection to the historic city of Vyborg. \nUnder the Köppen climate classification...', '*...The city is a node of the international European routes E18 towards Helsinki, E20 towards Tallinn, E95 towards Pskov, Kyiv and Odessa and E105 towards Petrozavodsk, Murmansk and Kirkenes (north) and towards Moscow and Kharkiv (south)....']","Saint Petersburg Ring Road, Rybatskoe village, округ Полюстрово, Saint Petersburg, Northwestern Federal District, 195043, Russia","{""coordinates"": [30.476288, 60.004393], ""type"": ""Point""}","Saint Petersburg Ring Road, Rybatskoe village, округ Полюстрово, Saint Petersburg, Northwestern Federal District, 195043, Russia",highway,motorway
97,Leader Tower,Leader Tower,"['*...Saint Petersburg has three skyscrapers: Leader Tower (140 m), Alexander Nevsky (124 m) and Atlantic City (105 m) all far from the historical centre....']","Leader Tower, 3 к2, площадь Конституции, Predportovaya, округ Новоизмайловское, Saint Petersburg, Northwestern Federal District, 196247, Russia","{""coordinates"": [30.304661, 59.850402], ""type"": ""Point""}","Leader Tower, 3 к2, площадь Конституции, Predportovaya, округ Новоизмайловское, Saint Petersburg, Northwestern Federal District, 196247, Russia",building,office
